No.,Time,Source,Destination,Protocol,Length,Info
1,0.0,72:26:78:39:96:8f,IPv4mcast_fb,TDLS,63,"TDLS Discovery Request, Dialog Token=15[Malformed Packet]"
2,1.397e-06,72:26:78:39:96:8f,IPv4mcast_fb,TDLS,63,"TDLS Discovery Request, Dialog Token=15[Malformed Packet]"
3,0.817171024,Cisco_74:bd:55,Broadcast,ARP,42,Gratuitous ARP for 0.0.0.0 (Request)
4,0.817172491,Cisco_74:bd:55,Broadcast,ARP,42,Gratuitous ARP for 0.0.0.0 (Request)
5,0.921626536,72:26:78:39:96:8f,IPv4mcast_fb,TDLS,63,"TDLS Discovery Request, Dialog Token=15[Malformed Packet]"
6,0.921627513,72:26:78:39:96:8f,IPv4mcast_fb,TDLS,63,"TDLS Discovery Request, Dialog Token=15[Malformed Packet]"
7,1.413762781,192.168.166.195,130.104.1.2,DNS,95,Standard query 0x3f89 A detectportal.firefox.com OPT
8,1.413916017,192.168.166.195,130.104.1.2,DNS,95,Standard query 0xe059 AAAA detectportal.firefox.com OPT
9,1.417412499,130.104.1.2,192.168.166.195,DNS,221,Standard query response 0xe059 AAAA detectportal.firefox.com CNAME detectportal.prod.mozaws.net CNAME prod.detectportal.prod.cloudops.mozgcp.net AAAA 2600:1901:0:38d7:: OPT
10,1.417430938,130.104.1.2,192.168.166.195,DNS,209,Standard query response 0x3f89 A detectportal.firefox.com CNAME detectportal.prod.mozaws.net CNAME prod.detectportal.prod.cloudops.mozgcp.net A 34.107.221.82 OPT
11,1.418077894,2001:6a8:3081:6f06:d9e4:1cb9:a410:d1a5,2600:1901:0:38d7::,TCP,94,55910  >  80 [SYN] Seq=0 Win=64800 Len=0 MSS=1440 SACK_PERM=1 TSval=2798764038 TSecr=0 WS=128
12,1.422194234,2600:1901:0:38d7::,2001:6a8:3081:6f06:d9e4:1cb9:a410:d1a5,TCP,94,"80  >  55910 [SYN, ACK] Seq=0 Ack=1 Win=65535 Len=0 MSS=1440 SACK_PERM=1 TSval=386317878 TSecr=2798764038 WS=256"
13,1.422228038,2001:6a8:3081:6f06:d9e4:1cb9:a410:d1a5,2600:1901:0:38d7::,TCP,86,55910  >  80 [ACK] Seq=1 Ack=1 Win=64896 Len=0 TSval=2798764042 TSecr=386317878
14,1.422383439,2001:6a8:3081:6f06:d9e4:1cb9:a410:d1a5,2600:1901:0:38d7::,HTTP,387,GET /canonical.html HTTP/1.1 
15,1.429689371,2600:1901:0:38d7::,2001:6a8:3081:6f06:d9e4:1cb9:a410:d1a5,TCP,86,80  >  55910 [ACK] Seq=1 Ack=302 Win=66816 Len=0 TSval=386317886 TSecr=2798764042
16,1.430408265,2600:1901:0:38d7::,2001:6a8:3081:6f06:d9e4:1cb9:a410:d1a5,HTTP,384,HTTP/1.1 200 OK  (text/html)
17,1.430431104,2001:6a8:3081:6f06:d9e4:1cb9:a410:d1a5,2600:1901:0:38d7::,TCP,86,55910  >  80 [ACK] Seq=302 Ack=299 Win=64640 Len=0 TSval=2798764050 TSecr=386317887
18,1.437462552,192.168.166.195,130.104.1.2,DNS,84,Standard query 0xb32a AAAA ipv4only.arpa OPT
19,1.437854232,192.168.166.195,34.107.221.82,TCP,74,34464  >  80 [SYN] Seq=0 Win=64240 Len=0 MSS=1460 SACK_PERM=1 TSval=2032008425 TSecr=0 WS=128
20,1.439076416,130.104.1.2,192.168.166.195,DNS,141,Standard query response 0xb32a AAAA ipv4only.arpa SOA sns.dns.icann.org OPT
21,1.439371852,2001:6a8:3081:6f06:d9e4:1cb9:a410:d1a5,2600:1901:0:38d7::,TCP,94,55920  >  80 [SYN] Seq=0 Win=64800 Len=0 MSS=1440 SACK_PERM=1 TSval=2798764059 TSecr=0 WS=128
22,1.443499227,2600:1901:0:38d7::,2001:6a8:3081:6f06:d9e4:1cb9:a410:d1a5,TCP,94,"80  >  55920 [SYN, ACK] Seq=0 Ack=1 Win=65535 Len=0 MSS=1440 SACK_PERM=1 TSval=3408543783 TSecr=2798764059 WS=256"
23,1.44355552,2001:6a8:3081:6f06:d9e4:1cb9:a410:d1a5,2600:1901:0:38d7::,TCP,86,55920  >  80 [ACK] Seq=1 Ack=1 Win=64896 Len=0 TSval=2798764064 TSecr=3408543783
24,1.443679492,2001:6a8:3081:6f06:d9e4:1cb9:a410:d1a5,2600:1901:0:38d7::,HTTP,389,GET /success.txt?ipv6 HTTP/1.1 
25,1.445730014,34.107.221.82,192.168.166.195,TCP,74,"80  >  34464 [SYN, ACK] Seq=0 Ack=1 Win=65535 Len=0 MSS=1412 SACK_PERM=1 TSval=2920204349 TSecr=2032008425 WS=256"
26,1.445762002,192.168.166.195,34.107.221.82,TCP,66,34464  >  80 [ACK] Seq=1 Ack=1 Win=64256 Len=0 TSval=2032008433 TSecr=2920204349
27,1.445817736,192.168.166.195,34.107.221.82,HTTP,369,GET /success.txt?ipv4 HTTP/1.1 
28,1.448124932,2600:1901:0:38d7::,2001:6a8:3081:6f06:d9e4:1cb9:a410:d1a5,TCP,86,80  >  55920 [ACK] Seq=1 Ack=304 Win=66816 Len=0 TSval=3408543788 TSecr=2798764064
29,1.449168526,2600:1901:0:38d7::,2001:6a8:3081:6f06:d9e4:1cb9:a410:d1a5,HTTP,302,HTTP/1.1 200 OK  (text/plain)
30,1.449190597,2001:6a8:3081:6f06:d9e4:1cb9:a410:d1a5,2600:1901:0:38d7::,TCP,86,55920  >  80 [ACK] Seq=304 Ack=217 Win=64768 Len=0 TSval=2798764069 TSecr=3408543789
31,1.453874132,34.107.221.82,192.168.166.195,TCP,66,80  >  34464 [ACK] Seq=1 Ack=304 Win=66816 Len=0 TSval=2920204357 TSecr=2032008433
32,1.455026822,34.107.221.82,192.168.166.195,HTTP,282,HTTP/1.1 200 OK  (text/plain)
33,1.455046098,192.168.166.195,34.107.221.82,TCP,66,34464  >  80 [ACK] Seq=304 Ack=217 Win=64128 Len=0 TSval=2032008442 TSecr=2920204358
34,1.471001114,192.168.166.195,130.104.1.2,DNS,99,Standard query 0xd8cf AAAA contile.services.mozilla.com OPT
35,1.472888203,130.104.1.2,192.168.166.195,DNS,183,Standard query response 0xd8cf AAAA contile.services.mozilla.com SOA ns-679.awsdns-20.net OPT
36,1.473245799,192.168.166.195,34.117.237.239,TCP,74,41066  >  443 [SYN] Seq=0 Win=64240 Len=0 MSS=1460 SACK_PERM=1 TSval=3982392522 TSecr=0 WS=128
37,1.480991533,34.117.237.239,192.168.166.195,TCP,74,"443  >  41066 [SYN, ACK] Seq=0 Ack=1 Win=65535 Len=0 MSS=1412 SACK_PERM=1 TSval=3518957319 TSecr=3982392522 WS=256"
38,1.481026874,192.168.166.195,34.117.237.239,TCP,66,41066  >  443 [ACK] Seq=1 Ack=1 Win=64256 Len=0 TSval=3982392530 TSecr=3518957319
39,1.482388673,192.168.166.195,34.117.237.239,TLSv1.2,742,Client Hello
40,1.483774569,34.117.237.239,192.168.166.195,TCP,66,443  >  41066 [ACK] Seq=1 Ack=677 Win=1174784 Len=0 TSval=3518957319 TSecr=3982392531
41,1.493752556,34.117.237.239,192.168.166.195,TLSv1.2,714,"[TCP Previous segment not captured] , Ignored Unknown Record"
42,1.493753534,34.117.237.239,192.168.166.195,TCP,1466,[TCP Out-Of-Order] 443  >  41066 [ACK] Seq=1 Ack=677 Win=67072 Len=1400 TSval=3518957330 TSecr=3982392531
43,1.493754442,34.117.237.239,192.168.166.195,TCP,2114,"443  >  41066 [PSH, ACK] Seq=2049 Ack=677 Win=67072 Len=2048 TSval=3518957330 TSecr=3982392531"
44,1.49375542,34.117.237.239,192.168.166.195,TLSv1.2,485,Ignored Unknown Record
45,1.493788316,192.168.166.195,34.117.237.239,TCP,78,[TCP Dup ACK 38#1] 41066  >  443 [ACK] Seq=677 Ack=1 Win=64256 Len=0 TSval=3982392543 TSecr=3518957319 SLE=1401 SRE=2049
46,1.493814088,192.168.166.195,34.117.237.239,TCP,66,41066  >  443 [ACK] Seq=677 Ack=2049 Win=62208 Len=0 TSval=3982392543 TSecr=3518957330
47,1.493823167,192.168.166.195,34.117.237.239,TCP,66,41066  >  443 [ACK] Seq=677 Ack=4097 Win=60160 Len=0 TSval=3982392543 TSecr=3518957330
48,1.493832317,192.168.166.195,34.117.237.239,TCP,66,41066  >  443 [ACK] Seq=677 Ack=4516 Win=59776 Len=0 TSval=3982392543 TSecr=3518957330
49,1.519397875,192.168.166.195,130.104.1.2,DNS,85,Standard query 0xcd8e A r3.o.lencr.org OPT
50,1.51953791,192.168.166.195,130.104.1.2,DNS,85,Standard query 0x8146 AAAA r3.o.lencr.org OPT
51,1.521704372,130.104.1.2,192.168.166.195,DNS,187,Standard query response 0xcd8e A r3.o.lencr.org CNAME o.lencr.edgesuite.net CNAME a1887.dscq.akamai.net A 96.17.206.24 A 96.17.206.28 OPT
52,1.521738246,130.104.1.2,192.168.166.195,DNS,211,Standard query response 0x8146 AAAA r3.o.lencr.org CNAME o.lencr.edgesuite.net CNAME a1887.dscq.akamai.net AAAA 2a02:26f0:9100:15::6010:7a9c AAAA 2a02:26f0:9100:15::6010:7a8b OPT
53,1.522339804,2001:6a8:3081:6f06:d9e4:1cb9:a410:d1a5,2a02:26f0:9100:15::6010:7a9c,TCP,94,59120  >  80 [SYN] Seq=0 Win=64800 Len=0 MSS=1440 SACK_PERM=1 TSval=1231461747 TSecr=0 WS=128
54,1.531236272,2a02:26f0:9100:15::6010:7a9c,2001:6a8:3081:6f06:d9e4:1cb9:a410:d1a5,TCP,94,"80  >  59120 [SYN, ACK] Seq=0 Ack=1 Win=64260 Len=0 MSS=1440 SACK_PERM=1 TSval=3643852973 TSecr=1231461747 WS=128"
55,1.531276781,2001:6a8:3081:6f06:d9e4:1cb9:a410:d1a5,2a02:26f0:9100:15::6010:7a9c,TCP,86,59120  >  80 [ACK] Seq=1 Ack=1 Win=64896 Len=0 TSval=1231461756 TSecr=3643852973
56,1.531682289,2001:6a8:3081:6f06:d9e4:1cb9:a410:d1a5,2a02:26f0:9100:15::6010:7a9c,OCSP,509,Request
57,1.540267466,2a02:26f0:9100:15::6010:7a9c,2001:6a8:3081:6f06:d9e4:1cb9:a410:d1a5,TCP,86,80  >  59120 [ACK] Seq=1 Ack=424 Win=64128 Len=0 TSval=3643852983 TSecr=1231461757
58,1.541577792,2a02:26f0:9100:15::6010:7a9c,2001:6a8:3081:6f06:d9e4:1cb9:a410:d1a5,OCSP,975,Response
59,1.541606916,2001:6a8:3081:6f06:d9e4:1cb9:a410:d1a5,2a02:26f0:9100:15::6010:7a9c,TCP,86,59120  >  80 [ACK] Seq=424 Ack=890 Win=64128 Len=0 TSval=1231461767 TSecr=3643852984
60,1.566195161,192.168.166.195,130.104.1.2,DNS,106,Standard query 0x0a0a A content-signature-2.cdn.mozilla.net OPT
61,1.566310821,192.168.166.195,130.104.1.2,DNS,106,Standard query 0xeb42 AAAA content-signature-2.cdn.mozilla.net OPT
62,1.567268998,192.168.166.195,34.117.237.239,TLSv1.2,130,"Change Cipher Spec, Application Data"
63,1.567829139,192.168.166.195,34.117.237.239,TLSv1.2,236,Application Data
64,1.567894442,192.168.166.195,34.117.237.239,TLSv1.2,253,Application Data
65,1.567918329,130.104.1.2,192.168.166.195,DNS,266,Standard query response 0x0a0a A content-signature-2.cdn.mozilla.net CNAME content-signature-chains.prod.autograph.services.mozaws.net CNAME prod.content-signature-chains.prod.webservices.mozgcp.net A 34.160.144.191 OPT
66,1.569130385,130.104.1.2,192.168.166.195,DNS,278,Standard query response 0xeb42 AAAA content-signature-2.cdn.mozilla.net CNAME content-signature-chains.prod.autograph.services.mozaws.net CNAME prod.content-signature-chains.prod.webservices.mozgcp.net AAAA 2600:1901:0:92a9:: OPT
67,1.57590998,34.117.237.239,192.168.166.195,TLSv1.2,684,"Application Data, Application Data"
68,1.575950977,192.168.166.195,34.117.237.239,TCP,66,41066  >  443 [ACK] Seq=1098 Ack=5134 Win=63616 Len=0 TSval=3982392625 TSecr=3518957413
69,1.576463835,34.117.237.239,192.168.166.195,TLSv1.2,97,Application Data
70,1.57647948,192.168.166.195,34.117.237.239,TCP,66,41066  >  443 [ACK] Seq=1098 Ack=5165 Win=63616 Len=0 TSval=3982392626 TSecr=3518957414
71,1.576732102,192.168.166.195,34.117.237.239,TLSv1.2,97,Application Data
72,1.589346245,34.117.237.239,192.168.166.195,TCP,66,443  >  41066 [ACK] Seq=5165 Ack=1129 Win=69632 Len=0 TSval=3518957427 TSecr=3982392626
73,1.745196325,34.117.237.239,192.168.166.195,TLSv1.2,264,Application Data
74,1.745707506,192.168.166.195,34.117.237.239,TLSv1.2,105,Application Data
75,1.753286175,34.117.237.239,192.168.166.195,TCP,66,443  >  41066 [ACK] Seq=5363 Ack=1168 Win=69632 Len=0 TSval=3518957591 TSecr=3982392795
76,1.850561615,Cisco_74:bd:55,Broadcast,ARP,42,Gratuitous ARP for 0.0.0.0 (Request)
77,1.850563501,Cisco_74:bd:55,Broadcast,ARP,42,Gratuitous ARP for 0.0.0.0 (Request)
78,2.014144787,192.168.166.195,130.104.1.2,DNS,96,Standard query 0x379d A push.services.mozilla.com OPT
79,2.014240612,192.168.166.195,130.104.1.2,DNS,96,Standard query 0xd677 AAAA push.services.mozilla.com OPT
80,2.017875942,130.104.1.2,192.168.166.195,DNS,219,Standard query response 0xd677 AAAA push.services.mozilla.com CNAME autopush.prod.mozaws.net SOA ns-1260.awsdns-29.org OPT
81,2.017875942,130.104.1.2,192.168.166.195,DNS,150,Standard query response 0x379d A push.services.mozilla.com CNAME autopush.prod.mozaws.net A 34.107.243.93 OPT
82,2.01813052,192.168.166.195,130.104.1.2,DNS,95,Standard query 0xef49 AAAA autopush.prod.mozaws.net OPT
83,2.019903067,130.104.1.2,192.168.166.195,DNS,180,Standard query response 0xef49 AAAA autopush.prod.mozaws.net SOA ns-1260.awsdns-29.org OPT
84,2.021988371,192.168.166.195,130.104.1.2,DNS,95,Standard query 0x4b2a AAAA autopush.prod.mozaws.net OPT
85,2.023783198,130.104.1.2,192.168.166.195,DNS,180,Standard query response 0x4b2a AAAA autopush.prod.mozaws.net SOA ns-1260.awsdns-29.org OPT
86,2.024252124,192.168.166.195,34.107.243.93,TCP,74,42132  >  443 [SYN] Seq=0 Win=64240 Len=0 MSS=1460 SACK_PERM=1 TSval=1064897267 TSecr=0 WS=128
87,2.031951133,34.107.243.93,192.168.166.195,TCP,74,"443  >  42132 [SYN, ACK] Seq=0 Ack=1 Win=65535 Len=0 MSS=1412 SACK_PERM=1 TSval=3330932508 TSecr=1064897267 WS=256"
88,2.032000512,192.168.166.195,34.107.243.93,TCP,66,42132  >  443 [ACK] Seq=1 Ack=1 Win=64256 Len=0 TSval=1064897275 TSecr=3330932508
89,2.033413297,192.168.166.195,34.107.243.93,TLSv1.3,739,Client Hello
90,2.03468891,34.107.243.93,192.168.166.195,TCP,66,443  >  42132 [ACK] Seq=1 Ack=674 Win=1174784 Len=0 TSval=3330932508 TSecr=1064897276
91,2.044285555,34.107.243.93,192.168.166.195,TLSv1.3,2114,"Server Hello, Change Cipher Spec"
92,2.044286952,34.107.243.93,192.168.166.195,TLSv1.3,1095,"Encrypted Extensions, Certificate, Certificate Verify, Finished"
93,2.044324597,192.168.166.195,34.107.243.93,TCP,66,42132  >  443 [ACK] Seq=674 Ack=2049 Win=62208 Len=0 TSval=1064897287 TSecr=3330932520
94,2.044357493,192.168.166.195,34.107.243.93,TCP,66,42132  >  443 [ACK] Seq=674 Ack=3078 Win=61184 Len=0 TSval=1064897287 TSecr=3330932520
95,2.048336102,2001:6a8:3081:6f06:d9e4:1cb9:a410:d1a5,2a02:26f0:9100:15::6010:7a9c,OCSP,509,Request
96,2.048457699,72:26:78:39:96:8f,IPv4mcast_fb,TDLS,63,"TDLS Discovery Request, Dialog Token=15[Malformed Packet]"
97,2.048463007,72:26:78:39:96:8f,IPv4mcast_fb,TDLS,63,"TDLS Discovery Request, Dialog Token=15[Malformed Packet]"
98,2.057031702,2a02:26f0:9100:15::6010:7a9c,2001:6a8:3081:6f06:d9e4:1cb9:a410:d1a5,TCP,86,80  >  59120 [ACK] Seq=890 Ack=847 Win=64128 Len=0 TSval=3643853499 TSecr=1231462273
99,2.058819893,2a02:26f0:9100:15::6010:7a9c,2001:6a8:3081:6f06:d9e4:1cb9:a410:d1a5,OCSP,974,Response
100,2.058845735,2001:6a8:3081:6f06:d9e4:1cb9:a410:d1a5,2a02:26f0:9100:15::6010:7a9c,TCP,86,59120  >  80 [ACK] Seq=847 Ack=1778 Win=63360 Len=0 TSval=1231462284 TSecr=3643853501
101,2.060072528,192.168.166.195,34.107.243.93,TLSv1.3,130,"Change Cipher Spec, Finished"
102,2.060347151,192.168.166.195,34.107.243.93,HTTP2,236,"Magic, SETTINGS[0], WINDOW_UPDATE[0], PRIORITY[3], PRIORITY[5], PRIORITY[7], PRIORITY[9], PRIORITY[11], PRIORITY[13]"
103,2.068329443,34.107.243.93,192.168.166.195,HTTP2,684,"SETTINGS[0], WINDOW_UPDATE[0]"
104,2.068331329,34.107.243.93,192.168.166.195,HTTP2,97,SETTINGS[0]
105,2.068943294,192.168.166.195,34.107.243.93,HTTP2,97,SETTINGS[0]
106,2.069964679,192.168.166.195,130.104.1.2,DNS,95,Standard query 0xfadb AAAA autopush.prod.mozaws.net OPT
107,2.071648874,130.104.1.2,192.168.166.195,DNS,180,Standard query response 0xfadb AAAA autopush.prod.mozaws.net SOA ns-1260.awsdns-29.org OPT
108,2.072577787,192.168.166.195,34.107.243.93,TCP,74,42140  >  443 [SYN] Seq=0 Win=64240 Len=0 MSS=1460 SACK_PERM=1 TSval=1064897316 TSecr=0 WS=128
109,2.08043939,34.107.243.93,192.168.166.195,TCP,74,"443  >  42140 [SYN, ACK] Seq=0 Ack=1 Win=65535 Len=0 MSS=1412 SACK_PERM=1 TSval=193320304 TSecr=1064897316 WS=256"
110,2.080483112,192.168.166.195,34.107.243.93,TCP,66,42140  >  443 [ACK] Seq=1 Ack=1 Win=64256 Len=0 TSval=1064897324 TSecr=193320304
111,2.08068405,34.107.243.93,192.168.166.195,TCP,66,443  >  42132 [ACK] Seq=3727 Ack=939 Win=68352 Len=0 TSval=3330932557 TSecr=1064897312
112,2.081470064,192.168.166.195,34.107.243.93,TLSv1.3,1312,Client Hello
113,2.083245055,34.107.243.93,192.168.166.195,TCP,66,443  >  42140 [ACK] Seq=1 Ack=1247 Win=1174784 Len=0 TSval=193320304 TSecr=1064897325
114,2.091117414,34.107.243.93,192.168.166.195,TLSv1.3,284,"Server Hello, Change Cipher Spec, Encrypted Extensions, Finished"
115,2.091149403,192.168.166.195,34.107.243.93,TCP,66,42140  >  443 [ACK] Seq=1247 Ack=219 Win=64128 Len=0 TSval=1064897334 TSecr=193320314
116,2.092138939,192.168.166.195,34.107.243.93,TLSv1.3,130,"Change Cipher Spec, Finished"
117,2.092474605,192.168.166.195,34.107.243.93,HTTP,690,GET / HTTP/1.1 
118,2.100349339,34.107.243.93,192.168.166.195,TCP,66,443  >  42140 [ACK] Seq=219 Ack=1935 Win=70656 Len=0 TSval=193320324 TSecr=1064897335
119,2.209077854,192.168.166.195,130.104.1.2,DNS,85,Standard query 0x7206 AAAA darkreader.org OPT
120,2.231919185,130.104.1.2,192.168.166.195,DNS,156,Standard query response 0x7206 AAAA darkreader.org SOA ns15.domaincontrol.com OPT
121,2.232400823,192.168.166.195,185.199.110.153,TCP,74,42040  >  443 [SYN] Seq=0 Win=64240 Len=0 MSS=1460 SACK_PERM=1 TSval=806825420 TSecr=0 WS=128
122,2.23808493,192.168.166.195,130.104.1.2,DNS,101,Standard query 0xd55c A incoming.telemetry.mozilla.org OPT
123,2.238184805,192.168.166.195,130.104.1.2,DNS,101,Standard query 0x93d0 AAAA incoming.telemetry.mozilla.org OPT
124,2.239078028,185.199.110.153,192.168.166.195,TCP,74,"443  >  42040 [SYN, ACK] Seq=0 Ack=1 Win=65535 Len=0 MSS=1396 SACK_PERM=1 TSval=935557582 TSecr=806825420 WS=512"
125,2.239111832,192.168.166.195,185.199.110.153,TCP,66,42040  >  443 [ACK] Seq=1 Ack=1 Win=64256 Len=0 TSval=806825427 TSecr=935557582
126,2.23973581,130.104.1.2,192.168.166.195,DNS,176,Standard query response 0xd55c A incoming.telemetry.mozilla.org CNAME telemetry-incoming.r53-2.services.mozilla.com A 34.120.208.123 OPT
127,2.239932837,192.168.166.195,185.199.110.153,TLSv1.3,728,Client Hello
128,2.240371731,130.104.1.2,192.168.166.195,DNS,245,Standard query response 0x93d0 AAAA incoming.telemetry.mozilla.org CNAME telemetry-incoming.r53-2.services.mozilla.com SOA ns-1507.awsdns-60.org OPT
129,2.240523919,192.168.166.195,130.104.1.2,DNS,116,Standard query 0xfb75 AAAA telemetry-incoming.r53-2.services.mozilla.com OPT
130,2.241010795,34.107.243.93,192.168.166.195,HTTP,898,HTTP/1.1 101 Switching Protocols 
131,2.241438723,185.199.110.153,192.168.166.195,TCP,66,443  >  42040 [ACK] Seq=1 Ack=663 Win=1161216 Len=0 TSval=935557582 TSecr=806825428
132,2.242320561,130.104.1.2,192.168.166.195,DNS,201,Standard query response 0xfb75 AAAA telemetry-incoming.r53-2.services.mozilla.com SOA ns-1507.awsdns-60.org OPT
133,2.242729423,192.168.166.195,34.120.208.123,TCP,74,59564  >  443 [SYN] Seq=0 Win=64240 Len=0 MSS=1460 SACK_PERM=1 TSval=3068761046 TSecr=0 WS=128
134,2.246736458,192.168.166.195,34.107.243.93,WebSocket,205,WebSocket Text [FIN] [MASKED]
135,2.249757449,185.199.110.153,192.168.166.195,TLSv1.3,3918,"Server Hello, Change Cipher Spec, Encrypted Extensions, Certificate, Certificate Verify, Finished, New Session Ticket"
136,2.249788809,192.168.166.195,185.199.110.153,TCP,66,42040  >  443 [ACK] Seq=663 Ack=3853 Win=60416 Len=0 TSval=806825438 TSecr=935557592
137,2.250779393,34.120.208.123,192.168.166.195,TCP,74,"443  >  59564 [SYN, ACK] Seq=0 Ack=1 Win=65535 Len=0 MSS=1412 SACK_PERM=1 TSval=4270650166 TSecr=3068761046 WS=256"
138,2.250799158,192.168.166.195,34.120.208.123,TCP,66,59564  >  443 [ACK] Seq=1 Ack=1 Win=64256 Len=0 TSval=3068761054 TSecr=4270650166
139,2.251885427,192.168.166.195,34.120.208.123,TLSv1.2,744,Client Hello
140,2.25291645,192.168.166.195,185.199.110.153,TLSv1.3,130,"Change Cipher Spec, Finished"
141,2.253230046,34.120.208.123,192.168.166.195,TCP,66,443  >  59564 [ACK] Seq=1 Ack=679 Win=1174784 Len=0 TSval=4270650166 TSecr=3068761055
142,2.253319794,192.168.166.195,185.199.110.153,HTTP2,236,"Magic, SETTINGS[0], WINDOW_UPDATE[0], PRIORITY[3], PRIORITY[5], PRIORITY[7], PRIORITY[9], PRIORITY[11], PRIORITY[13]"
143,2.253505716,192.168.166.195,185.199.110.153,HTTP2,311,"HEADERS[15]: GET /blog/posts.json, WINDOW_UPDATE[15]"
144,2.25885304,34.107.243.93,192.168.166.195,TCP,66,443  >  42140 [ACK] Seq=1051 Ack=2074 Win=73216 Len=0 TSval=193320483 TSecr=1064897490
145,2.259166495,185.199.110.153,192.168.166.195,TCP,66,443  >  42040 [ACK] Seq=3853 Ack=727 Win=139776 Len=0 TSval=935557602 TSecr=806825441
146,2.259443144,185.199.110.153,192.168.166.195,TCP,66,443  >  42040 [ACK] Seq=3853 Ack=897 Win=141312 Len=0 TSval=935557602 TSecr=806825441
147,2.26001006,185.199.110.153,192.168.166.195,HTTP2,125,"SETTINGS[0], WINDOW_UPDATE[0], SETTINGS[0]"
148,2.260011037,185.199.110.153,192.168.166.195,TCP,66,443  >  42040 [ACK] Seq=3912 Ack=1142 Win=142848 Len=0 TSval=935557603 TSecr=806825442
149,2.260078855,192.168.166.195,185.199.110.153,HTTP2,97,SETTINGS[0]
150,2.262013996,185.199.110.153,192.168.166.195,HTTP2/JSON,1784,"DATA[15], JavaScript Object Notation (application/json)"
151,2.262053458,192.168.166.195,185.199.110.153,TCP,66,42040  >  443 [ACK] Seq=1173 Ack=5630 Win=62464 Len=0 TSval=806825450 TSecr=935557604
152,2.262500104,34.120.208.123,192.168.166.195,TLSv1.2,714,"[TCP Previous segment not captured] , Ignored Unknown Record"
153,2.262501082,34.120.208.123,192.168.166.195,TCP,1466,[TCP Out-Of-Order] 443  >  59564 [ACK] Seq=1 Ack=679 Win=67072 Len=1400 TSval=4270650178 TSecr=3068761055
154,2.26250206,34.120.208.123,192.168.166.195,TLSv1.2,1530,Ignored Unknown Record
155,2.262514841,192.168.166.195,34.120.208.123,TCP,78,[TCP Dup ACK 138#1] 59564  >  443 [ACK] Seq=679 Ack=1 Win=64256 Len=0 TSval=3068761066 TSecr=4270650166 SLE=1401 SRE=2049
156,2.262530137,192.168.166.195,34.120.208.123,TCP,66,59564  >  443 [ACK] Seq=679 Ack=2049 Win=62208 Len=0 TSval=3068761066 TSecr=4270650178
157,2.262538727,192.168.166.195,34.120.208.123,TCP,66,59564  >  443 [ACK] Seq=679 Ack=3513 Win=60800 Len=0 TSval=3068761066 TSecr=4270650178
158,2.266390082,185.199.110.153,192.168.166.195,TCP,66,443  >  42040 [ACK] Seq=5630 Ack=1173 Win=142848 Len=0 TSval=935557609 TSecr=806825448
159,2.268622965,192.168.166.195,130.104.1.2,DNS,92,Standard query 0x8e86 AAAA fp2e7a.wpc.phicdn.net OPT
160,2.270726987,130.104.1.2,192.168.166.195,DNS,158,Standard query response 0x8e86 AAAA fp2e7a.wpc.phicdn.net SOA ns1.phicdn.net OPT
161,2.271150166,192.168.166.195,192.229.221.95,TCP,74,46418  >  80 [SYN] Seq=0 Win=64240 Len=0 MSS=1460 SACK_PERM=1 TSval=3186725920 TSecr=0 WS=128
162,2.27768957,192.229.221.95,192.168.166.195,TCP,74,"80  >  46418 [SYN, ACK] Seq=0 Ack=1 Win=65535 Len=0 MSS=1460 SACK_PERM=1 TSval=3671271854 TSecr=3186725920 WS=512"
163,2.27772533,192.168.166.195,192.229.221.95,TCP,66,46418  >  80 [ACK] Seq=1 Ack=1 Win=64256 Len=0 TSval=3186725927 TSecr=3671271854
164,2.281542043,192.168.166.195,192.229.221.95,OCSP,490,Request
165,2.287949165,192.229.221.95,192.168.166.195,TCP,66,80  >  46418 [ACK] Seq=1 Ack=425 Win=67072 Len=0 TSval=3671271864 TSecr=3186725931
166,2.289208086,192.229.221.95,192.168.166.195,OCSP,803,Response
167,2.289224709,192.168.166.195,192.229.221.95,TCP,66,46418  >  80 [ACK] Seq=425 Ack=738 Win=63616 Len=0 TSval=3186725938 TSecr=3671271865
168,2.290398142,192.168.166.195,34.120.208.123,TLSv1.2,130,"Change Cipher Spec, Application Data"
169,2.290778647,192.168.166.195,34.120.208.123,TLSv1.2,236,Application Data
170,2.290808749,192.168.166.195,34.120.208.123,TLSv1.2,465,Application Data
171,2.291087213,192.168.166.195,34.120.208.123,TLSv1.2,936,Application Data
172,2.298676499,34.120.208.123,192.168.166.195,TLSv1.2,684,"Application Data, Application Data"
173,2.299130269,192.168.166.195,34.120.208.123,TLSv1.2,97,Application Data
174,2.300355805,34.120.208.123,192.168.166.195,TLSv1.2,97,Application Data
175,2.300357202,34.120.208.123,192.168.166.195,TCP,66,443  >  59564 [ACK] Seq=4162 Ack=2182 Win=71424 Len=0 TSval=4270650216 TSecr=3068761094
176,2.311181268,34.120.208.123,192.168.166.195,TCP,66,443  >  59564 [ACK] Seq=4162 Ack=2213 Win=71424 Len=0 TSval=4270650227 TSecr=3068761102
177,2.3414803,192.168.166.195,34.120.208.123,TCP,66,59564  >  443 [ACK] Seq=2213 Ack=4162 Win=64128 Len=0 TSval=3068761145 TSecr=4270650216
178,2.393876765,34.107.243.93,192.168.166.195,WebSocket,203,WebSocket Text [FIN] 
179,2.441470892,192.168.166.195,34.107.243.93,TCP,66,42140  >  443 [ACK] Seq=2074 Ack=1188 Win=64128 Len=0 TSval=1064897685 TSecr=193320617
180,2.511308702,34.120.208.123,192.168.166.195,TLSv1.2,515,Application Data
181,2.511396844,192.168.166.195,34.120.208.123,TCP,66,59564  >  443 [ACK] Seq=2213 Ack=4611 Win=63744 Len=0 TSval=3068761314 TSecr=4270650426
182,2.513622114,34.120.208.123,192.168.166.195,TLSv1.2,273,Application Data
183,2.513623092,34.120.208.123,192.168.166.195,TLSv1.2,105,Application Data
184,2.513691398,192.168.166.195,34.120.208.123,TCP,66,59564  >  443 [ACK] Seq=2213 Ack=4818 Win=64128 Len=0 TSval=3068761317 TSecr=4270650428
185,2.513734771,192.168.166.195,34.120.208.123,TCP,66,59564  >  443 [ACK] Seq=2213 Ack=4857 Win=64128 Len=0 TSval=3068761317 TSecr=4270650429
186,2.51389981,192.168.166.195,34.120.208.123,TLSv1.2,105,Application Data
187,2.516154553,192.168.166.195,34.120.208.123,TLSv1.2,189,Application Data
188,2.516194713,192.168.166.195,34.120.208.123,TLSv1.2,1056,Application Data
189,2.521893905,34.120.208.123,192.168.166.195,TCP,66,443  >  59564 [ACK] Seq=4857 Ack=2252 Win=71424 Len=0 TSval=4270650437 TSecr=3068761317
190,2.52376954,34.120.208.123,192.168.166.195,TCP,66,443  >  59564 [ACK] Seq=4857 Ack=2375 Win=71424 Len=0 TSval=4270650439 TSecr=3068761319
191,2.524118476,34.120.208.123,192.168.166.195,TCP,66,443  >  59564 [ACK] Seq=4857 Ack=3365 Win=73472 Len=0 TSval=4270650439 TSecr=3068761319
192,2.762816385,34.120.208.123,192.168.166.195,TLSv1.2,134,Application Data
193,2.762817363,34.120.208.123,192.168.166.195,TLSv1.2,347,Application Data
194,2.762818341,34.120.208.123,192.168.166.195,TLSv1.2,105,Application Data
195,2.762819319,34.120.208.123,192.168.166.195,TCP,105,"[TCP Retransmission] 443  >  59564 [PSH, ACK] Seq=5206 Ack=3365 Win=73472 Len=39 TSval=4270650638 TSecr=3068761319"
196,2.762857034,192.168.166.195,34.120.208.123,TCP,78,59564  >  443 [ACK] Seq=3365 Ack=5245 Win=63744 Len=0 TSval=3068761566 TSecr=4270650609 SLE=5206 SRE=5245
197,2.763055458,192.168.166.195,34.120.208.123,TLSv1.2,105,Application Data
198,2.764650883,192.168.166.195,34.120.208.123,TLSv1.2,193,Application Data
199,2.764699843,192.168.166.195,34.120.208.123,TLSv1.2,1524,Application Data
200,2.765428446,192.168.166.195,34.120.208.123,TLSv1.2,1789,Application Data
201,2.77181238,34.120.208.123,192.168.166.195,TCP,66,443  >  59564 [ACK] Seq=5245 Ack=3404 Win=73472 Len=0 TSval=4270650687 TSecr=3068761566
202,2.772638344,34.120.208.123,192.168.166.195,TCP,66,443  >  59564 [ACK] Seq=5245 Ack=3531 Win=73472 Len=0 TSval=4270650688 TSecr=3068761568
203,2.77501196,34.120.208.123,192.168.166.195,TCP,66,443  >  59564 [ACK] Seq=5245 Ack=4931 Win=76288 Len=0 TSval=4270650688 TSecr=3068761568
204,2.775012937,34.120.208.123,192.168.166.195,TCP,66,443  >  59564 [ACK] Seq=5245 Ack=4989 Win=76288 Len=0 TSval=4270650688 TSecr=3068761568
205,2.775013845,34.120.208.123,192.168.166.195,TCP,66,443  >  59564 [ACK] Seq=5245 Ack=6389 Win=79104 Len=0 TSval=4270650689 TSecr=3068761568
206,2.775014823,34.120.208.123,192.168.166.195,TCP,66,443  >  59564 [ACK] Seq=5245 Ack=6712 Win=81920 Len=0 TSval=4270650689 TSecr=3068761568
207,2.848197697,192.168.166.195,130.104.1.2,DNS,85,Standard query 0x0367 A www.icloud.com OPT
208,2.848298411,192.168.166.195,130.104.1.2,DNS,85,Standard query 0x2eeb AAAA www.icloud.com OPT
209,2.851468866,130.104.1.2,192.168.166.195,DNS,266,Standard query response 0x2eeb AAAA www.icloud.com CNAME www-cdn.icloud.com.akadns.net CNAME www.icloud.com-v1.edgekey.net CNAME e4478.dscb.akamaiedge.net AAAA 2a02:26f0:de:6aa::117e AAAA 2a02:26f0:de:6ae::117e OPT
210,2.851494568,130.104.1.2,192.168.166.195,DNS,226,Standard query response 0x0367 A www.icloud.com CNAME www-cdn.icloud.com.akadns.net CNAME www.icloud.com-v1.edgekey.net CNAME e4478.dscb.akamaiedge.net A 23.52.37.238 OPT
211,2.973501994,34.120.208.123,192.168.166.195,TLSv1.2,134,Application Data
212,2.973502902,34.120.208.123,192.168.166.195,TLSv1.2,199,Application Data
213,2.973503879,34.120.208.123,192.168.166.195,TLSv1.2,105,Application Data
214,2.973735549,192.168.166.195,34.120.208.123,TCP,66,59564  >  443 [ACK] Seq=6712 Ack=5485 Win=64128 Len=0 TSval=3068761777 TSecr=4270650879
215,2.973778921,192.168.166.195,34.120.208.123,TLSv1.2,105,Application Data
216,2.976679154,192.168.166.195,34.120.208.123,TLSv1.2,190,Application Data
217,2.976713098,192.168.166.195,34.120.208.123,TLSv1.2,503,Application Data
218,2.981348092,34.120.208.123,192.168.166.195,TCP,66,443  >  59564 [ACK] Seq=5485 Ack=6751 Win=81920 Len=0 TSval=4270650897 TSecr=3068761777
219,2.985170323,34.120.208.123,192.168.166.195,TCP,66,443  >  59564 [ACK] Seq=5485 Ack=6875 Win=81920 Len=0 TSval=4270650900 TSecr=3068761780
220,2.985171231,34.120.208.123,192.168.166.195,TCP,66,443  >  59564 [ACK] Seq=5485 Ack=7312 Win=84736 Len=0 TSval=4270650901 TSecr=3068761780
221,3.006711526,192.168.166.195,130.104.1.2,DNS,84,Standard query 0x6f8c A www.apple.com OPT
222,3.0068077,192.168.166.195,130.104.1.2,DNS,84,Standard query 0x7d9f AAAA www.apple.com OPT
223,3.008364781,130.104.1.2,192.168.166.195,DNS,240,Standard query response 0x6f8c A www.apple.com CNAME www.apple.com.edgekey.net CNAME www.apple.com.edgekey.net.globalredir.akadns.net CNAME e6858.dscx.akamaiedge.net A 23.211.188.208 OPT
224,3.008962218,130.104.1.2,192.168.166.195,DNS,280,Standard query response 0x7d9f AAAA www.apple.com CNAME www.apple.com.edgekey.net CNAME www.apple.com.edgekey.net.globalredir.akadns.net CNAME e6858.dscx.akamaiedge.net AAAA 2a02:26f0:8d00:1b7::1aca AAAA 2a02:26f0:8d00:1b2::1aca OPT
225,3.014759052,192.168.166.195,130.104.1.2,DNS,87,Standard query 0x5090 A setup.icloud.com OPT
226,3.014851873,192.168.166.195,130.104.1.2,DNS,87,Standard query 0xe0c5 AAAA setup.icloud.com OPT
227,3.017240715,130.104.1.2,192.168.166.195,DNS,188,Standard query response 0x5090 A setup.icloud.com CNAME setup.fe2.apple-dns.net A 17.248.236.67 A 17.248.236.69 A 17.248.236.64 A 17.248.236.66 OPT
228,3.017240715,130.104.1.2,192.168.166.195,DNS,236,Standard query response 0xe0c5 AAAA setup.icloud.com CNAME setup.fe2.apple-dns.net AAAA 2a01:b740:a41:e80::2:3 AAAA 2a01:b740:a41:e80::2:1 AAAA 2a01:b740:a41:e80::2:6 AAAA 2a01:b740:a41:e80::2:5 OPT
229,3.023056686,2001:6a8:3081:6f06:d9e4:1cb9:a410:d1a5,2a01:b740:a41:e80::2:6,TCP,94,39446  >  443 [SYN] Seq=0 Win=64800 Len=0 MSS=1440 SACK_PERM=1 TSval=2423953532 TSecr=0 WS=128
230,3.030057055,2a01:b740:a41:e80::2:6,2001:6a8:3081:6f06:d9e4:1cb9:a410:d1a5,TCP,94,"443  >  39446 [SYN, ACK] Seq=0 Ack=1 Win=64260 Len=0 MSS=1440 SACK_PERM=1 TSval=1938245218 TSecr=2423953532 WS=128"
231,3.030100916,2001:6a8:3081:6f06:d9e4:1cb9:a410:d1a5,2a01:b740:a41:e80::2:6,TCP,86,39446  >  443 [ACK] Seq=1 Ack=1 Win=64896 Len=0 TSval=2423953539 TSecr=1938245218
232,3.030994837,2001:6a8:3081:6f06:d9e4:1cb9:a410:d1a5,2a01:b740:a41:e80::2:6,TLSv1.2,750,Client Hello
233,3.032630422,2a01:b740:a41:e80::2:6,2001:6a8:3081:6f06:d9e4:1cb9:a410:d1a5,TCP,86,443  >  39446 [ACK] Seq=1 Ack=665 Win=1198080 Len=0 TSval=1938245218 TSecr=2423953540
234,3.039365667,2a01:b740:a41:e80::2:6,2001:6a8:3081:6f06:d9e4:1cb9:a410:d1a5,TLSv1.2,1514,Server Hello
235,3.039367133,2a01:b740:a41:e80::2:6,2001:6a8:3081:6f06:d9e4:1cb9:a410:d1a5,TCP,1326,"[TCP Previous segment not captured] 443  >  39446 [PSH, ACK] Seq=2857 Ack=665 Win=64128 Len=1240 TSval=1938245226 TSecr=2423953540 [TCP segment of a reassembled PDU]"
236,3.039368111,2a01:b740:a41:e80::2:6,2001:6a8:3081:6f06:d9e4:1cb9:a410:d1a5,TCP,1514,[TCP Out-Of-Order] 443  >  39446 [ACK] Seq=1429 Ack=665 Win=64128 Len=1428 TSval=1938245226 TSecr=2423953540 [TCP segment of a reassembled PDU]
237,3.039369089,2a01:b740:a41:e80::2:6,2001:6a8:3081:6f06:d9e4:1cb9:a410:d1a5,TCP,1514,443  >  39446 [ACK] Seq=4097 Ack=665 Win=64128 Len=1428 TSval=1938245226 TSecr=2423953540 [TCP segment of a reassembled PDU]
238,3.039369997,2a01:b740:a41:e80::2:6,2001:6a8:3081:6f06:d9e4:1cb9:a410:d1a5,TLSv1.2,506,"[TCP Previous segment not captured] , Ignored Unknown Record"
239,3.039370975,2a01:b740:a41:e80::2:6,2001:6a8:3081:6f06:d9e4:1cb9:a410:d1a5,TCP,1514,[TCP Out-Of-Order] 443  >  39446 [ACK] Seq=5525 Ack=665 Win=64128 Len=1428 TSval=1938245226 TSecr=2423953540
240,3.039406036,2001:6a8:3081:6f06:d9e4:1cb9:a410:d1a5,2a01:b740:a41:e80::2:6,TCP,86,39446  >  443 [ACK] Seq=665 Ack=1429 Win=63488 Len=0 TSval=2423953548 TSecr=1938245226
241,3.039434881,2001:6a8:3081:6f06:d9e4:1cb9:a410:d1a5,2a01:b740:a41:e80::2:6,TCP,98,[TCP Dup ACK 240#1] 39446  >  443 [ACK] Seq=665 Ack=1429 Win=63488 Len=0 TSval=2423953548 TSecr=1938245226 SLE=2857 SRE=4097
242,3.039537969,2001:6a8:3081:6f06:d9e4:1cb9:a410:d1a5,2a01:b740:a41:e80::2:6,TCP,86,39446  >  443 [ACK] Seq=665 Ack=4097 Win=60928 Len=0 TSval=2423953549 TSecr=1938245226
243,3.039565208,2001:6a8:3081:6f06:d9e4:1cb9:a410:d1a5,2a01:b740:a41:e80::2:6,TCP,86,39446  >  443 [ACK] Seq=665 Ack=5525 Win=59520 Len=0 TSval=2423953549 TSecr=1938245226
244,3.039573659,2001:6a8:3081:6f06:d9e4:1cb9:a410:d1a5,2a01:b740:a41:e80::2:6,TCP,98,[TCP Dup ACK 243#1] 39446  >  443 [ACK] Seq=665 Ack=5525 Win=59520 Len=0 TSval=2423953549 TSecr=1938245226 SLE=6953 SRE=7373
245,3.039583158,2001:6a8:3081:6f06:d9e4:1cb9:a410:d1a5,2a01:b740:a41:e80::2:6,TCP,86,39446  >  443 [ACK] Seq=665 Ack=7373 Win=57728 Len=0 TSval=2423953549 TSecr=1938245226
246,3.041012426,2001:6a8:3081:6f06:d9e4:1cb9:a410:d1a5,2a01:b740:a41:e80::2:6,TLSv1.2,179,"Client Key Exchange, Change Cipher Spec, Finished"
247,3.047889871,2a01:b740:a41:e80::2:6,2001:6a8:3081:6f06:d9e4:1cb9:a410:d1a5,TCP,86,443  >  39446 [ACK] Seq=7373 Ack=758 Win=64128 Len=0 TSval=1938245236 TSecr=2423953550
248,3.047890779,2a01:b740:a41:e80::2:6,2001:6a8:3081:6f06:d9e4:1cb9:a410:d1a5,TLSv1.2,360,"New Session Ticket, Change Cipher Spec, Finished"
249,3.04861589,2001:6a8:3081:6f06:d9e4:1cb9:a410:d1a5,2a01:b740:a41:e80::2:6,HTTP,3398,POST /setup/ws/1/validate?clientBuildNumber=2410Project42&clientMasteringNumber=2410B20&clientId=18e0fecb-8f7f-4a12-9150-7e249a8a8fc5 HTTP/1.1 
250,3.055608297,2a01:b740:a41:e80::2:6,2001:6a8:3081:6f06:d9e4:1cb9:a410:d1a5,TCP,86,443  >  39446 [ACK] Seq=7647 Ack=2186 Win=64128 Len=0 TSval=1938245243 TSecr=2423953558
251,3.055609275,2a01:b740:a41:e80::2:6,2001:6a8:3081:6f06:d9e4:1cb9:a410:d1a5,TCP,86,443  >  39446 [ACK] Seq=7647 Ack=4070 Win=64000 Len=0 TSval=1938245243 TSecr=2423953558
252,3.160471702,2001:6a8:3081:6f06:d9e4:1cb9:a410:d1a5,2a02:26f0:de:6ae::117e,TCP,94,58988  >  443 [SYN] Seq=0 Win=64800 Len=0 MSS=1440 SACK_PERM=1 TSval=637256065 TSecr=0 WS=128
253,3.19194738,2a02:26f0:de:6ae::117e,2001:6a8:3081:6f06:d9e4:1cb9:a410:d1a5,TCP,94,"443  >  58988 [SYN, ACK] Seq=0 Ack=1 Win=64260 Len=0 MSS=1440 SACK_PERM=1 TSval=1074985952 TSecr=637256065 WS=128"
254,3.192005141,2001:6a8:3081:6f06:d9e4:1cb9:a410:d1a5,2a02:26f0:de:6ae::117e,TCP,86,58988  >  443 [ACK] Seq=1 Ack=1 Win=64896 Len=0 TSval=637256096 TSecr=1074985952
255,3.192856527,2001:6a8:3081:6f06:d9e4:1cb9:a410:d1a5,2a02:26f0:de:6ae::117e,TLSv1.2,748,Client Hello
256,3.194606445,2a02:26f0:de:6ae::117e,2001:6a8:3081:6f06:d9e4:1cb9:a410:d1a5,TCP,86,443  >  58988 [ACK] Seq=1 Ack=663 Win=1198080 Len=0 TSval=1074985952 TSecr=637256097
257,3.195836032,34.120.208.123,192.168.166.195,TLSv1.2,134,Application Data
258,3.197937749,34.120.208.123,192.168.166.195,TLSv1.2,335,Application Data
259,3.197938657,34.120.208.123,192.168.166.195,TLSv1.2,105,Application Data
260,3.198148466,192.168.166.195,34.120.208.123,TCP,66,59564  >  443 [ACK] Seq=7312 Ack=5861 Win=64128 Len=0 TSval=3068762001 TSecr=4270651111
261,3.198214817,192.168.166.195,34.120.208.123,TLSv1.2,105,Application Data
262,3.205857462,34.120.208.123,192.168.166.195,TCP,66,443  >  59564 [ACK] Seq=5861 Ack=7351 Win=84736 Len=0 TSval=4270651121 TSecr=3068762001
263,3.223791412,2a02:26f0:de:6ae::117e,2001:6a8:3081:6f06:d9e4:1cb9:a410:d1a5,TLSv1.2,1326,"[TCP Previous segment not captured] , Ignored Unknown Record"
264,3.223793856,2a02:26f0:de:6ae::117e,2001:6a8:3081:6f06:d9e4:1cb9:a410:d1a5,TCP,2942,"[TCP Out-Of-Order] 443  >  58988 [PSH, ACK] Seq=1 Ack=663 Win=64128 Len=2856 TSval=1074985984 TSecr=637256097"
265,3.2238234,2001:6a8:3081:6f06:d9e4:1cb9:a410:d1a5,2a02:26f0:de:6ae::117e,TCP,98,[TCP Dup ACK 254#1] 58988  >  443 [ACK] Seq=663 Ack=1 Win=64896 Len=0 TSval=637256128 TSecr=1074985952 SLE=2857 SRE=4097
266,3.223857274,2001:6a8:3081:6f06:d9e4:1cb9:a410:d1a5,2a02:26f0:de:6ae::117e,TCP,86,58988  >  443 [ACK] Seq=663 Ack=4097 Win=60800 Len=0 TSval=637256128 TSecr=1074985984
267,3.224485791,192.168.166.195,34.120.208.123,TLSv1.2,214,Application Data
268,3.224527767,192.168.166.195,34.120.208.123,TLSv1.2,574,Application Data
269,3.228872494,2a02:26f0:de:6ae::117e,2001:6a8:3081:6f06:d9e4:1cb9:a410:d1a5,TLSv1.2,1311,Ignored Unknown Record
270,3.228906856,2001:6a8:3081:6f06:d9e4:1cb9:a410:d1a5,2a02:26f0:de:6ae::117e,TCP,86,58988  >  443 [ACK] Seq=663 Ack=5322 Win=63104 Len=0 TSval=637256133 TSecr=1074985989
271,3.232251012,2001:6a8:3081:6f06:d9e4:1cb9:a410:d1a5,2a02:26f0:de:6ae::117e,TLSv1.2,166,"Change Cipher Spec, Application Data"
272,3.232344112,34.120.208.123,192.168.166.195,TCP,66,443  >  59564 [ACK] Seq=5861 Ack=7499 Win=87552 Len=0 TSval=4270651148 TSecr=3068762028
273,3.23234502,34.120.208.123,192.168.166.195,TCP,66,443  >  59564 [ACK] Seq=5861 Ack=8007 Win=90368 Len=0 TSval=4270651148 TSecr=3068762028
274,3.232647511,2001:6a8:3081:6f06:d9e4:1cb9:a410:d1a5,2a02:26f0:de:6ae::117e,TLSv1.2,256,Application Data
275,3.232671606,2001:6a8:3081:6f06:d9e4:1cb9:a410:d1a5,2a02:26f0:de:6ae::117e,TLSv1.2,2674,Application Data
276,3.233462439,2a01:b740:a41:e80::2:6,2001:6a8:3081:6f06:d9e4:1cb9:a410:d1a5,TCP,1514,443  >  39446 [ACK] Seq=7647 Ack=4070 Win=64128 Len=1428 TSval=1938245421 TSecr=2423953558 [TCP segment of a reassembled PDU]
277,3.2343345,2a01:b740:a41:e80::2:6,2001:6a8:3081:6f06:d9e4:1cb9:a410:d1a5,TCP,1514,443  >  39446 [ACK] Seq=9075 Ack=4070 Win=64128 Len=1428 TSval=1938245421 TSecr=2423953558 [TCP segment of a reassembled PDU]
278,3.234335477,2a01:b740:a41:e80::2:6,2001:6a8:3081:6f06:d9e4:1cb9:a410:d1a5,TCP,1157,"[TCP Previous segment not captured] 443  >  39446 [PSH, ACK] Seq=11931 Ack=4070 Win=64128 Len=1071 TSval=1938245421 TSecr=2423953558 [TCP segment of a reassembled PDU]"
279,3.234336385,2a01:b740:a41:e80::2:6,2001:6a8:3081:6f06:d9e4:1cb9:a410:d1a5,TCP,1514,[TCP Out-Of-Order] 443  >  39446 [ACK] Seq=10503 Ack=4070 Win=64128 Len=1428 TSval=1938245421 TSecr=2423953558
280,3.23436118,2001:6a8:3081:6f06:d9e4:1cb9:a410:d1a5,2a01:b740:a41:e80::2:6,TCP,98,39446  >  443 [ACK] Seq=4070 Ack=10503 Win=61312 Len=0 TSval=2423953743 TSecr=1938245421 SLE=11931 SRE=13002
281,3.234387999,2001:6a8:3081:6f06:d9e4:1cb9:a410:d1a5,2a01:b740:a41:e80::2:6,TCP,86,39446  >  443 [ACK] Seq=4070 Ack=13002 Win=58880 Len=0 TSval=2423953743 TSecr=1938245421
282,3.277621616,192.168.166.195,130.104.1.2,DNS,92,Standard query 0x0320 A appleid.cdn-apple.com OPT
283,3.277727848,192.168.166.195,130.104.1.2,DNS,92,Standard query 0xc536 AAAA appleid.cdn-apple.com OPT
284,3.281079546,2a02:26f0:de:6ae::117e,2001:6a8:3081:6f06:d9e4:1cb9:a410:d1a5,TCP,86,443  >  58988 [ACK] Seq=5322 Ack=3501 Win=62336 Len=0 TSval=1074986041 TSecr=637256136
285,3.281080454,2a02:26f0:de:6ae::117e,2001:6a8:3081:6f06:d9e4:1cb9:a410:d1a5,TLSv1.2,373,Application Data
286,3.281081362,2a02:26f0:de:6ae::117e,2001:6a8:3081:6f06:d9e4:1cb9:a410:d1a5,TLSv1.2,373,Application Data
287,3.281573685,2001:6a8:3081:6f06:d9e4:1cb9:a410:d1a5,2a02:26f0:de:6ae::117e,TCP,86,58988  >  443 [ACK] Seq=3501 Ack=5896 Win=64128 Len=0 TSval=637256186 TSecr=1074986041
288,3.281701498,2a02:26f0:de:6ae::117e,2001:6a8:3081:6f06:d9e4:1cb9:a410:d1a5,TLSv1.2,147,Application Data
289,3.281702895,2a02:26f0:de:6ae::117e,2001:6a8:3081:6f06:d9e4:1cb9:a410:d1a5,TLSv1.2,117,Application Data
290,3.281747176,2001:6a8:3081:6f06:d9e4:1cb9:a410:d1a5,2a02:26f0:de:6ae::117e,TLSv1.2,117,Application Data
291,3.283778281,192.168.166.195,130.104.1.2,DNS,98,Standard query 0x4edb A p50-ckdatabasews.icloud.com OPT
292,3.283882767,192.168.166.195,130.104.1.2,DNS,98,Standard query 0xa406 AAAA p50-ckdatabasews.icloud.com OPT
293,3.284075464,192.168.166.195,130.104.1.2,DNS,94,Standard query 0xa15d AAAA docws.fe2.apple-dns.net OPT
294,3.28425943,192.168.166.195,130.104.1.2,DNS,101,Standard query 0x9863 A p50-keyvalueservice.icloud.com OPT
295,3.284341566,192.168.166.195,130.104.1.2,DNS,101,Standard query 0x2ee4 AAAA p50-keyvalueservice.icloud.com OPT
296,3.28644014,130.104.1.2,192.168.166.195,DNS,338,Standard query response 0xa406 AAAA p50-ckdatabasews.icloud.com CNAME ckdatabasews.fe2.apple-dns.net AAAA 2a01:b740:a41:280::2:1 AAAA 2a01:b740:a41:280::2:7 AAAA 2a01:b740:a41:280::2:a AAAA 2a01:b740:a41:280::2:b AAAA 2a01:b740:a41:280::2:2 AAAA 2a01:b740:a41:280::2:6 AAAA 2a01:b740:a41:280::2:5 OPT
