No.,Time,Source,Destination,Protocol,Length,Info
1,0.0,2001:6a8:3081:6f06:6929:a50d:93f0:6a7e,2a01:b740:a41:e80::2:1,TCP,86,"33660  >  443 [RST, ACK] Seq=1 Ack=1 Win=501 Len=0 TSval=4014341384 TSecr=4121536137"
2,0.000421844,2001:6a8:3081:6f06:6929:a50d:93f0:6a7e,2a01:b740:a41:e80::2:2,TLSv1.2,4924,Application Data
3,0.008556039,2a01:b740:a41:e80::2:2,2001:6a8:3081:6f06:6929:a50d:93f0:6a7e,TCP,86,443  >  48446 [ACK] Seq=1 Ack=1429 Win=501 Len=0 TSval=2541604770 TSecr=2862217734
4,0.008557017,2a01:b740:a41:e80::2:2,2001:6a8:3081:6f06:6929:a50d:93f0:6a7e,TCP,86,443  >  48446 [ACK] Seq=1 Ack=2857 Win=501 Len=0 TSval=2541604770 TSecr=2862217734
5,0.008558483,2a01:b740:a41:e80::2:2,2001:6a8:3081:6f06:6929:a50d:93f0:6a7e,TCP,86,443  >  48446 [ACK] Seq=1 Ack=4839 Win=500 Len=0 TSval=2541604770 TSecr=2862217734
6,0.338706099,2a01:b740:a41:e80::2:2,2001:6a8:3081:6f06:6929:a50d:93f0:6a7e,TLSv1.2,1260,Application Data
7,0.338772169,2001:6a8:3081:6f06:6929:a50d:93f0:6a7e,2a01:b740:a41:e80::2:2,TCP,86,48446  >  443 [ACK] Seq=4839 Ack=1175 Win=493 Len=0 TSval=2862218073 TSecr=2541605013
8,0.344875085,2001:6a8:3081:6f06:6929:a50d:93f0:6a7e,2a01:b740:a41:e80::2:2,TLSv1.2,3998,Application Data
9,0.351531497,2a01:b740:a41:e80::2:2,2001:6a8:3081:6f06:6929:a50d:93f0:6a7e,TCP,86,443  >  48446 [ACK] Seq=1175 Ack=6267 Win=501 Len=0 TSval=2541605113 TSecr=2862218079
10,0.351532474,2a01:b740:a41:e80::2:2,2001:6a8:3081:6f06:6929:a50d:93f0:6a7e,TCP,86,443  >  48446 [ACK] Seq=1175 Ack=7695 Win=501 Len=0 TSval=2541605113 TSecr=2862218079
11,0.351533452,2a01:b740:a41:e80::2:2,2001:6a8:3081:6f06:6929:a50d:93f0:6a7e,TCP,86,443  >  48446 [ACK] Seq=1175 Ack=8751 Win=498 Len=0 TSval=2541605113 TSecr=2862218079
12,0.65175309,2a01:b740:a41:e80::2:2,2001:6a8:3081:6f06:6929:a50d:93f0:6a7e,TLSv1.2,412,"[TCP Previous segment not captured] , Ignored Unknown Record"
13,0.651754068,2a01:b740:a41:e80::2:2,2001:6a8:3081:6f06:6929:a50d:93f0:6a7e,TCP,1514,[TCP Out-Of-Order] 443  >  48446 [ACK] Seq=1175 Ack=8751 Win=501 Len=1428 TSval=2541605375 TSecr=2862218079
14,0.651794646,2001:6a8:3081:6f06:6929:a50d:93f0:6a7e,2a01:b740:a41:e80::2:2,TCP,98,[TCP Dup ACK 7#1] 48446  >  443 [ACK] Seq=8751 Ack=1175 Win=501 Len=0 TSval=2862218386 TSecr=2541605113 SLE=2603 SRE=2929
15,0.651837878,2001:6a8:3081:6f06:6929:a50d:93f0:6a7e,2a01:b740:a41:e80::2:2,TCP,86,48446  >  443 [ACK] Seq=8751 Ack=2929 Win=488 Len=0 TSval=2862218386 TSecr=2541605375
16,0.979924951,2001:6a8:3081:6f06:6929:a50d:93f0:6a7e,2a01:b740:a41:e80::2:1,TLSv1.2,3056,Application Data
17,0.982680629,2001:6a8:3081:6f06:6929:a50d:93f0:6a7e,2a01:b740:a41:e80::2:1,TLSv1.2,152,Application Data
18,0.989272646,2a01:b740:a41:e80::2:1,2001:6a8:3081:6f06:6929:a50d:93f0:6a7e,TCP,86,443  >  41750 [ACK] Seq=1 Ack=1429 Win=955 Len=0 TSval=2360876257 TSecr=4014342364
19,0.989273554,2a01:b740:a41:e80::2:1,2001:6a8:3081:6f06:6929:a50d:93f0:6a7e,TCP,86,443  >  41750 [ACK] Seq=1 Ack=2971 Win=952 Len=0 TSval=2360876257 TSecr=4014342364
20,0.989274532,2a01:b740:a41:e80::2:1,2001:6a8:3081:6f06:6929:a50d:93f0:6a7e,TCP,86,443  >  41750 [ACK] Seq=1 Ack=3037 Win=952 Len=0 TSval=2360876258 TSecr=4014342367
21,1.38255508,2a01:b740:a41:e80::2:1,2001:6a8:3081:6f06:6929:a50d:93f0:6a7e,TLSv1.2,968,Application Data
22,1.382626179,2001:6a8:3081:6f06:6929:a50d:93f0:6a7e,2a01:b740:a41:e80::2:1,TCP,86,41750  >  443 [ACK] Seq=3037 Ack=883 Win=6850 Len=0 TSval=4014342767 TSecr=2360876647
23,1.385457216,2001:6a8:3081:6f06:6929:a50d:93f0:6a7e,2a01:b740:a41:e80::2:1,TLSv1.2,128,Application Data
24,1.391872185,2a01:b740:a41:e80::2:1,2001:6a8:3081:6f06:6929:a50d:93f0:6a7e,TCP,86,443  >  41750 [ACK] Seq=883 Ack=3079 Win=960 Len=0 TSval=2360876660 TSecr=4014342769
25,1.98843971,2001:6a8:3081:6f06:6929:a50d:93f0:6a7e,2a01:b740:a41:e80::2:2,TLSv1.2,3035,Application Data
26,1.991026441,2001:6a8:3081:6f06:6929:a50d:93f0:6a7e,2a01:b740:a41:e80::2:2,TLSv1.2,3570,Application Data
27,1.997817857,2a01:b740:a41:e80::2:2,2001:6a8:3081:6f06:6929:a50d:93f0:6a7e,TCP,86,443  >  43038 [ACK] Seq=1 Ack=1429 Win=2643 Len=0 TSval=1364024370 TSecr=2862219722
28,1.997818835,2a01:b740:a41:e80::2:2,2001:6a8:3081:6f06:6929:a50d:93f0:6a7e,TCP,86,443  >  43038 [ACK] Seq=1 Ack=2950 Win=2641 Len=0 TSval=1364024370 TSecr=2862219722
29,1.997819813,2a01:b740:a41:e80::2:2,2001:6a8:3081:6f06:6929:a50d:93f0:6a7e,TCP,86,443  >  43038 [ACK] Seq=1 Ack=4378 Win=2643 Len=0 TSval=1364024371 TSecr=2862219725
30,1.99782121,2a01:b740:a41:e80::2:2,2001:6a8:3081:6f06:6929:a50d:93f0:6a7e,TCP,86,443  >  43038 [ACK] Seq=1 Ack=5806 Win=2635 Len=0 TSval=1364024371 TSecr=2862219725
31,1.997822187,2a01:b740:a41:e80::2:2,2001:6a8:3081:6f06:6929:a50d:93f0:6a7e,TCP,86,443  >  43038 [ACK] Seq=1 Ack=6434 Win=2631 Len=0 TSval=1364024371 TSecr=2862219725
32,2.218395359,2a01:b740:a41:e80::2:2,2001:6a8:3081:6f06:6929:a50d:93f0:6a7e,TLSv1.2,676,Application Data
33,2.220789466,2001:6a8:3081:6f06:6929:a50d:93f0:6a7e,2a01:b740:a41:e80::2:2,TLSv1.2,121,Application Data
34,2.228087165,2a01:b740:a41:e80::2:2,2001:6a8:3081:6f06:6929:a50d:93f0:6a7e,TCP,86,443  >  43038 [ACK] Seq=591 Ack=6469 Win=2647 Len=0 TSval=1364024601 TSecr=2862219955
35,2.568438457,2001:6a8:3081:6f06:6929:a50d:93f0:6a7e,2a01:b740:a41:e80::2:1,TLSv1.2,3062,Application Data
36,2.570866018,2001:6a8:3081:6f06:6929:a50d:93f0:6a7e,2a01:b740:a41:e80::2:1,TLSv1.2,195,Application Data
37,2.5774785,2a01:b740:a41:e80::2:1,2001:6a8:3081:6f06:6929:a50d:93f0:6a7e,TCP,86,443  >  41750 [ACK] Seq=883 Ack=4507 Win=955 Len=0 TSval=2360877845 TSecr=4014343952
38,2.577479478,2a01:b740:a41:e80::2:1,2001:6a8:3081:6f06:6929:a50d:93f0:6a7e,TCP,86,443  >  41750 [ACK] Seq=883 Ack=6055 Win=952 Len=0 TSval=2360877845 TSecr=4014343952
39,2.577480875,2a01:b740:a41:e80::2:1,2001:6a8:3081:6f06:6929:a50d:93f0:6a7e,TCP,86,443  >  41750 [ACK] Seq=883 Ack=6164 Win=960 Len=0 TSval=2360877846 TSecr=4014343955
40,3.054078145,2a01:b740:a41:e80::2:1,2001:6a8:3081:6f06:6929:a50d:93f0:6a7e,TLSv1.2,1207,Application Data
41,3.063685372,2001:6a8:3081:6f06:6929:a50d:93f0:6a7e,2a01:b740:a41:e80::2:1,TLSv1.2,3058,Application Data
42,3.064276374,2001:6a8:3081:6f06:6929:a50d:93f0:6a7e,2a01:b740:a41:e80::2:1,TLSv1.2,162,Application Data
43,3.07098391,2a01:b740:a41:e80::2:1,2001:6a8:3081:6f06:6929:a50d:93f0:6a7e,TCP,86,443  >  41750 [ACK] Seq=2004 Ack=7592 Win=955 Len=0 TSval=2360878339 TSecr=4014344448
44,3.070985377,2a01:b740:a41:e80::2:1,2001:6a8:3081:6f06:6929:a50d:93f0:6a7e,TCP,86,443  >  41750 [ACK] Seq=2004 Ack=9136 Win=952 Len=0 TSval=2360878339 TSecr=4014344448
45,3.070986354,2a01:b740:a41:e80::2:1,2001:6a8:3081:6f06:6929:a50d:93f0:6a7e,TCP,86,443  >  41750 [ACK] Seq=2004 Ack=9212 Win=960 Len=0 TSval=2360878339 TSecr=4014344448
46,3.471633815,2a01:b740:a41:e80::2:1,2001:6a8:3081:6f06:6929:a50d:93f0:6a7e,TLSv1.2,963,Application Data
47,3.515825652,2001:6a8:3081:6f06:6929:a50d:93f0:6a7e,2a01:b740:a41:e80::2:1,TCP,86,41750  >  443 [ACK] Seq=9212 Ack=2881 Win=6870 Len=0 TSval=4014344900 TSecr=2360878665
48,4.971837399,2001:6a8:3081:6f06:6929:a50d:93f0:6a7e,2a01:b740:a41:e80::2:5,TCP,86,40566  >  443 [ACK] Seq=1 Ack=1 Win=1166 Len=0 TSval=69622458 TSecr=852665
49,4.980485769,2a01:b740:a41:e80::2:5,2001:6a8:3081:6f06:6929:a50d:93f0:6a7e,TCP,86,[TCP ACKed unseen segment] 443  >  40566 [ACK] Seq=1 Ack=2 Win=501 Len=0 TSval=899021 TSecr=69576150
50,9.989332267,2001:6a8:3081:6f06:6929:a50d:93f0:6a7e,2a01:b740:a41:e80::2:2,TLSv1.2,3036,Application Data
51,9.992098211,2001:6a8:3081:6f06:6929:a50d:93f0:6a7e,2a01:b740:a41:e80::2:2,TLSv1.2,2500,Application Data
52,9.998056974,2a01:b740:a41:e80::2:2,2001:6a8:3081:6f06:6929:a50d:93f0:6a7e,TCP,86,443  >  43038 [ACK] Seq=591 Ack=7897 Win=2643 Len=0 TSval=1364032371 TSecr=2862227723
53,9.998058301,2a01:b740:a41:e80::2:2,2001:6a8:3081:6f06:6929:a50d:93f0:6a7e,TCP,86,443  >  43038 [ACK] Seq=591 Ack=9325 Win=2643 Len=0 TSval=1364032371 TSecr=2862227723
54,9.998059278,2a01:b740:a41:e80::2:2,2001:6a8:3081:6f06:6929:a50d:93f0:6a7e,TCP,86,443  >  43038 [ACK] Seq=591 Ack=9419 Win=2645 Len=0 TSval=1364032371 TSecr=2862227723
55,9.999181985,2a01:b740:a41:e80::2:2,2001:6a8:3081:6f06:6929:a50d:93f0:6a7e,TCP,86,443  >  43038 [ACK] Seq=591 Ack=10847 Win=2643 Len=0 TSval=1364032372 TSecr=2862227726
56,9.999183452,2a01:b740:a41:e80::2:2,2001:6a8:3081:6f06:6929:a50d:93f0:6a7e,TCP,86,443  >  43038 [ACK] Seq=591 Ack=11833 Win=2645 Len=0 TSval=1364032372 TSecr=2862227726
57,10.156708269,2a01:b740:a41:e80::2:2,2001:6a8:3081:6f06:6929:a50d:93f0:6a7e,TLSv1.2,705,Application Data
58,10.156709666,2a01:b740:a41:e80::2:2,2001:6a8:3081:6f06:6929:a50d:93f0:6a7e,TLSv1.2,117,Application Data
59,10.156782441,2001:6a8:3081:6f06:6929:a50d:93f0:6a7e,2a01:b740:a41:e80::2:2,TCP,86,43038  >  443 [ACK] Seq=11833 Ack=1241 Win=2513 Len=0 TSval=2862227891 TSecr=1364032522
60,10.159923716,2001:6a8:3081:6f06:6929:a50d:93f0:6a7e,2a01:b740:a41:e80::2:2,TLSv1.2,121,Application Data
61,10.1667247,2a01:b740:a41:e80::2:2,2001:6a8:3081:6f06:6929:a50d:93f0:6a7e,TCP,86,443  >  43038 [ACK] Seq=1241 Ack=11868 Win=2647 Len=0 TSval=1364032540 TSecr=2862227894
1,0.0,2a01:b740:a41:e80::2:1,2001:6a8:3081:6f06:6929:a50d:93f0:6a7e,TCP,4370,"443  >  33660 [PSH, ACK] Seq=1 Ack=1 Win=501 Len=4284 TSval=4121452794 TSecr=4014250376 [TCP segment of a reassembled PDU]"
2,1.396e-06,2a01:b740:a41:e80::2:1,2001:6a8:3081:6f06:6929:a50d:93f0:6a7e,TLSv1.2,1252,Application Data
3,4.6654e-05,2001:6a8:3081:6f06:6929:a50d:93f0:6a7e,2a01:b740:a41:e80::2:1,TCP,86,33660  >  443 [ACK] Seq=1 Ack=4285 Win=468 Len=0 TSval=4014250643 TSecr=4121452794
4,8.1715e-05,2001:6a8:3081:6f06:6929:a50d:93f0:6a7e,2a01:b740:a41:e80::2:1,TCP,86,33660  >  443 [ACK] Seq=1 Ack=5451 Win=459 Len=0 TSval=4014250643 TSecr=4121452795
5,0.046871038,2a01:b740:a41:e80::2:5,2001:6a8:3081:6f06:6929:a50d:93f0:6a7e,TLSv1.2,1260,Application Data
6,0.053849421,2001:6a8:3081:6f06:6929:a50d:93f0:6a7e,2a01:b740:a41:e80::2:5,TLSv1.2,3998,Application Data
7,0.060960573,2a01:b740:a41:e80::2:5,2001:6a8:3081:6f06:6929:a50d:93f0:6a7e,TCP,86,443  >  40566 [ACK] Seq=1175 Ack=1429 Win=501 Len=0 TSval=803360 TSecr=69526799
8,0.060962039,2a01:b740:a41:e80::2:5,2001:6a8:3081:6f06:6929:a50d:93f0:6a7e,TCP,86,443  >  40566 [ACK] Seq=1175 Ack=2857 Win=501 Len=0 TSval=803360 TSecr=69526799
9,0.060962947,2a01:b740:a41:e80::2:5,2001:6a8:3081:6f06:6929:a50d:93f0:6a7e,TCP,86,443  >  40566 [ACK] Seq=1175 Ack=3913 Win=501 Len=0 TSval=803360 TSecr=69526799
10,0.418349073,2a01:b740:a41:e80::2:5,2001:6a8:3081:6f06:6929:a50d:93f0:6a7e,TLSv1.2,1091,"[TCP Previous segment not captured] , Ignored Unknown Record"
11,0.418350469,2a01:b740:a41:e80::2:5,2001:6a8:3081:6f06:6929:a50d:93f0:6a7e,TCP,1514,[TCP Out-Of-Order] 443  >  40566 [ACK] Seq=1175 Ack=3913 Win=501 Len=1428 TSval=803708 TSecr=69526799
12,0.418384343,2001:6a8:3081:6f06:6929:a50d:93f0:6a7e,2a01:b740:a41:e80::2:5,TCP,98,[TCP Window Update] 40566  >  443 [ACK] Seq=3913 Ack=1175 Win=915 Len=0 TSval=69527164 TSecr=803360 SLE=2603 SRE=3608
13,0.418424083,2001:6a8:3081:6f06:6929:a50d:93f0:6a7e,2a01:b740:a41:e80::2:5,TCP,86,40566  >  443 [ACK] Seq=3913 Ack=3608 Win=938 Len=0 TSval=69527164 TSecr=803708
14,2.022767163,2001:6a8:3081:6f06:6929:a50d:93f0:6a7e,2a01:b740:a41:e80::2:1,TLSv1.2,3058,Application Data
15,2.025451951,2001:6a8:3081:6f06:6929:a50d:93f0:6a7e,2a01:b740:a41:e80::2:1,TLSv1.2,195,Application Data
16,2.031904914,2a01:b740:a41:e80::2:1,2001:6a8:3081:6f06:6929:a50d:93f0:6a7e,TCP,86,443  >  41750 [ACK] Seq=1 Ack=1429 Win=955 Len=0 TSval=2360786559 TSecr=4014252666
17,2.031905892,2a01:b740:a41:e80::2:1,2001:6a8:3081:6f06:6929:a50d:93f0:6a7e,TCP,86,443  >  41750 [ACK] Seq=1 Ack=2973 Win=945 Len=0 TSval=2360786559 TSecr=4014252666
18,2.03190687,2a01:b740:a41:e80::2:1,2001:6a8:3081:6f06:6929:a50d:93f0:6a7e,TCP,86,443  >  41750 [ACK] Seq=1 Ack=3082 Win=960 Len=0 TSval=2360786560 TSecr=4014252669
19,2.507013367,2a01:b740:a41:e80::2:1,2001:6a8:3081:6f06:6929:a50d:93f0:6a7e,TLSv1.2,1127,Application Data
20,2.507055621,2001:6a8:3081:6f06:6929:a50d:93f0:6a7e,2a01:b740:a41:e80::2:1,TCP,86,41750  >  443 [ACK] Seq=3082 Ack=1042 Win=6669 Len=0 TSval=4014253150 TSecr=2360786938
21,2.509689984,2001:6a8:3081:6f06:6929:a50d:93f0:6a7e,2a01:b740:a41:e80::2:1,TLSv1.2,128,Application Data
22,2.515222152,2001:6a8:3081:6f06:6929:a50d:93f0:6a7e,2a01:b740:a41:e80::2:1,TLSv1.2,3052,Application Data
23,2.516333056,2001:6a8:3081:6f06:6929:a50d:93f0:6a7e,2a01:b740:a41:e80::2:1,TLSv1.2,162,Application Data
24,2.517527211,2a01:b740:a41:e80::2:1,2001:6a8:3081:6f06:6929:a50d:93f0:6a7e,TCP,86,443  >  41750 [ACK] Seq=1042 Ack=3124 Win=960 Len=0 TSval=2360787044 TSecr=4014253153
25,2.522968166,2a01:b740:a41:e80::2:1,2001:6a8:3081:6f06:6929:a50d:93f0:6a7e,TCP,86,443  >  41750 [ACK] Seq=1042 Ack=4552 Win=955 Len=0 TSval=2360787050 TSecr=4014253158
26,2.522969563,2a01:b740:a41:e80::2:1,2001:6a8:3081:6f06:6929:a50d:93f0:6a7e,TCP,86,443  >  41750 [ACK] Seq=1042 Ack=6090 Win=943 Len=0 TSval=2360787050 TSecr=4014253158
27,2.523612177,2a01:b740:a41:e80::2:1,2001:6a8:3081:6f06:6929:a50d:93f0:6a7e,TCP,86,443  >  41750 [ACK] Seq=1042 Ack=6166 Win=960 Len=0 TSval=2360787051 TSecr=4014253160
28,2.926324091,2a01:b740:a41:e80::2:1,2001:6a8:3081:6f06:6929:a50d:93f0:6a7e,TLSv1.2,959,Application Data
29,2.968293423,2001:6a8:3081:6f06:6929:a50d:93f0:6a7e,2a01:b740:a41:e80::2:1,TCP,86,41750  >  443 [ACK] Seq=6166 Ack=1915 Win=6669 Len=0 TSval=4014253612 TSecr=2360787354
30,3.552523954,2001:6a8:3081:6f06:6929:a50d:93f0:6a7e,2a01:b740:a41:e80::2:5,TCP,86,50306  >  443 [ACK] Seq=1 Ack=1 Win=501 Len=0 TSval=69530298 TSecr=2126753130
31,3.561254877,2a01:b740:a41:e80::2:5,2001:6a8:3081:6f06:6929:a50d:93f0:6a7e,TCP,86,[TCP ACKed unseen segment] 443  >  50306 [ACK] Seq=1 Ack=2 Win=501 Len=0 TSval=2126798188 TSecr=69485287
32,4.728624312,2001:6a8:3081:6f06:6929:a50d:93f0:6a7e,2a01:b740:a41:e80::2:2,TLSv1.2,3031,Application Data
33,4.728736897,2001:6a8:3081:6f06:6929:a50d:93f0:6a7e,2a01:b740:a41:e80::2:2,TLSv1.2,6038,Application Data
34,4.738172873,2a01:b740:a41:e80::2:2,2001:6a8:3081:6f06:6929:a50d:93f0:6a7e,TCP,86,443  >  43038 [ACK] Seq=1 Ack=1429 Win=2643 Len=0 TSval=1363936370 TSecr=2862131722
35,4.738173781,2a01:b740:a41:e80::2:2,2001:6a8:3081:6f06:6929:a50d:93f0:6a7e,TCP,86,443  >  43038 [ACK] Seq=1 Ack=2857 Win=2635 Len=0 TSval=1363936370 TSecr=2862131722
36,4.738174759,2a01:b740:a41:e80::2:2,2001:6a8:3081:6f06:6929:a50d:93f0:6a7e,TCP,86,443  >  43038 [ACK] Seq=1 Ack=2946 Win=2635 Len=0 TSval=1363936370 TSecr=2862131722
37,4.738176156,2a01:b740:a41:e80::2:2,2001:6a8:3081:6f06:6929:a50d:93f0:6a7e,TCP,86,443  >  43038 [ACK] Seq=1 Ack=4374 Win=2643 Len=0 TSval=1363936370 TSecr=2862131722
38,4.738575371,2a01:b740:a41:e80::2:2,2001:6a8:3081:6f06:6929:a50d:93f0:6a7e,TCP,86,443  >  43038 [ACK] Seq=1 Ack=5802 Win=2635 Len=0 TSval=1363936370 TSecr=2862131722
39,4.738576768,2a01:b740:a41:e80::2:2,2001:6a8:3081:6f06:6929:a50d:93f0:6a7e,TCP,86,443  >  43038 [ACK] Seq=1 Ack=7230 Win=2643 Len=0 TSval=1363936370 TSecr=2862131722
40,4.738577746,2a01:b740:a41:e80::2:2,2001:6a8:3081:6f06:6929:a50d:93f0:6a7e,TCP,86,443  >  43038 [ACK] Seq=1 Ack=8898 Win=2640 Len=0 TSval=1363936371 TSecr=2862131722
41,4.909746996,2a01:b740:a41:e80::2:2,2001:6a8:3081:6f06:6929:a50d:93f0:6a7e,TLSv1.2,677,Application Data
42,4.909748393,2a01:b740:a41:e80::2:2,2001:6a8:3081:6f06:6929:a50d:93f0:6a7e,TLSv1.2,117,Application Data
43,4.910029367,2001:6a8:3081:6f06:6929:a50d:93f0:6a7e,2a01:b740:a41:e80::2:2,TCP,86,43038  >  443 [ACK] Seq=8898 Ack=623 Win=2425 Len=0 TSval=2862131903 TSecr=1363936536
44,4.912166316,2001:6a8:3081:6f06:6929:a50d:93f0:6a7e,2a01:b740:a41:e80::2:2,TLSv1.2,121,Application Data
45,4.918842284,2a01:b740:a41:e80::2:2,2001:6a8:3081:6f06:6929:a50d:93f0:6a7e,TCP,86,443  >  43038 [ACK] Seq=623 Ack=8933 Win=2647 Len=0 TSval=1363936551 TSecr=2862131905
1,0.0,2001:6a8:3081:6f06:6929:a50d:93f0:6a7e,2a01:b740:a41:e80::2:2,TLSv1.2,3032,Application Data
2,0.000118732,2001:6a8:3081:6f06:6929:a50d:93f0:6a7e,2a01:b740:a41:e80::2:2,TLSv1.2,5926,Application Data
3,0.010358796,2a01:b740:a41:e80::2:2,2001:6a8:3081:6f06:6929:a50d:93f0:6a7e,TCP,86,443  >  43038 [ACK] Seq=1 Ack=1429 Win=2643 Len=0 TSval=1363784370 TSecr=2861979722
4,0.010359704,2a01:b740:a41:e80::2:2,2001:6a8:3081:6f06:6929:a50d:93f0:6a7e,TCP,86,443  >  43038 [ACK] Seq=1 Ack=2947 Win=2641 Len=0 TSval=1363784370 TSecr=2861979722
5,0.010361171,2a01:b740:a41:e80::2:2,2001:6a8:3081:6f06:6929:a50d:93f0:6a7e,TCP,86,443  >  43038 [ACK] Seq=1 Ack=4375 Win=2643 Len=0 TSval=1363784370 TSecr=2861979722
6,0.010362148,2a01:b740:a41:e80::2:2,2001:6a8:3081:6f06:6929:a50d:93f0:6a7e,TCP,86,443  >  43038 [ACK] Seq=1 Ack=5803 Win=2635 Len=0 TSval=1363784370 TSecr=2861979722
7,0.010363545,2a01:b740:a41:e80::2:2,2001:6a8:3081:6f06:6929:a50d:93f0:6a7e,TCP,86,443  >  43038 [ACK] Seq=1 Ack=7231 Win=2643 Len=0 TSval=1363784370 TSecr=2861979722
8,0.010364523,2a01:b740:a41:e80::2:2,2001:6a8:3081:6f06:6929:a50d:93f0:6a7e,TCP,86,443  >  43038 [ACK] Seq=1 Ack=8787 Win=2640 Len=0 TSval=1363784371 TSecr=2861979722
9,0.313404023,2a01:b740:a41:e80::2:2,2001:6a8:3081:6f06:6929:a50d:93f0:6a7e,TLSv1.2,706,Application Data
10,0.315861896,2001:6a8:3081:6f06:6929:a50d:93f0:6a7e,2a01:b740:a41:e80::2:2,TLSv1.2,121,Application Data
11,0.322576765,2a01:b740:a41:e80::2:2,2001:6a8:3081:6f06:6929:a50d:93f0:6a7e,TCP,86,443  >  43038 [ACK] Seq=621 Ack=8822 Win=2647 Len=0 TSval=1363784683 TSecr=2861980038
12,1.67160073,2001:6a8:3081:6f06:6929:a50d:93f0:6a7e,2620:149:208:430e::1d,TCP,86,54802  >  443 [ACK] Seq=1 Ack=1 Win=501 Len=0 TSval=829118648 TSecr=3627364800
13,1.984703875,2620:149:208:430e::1d,2001:6a8:3081:6f06:6929:a50d:93f0:6a7e,TCP,86,[TCP ACKed unseen segment] 443  >  54802 [ACK] Seq=1 Ack=2 Win=501 Len=0 TSval=3627410208 TSecr=826815747
14,7.321510755,2001:6a8:3081:6f06:6929:a50d:93f0:6a7e,2a01:b740:a41:e80::2:5,TLSv1.2,4121,Application Data
15,7.323992583,2001:6a8:3081:6f06:6929:a50d:93f0:6a7e,2a01:b740:a41:e80::2:5,TLSv1.2,169,Application Data
16,7.330189786,2a01:b740:a41:e80::2:5,2001:6a8:3081:6f06:6929:a50d:93f0:6a7e,TCP,86,443  >  40566 [ACK] Seq=1 Ack=1429 Win=501 Len=0 TSval=663358 TSecr=69386795
17,7.330190763,2a01:b740:a41:e80::2:5,2001:6a8:3081:6f06:6929:a50d:93f0:6a7e,TCP,86,443  >  40566 [ACK] Seq=1 Ack=2857 Win=501 Len=0 TSval=663358 TSecr=69386795
18,7.33019216,2a01:b740:a41:e80::2:5,2001:6a8:3081:6f06:6929:a50d:93f0:6a7e,TCP,86,443  >  40566 [ACK] Seq=1 Ack=4036 Win=497 Len=0 TSval=663358 TSecr=69386795
19,7.330832121,2a01:b740:a41:e80::2:5,2001:6a8:3081:6f06:6929:a50d:93f0:6a7e,TCP,86,443  >  40566 [ACK] Seq=1 Ack=4119 Win=501 Len=0 TSval=663358 TSecr=69386798
20,7.730130308,2a01:b740:a41:e80::2:5,2001:6a8:3081:6f06:6929:a50d:93f0:6a7e,TLSv1.2,697,"[TCP Previous segment not captured] , Ignored Unknown Record"
21,7.730131774,2a01:b740:a41:e80::2:5,2001:6a8:3081:6f06:6929:a50d:93f0:6a7e,TCP,1514,[TCP Out-Of-Order] 443  >  40566 [ACK] Seq=1 Ack=4119 Win=501 Len=1428 TSval=663661 TSecr=69386798
22,7.730187648,2001:6a8:3081:6f06:6929:a50d:93f0:6a7e,2a01:b740:a41:e80::2:5,TCP,98,[TCP Dup ACK 14#1] 40566  >  443 [ACK] Seq=4119 Ack=1 Win=501 Len=0 TSval=69387204 TSecr=663358 SLE=1429 SRE=2040
23,7.730242264,2001:6a8:3081:6f06:6929:a50d:93f0:6a7e,2a01:b740:a41:e80::2:5,TCP,86,40566  >  443 [ACK] Seq=4119 Ack=2040 Win=486 Len=0 TSval=69387204 TSecr=663661
24,7.733549133,2a01:b740:a41:e80::2:5,2001:6a8:3081:6f06:6929:a50d:93f0:6a7e,TCP,697,"[TCP Spurious Retransmission] 443  >  40566 [PSH, ACK] Seq=1429 Ack=4119 Win=501 Len=611 TSval=663761 TSecr=69386798"
25,7.733586219,2001:6a8:3081:6f06:6929:a50d:93f0:6a7e,2a01:b740:a41:e80::2:5,TCP,98,[TCP Window Update] 40566  >  443 [ACK] Seq=4119 Ack=2040 Win=501 Len=0 TSval=69387208 TSecr=663761 SLE=1429 SRE=2040
26,7.999403884,2001:6a8:3081:6f06:6929:a50d:93f0:6a7e,2a01:b740:a41:e80::2:2,TLSv1.2,3032,Application Data
27,8.00253126,2001:6a8:3081:6f06:6929:a50d:93f0:6a7e,2a01:b740:a41:e80::2:2,TLSv1.2,1324,Application Data
28,8.008616017,2a01:b740:a41:e80::2:2,2001:6a8:3081:6f06:6929:a50d:93f0:6a7e,TCP,86,443  >  43038 [ACK] Seq=621 Ack=10250 Win=2643 Len=0 TSval=1363792369 TSecr=2861987721
29,8.008617413,2a01:b740:a41:e80::2:2,2001:6a8:3081:6f06:6929:a50d:93f0:6a7e,TCP,86,443  >  43038 [ACK] Seq=621 Ack=11678 Win=2635 Len=0 TSval=1363792369 TSecr=2861987721
30,8.008618391,2a01:b740:a41:e80::2:2,2001:6a8:3081:6f06:6929:a50d:93f0:6a7e,TCP,86,443  >  43038 [ACK] Seq=621 Ack=11768 Win=2635 Len=0 TSval=1363792369 TSecr=2861987721
31,8.009547008,2a01:b740:a41:e80::2:2,2001:6a8:3081:6f06:6929:a50d:93f0:6a7e,TCP,86,443  >  43038 [ACK] Seq=621 Ack=13006 Win=2644 Len=0 TSval=1363792370 TSecr=2861987724
32,8.25150022,2a01:b740:a41:e80::2:2,2001:6a8:3081:6f06:6929:a50d:93f0:6a7e,TLSv1.2,706,Application Data
33,8.254007051,2001:6a8:3081:6f06:6929:a50d:93f0:6a7e,2a01:b740:a41:e80::2:2,TLSv1.2,121,Application Data
34,8.260608707,2a01:b740:a41:e80::2:2,2001:6a8:3081:6f06:6929:a50d:93f0:6a7e,TCP,86,443  >  43038 [ACK] Seq=1241 Ack=13041 Win=2647 Len=0 TSval=1363792621 TSecr=2861987976
1,0.0,2001:6a8:3081:6f06:6929:a50d:93f0:6a7e,2620:149:208:430e::1d,TCP,86,54802  >  443 [ACK] Seq=1 Ack=1 Win=501 Len=0 TSval=829233336 TSecr=3627479489
2,0.308822122,2620:149:208:430e::1d,2001:6a8:3081:6f06:6929:a50d:93f0:6a7e,TCP,86,[TCP ACKed unseen segment] 443  >  54802 [ACK] Seq=1 Ack=2 Win=501 Len=0 TSval=3627524896 TSecr=829142372
3,0.339055587,2001:6a8:3081:6f06:6929:a50d:93f0:6a7e,2a01:b740:a41:e80::2:5,TLSv1.2,5108,Application Data
4,0.345841486,2a01:b740:a41:e80::2:5,2001:6a8:3081:6f06:6929:a50d:93f0:6a7e,TCP,86,443  >  40566 [ACK] Seq=1 Ack=1429 Win=501 Len=0 TSval=772733 TSecr=69496173
5,0.345842394,2a01:b740:a41:e80::2:5,2001:6a8:3081:6f06:6929:a50d:93f0:6a7e,TCP,86,443  >  40566 [ACK] Seq=1 Ack=2857 Win=501 Len=0 TSval=772733 TSecr=69496173
6,0.345843372,2a01:b740:a41:e80::2:5,2001:6a8:3081:6f06:6929:a50d:93f0:6a7e,TCP,86,443  >  40566 [ACK] Seq=1 Ack=5023 Win=499 Len=0 TSval=772733 TSecr=69496173
7,0.726705909,2a01:b740:a41:e80::2:5,2001:6a8:3081:6f06:6929:a50d:93f0:6a7e,TLSv1.2,1260,Application Data
8,0.726747046,2001:6a8:3081:6f06:6929:a50d:93f0:6a7e,2a01:b740:a41:e80::2:5,TCP,86,40566  >  443 [ACK] Seq=5023 Ack=1175 Win=694 Len=0 TSval=69496560 TSecr=773054
9,0.731612714,2001:6a8:3081:6f06:6929:a50d:93f0:6a7e,2a01:b740:a41:e80::2:5,TLSv1.2,3998,Application Data
10,0.738874515,2a01:b740:a41:e80::2:5,2001:6a8:3081:6f06:6929:a50d:93f0:6a7e,TCP,86,443  >  40566 [ACK] Seq=1175 Ack=6451 Win=501 Len=0 TSval=773126 TSecr=69496565
11,0.738875492,2a01:b740:a41:e80::2:5,2001:6a8:3081:6f06:6929:a50d:93f0:6a7e,TCP,86,443  >  40566 [ACK] Seq=1175 Ack=7879 Win=501 Len=0 TSval=773126 TSecr=69496565
12,0.73887647,2a01:b740:a41:e80::2:5,2001:6a8:3081:6f06:6929:a50d:93f0:6a7e,TCP,86,443  >  40566 [ACK] Seq=1175 Ack=8935 Win=501 Len=0 TSval=773126 TSecr=69496565
13,1.144079571,2a01:b740:a41:e80::2:5,2001:6a8:3081:6f06:6929:a50d:93f0:6a7e,TLSv1.2,2513,Application Data
14,1.144118613,2001:6a8:3081:6f06:6929:a50d:93f0:6a7e,2a01:b740:a41:e80::2:5,TCP,86,40566  >  443 [ACK] Seq=8935 Ack=3602 Win=732 Len=0 TSval=69496978 TSecr=773444
15,1.179016044,2001:6a8:3081:6f06:6929:a50d:93f0:6a7e,2a01:b740:a41:e80::2:1,TLSv1.2,3053,Application Data
16,1.179642175,2001:6a8:3081:6f06:6929:a50d:93f0:6a7e,2a01:b740:a41:e80::2:1,TLSv1.2,136,Application Data
17,1.186364239,2a01:b740:a41:e80::2:1,2001:6a8:3081:6f06:6929:a50d:93f0:6a7e,TCP,86,443  >  41750 [ACK] Seq=1 Ack=1429 Win=955 Len=0 TSval=2360754801 TSecr=4014220911
18,1.186365217,2a01:b740:a41:e80::2:1,2001:6a8:3081:6f06:6929:a50d:93f0:6a7e,TCP,86,443  >  41750 [ACK] Seq=1 Ack=2968 Win=952 Len=0 TSval=2360754802 TSecr=4014220911
19,1.186366194,2a01:b740:a41:e80::2:1,2001:6a8:3081:6f06:6929:a50d:93f0:6a7e,TCP,86,443  >  41750 [ACK] Seq=1 Ack=3018 Win=960 Len=0 TSval=2360754802 TSecr=4014220911
20,1.353347102,2a01:b740:a41:e80::2:1,2001:6a8:3081:6f06:6929:a50d:93f0:6a7e,TLSv1.2,961,Application Data
21,1.353390963,2001:6a8:3081:6f06:6929:a50d:93f0:6a7e,2a01:b740:a41:e80::2:1,TCP,86,41750  >  443 [ACK] Seq=3018 Ack=876 Win=6569 Len=0 TSval=4014221085 TSecr=2360754960
22,1.35573199,2001:6a8:3081:6f06:6929:a50d:93f0:6a7e,2a01:b740:a41:e80::2:1,TLSv1.2,128,Application Data
23,1.36242458,2a01:b740:a41:e80::2:1,2001:6a8:3081:6f06:6929:a50d:93f0:6a7e,TCP,86,443  >  41750 [ACK] Seq=876 Ack=3060 Win=960 Len=0 TSval=2360754978 TSecr=4014221087
24,1.941869831,fe80::7873:cbf6:a56b:7b3b,ff02::2,ICMPv6,62,Router Solicitation
25,2.32779492,2001:6a8:3081:6f06:6929:a50d:93f0:6a7e,2a01:b740:a41:e80::2:1,TLSv1.2,3059,Application Data
26,2.330943737,2001:6a8:3081:6f06:6929:a50d:93f0:6a7e,2a01:b740:a41:e80::2:1,TLSv1.2,195,Application Data
27,2.337218673,2a01:b740:a41:e80::2:1,2001:6a8:3081:6f06:6929:a50d:93f0:6a7e,TCP,86,443  >  41750 [ACK] Seq=876 Ack=4488 Win=955 Len=0 TSval=2360755952 TSecr=4014222059
28,2.337219651,2a01:b740:a41:e80::2:1,2001:6a8:3081:6f06:6929:a50d:93f0:6a7e,TCP,86,443  >  41750 [ACK] Seq=876 Ack=5916 Win=955 Len=0 TSval=2360755953 TSecr=4014222059
29,2.337221118,2a01:b740:a41:e80::2:1,2001:6a8:3081:6f06:6929:a50d:93f0:6a7e,TCP,86,443  >  41750 [ACK] Seq=876 Ack=6033 Win=955 Len=0 TSval=2360755953 TSecr=4014222059
30,2.337417723,2a01:b740:a41:e80::2:1,2001:6a8:3081:6f06:6929:a50d:93f0:6a7e,TCP,86,443  >  41750 [ACK] Seq=876 Ack=6142 Win=960 Len=0 TSval=2360755953 TSecr=4014222062
31,2.921902967,2a01:b740:a41:e80::2:1,2001:6a8:3081:6f06:6929:a50d:93f0:6a7e,TLSv1.2,1129,Application Data
32,2.921904434,2a01:b740:a41:e80::2:1,2001:6a8:3081:6f06:6929:a50d:93f0:6a7e,TLSv1.2,124,Application Data
33,2.922155585,2001:6a8:3081:6f06:6929:a50d:93f0:6a7e,2a01:b740:a41:e80::2:1,TCP,86,41750  >  443 [ACK] Seq=6142 Ack=1957 Win=6589 Len=0 TSval=4014222654 TSecr=2360756486
34,2.931721117,2001:6a8:3081:6f06:6929:a50d:93f0:6a7e,2a01:b740:a41:e80::2:1,TLSv1.2,3053,Application Data
35,2.932912269,2001:6a8:3081:6f06:6929:a50d:93f0:6a7e,2a01:b740:a41:e80::2:1,TLSv1.2,162,Application Data
36,2.939691253,2a01:b740:a41:e80::2:1,2001:6a8:3081:6f06:6929:a50d:93f0:6a7e,TCP,86,443  >  41750 [ACK] Seq=1957 Ack=7570 Win=955 Len=0 TSval=2360756555 TSecr=4014222663
37,2.93969265,2a01:b740:a41:e80::2:1,2001:6a8:3081:6f06:6929:a50d:93f0:6a7e,TCP,86,443  >  41750 [ACK] Seq=1957 Ack=9109 Win=952 Len=0 TSval=2360756555 TSecr=4014222663
38,2.939694117,2a01:b740:a41:e80::2:1,2001:6a8:3081:6f06:6929:a50d:93f0:6a7e,TCP,86,443  >  41750 [ACK] Seq=1957 Ack=9185 Win=960 Len=0 TSval=2360756555 TSecr=4014222664
39,3.337941464,2a01:b740:a41:e80::2:1,2001:6a8:3081:6f06:6929:a50d:93f0:6a7e,TLSv1.2,963,Application Data
40,3.380228436,2001:6a8:3081:6f06:6929:a50d:93f0:6a7e,2a01:b740:a41:e80::2:1,TCP,86,41750  >  443 [ACK] Seq=9185 Ack=2834 Win=6589 Len=0 TSval=4014223112 TSecr=2360756855
41,3.641806424,2001:6a8:3081:6f06:6929:a50d:93f0:6a7e,2a01:b740:a41:e80::2:2,TLSv1.2,3034,Application Data
42,3.6419408,2001:6a8:3081:6f06:6929:a50d:93f0:6a7e,2a01:b740:a41:e80::2:2,TLSv1.2,5926,Application Data
43,3.650775787,2a01:b740:a41:e80::2:2,2001:6a8:3081:6f06:6929:a50d:93f0:6a7e,TCP,86,443  >  43038 [ACK] Seq=1 Ack=1429 Win=2643 Len=0 TSval=1363904371 TSecr=2862099723
44,3.650776695,2a01:b740:a41:e80::2:2,2001:6a8:3081:6f06:6929:a50d:93f0:6a7e,TCP,86,443  >  43038 [ACK] Seq=1 Ack=2857 Win=2635 Len=0 TSval=1363904371 TSecr=2862099723
45,3.650778092,2a01:b740:a41:e80::2:2,2001:6a8:3081:6f06:6929:a50d:93f0:6a7e,TCP,86,443  >  43038 [ACK] Seq=1 Ack=2949 Win=2635 Len=0 TSval=1363904371 TSecr=2862099723
46,3.650779558,2a01:b740:a41:e80::2:2,2001:6a8:3081:6f06:6929:a50d:93f0:6a7e,TCP,86,443  >  43038 [ACK] Seq=1 Ack=4377 Win=2626 Len=0 TSval=1363904371 TSecr=2862099723
47,3.650780466,2a01:b740:a41:e80::2:2,2001:6a8:3081:6f06:6929:a50d:93f0:6a7e,TCP,86,443  >  43038 [ACK] Seq=1 Ack=5805 Win=2643 Len=0 TSval=1363904371 TSecr=2862099723
48,3.650781444,2a01:b740:a41:e80::2:2,2001:6a8:3081:6f06:6929:a50d:93f0:6a7e,TCP,86,443  >  43038 [ACK] Seq=1 Ack=7233 Win=2635 Len=0 TSval=1363904371 TSecr=2862099723
49,3.650782911,2a01:b740:a41:e80::2:2,2001:6a8:3081:6f06:6929:a50d:93f0:6a7e,TCP,86,443  >  43038 [ACK] Seq=1 Ack=8789 Win=2625 Len=0 TSval=1363904371 TSecr=2862099723
50,4.069334665,2a01:b740:a41:e80::2:2,2001:6a8:3081:6f06:6929:a50d:93f0:6a7e,TLSv1.2,716,Application Data
51,4.069336131,2a01:b740:a41:e80::2:2,2001:6a8:3081:6f06:6929:a50d:93f0:6a7e,TLSv1.2,117,Application Data
52,4.069411491,2001:6a8:3081:6f06:6929:a50d:93f0:6a7e,2a01:b740:a41:e80::2:2,TCP,86,43038  >  443 [ACK] Seq=8789 Ack=662 Win=2386 Len=0 TSval=2862100151 TSecr=1363904693
53,4.072642442,2001:6a8:3081:6f06:6929:a50d:93f0:6a7e,2a01:b740:a41:e80::2:2,TLSv1.2,121,Application Data
54,4.079508798,2a01:b740:a41:e80::2:2,2001:6a8:3081:6f06:6929:a50d:93f0:6a7e,TCP,86,443  >  43038 [ACK] Seq=662 Ack=8824 Win=2647 Len=0 TSval=1363904800 TSecr=2862100154
55,4.904345433,fe80::80,ff02::1,ICMPv6,158,Router Advertisement from 00:00:5e:00:02:01
56,4.920307147,fe80::7873:cbf6:a56b:7b3b,ff02::16,ICMPv6,150,Multicast Listener Report Message v2
57,5.012078638,fe80::7873:cbf6:a56b:7b3b,ff02::16,ICMPv6,150,Multicast Listener Report Message v2
58,7.258981393,2001:6a8:3081:6f06:6929:a50d:93f0:6a7e,2a01:b740:a41:e80::2:1,TLSv1.2,4080,Application Data
59,7.261432142,2001:6a8:3081:6f06:6929:a50d:93f0:6a7e,2a01:b740:a41:e80::2:1,TLSv1.2,226,Application Data
60,7.268096236,2a01:b740:a41:e80::2:1,2001:6a8:3081:6f06:6929:a50d:93f0:6a7e,TCP,86,443  >  33660 [ACK] Seq=1 Ack=1429 Win=501 Len=0 TSval=4121429181 TSecr=4014226991
61,7.268097144,2a01:b740:a41:e80::2:1,2001:6a8:3081:6f06:6929:a50d:93f0:6a7e,TCP,86,443  >  33660 [ACK] Seq=1 Ack=2857 Win=496 Len=0 TSval=4121429181 TSecr=4014226991
62,7.268098122,2a01:b740:a41:e80::2:1,2001:6a8:3081:6f06:6929:a50d:93f0:6a7e,TCP,86,443  >  33660 [ACK] Seq=1 Ack=3995 Win=490 Len=0 TSval=4121429181 TSecr=4014226991
63,7.26809903,2a01:b740:a41:e80::2:1,2001:6a8:3081:6f06:6929:a50d:93f0:6a7e,TCP,86,443  >  33660 [ACK] Seq=1 Ack=4135 Win=501 Len=0 TSval=4121429182 TSecr=4014226993
64,7.620757634,2a01:b740:a41:e80::2:1,2001:6a8:3081:6f06:6929:a50d:93f0:6a7e,TCP,4370,"443  >  33660 [PSH, ACK] Seq=1 Ack=4135 Win=501 Len=4284 TSval=4121429439 TSecr=4014226993 [TCP segment of a reassembled PDU]"
65,7.620758611,2a01:b740:a41:e80::2:1,2001:6a8:3081:6f06:6929:a50d:93f0:6a7e,TLSv1.2,1233,Application Data
66,7.620759589,2a01:b740:a41:e80::2:1,2001:6a8:3081:6f06:6929:a50d:93f0:6a7e,TCP,1233,"[TCP Retransmission] 443  >  33660 [PSH, ACK] Seq=4285 Ack=4135 Win=501 Len=1147 TSval=4121429476 TSecr=4014226993"
67,7.620801005,2001:6a8:3081:6f06:6929:a50d:93f0:6a7e,2a01:b740:a41:e80::2:1,TCP,86,33660  >  443 [ACK] Seq=4135 Ack=4285 Win=468 Len=0 TSval=4014227352 TSecr=4121429439
68,7.620831526,2001:6a8:3081:6f06:6929:a50d:93f0:6a7e,2a01:b740:a41:e80::2:1,TCP,86,33660  >  443 [ACK] Seq=4135 Ack=5432 Win=460 Len=0 TSval=4014227352 TSecr=4121429440
69,7.620845355,2001:6a8:3081:6f06:6929:a50d:93f0:6a7e,2a01:b740:a41:e80::2:1,TCP,98,[TCP Dup ACK 68#1] 33660  >  443 [ACK] Seq=4135 Ack=5432 Win=460 Len=0 TSval=4014227352 TSecr=4121429476 SLE=4285 SRE=5432
70,7.624005696,2001:6a8:3081:6f06:6929:a50d:93f0:6a7e,2a01:b740:a41:e80::2:1,TLSv1.2,3048,Application Data
71,7.624564221,2001:6a8:3081:6f06:6929:a50d:93f0:6a7e,2a01:b740:a41:e80::2:1,TLSv1.2,478,Application Data
72,7.630589473,2a01:b740:a41:e80::2:1,2001:6a8:3081:6f06:6929:a50d:93f0:6a7e,TCP,86,443  >  41750 [ACK] Seq=2834 Ack=10613 Win=955 Len=0 TSval=2360761246 TSecr=4014227356
73,7.63136339,2a01:b740:a41:e80::2:1,2001:6a8:3081:6f06:6929:a50d:93f0:6a7e,TCP,86,443  >  41750 [ACK] Seq=2834 Ack=12147 Win=953 Len=0 TSval=2360761247 TSecr=4014227356
74,7.631364856,2a01:b740:a41:e80::2:1,2001:6a8:3081:6f06:6929:a50d:93f0:6a7e,TCP,86,443  >  41750 [ACK] Seq=2834 Ack=12539 Win=959 Len=0 TSval=2360761247 TSecr=4014227356
75,9.186948516,2a01:b740:a41:e80::2:1,2001:6a8:3081:6f06:6929:a50d:93f0:6a7e,TLSv1.2,1371,Application Data
76,9.18699049,2001:6a8:3081:6f06:6929:a50d:93f0:6a7e,2a01:b740:a41:e80::2:1,TCP,86,41750  >  443 [ACK] Seq=12539 Ack=4119 Win=6609 Len=0 TSval=4014228919 TSecr=2360762780
77,9.189260908,2001:6a8:3081:6f06:6929:a50d:93f0:6a7e,2a01:b740:a41:e80::2:1,TLSv1.2,128,Application Data
78,9.195801452,2001:6a8:3081:6f06:6929:a50d:93f0:6a7e,2a01:b740:a41:e80::2:5,TLSv1.2,4121,Application Data
79,9.195913967,2a01:b740:a41:e80::2:1,2001:6a8:3081:6f06:6929:a50d:93f0:6a7e,TCP,86,443  >  41750 [ACK] Seq=4119 Ack=12581 Win=960 Len=0 TSval=2360762812 TSecr=4014228921
80,9.197130402,2001:6a8:3081:6f06:6929:a50d:93f0:6a7e,2a01:b740:a41:e80::2:5,TLSv1.2,169,Application Data
81,9.20315293,2a01:b740:a41:e80::2:5,2001:6a8:3081:6f06:6929:a50d:93f0:6a7e,TCP,86,443  >  40566 [ACK] Seq=3602 Ack=10363 Win=501 Len=0 TSval=781591 TSecr=69505029
82,9.203153907,2a01:b740:a41:e80::2:5,2001:6a8:3081:6f06:6929:a50d:93f0:6a7e,TCP,86,443  >  40566 [ACK] Seq=3602 Ack=11791 Win=501 Len=0 TSval=781591 TSecr=69505029
83,9.203154885,2a01:b740:a41:e80::2:5,2001:6a8:3081:6f06:6929:a50d:93f0:6a7e,TCP,86,443  >  40566 [ACK] Seq=3602 Ack=12970 Win=501 Len=0 TSval=781591 TSecr=69505029
84,9.203847995,2a01:b740:a41:e80::2:5,2001:6a8:3081:6f06:6929:a50d:93f0:6a7e,TCP,86,443  >  40566 [ACK] Seq=3602 Ack=13053 Win=501 Len=0 TSval=781591 TSecr=69505031
85,9.604948589,2a01:b740:a41:e80::2:5,2001:6a8:3081:6f06:6929:a50d:93f0:6a7e,TCP,695,"[TCP Previous segment not captured] 443  >  40566 [PSH, ACK] Seq=5030 Ack=13053 Win=501 Len=609 TSval=781956 TSecr=69505031 [TCP segment of a reassembled PDU]"
86,9.604950056,2a01:b740:a41:e80::2:5,2001:6a8:3081:6f06:6929:a50d:93f0:6a7e,TCP,1514,[TCP Out-Of-Order] 443  >  40566 [ACK] Seq=3602 Ack=13053 Win=501 Len=1428 TSval=781956 TSecr=69505031
87,9.604988888,2001:6a8:3081:6f06:6929:a50d:93f0:6a7e,2a01:b740:a41:e80::2:5,TCP,98,[TCP Window Update] 40566  >  443 [ACK] Seq=13053 Ack=3602 Win=754 Len=0 TSval=69505439 TSecr=781591 SLE=5030 SRE=5639
88,9.605035193,2001:6a8:3081:6f06:6929:a50d:93f0:6a7e,2a01:b740:a41:e80::2:5,TCP,86,40566  >  443 [ACK] Seq=13053 Ack=5639 Win=776 Len=0 TSval=69505439 TSecr=781956
89,11.640826175,2001:6a8:3081:6f06:6929:a50d:93f0:6a7e,2a01:b740:a41:e80::2:2,TLSv1.2,3033,Application Data
90,11.643941748,2001:6a8:3081:6f06:6929:a50d:93f0:6a7e,2a01:b740:a41:e80::2:2,TLSv1.2,3762,Application Data
91,11.650433612,2a01:b740:a41:e80::2:2,2001:6a8:3081:6f06:6929:a50d:93f0:6a7e,TCP,86,443  >  43038 [ACK] Seq=662 Ack=10252 Win=2643 Len=0 TSval=1363912370 TSecr=2862107722
92,11.65043459,2a01:b740:a41:e80::2:2,2001:6a8:3081:6f06:6929:a50d:93f0:6a7e,TCP,86,443  >  43038 [ACK] Seq=662 Ack=11771 Win=2641 Len=0 TSval=1363912370 TSecr=2862107722
93,11.651632586,2a01:b740:a41:e80::2:2,2001:6a8:3081:6f06:6929:a50d:93f0:6a7e,TCP,86,443  >  43038 [ACK] Seq=662 Ack=13199 Win=2643 Len=0 TSval=1363912372 TSecr=2862107725
94,11.651633983,2a01:b740:a41:e80::2:2,2001:6a8:3081:6f06:6929:a50d:93f0:6a7e,TCP,86,443  >  43038 [ACK] Seq=662 Ack=15447 Win=2638 Len=0 TSval=1363912372 TSecr=2862107725
95,11.902764896,2a01:b740:a41:e80::2:2,2001:6a8:3081:6f06:6929:a50d:93f0:6a7e,TLSv1.2,708,Application Data
96,11.904950595,2001:6a8:3081:6f06:6929:a50d:93f0:6a7e,2a01:b740:a41:e80::2:2,TLSv1.2,121,Application Data
97,11.912098134,2a01:b740:a41:e80::2:2,2001:6a8:3081:6f06:6929:a50d:93f0:6a7e,TCP,86,443  >  43038 [ACK] Seq=1284 Ack=15482 Win=2647 Len=0 TSval=1363912632 TSecr=2862107986
98,16.19896883,2001:6a8:3081:6f06:6929:a50d:93f0:6a7e,2a01:b740:a41:e80::2:1,TLSv1.2,3048,Application Data
99,16.201445909,2001:6a8:3081:6f06:6929:a50d:93f0:6a7e,2a01:b740:a41:e80::2:1,TLSv1.2,264,Application Data
100,16.208090168,2a01:b740:a41:e80::2:1,2001:6a8:3081:6f06:6929:a50d:93f0:6a7e,TCP,86,443  >  41750 [ACK] Seq=4119 Ack=14009 Win=955 Len=0 TSval=2360769823 TSecr=4014235930
101,16.208091076,2a01:b740:a41:e80::2:1,2001:6a8:3081:6f06:6929:a50d:93f0:6a7e,TCP,86,443  >  41750 [ACK] Seq=4119 Ack=15543 Win=953 Len=0 TSval=2360769823 TSecr=4014235930
102,16.208092054,2a01:b740:a41:e80::2:1,2001:6a8:3081:6f06:6929:a50d:93f0:6a7e,TCP,86,443  >  41750 [ACK] Seq=4119 Ack=15721 Win=960 Len=0 TSval=2360769824 TSecr=4014235933
103,17.124933102,2a01:b740:a41:e80::2:1,2001:6a8:3081:6f06:6929:a50d:93f0:6a7e,TLSv1.2,1251,Application Data
104,17.127423451,2001:6a8:3081:6f06:6929:a50d:93f0:6a7e,2a01:b740:a41:e80::2:1,TLSv1.2,128,Application Data
105,17.13367932,2001:6a8:3081:6f06:6929:a50d:93f0:6a7e,2a01:b740:a41:e80::2:5,TLSv1.2,4121,Application Data
106,17.133867055,2a01:b740:a41:e80::2:1,2001:6a8:3081:6f06:6929:a50d:93f0:6a7e,TCP,86,443  >  41750 [ACK] Seq=5284 Ack=15763 Win=960 Len=0 TSval=2360770750 TSecr=4014236859
107,17.135099413,2001:6a8:3081:6f06:6929:a50d:93f0:6a7e,2a01:b740:a41:e80::2:5,TLSv1.2,169,Application Data
108,17.141886988,2a01:b740:a41:e80::2:5,2001:6a8:3081:6f06:6929:a50d:93f0:6a7e,TCP,86,443  >  40566 [ACK] Seq=5639 Ack=15909 Win=496 Len=0 TSval=789529 TSecr=69512967
109,17.141888385,2a01:b740:a41:e80::2:5,2001:6a8:3081:6f06:6929:a50d:93f0:6a7e,TCP,86,443  >  40566 [ACK] Seq=5639 Ack=17088 Win=501 Len=0 TSval=789529 TSecr=69512967
110,17.141889293,2a01:b740:a41:e80::2:5,2001:6a8:3081:6f06:6929:a50d:93f0:6a7e,TCP,86,443  >  40566 [ACK] Seq=5639 Ack=17171 Win=501 Len=0 TSval=789529 TSecr=69512969
111,17.54322707,2a01:b740:a41:e80::2:5,2001:6a8:3081:6f06:6929:a50d:93f0:6a7e,TCP,699,"[TCP Previous segment not captured] 443  >  40566 [PSH, ACK] Seq=7067 Ack=17171 Win=501 Len=613 TSval=789875 TSecr=69512969 [TCP segment of a reassembled PDU]"
112,17.543228048,2a01:b740:a41:e80::2:5,2001:6a8:3081:6f06:6929:a50d:93f0:6a7e,TCP,1514,[TCP Out-Of-Order] 443  >  40566 [ACK] Seq=5639 Ack=17171 Win=501 Len=1428 TSval=789875 TSecr=69512969 [TCP segment of a reassembled PDU]
113,17.543288321,2001:6a8:3081:6f06:6929:a50d:93f0:6a7e,2a01:b740:a41:e80::2:5,TCP,98,[TCP Window Update] 40566  >  443 [ACK] Seq=17171 Ack=5639 Win=799 Len=0 TSval=69513377 TSecr=789529 SLE=7067 SRE=7680
114,17.543354671,2001:6a8:3081:6f06:6929:a50d:93f0:6a7e,2a01:b740:a41:e80::2:5,TCP,86,40566  >  443 [ACK] Seq=17171 Ack=7680 Win=821 Len=0 TSval=69513377 TSecr=789875
115,17.751455564,17.138.224.1,192.168.166.19,TLSv1.2,105,Application Data
116,17.751456472,17.138.224.1,192.168.166.19,TLSv1.2,90,Application Data
117,17.751457869,17.138.224.1,192.168.166.19,TCP,66,"443  >  47270 [FIN, ACK] Seq=64 Ack=1 Win=158 Len=0 TSval=2712478441 TSecr=648520011"
118,17.751502568,192.168.166.19,17.138.224.1,TCP,66,47270  >  443 [ACK] Seq=1 Ack=40 Win=501 Len=0 TSval=648676578 TSecr=2712478440
119,17.751533997,192.168.166.19,17.138.224.1,TCP,66,47270  >  443 [ACK] Seq=1 Ack=64 Win=501 Len=0 TSval=648676578 TSecr=2712478440
120,17.751747224,192.168.166.19,17.138.224.1,TCP,66,"47270  >  443 [FIN, ACK] Seq=1 Ack=65 Win=501 Len=0 TSval=648676578 TSecr=2712478441"
121,17.839347134,17.138.224.1,192.168.166.19,TCP,66,443  >  47270 [ACK] Seq=65 Ack=2 Win=158 Len=0 TSval=2712478567 TSecr=648676578
122,18.669883208,2001:6a8:3081:6f06:6929:a50d:93f0:6a7e,2a01:b740:a41:e80::2:5,TLSv1.2,4854,Application Data
123,18.678472073,2a01:b740:a41:e80::2:5,2001:6a8:3081:6f06:6929:a50d:93f0:6a7e,TCP,86,443  >  40566 [ACK] Seq=7680 Ack=18599 Win=501 Len=0 TSval=791066 TSecr=69514503
124,18.67877805,2a01:b740:a41:e80::2:5,2001:6a8:3081:6f06:6929:a50d:93f0:6a7e,TCP,86,443  >  40566 [ACK] Seq=7680 Ack=20027 Win=501 Len=0 TSval=791066 TSecr=69514503
125,18.678779027,2a01:b740:a41:e80::2:5,2001:6a8:3081:6f06:6929:a50d:93f0:6a7e,TCP,86,443  >  40566 [ACK] Seq=7680 Ack=21455 Win=496 Len=0 TSval=791066 TSecr=69514503
126,18.678780424,2a01:b740:a41:e80::2:5,2001:6a8:3081:6f06:6929:a50d:93f0:6a7e,TCP,86,443  >  40566 [ACK] Seq=7680 Ack=21939 Win=493 Len=0 TSval=791066 TSecr=69514503
127,19.005097008,2a01:b740:a41:e80::2:5,2001:6a8:3081:6f06:6929:a50d:93f0:6a7e,TCP,1260,"443  >  40566 [PSH, ACK] Seq=7680 Ack=21939 Win=501 Len=1174 TSval=791296 TSecr=69514503 [TCP segment of a reassembled PDU]"
128,19.009743652,2001:6a8:3081:6f06:6929:a50d:93f0:6a7e,2a01:b740:a41:e80::2:5,TLSv1.2,3951,Application Data
129,19.017245918,2a01:b740:a41:e80::2:5,2001:6a8:3081:6f06:6929:a50d:93f0:6a7e,TCP,86,443  >  40566 [ACK] Seq=8854 Ack=23367 Win=501 Len=0 TSval=791404 TSecr=69514843
