"No.","Time","Source","Destination","Protocol","Length","Info"
"1","0.000000000","2603:1026:2400:1::b","2001:6a8:3081:6f06:3a94:8b2c:c377:90c7","TLSv1.2","125","Application Data"
"2","0.000104134","2001:6a8:3081:6f06:3a94:8b2c:c377:90c7","2603:1026:2400:1::b","TCP","74","57122  >  443 [ACK] Seq=1 Ack=52 Win=501 Len=0"
"3","1.842812669","Fortinet_93:32:4a","IntelCor_85:a6:01","ARP","60","Who has 192.168.166.195? Tell 192.168.167.253"
"4","1.842835647","IntelCor_85:a6:01","Fortinet_93:32:4a","ARP","42","192.168.166.195 is at c0:3c:59:85:a6:01"
"5","1.958318869","IntelCor_85:a6:01","IETF-VRRP-VRID_ff","ARP","42","Who has 192.168.167.254? Tell 192.168.166.195"
"6","1.961213599","IETF-VRRP-VRID_ff","IntelCor_85:a6:01","ARP","60","192.168.167.254 is at 00:00:5e:00:01:ff"
"7","2.505135293","192.168.166.195","130.104.1.2","DNS","84","Standard query 0x561f A www.apple.com OPT"
"8","2.505302355","192.168.166.195","130.104.1.2","DNS","84","Standard query 0x5fa7 AAAA www.apple.com OPT"
"9","2.507175859","192.168.166.195","130.104.1.2","DNS","87","Standard query 0x99e2 A setup.icloud.com OPT"
"10","2.507315542","192.168.166.195","130.104.1.2","DNS","87","Standard query 0x7e63 AAAA setup.icloud.com OPT"
"11","2.509158665","130.104.1.2","192.168.166.195","DNS","240","Standard query response 0x561f A www.apple.com CNAME www.apple.com.edgekey.net CNAME www.apple.com.edgekey.net.globalredir.akadns.net CNAME e6858.dscx.akamaiedge.net A 23.77.164.214 OPT"
"12","2.509160062","130.104.1.2","192.168.166.195","DNS","188","Standard query response 0x99e2 A setup.icloud.com CNAME setup.fe2.apple-dns.net A 17.248.236.69 A 17.248.236.64 A 17.248.236.67 A 17.248.236.68 OPT"
"13","2.509200501","130.104.1.2","192.168.166.195","DNS","280","Standard query response 0x5fa7 AAAA www.apple.com CNAME www.apple.com.edgekey.net CNAME www.apple.com.edgekey.net.globalredir.akadns.net CNAME e6858.dscx.akamaiedge.net AAAA 2a02:26f0:9100:59a::1aca AAAA 2a02:26f0:9100:59c::1aca OPT"
"14","2.511827527","2001:6a8:3081:6f06:3a94:8b2c:c377:90c7","2a02:26f0:9100:59a::1aca","TCP","94","34240  >  443 [SYN] Seq=0 Win=64800 Len=0 MSS=1440 SACK_PERM=1 TSval=3212032080 TSecr=0 WS=128"
"15","2.521392351","192.168.166.195","130.104.1.2","DNS","94","Standard query 0xc5f7 A ckdatabasews.icloud.com OPT"
"16","2.521538390","2a02:26f0:9100:59a::1aca","2001:6a8:3081:6f06:3a94:8b2c:c377:90c7","TCP","94","443  >  34240 [SYN, ACK] Seq=0 Ack=1 Win=64260 Len=0 MSS=1440 SACK_PERM=1 TSval=3090360000 TSecr=3212032080 WS=128"
"17","2.521585883","2001:6a8:3081:6f06:3a94:8b2c:c377:90c7","2a02:26f0:9100:59a::1aca","TCP","86","34240  >  443 [ACK] Seq=1 Ack=1 Win=64896 Len=0 TSval=3212032090 TSecr=3090360000"
"18","2.521634423","192.168.166.195","130.104.1.2","DNS","94","Standard query 0xa5d2 AAAA ckdatabasews.icloud.com OPT"
"19","2.521709642","192.168.166.195","130.104.1.2","DNS","94","Standard query 0x557c A cvws.icloud-content.com OPT"
"20","2.521783675","192.168.166.195","130.104.1.2","DNS","94","Standard query 0x5c2a AAAA cvws.icloud-content.com OPT"
"21","2.522087137","192.168.166.195","130.104.1.2","DNS","89","Standard query 0xf919 A gateway.icloud.com OPT"
"22","2.522179887","192.168.166.195","130.104.1.2","DNS","89","Standard query 0x5eaa AAAA gateway.icloud.com OPT"
"23","2.523309716","2001:6a8:3081:6f06:3a94:8b2c:c377:90c7","2a02:26f0:9100:59a::1aca","TLSv1.3","603","Client Hello"
"24","2.525343647","2a02:26f0:9100:59a::1aca","2001:6a8:3081:6f06:3a94:8b2c:c377:90c7","TCP","86","443  >  34240 [ACK] Seq=1 Ack=518 Win=1198080 Len=0 TSval=3090360000 TSecr=3212032092"
"25","2.525343647","130.104.1.2","192.168.166.195","DNS","240","Standard query response 0x5eaa AAAA gateway.icloud.com CNAME gateway.fe2.apple-dns.net AAAA 2a01:b740:a41:e80::2:6 AAAA 2a01:b740:a41:e80::2:3 AAAA 2a01:b740:a41:e80::2:1 AAAA 2a01:b740:a41:e80::2:2 OPT"
"26","2.525345044","130.104.1.2","192.168.166.195","DNS","176","Standard query response 0xf919 A gateway.icloud.com CNAME gateway.fe2.apple-dns.net A 17.248.236.68 A 17.248.236.69 A 17.248.236.64 OPT"
"27","2.530380702","130.104.1.2","192.168.166.195","DNS","292","Standard query response 0x7e63 AAAA setup.icloud.com CNAME setup.fe2.apple-dns.net AAAA 2a01:b740:a41:280::2:1 AAAA 2a01:b740:a41:280::2:8 AAAA 2a01:b740:a41:280::2:7 AAAA 2a01:b740:a41:280::2:2 AAAA 2a01:b740:a41:280::2:9 AAAA 2a01:b740:a41:280::2:a OPT"
"28","2.532223057","2001:6a8:3081:6f06:3a94:8b2c:c377:90c7","2a01:b740:a41:280::2:1","TCP","94","45962  >  443 [SYN] Seq=0 Win=64800 Len=0 MSS=1440 SACK_PERM=1 TSval=885549526 TSecr=0 WS=128"
"29","2.532842902","2a02:26f0:9100:59a::1aca","2001:6a8:3081:6f06:3a94:8b2c:c377:90c7","TLSv1.3","1514","Server Hello, Change Cipher Spec, Application Data"
"30","2.532843880","2a02:26f0:9100:59a::1aca","2001:6a8:3081:6f06:3a94:8b2c:c377:90c7","TCP","1326","[TCP Previous segment not captured] 443  >  34240 [PSH, ACK] Seq=2857 Ack=518 Win=64128 Len=1240 TSval=3090360012 TSecr=3212032092 [TCP segment of a reassembled PDU]"
"31","2.532845277","2a02:26f0:9100:59a::1aca","2001:6a8:3081:6f06:3a94:8b2c:c377:90c7","TCP","1514","[TCP Out-Of-Order] 443  >  34240 [PSH, ACK] Seq=1429 Ack=518 Win=64128 Len=1428 TSval=3090360012 TSecr=3212032092 [TCP segment of a reassembled PDU]"
"32","2.532874401","2001:6a8:3081:6f06:3a94:8b2c:c377:90c7","2a02:26f0:9100:59a::1aca","TCP","86","34240  >  443 [ACK] Seq=518 Ack=1429 Win=63488 Len=0 TSval=3212032101 TSecr=3090360012"
"33","2.532897309","2001:6a8:3081:6f06:3a94:8b2c:c377:90c7","2a02:26f0:9100:59a::1aca","TCP","98","[TCP Dup ACK 32#1] 34240  >  443 [ACK] Seq=518 Ack=1429 Win=63488 Len=0 TSval=3212032101 TSecr=3090360012 SLE=2857 SRE=4097"
"34","2.532908693","2001:6a8:3081:6f06:3a94:8b2c:c377:90c7","2a02:26f0:9100:59a::1aca","TCP","86","34240  >  443 [ACK] Seq=518 Ack=4097 Win=60928 Len=0 TSval=3212032101 TSecr=3090360012"
"35","2.533562202","2a02:26f0:9100:59a::1aca","2001:6a8:3081:6f06:3a94:8b2c:c377:90c7","TLSv1.3","1275","Application Data, Application Data, Application Data"
"36","2.533575053","2001:6a8:3081:6f06:3a94:8b2c:c377:90c7","2a02:26f0:9100:59a::1aca","TCP","86","34240  >  443 [ACK] Seq=518 Ack=5286 Win=59776 Len=0 TSval=3212032102 TSecr=3090360013"
"37","2.540821271","2001:6a8:3081:6f06:3a94:8b2c:c377:90c7","2a02:26f0:9100:59a::1aca","TLSv1.3","166","Change Cipher Spec, Application Data"
"38","2.541199814","2001:6a8:3081:6f06:3a94:8b2c:c377:90c7","2a02:26f0:9100:59a::1aca","TLSv1.3","184","Application Data"
"39","2.541521854","2001:6a8:3081:6f06:3a94:8b2c:c377:90c7","2a02:26f0:9100:59a::1aca","TLSv1.3","517","Application Data"
"40","2.545350298","2a01:b740:a41:280::2:1","2001:6a8:3081:6f06:3a94:8b2c:c377:90c7","TCP","94","443  >  45962 [SYN, ACK] Seq=0 Ack=1 Win=64260 Len=0 MSS=1440 SACK_PERM=1 TSval=651827864 TSecr=885549526 WS=128"
"41","2.545399117","2001:6a8:3081:6f06:3a94:8b2c:c377:90c7","2a01:b740:a41:280::2:1","TCP","86","45962  >  443 [ACK] Seq=1 Ack=1 Win=64896 Len=0 TSval=885549540 TSecr=651827864"
"42","2.546570014","2001:6a8:3081:6f06:3a94:8b2c:c377:90c7","2a01:b740:a41:280::2:1","TLSv1.2","603","Client Hello"
"43","2.548212342","2a01:b740:a41:280::2:1","2001:6a8:3081:6f06:3a94:8b2c:c377:90c7","TCP","86","443  >  45962 [ACK] Seq=1 Ack=518 Win=1198080 Len=0 TSval=651827864 TSecr=885549541"
"44","2.549273726","2a02:26f0:9100:59a::1aca","2001:6a8:3081:6f06:3a94:8b2c:c377:90c7","TCP","86","443  >  34240 [ACK] Seq=5286 Ack=598 Win=64128 Len=0 TSval=3090360029 TSecr=3212032109"
"45","2.549274634","2a02:26f0:9100:59a::1aca","2001:6a8:3081:6f06:3a94:8b2c:c377:90c7","TLSv1.3","373","Application Data"
"46","2.549276101","2a02:26f0:9100:59a::1aca","2001:6a8:3081:6f06:3a94:8b2c:c377:90c7","TLSv1.3","373","Application Data"
"47","2.549277079","2a02:26f0:9100:59a::1aca","2001:6a8:3081:6f06:3a94:8b2c:c377:90c7","TCP","86","443  >  34240 [ACK] Seq=5860 Ack=696 Win=64128 Len=0 TSval=3090360029 TSecr=3212032109"
"48","2.549278476","2a02:26f0:9100:59a::1aca","2001:6a8:3081:6f06:3a94:8b2c:c377:90c7","TLSv1.3","147","Application Data"
"49","2.549279384","2a02:26f0:9100:59a::1aca","2001:6a8:3081:6f06:3a94:8b2c:c377:90c7","TLSv1.3","117","Application Data"
"50","2.549900766","2a02:26f0:9100:59a::1aca","2001:6a8:3081:6f06:3a94:8b2c:c377:90c7","TCP","86","443  >  34240 [ACK] Seq=5952 Ack=1127 Win=64128 Len=0 TSval=3090360029 TSecr=3212032110"
"51","2.550030462","2001:6a8:3081:6f06:3a94:8b2c:c377:90c7","2a02:26f0:9100:59a::1aca","TCP","86","34240  >  443 [ACK] Seq=1127 Ack=5952 Win=64128 Len=0 TSval=3212032118 TSecr=3090360029"
"52","2.550226088","2001:6a8:3081:6f06:3a94:8b2c:c377:90c7","2a02:26f0:9100:59a::1aca","TLSv1.3","117","Application Data"
"53","2.552023814","2a02:26f0:9100:59a::1aca","2001:6a8:3081:6f06:3a94:8b2c:c377:90c7","TLSv1.3","955","Application Data"
"54","2.552025211","2a02:26f0:9100:59a::1aca","2001:6a8:3081:6f06:3a94:8b2c:c377:90c7","TLSv1.3","1059","Application Data"
"55","2.552106297","2001:6a8:3081:6f06:3a94:8b2c:c377:90c7","2a02:26f0:9100:59a::1aca","TCP","86","34240  >  443 [ACK] Seq=1158 Ack=7794 Win=64128 Len=0 TSval=3212032120 TSecr=3090360031"
"56","2.559136356","2a02:26f0:9100:59a::1aca","2001:6a8:3081:6f06:3a94:8b2c:c377:90c7","TCP","86","443  >  34240 [ACK] Seq=7794 Ack=1158 Win=64128 Len=0 TSval=3090360038 TSecr=3212032118"
"57","2.560069092","2a01:b740:a41:280::2:1","2001:6a8:3081:6f06:3a94:8b2c:c377:90c7","TLSv1.2","1326","[TCP Previous segment not captured] , Ignored Unknown Record"
"58","2.560070489","2a01:b740:a41:280::2:1","2001:6a8:3081:6f06:3a94:8b2c:c377:90c7","TCP","2942","[TCP Out-Of-Order] 443  >  45962 [PSH, ACK] Seq=1 Ack=518 Win=64128 Len=2856 TSval=651827878 TSecr=885549541"
"59","2.560098705","2001:6a8:3081:6f06:3a94:8b2c:c377:90c7","2a01:b740:a41:280::2:1","TCP","98","[TCP Dup ACK 41#1] 45962  >  443 [ACK] Seq=518 Ack=1 Win=64896 Len=0 TSval=885549554 TSecr=651827864 SLE=2857 SRE=4097"
"60","2.560132089","2001:6a8:3081:6f06:3a94:8b2c:c377:90c7","2a01:b740:a41:280::2:1","TCP","86","45962  >  443 [ACK] Seq=518 Ack=4097 Win=60800 Len=0 TSval=885549554 TSecr=651827878"
"61","2.562389164","2a01:b740:a41:280::2:1","2001:6a8:3081:6f06:3a94:8b2c:c377:90c7","TCP","1514","[TCP segment of a reassembled PDU]"
"62","2.562390142","2a01:b740:a41:280::2:1","2001:6a8:3081:6f06:3a94:8b2c:c377:90c7","TLSv1.2","507","[TCP Previous segment not captured] , Ignored Unknown Record"
"63","2.562391609","2a01:b740:a41:280::2:1","2001:6a8:3081:6f06:3a94:8b2c:c377:90c7","TCP","1514","[TCP Out-Of-Order] 443  >  45962 [PSH, ACK] Seq=5525 Ack=518 Win=64128 Len=1428 TSval=651827881 TSecr=885549541"
"64","2.562432117","2001:6a8:3081:6f06:3a94:8b2c:c377:90c7","2a01:b740:a41:280::2:1","TCP","86","45962  >  443 [ACK] Seq=518 Ack=5525 Win=63104 Len=0 TSval=885549557 TSecr=651827881"
"65","2.562466409","2001:6a8:3081:6f06:3a94:8b2c:c377:90c7","2a01:b740:a41:280::2:1","TCP","98","[TCP Dup ACK 64#1] 45962  >  443 [ACK] Seq=518 Ack=5525 Win=63104 Len=0 TSval=885549557 TSecr=651827881 SLE=6953 SRE=7374"
"66","2.562487013","2001:6a8:3081:6f06:3a94:8b2c:c377:90c7","2a01:b740:a41:280::2:1","TCP","86","45962  >  443 [ACK] Seq=518 Ack=7374 Win=61312 Len=0 TSval=885549557 TSecr=651827881"
"67","2.565780469","2001:6a8:3081:6f06:3a94:8b2c:c377:90c7","2a01:b740:a41:280::2:1","TLSv1.2","179","Client Key Exchange, Change Cipher Spec, Encrypted Handshake Message"
"68","2.566085328","2001:6a8:3081:6f06:3a94:8b2c:c377:90c7","2a01:b740:a41:280::2:1","TLSv1.2","3561","Application Data"
"69","2.579424818","2a01:b740:a41:280::2:1","2001:6a8:3081:6f06:3a94:8b2c:c377:90c7","TCP","86","443  >  45962 [ACK] Seq=7374 Ack=611 Win=64128 Len=0 TSval=651827897 TSecr=885549560"
"70","2.579426285","2a01:b740:a41:280::2:1","2001:6a8:3081:6f06:3a94:8b2c:c377:90c7","TLSv1.2","360","New Session Ticket, Change Cipher Spec, Encrypted Handshake Message"
"71","2.579427193","2a01:b740:a41:280::2:1","2001:6a8:3081:6f06:3a94:8b2c:c377:90c7","TCP","86","443  >  45962 [ACK] Seq=7648 Ack=2039 Win=64128 Len=0 TSval=651827898 TSecr=885549560"
"72","2.579428589","2a01:b740:a41:280::2:1","2001:6a8:3081:6f06:3a94:8b2c:c377:90c7","TCP","86","443  >  45962 [ACK] Seq=7648 Ack=3467 Win=64128 Len=0 TSval=651827898 TSecr=885549560"
"73","2.579429916","2a01:b740:a41:280::2:1","2001:6a8:3081:6f06:3a94:8b2c:c377:90c7","TCP","86","443  >  45962 [ACK] Seq=7648 Ack=4086 Win=64128 Len=0 TSval=651827898 TSecr=885549560"
"74","2.598633946","2001:6a8:3081:6f06:3a94:8b2c:c377:90c7","2a02:26f0:9100:59a::1aca","TCP","94","34250  >  443 [SYN] Seq=0 Win=64800 Len=0 MSS=1440 SACK_PERM=1 TSval=3212032167 TSecr=0 WS=128"
"75","2.607301514","2a02:26f0:9100:59a::1aca","2001:6a8:3081:6f06:3a94:8b2c:c377:90c7","TCP","94","443  >  34250 [SYN, ACK] Seq=0 Ack=1 Win=64260 Len=0 MSS=1440 SACK_PERM=1 TSval=2363562447 TSecr=3212032167 WS=128"
"76","2.607383648","2001:6a8:3081:6f06:3a94:8b2c:c377:90c7","2a02:26f0:9100:59a::1aca","TCP","86","34250  >  443 [ACK] Seq=1 Ack=1 Win=64896 Len=0 TSval=3212032176 TSecr=2363562447"
"77","2.609110624","2001:6a8:3081:6f06:3a94:8b2c:c377:90c7","2a02:26f0:9100:59a::1aca","TLSv1.2","603","Client Hello"
"78","2.610707834","2a02:26f0:9100:59a::1aca","2001:6a8:3081:6f06:3a94:8b2c:c377:90c7","TCP","86","443  >  34250 [ACK] Seq=1 Ack=518 Win=1198080 Len=0 TSval=2363562447 TSecr=3212032177"
"79","2.618741379","2a02:26f0:9100:59a::1aca","2001:6a8:3081:6f06:3a94:8b2c:c377:90c7","TLSv1.2","1326","[TCP Previous segment not captured] , Ignored Unknown Record"
"80","2.618742357","2a02:26f0:9100:59a::1aca","2001:6a8:3081:6f06:3a94:8b2c:c377:90c7","TCP","2942","[TCP Out-Of-Order] 443  >  34250 [PSH, ACK] Seq=1 Ack=518 Win=64128 Len=2856 TSval=2363562458 TSecr=3212032177"
"81","2.618800255","2001:6a8:3081:6f06:3a94:8b2c:c377:90c7","2a02:26f0:9100:59a::1aca","TCP","98","[TCP Dup ACK 76#1] 34250  >  443 [ACK] Seq=518 Ack=1 Win=64896 Len=0 TSval=3212032187 TSecr=2363562447 SLE=2857 SRE=4097"
"82","2.618850891","2001:6a8:3081:6f06:3a94:8b2c:c377:90c7","2a02:26f0:9100:59a::1aca","TCP","86","34250  >  443 [ACK] Seq=518 Ack=4097 Win=60800 Len=0 TSval=3212032187 TSecr=2363562458"
"83","2.619457885","2a02:26f0:9100:59a::1aca","2001:6a8:3081:6f06:3a94:8b2c:c377:90c7","TLSv1.2","1275","Ignored Unknown Record"
"84","2.619473599","2001:6a8:3081:6f06:3a94:8b2c:c377:90c7","2a02:26f0:9100:59a::1aca","TCP","86","34250  >  443 [ACK] Seq=518 Ack=5286 Win=63104 Len=0 TSval=3212032188 TSecr=2363562459"
"85","2.622326843","2001:6a8:3081:6f06:3a94:8b2c:c377:90c7","2a01:b740:a41:280::2:1","TCP","86","45962  >  443 [ACK] Seq=4086 Ack=7648 Win=64128 Len=0 TSval=885549617 TSecr=651827898"
"86","2.624085039","2001:6a8:3081:6f06:3a94:8b2c:c377:90c7","2a02:26f0:9100:59a::1aca","TLSv1.2","166","Change Cipher Spec, Application Data"
"87","2.626319625","2001:6a8:3081:6f06:3a94:8b2c:c377:90c7","2a02:26f0:9100:59a::1aca","TLSv1.2","184","Application Data"
"88","2.626821787","2001:6a8:3081:6f06:3a94:8b2c:c377:90c7","2a02:26f0:9100:59a::1aca","TLSv1.2","515","Application Data"
"89","2.635605711","2a02:26f0:9100:59a::1aca","2001:6a8:3081:6f06:3a94:8b2c:c377:90c7","TCP","86","443  >  34250 [ACK] Seq=5286 Ack=598 Win=64128 Len=0 TSval=2363562474 TSecr=3212032192"
"90","2.635607177","2a02:26f0:9100:59a::1aca","2001:6a8:3081:6f06:3a94:8b2c:c377:90c7","TCP","86","443  >  34250 [ACK] Seq=5286 Ack=696 Win=64128 Len=0 TSval=2363562474 TSecr=3212032195"
"91","2.635608155","2a02:26f0:9100:59a::1aca","2001:6a8:3081:6f06:3a94:8b2c:c377:90c7","TLSv1.2","373","Application Data"
"92","2.635609622","2a02:26f0:9100:59a::1aca","2001:6a8:3081:6f06:3a94:8b2c:c377:90c7","TLSv1.2","373","Application Data"
"93","2.635610530","2a02:26f0:9100:59a::1aca","2001:6a8:3081:6f06:3a94:8b2c:c377:90c7","TCP","86","443  >  34250 [ACK] Seq=5860 Ack=1125 Win=64128 Len=0 TSval=2363562475 TSecr=3212032195"
"94","2.635611508","2a02:26f0:9100:59a::1aca","2001:6a8:3081:6f06:3a94:8b2c:c377:90c7","TLSv1.2","147","Application Data"
"95","2.635612974","2a02:26f0:9100:59a::1aca","2001:6a8:3081:6f06:3a94:8b2c:c377:90c7","TLSv1.2","117","Application Data"
"96","2.635760759","2001:6a8:3081:6f06:3a94:8b2c:c377:90c7","2a02:26f0:9100:59a::1aca","TCP","86","34250  >  443 [ACK] Seq=1125 Ack=5952 Win=64128 Len=0 TSval=3212032204 TSecr=2363562474"
"97","2.635965815","2001:6a8:3081:6f06:3a94:8b2c:c377:90c7","2a02:26f0:9100:59a::1aca","TLSv1.2","117","Application Data"
"98","2.636054444","2a02:26f0:9100:59a::1aca","2001:6a8:3081:6f06:3a94:8b2c:c377:90c7","TLSv1.2","335","Application Data"
"99","2.636423068","2001:6a8:3081:6f06:3a94:8b2c:c377:90c7","2a02:26f0:9100:59a::1aca","TLSv1.2","121","Application Data"
"100","2.636517215","2a02:26f0:9100:59a::1aca","2001:6a8:3081:6f06:3a94:8b2c:c377:90c7","TLSv1.2","117","Application Data"
"101","2.644982940","2a02:26f0:9100:59a::1aca","2001:6a8:3081:6f06:3a94:8b2c:c377:90c7","TCP","86","443  >  34250 [ACK] Seq=6232 Ack=1156 Win=64128 Len=0 TSval=2363562484 TSecr=3212032204"
"102","2.644984337","2a02:26f0:9100:59a::1aca","2001:6a8:3081:6f06:3a94:8b2c:c377:90c7","TCP","86","443  >  34250 [ACK] Seq=6232 Ack=1191 Win=64128 Len=0 TSval=2363562484 TSecr=3212032205"
"103","2.682332478","2001:6a8:3081:6f06:3a94:8b2c:c377:90c7","2a02:26f0:9100:59a::1aca","TCP","86","34250  >  443 [ACK] Seq=1191 Ack=6232 Win=64128 Len=0 TSval=3212032251 TSecr=2363562476"
"104","2.765796971","192.168.166.195","130.104.1.2","DNS","85","Standard query 0x5d82 A www.icloud.com OPT"
"105","2.765985264","192.168.166.195","130.104.1.2","DNS","85","Standard query 0xd744 AAAA www.icloud.com OPT"
"106","2.790388871","2a01:b740:a41:280::2:1","2001:6a8:3081:6f06:3a94:8b2c:c377:90c7","TCP","1514","443  >  45962 [ACK] Seq=7648 Ack=4086 Win=64128 Len=1428 TSval=651828109 TSecr=885549617 [TCP segment of a reassembled PDU]"
"107","2.790389779","2a01:b740:a41:280::2:1","2001:6a8:3081:6f06:3a94:8b2c:c377:90c7","TCP","1152","[TCP Previous segment not captured] 443  >  45962 [PSH, ACK] Seq=11932 Ack=4086 Win=64128 Len=1066 TSval=651828109 TSecr=885549617 [TCP segment of a reassembled PDU]"
"108","2.790391246","2a01:b740:a41:280::2:1","2001:6a8:3081:6f06:3a94:8b2c:c377:90c7","TCP","1514","[TCP Out-Of-Order] 443  >  45962 [PSH, ACK] Seq=9076 Ack=4086 Win=64128 Len=1428 TSval=651828109 TSecr=885549617 [TCP segment of a reassembled PDU]"
"109","2.790392223","2a01:b740:a41:280::2:1","2001:6a8:3081:6f06:3a94:8b2c:c377:90c7","TCP","1514","[TCP Out-Of-Order] 443  >  45962 [ACK] Seq=10504 Ack=4086 Win=64128 Len=1428 TSval=651828109 TSecr=885549617"
"110","2.790432871","2001:6a8:3081:6f06:3a94:8b2c:c377:90c7","2a01:b740:a41:280::2:1","TCP","86","45962  >  443 [ACK] Seq=4086 Ack=9076 Win=63104 Len=0 TSval=885549785 TSecr=651828109"
"111","2.790471843","2001:6a8:3081:6f06:3a94:8b2c:c377:90c7","2a01:b740:a41:280::2:1","TCP","98","[TCP Dup ACK 110#1] 45962  >  443 [ACK] Seq=4086 Ack=9076 Win=63104 Len=0 TSval=885549785 TSecr=651828109 SLE=11932 SRE=12998"
"112","2.790483786","2001:6a8:3081:6f06:3a94:8b2c:c377:90c7","2a01:b740:a41:280::2:1","TCP","98","45962  >  443 [ACK] Seq=4086 Ack=10504 Win=61696 Len=0 TSval=885549785 TSecr=651828109 SLE=11932 SRE=12998"
"113","2.790493913","2001:6a8:3081:6f06:3a94:8b2c:c377:90c7","2a01:b740:a41:280::2:1","TCP","86","45962  >  443 [ACK] Seq=4086 Ack=12998 Win=59264 Len=0 TSval=885549785 TSecr=651828109"
"114","2.832944900","130.104.1.2","192.168.166.195","DNS","226","Standard query response 0x5d82 A www.icloud.com CNAME www-cdn.icloud.com.akadns.net CNAME www.icloud.com-v1.edgekey.net CNAME e4478.dscb.akamaiedge.net A 23.52.37.238 OPT"
"115","2.832944900","130.104.1.2","192.168.166.195","DNS","266","Standard query response 0xd744 AAAA www.icloud.com CNAME www-cdn.icloud.com.akadns.net CNAME www.icloud.com-v1.edgekey.net CNAME e4478.dscb.akamaiedge.net AAAA 2a02:26f0:de:58e::117e AAAA 2a02:26f0:de:59b::117e OPT"
"116","2.834327278","2001:6a8:3081:6f06:3a94:8b2c:c377:90c7","2a02:26f0:de:58e::117e","TCP","94","44910  >  443 [SYN] Seq=0 Win=64800 Len=0 MSS=1440 SACK_PERM=1 TSval=2833805767 TSecr=0 WS=128"
"117","2.861998848","2a02:26f0:de:58e::117e","2001:6a8:3081:6f06:3a94:8b2c:c377:90c7","TCP","94","443  >  44910 [SYN, ACK] Seq=0 Ack=1 Win=64260 Len=0 MSS=1440 SACK_PERM=1 TSval=3321116403 TSecr=2833805767 WS=128"
"118","2.862098512","2001:6a8:3081:6f06:3a94:8b2c:c377:90c7","2a02:26f0:de:58e::117e","TCP","86","44910  >  443 [ACK] Seq=1 Ack=1 Win=64896 Len=0 TSval=2833805794 TSecr=3321116403"
"119","2.862661507","2001:6a8:3081:6f06:3a94:8b2c:c377:90c7","2a02:26f0:de:58e::117e","TLSv1.3","603","Client Hello"
"120","2.864347067","2a02:26f0:de:58e::117e","2001:6a8:3081:6f06:3a94:8b2c:c377:90c7","TCP","86","443  >  44910 [ACK] Seq=1 Ack=518 Win=1198080 Len=0 TSval=3321116403 TSecr=2833805795"
"121","2.891331674","2a02:26f0:de:58e::117e","2001:6a8:3081:6f06:3a94:8b2c:c377:90c7","TLSv1.3","1514","Server Hello, Change Cipher Spec, Application Data"
"122","2.891333071","2a02:26f0:de:58e::117e","2001:6a8:3081:6f06:3a94:8b2c:c377:90c7","TCP","1326","[TCP Previous segment not captured] 443  >  44910 [PSH, ACK] Seq=2857 Ack=518 Win=64128 Len=1240 TSval=3321116432 TSecr=2833805795 [TCP segment of a reassembled PDU]"
"123","2.891334468","2a02:26f0:de:58e::117e","2001:6a8:3081:6f06:3a94:8b2c:c377:90c7","TCP","1514","[TCP Out-Of-Order] 443  >  44910 [PSH, ACK] Seq=1429 Ack=518 Win=64128 Len=1428 TSval=3321116432 TSecr=2833805795 [TCP segment of a reassembled PDU]"
"124","2.891402633","2001:6a8:3081:6f06:3a94:8b2c:c377:90c7","2a02:26f0:de:58e::117e","TCP","86","44910  >  443 [ACK] Seq=518 Ack=1429 Win=63488 Len=0 TSval=2833805824 TSecr=3321116432"
"125","2.891453827","2001:6a8:3081:6f06:3a94:8b2c:c377:90c7","2a02:26f0:de:58e::117e","TCP","98","[TCP Dup ACK 124#1] 44910  >  443 [ACK] Seq=518 Ack=1429 Win=63488 Len=0 TSval=2833805824 TSecr=3321116432 SLE=2857 SRE=4097"
"126","2.891470729","2001:6a8:3081:6f06:3a94:8b2c:c377:90c7","2a02:26f0:de:58e::117e","TCP","86","44910  >  443 [ACK] Seq=518 Ack=4097 Win=60928 Len=0 TSval=2833805824 TSecr=3321116432"
"127","2.892486786","2a02:26f0:de:58e::117e","2001:6a8:3081:6f06:3a94:8b2c:c377:90c7","TLSv1.3","1311","Application Data, Application Data, Application Data"
"128","2.892507460","2001:6a8:3081:6f06:3a94:8b2c:c377:90c7","2a02:26f0:de:58e::117e","TCP","86","44910  >  443 [ACK] Seq=518 Ack=5322 Win=63104 Len=0 TSval=2833805825 TSecr=3321116433"
"129","2.896628750","2001:6a8:3081:6f06:3a94:8b2c:c377:90c7","2a02:26f0:de:58e::117e","TLSv1.3","166","Change Cipher Spec, Application Data"
"130","2.896967273","2001:6a8:3081:6f06:3a94:8b2c:c377:90c7","2a02:26f0:de:58e::117e","TLSv1.3","184","Application Data"
"131","2.897359923","2001:6a8:3081:6f06:3a94:8b2c:c377:90c7","2a02:26f0:de:58e::117e","TLSv1.3","2833","Application Data"
"132","2.924990566","2a02:26f0:de:58e::117e","2001:6a8:3081:6f06:3a94:8b2c:c377:90c7","TCP","86","443  >  44910 [ACK] Seq=5322 Ack=598 Win=64128 Len=0 TSval=3321116465 TSecr=2833805829"
"133","2.924992452","2a02:26f0:de:58e::117e","2001:6a8:3081:6f06:3a94:8b2c:c377:90c7","TLSv1.3","373","Application Data"
"134","2.924993430","2a02:26f0:de:58e::117e","2001:6a8:3081:6f06:3a94:8b2c:c377:90c7","TLSv1.3","373","Application Data"
"135","2.924994827","2a02:26f0:de:58e::117e","2001:6a8:3081:6f06:3a94:8b2c:c377:90c7","TCP","86","443  >  44910 [ACK] Seq=5896 Ack=696 Win=64128 Len=0 TSval=3321116465 TSecr=2833805829"
"136","2.924995735","2a02:26f0:de:58e::117e","2001:6a8:3081:6f06:3a94:8b2c:c377:90c7","TLSv1.3","147","Application Data"
"137","2.924997131","2a02:26f0:de:58e::117e","2001:6a8:3081:6f06:3a94:8b2c:c377:90c7","TLSv1.3","117","Application Data"
"138","2.924998528","2a02:26f0:de:58e::117e","2001:6a8:3081:6f06:3a94:8b2c:c377:90c7","TCP","86","443  >  44910 [ACK] Seq=5988 Ack=2124 Win=64128 Len=0 TSval=3321116466 TSecr=2833805830"
"139","2.924999925","2a02:26f0:de:58e::117e","2001:6a8:3081:6f06:3a94:8b2c:c377:90c7","TCP","86","443  >  44910 [ACK] Seq=5988 Ack=3443 Win=64128 Len=0 TSval=3321116466 TSecr=2833805830"
"140","2.925882655","2001:6a8:3081:6f06:3a94:8b2c:c377:90c7","2a02:26f0:de:58e::117e","TCP","86","44910  >  443 [ACK] Seq=3443 Ack=5988 Win=64128 Len=0 TSval=2833805858 TSecr=3321116465"
"141","2.927875379","2001:6a8:3081:6f06:3a94:8b2c:c377:90c7","2a02:26f0:de:58e::117e","TLSv1.3","117","Application Data"
"142","2.928542158","192.168.166.195","130.104.1.2","DNS","101","Standard query 0x52a5 A p50-keyvalueservice.icloud.com OPT"
"143","2.928704121","192.168.166.195","130.104.1.2","DNS","101","Standard query 0xc8b7 AAAA p50-keyvalueservice.icloud.com OPT"
"144","2.931117362","192.168.166.195","130.104.1.2","DNS","91","Standard query 0x8773 A p50-setup.icloud.com OPT"
"145","2.931271363","192.168.166.195","130.104.1.2","DNS","91","Standard query 0xab61 AAAA p50-setup.icloud.com OPT"
"146","2.933336233","130.104.1.2","192.168.166.195","DNS","296","Standard query response 0xab61 AAAA p50-setup.icloud.com CNAME setup.fe2.apple-dns.net AAAA 2a01:b740:a41:280::2:a AAAA 2a01:b740:a41:280::2:7 AAAA 2a01:b740:a41:280::2:1 AAAA 2a01:b740:a41:280::2:2 AAAA 2a01:b740:a41:280::2:8 AAAA 2a01:b740:a41:280::2:9 OPT"
"147","2.933398672","130.104.1.2","192.168.166.195","DNS","192","Standard query response 0x8773 A p50-setup.icloud.com CNAME setup.fe2.apple-dns.net A 17.248.236.68 A 17.248.236.67 A 17.248.236.64 A 17.248.236.69 OPT"
"148","2.933949094","192.168.166.195","130.104.1.2","DNS","96","Standard query 0x9c57 A p50-contactsws.icloud.com OPT"
"149","2.934391751","192.168.166.195","130.104.1.2","DNS","96","Standard query 0xa58d AAAA p50-contactsws.icloud.com OPT"
"150","2.934651353","2001:6a8:3081:6f06:3a94:8b2c:c377:90c7","2a01:b740:a41:280::2:a","TCP","94","45648  >  443 [SYN] Seq=0 Win=64800 Len=0 MSS=1440 SACK_PERM=1 TSval=2412911275 TSecr=0 WS=128"
"151","2.935850256","192.168.166.195","130.104.1.2","DNS","92","Standard query 0xfa9d A experiments.apple.com OPT"
"152","2.935999089","192.168.166.195","130.104.1.2","DNS","92","Standard query 0x9702 AAAA experiments.apple.com OPT"
"153","2.947802620","2a01:b740:a41:280::2:a","2001:6a8:3081:6f06:3a94:8b2c:c377:90c7","TCP","94","443  >  45648 [SYN, ACK] Seq=0 Ack=1 Win=64260 Len=0 MSS=1440 SACK_PERM=1 TSval=1935690677 TSecr=2412911275 WS=128"
"154","2.947871344","2001:6a8:3081:6f06:3a94:8b2c:c377:90c7","2a01:b740:a41:280::2:a","TCP","86","45648  >  443 [ACK] Seq=1 Ack=1 Win=64896 Len=0 TSval=2412911288 TSecr=1935690677"
"155","2.948207911","2001:6a8:3081:6f06:3a94:8b2c:c377:90c7","2a01:b740:a41:280::2:a","TLSv1.2","603","Client Hello"
"156","2.949838296","2a01:b740:a41:280::2:a","2001:6a8:3081:6f06:3a94:8b2c:c377:90c7","TCP","86","443  >  45648 [ACK] Seq=1 Ack=518 Win=1198080 Len=0 TSval=1935690677 TSecr=2412911288"
"157","2.952101028","130.104.1.2","192.168.166.195","DNS","228","Standard query response 0x52a5 A p50-keyvalueservice.icloud.com CNAME keyvalueservice.fe2.apple-dns.net A 17.248.209.64 A 17.248.209.71 A 17.248.209.70 A 17.248.209.67 A 17.248.209.72 OPT"
"158","2.952153061","2a02:26f0:de:58e::117e","2001:6a8:3081:6f06:3a94:8b2c:c377:90c7","TLSv1.3","516","Application Data"
"159","2.952154527","2a02:26f0:de:58e::117e","2001:6a8:3081:6f06:3a94:8b2c:c377:90c7","TLSv1.3","1112","Application Data"
"160","2.952155924","2a02:26f0:de:58e::117e","2001:6a8:3081:6f06:3a94:8b2c:c377:90c7","TLSv1.3","136","Application Data"
"161","2.952270395","2001:6a8:3081:6f06:3a94:8b2c:c377:90c7","2a02:26f0:de:58e::117e","TCP","86","44910  >  443 [ACK] Seq=3474 Ack=7494 Win=64128 Len=0 TSval=2833805884 TSecr=3321116493"
"162","2.953271995","130.104.1.2","192.168.166.195","DNS","344","Standard query response 0xc8b7 AAAA p50-keyvalueservice.icloud.com CNAME keyvalueservice.fe2.apple-dns.net AAAA 2a01:b740:a41:280::2:9 AAAA 2a01:b740:a41:280::2:4 AAAA 2a01:b740:a41:280::2:b AAAA 2a01:b740:a41:280::2:2 AAAA 2a01:b740:a41:280::2:3 AAAA 2a01:b740:a41:280::2:1 AAAA 2a01:b740:a41:280::2:5 OPT"
"163","2.955348040","2001:6a8:3081:6f06:3a94:8b2c:c377:90c7","2a01:b740:a41:280::2:9","TCP","94","35336  >  443 [SYN] Seq=0 Win=64800 Len=0 MSS=1440 SACK_PERM=1 TSval=1400873661 TSecr=0 WS=128"
"164","2.955982971","2a02:26f0:de:58e::117e","2001:6a8:3081:6f06:3a94:8b2c:c377:90c7","TCP","86","443  >  44910 [ACK] Seq=7494 Ack=3474 Win=64128 Len=0 TSval=3321116497 TSecr=2833805860"
"165","2.959092325","130.104.1.2","192.168.166.195","DNS","218","Standard query response 0x9c57 A p50-contactsws.icloud.com CNAME contactsws.fe2.apple-dns.net A 17.248.209.73 A 17.248.209.74 A 17.248.209.71 A 17.248.209.70 A 17.248.209.65 OPT"
"166","2.959092325","130.104.1.2","192.168.166.195","DNS","278","Standard query response 0xa58d AAAA p50-contactsws.icloud.com CNAME contactsws.fe2.apple-dns.net AAAA 2a01:b740:a41:280::2:7 AAAA 2a01:b740:a41:280::2:9 AAAA 2a01:b740:a41:280::2:6 AAAA 2a01:b740:a41:280::2:4 AAAA 2a01:b740:a41:280::2:a OPT"
"167","2.960168935","2001:6a8:3081:6f06:3a94:8b2c:c377:90c7","2a01:b740:a41:280::2:7","TCP","94","33942  >  443 [SYN] Seq=0 Win=64800 Len=0 MSS=1440 SACK_PERM=1 TSval=2428981898 TSecr=0 WS=128"
"168","2.962583294","2a01:b740:a41:280::2:a","2001:6a8:3081:6f06:3a94:8b2c:c377:90c7","TLSv1.2","1514","Server Hello"
"169","2.962584760","2a01:b740:a41:280::2:a","2001:6a8:3081:6f06:3a94:8b2c:c377:90c7","TCP","1326","[TCP Previous segment not captured] 443  >  45648 [PSH, ACK] Seq=2857 Ack=518 Win=64128 Len=1240 TSval=1935690691 TSecr=2412911288 [TCP segment of a reassembled PDU]"
"170","2.962586227","2a01:b740:a41:280::2:a","2001:6a8:3081:6f06:3a94:8b2c:c377:90c7","TCP","1514","[TCP Out-Of-Order] 443  >  45648 [PSH, ACK] Seq=1429 Ack=518 Win=64128 Len=1428 TSval=1935690691 TSecr=2412911288 [TCP segment of a reassembled PDU]"
"171","2.962587694","2a01:b740:a41:280::2:a","2001:6a8:3081:6f06:3a94:8b2c:c377:90c7","TCP","1514","443  >  45648 [ACK] Seq=4097 Ack=518 Win=64128 Len=1428 TSval=1935690691 TSecr=2412911288 [TCP segment of a reassembled PDU]"
"172","2.962589160","2a01:b740:a41:280::2:a","2001:6a8:3081:6f06:3a94:8b2c:c377:90c7","TLSv1.2","505","[TCP Previous segment not captured] , Ignored Unknown Record"
"173","2.962590557","2a01:b740:a41:280::2:a","2001:6a8:3081:6f06:3a94:8b2c:c377:90c7","TCP","1514","[TCP Out-Of-Order] 443  >  45648 [PSH, ACK] Seq=5525 Ack=518 Win=64128 Len=1428 TSval=1935690691 TSecr=2412911288"
"174","2.962635815","2001:6a8:3081:6f06:3a94:8b2c:c377:90c7","2a01:b740:a41:280::2:a","TCP","86","45648  >  443 [ACK] Seq=518 Ack=1429 Win=63488 Len=0 TSval=2412911303 TSecr=1935690691"
"175","2.962678208","2001:6a8:3081:6f06:3a94:8b2c:c377:90c7","2a01:b740:a41:280::2:a","TCP","98","[TCP Dup ACK 174#1] 45648  >  443 [ACK] Seq=518 Ack=1429 Win=63488 Len=0 TSval=2412911303 TSecr=1935690691 SLE=2857 SRE=4097"
"176","2.962695390","2001:6a8:3081:6f06:3a94:8b2c:c377:90c7","2a01:b740:a41:280::2:a","TCP","86","45648  >  443 [ACK] Seq=518 Ack=4097 Win=60928 Len=0 TSval=2412911303 TSecr=1935690691"
"177","2.962726399","2001:6a8:3081:6f06:3a94:8b2c:c377:90c7","2a01:b740:a41:280::2:a","TCP","86","45648  >  443 [ACK] Seq=518 Ack=5525 Win=59520 Len=0 TSval=2412911303 TSecr=1935690691"
"178","2.962750634","2001:6a8:3081:6f06:3a94:8b2c:c377:90c7","2a01:b740:a41:280::2:a","TCP","98","[TCP Dup ACK 177#1] 45648  >  443 [ACK] Seq=518 Ack=5525 Win=59520 Len=0 TSval=2412911303 TSecr=1935690691 SLE=6953 SRE=7372"
"179","2.962767047","2001:6a8:3081:6f06:3a94:8b2c:c377:90c7","2a01:b740:a41:280::2:a","TCP","86","45648  >  443 [ACK] Seq=518 Ack=7372 Win=57728 Len=0 TSval=2412911303 TSecr=1935690691"
"180","2.967005392","2001:6a8:3081:6f06:3a94:8b2c:c377:90c7","2a01:b740:a41:280::2:a","TLSv1.2","179","Client Key Exchange, Change Cipher Spec, Encrypted Handshake Message"
"181","2.967365985","2001:6a8:3081:6f06:3a94:8b2c:c377:90c7","2a01:b740:a41:280::2:a","TLSv1.2","3837","Application Data"
"182","2.969272385","2a01:b740:a41:280::2:9","2001:6a8:3081:6f06:3a94:8b2c:c377:90c7","TCP","94","443  >  35336 [SYN, ACK] Seq=0 Ack=1 Win=64260 Len=0 MSS=1440 SACK_PERM=1 TSval=3648561168 TSecr=1400873661 WS=128"
"183","2.969336150","2001:6a8:3081:6f06:3a94:8b2c:c377:90c7","2a01:b740:a41:280::2:9","TCP","86","35336  >  443 [ACK] Seq=1 Ack=1 Win=64896 Len=0 TSval=1400873675 TSecr=3648561168"
"184","2.969583320","2001:6a8:3081:6f06:3a94:8b2c:c377:90c7","2a01:b740:a41:280::2:9","TLSv1.3","603","Client Hello"
"185","2.971218385","2a01:b740:a41:280::2:9","2001:6a8:3081:6f06:3a94:8b2c:c377:90c7","TCP","86","443  >  35336 [ACK] Seq=1 Ack=518 Win=1198080 Len=0 TSval=3648561168 TSecr=1400873675"
"186","2.973341433","2a01:b740:a41:280::2:7","2001:6a8:3081:6f06:3a94:8b2c:c377:90c7","TCP","94","443  >  33942 [SYN, ACK] Seq=0 Ack=1 Win=64260 Len=0 MSS=1440 SACK_PERM=1 TSval=669441170 TSecr=2428981898 WS=128"
"187","2.973388646","2001:6a8:3081:6f06:3a94:8b2c:c377:90c7","2a01:b740:a41:280::2:7","TCP","86","33942  >  443 [ACK] Seq=1 Ack=1 Win=64896 Len=0 TSval=2428981912 TSecr=669441170"
"188","2.973841151","2001:6a8:3081:6f06:3a94:8b2c:c377:90c7","2a01:b740:a41:280::2:7","TLSv1.2","603","Client Hello"
"189","2.975387656","2a01:b740:a41:280::2:7","2001:6a8:3081:6f06:3a94:8b2c:c377:90c7","TCP","86","443  >  33942 [ACK] Seq=1 Ack=518 Win=1198080 Len=0 TSval=669441170 TSecr=2428981912"
"190","2.981018785","2a01:b740:a41:280::2:a","2001:6a8:3081:6f06:3a94:8b2c:c377:90c7","TCP","86","443  >  45648 [ACK] Seq=7372 Ack=611 Win=64128 Len=0 TSval=1935690709 TSecr=2412911307"
"191","2.981019763","2a01:b740:a41:280::2:a","2001:6a8:3081:6f06:3a94:8b2c:c377:90c7","TLSv1.2","376","New Session Ticket, Change Cipher Spec, Encrypted Handshake Message"
"192","2.981021229","2a01:b740:a41:280::2:a","2001:6a8:3081:6f06:3a94:8b2c:c377:90c7","TCP","86","443  >  45648 [ACK] Seq=7662 Ack=2039 Win=64128 Len=0 TSval=1935690710 TSecr=2412911308"
"193","2.981022207","2a01:b740:a41:280::2:a","2001:6a8:3081:6f06:3a94:8b2c:c377:90c7","TCP","86","443  >  45648 [ACK] Seq=7662 Ack=3467 Win=64128 Len=0 TSval=1935690710 TSecr=2412911308"
"194","2.981810441","2a01:b740:a41:280::2:a","2001:6a8:3081:6f06:3a94:8b2c:c377:90c7","TCP","86","443  >  45648 [ACK] Seq=7662 Ack=4362 Win=64128 Len=0 TSval=1935690711 TSecr=2412911308"
"195","2.983588960","2a01:b740:a41:280::2:9","2001:6a8:3081:6f06:3a94:8b2c:c377:90c7","TLSv1.3","1514","Server Hello, Change Cipher Spec, Application Data"
"196","2.983590357","2a01:b740:a41:280::2:9","2001:6a8:3081:6f06:3a94:8b2c:c377:90c7","TCP","1326","[TCP Previous segment not captured] 443  >  35336 [PSH, ACK] Seq=2857 Ack=518 Win=64128 Len=1240 TSval=3648561183 TSecr=1400873675 [TCP segment of a reassembled PDU]"
"197","2.983591335","2a01:b740:a41:280::2:9","2001:6a8:3081:6f06:3a94:8b2c:c377:90c7","TCP","1514","[TCP Out-Of-Order] 443  >  35336 [PSH, ACK] Seq=1429 Ack=518 Win=64128 Len=1428 TSval=3648561183 TSecr=1400873675 [TCP segment of a reassembled PDU]"
"198","2.983592662","2a01:b740:a41:280::2:9","2001:6a8:3081:6f06:3a94:8b2c:c377:90c7","TCP","264","[TCP Previous segment not captured] 443  >  35336 [PSH, ACK] Seq=6953 Ack=518 Win=64128 Len=178 TSval=3648561183 TSecr=1400873675 [TCP segment of a reassembled PDU], Application Data, Application Data"
"199","2.983593640","2a01:b740:a41:280::2:9","2001:6a8:3081:6f06:3a94:8b2c:c377:90c7","TCP","2942","[TCP Out-Of-Order] 443  >  35336 [PSH, ACK] Seq=4097 Ack=518 Win=64128 Len=2856 TSval=3648561183 TSecr=1400873675"
"200","2.983627234","2001:6a8:3081:6f06:3a94:8b2c:c377:90c7","2a01:b740:a41:280::2:9","TCP","86","35336  >  443 [ACK] Seq=518 Ack=1429 Win=63488 Len=0 TSval=1400873689 TSecr=3648561183"
"201","2.983671024","2001:6a8:3081:6f06:3a94:8b2c:c377:90c7","2a01:b740:a41:280::2:9","TCP","98","[TCP Dup ACK 200#1] 35336  >  443 [ACK] Seq=518 Ack=1429 Win=63488 Len=0 TSval=1400873689 TSecr=3648561183 SLE=2857 SRE=4097"
"202","2.983699171","2001:6a8:3081:6f06:3a94:8b2c:c377:90c7","2a01:b740:a41:280::2:9","TCP","86","35336  >  443 [ACK] Seq=518 Ack=4097 Win=60928 Len=0 TSval=1400873689 TSecr=3648561183"
"203","2.983721590","2001:6a8:3081:6f06:3a94:8b2c:c377:90c7","2a01:b740:a41:280::2:9","TCP","98","[TCP Dup ACK 202#1] 35336  >  443 [ACK] Seq=518 Ack=4097 Win=60928 Len=0 TSval=1400873689 TSecr=3648561183 SLE=6953 SRE=7131"
"204","2.983734930","2001:6a8:3081:6f06:3a94:8b2c:c377:90c7","2a01:b740:a41:280::2:9","TCP","86","35336  >  443 [ACK] Seq=518 Ack=7131 Win=57984 Len=0 TSval=1400873689 TSecr=3648561183"
"205","2.988252921","2001:6a8:3081:6f06:3a94:8b2c:c377:90c7","2a01:b740:a41:280::2:9","TLSv1.3","166","Change Cipher Spec, Application Data"
"206","2.988645920","2001:6a8:3081:6f06:3a94:8b2c:c377:90c7","2a01:b740:a41:280::2:9","TLSv1.3","3847","Application Data"
"207","2.989679368","2001:6a8:3081:6f06:3a94:8b2c:c377:90c7","2a01:b740:a41:280::2:9","TLSv1.3","404","Application Data"
"208","2.989727140","2a01:b740:a41:280::2:7","2001:6a8:3081:6f06:3a94:8b2c:c377:90c7","TLSv1.2","1326","[TCP Previous segment not captured] , Ignored Unknown Record"
"209","2.989728118","2a01:b740:a41:280::2:7","2001:6a8:3081:6f06:3a94:8b2c:c377:90c7","TCP","2942","[TCP Out-Of-Order] 443  >  33942 [PSH, ACK] Seq=1 Ack=518 Win=64128 Len=2856 TSval=669441186 TSecr=2428981912"
"210","2.989747464","2001:6a8:3081:6f06:3a94:8b2c:c377:90c7","2a01:b740:a41:280::2:7","TCP","98","[TCP Dup ACK 187#1] 33942  >  443 [ACK] Seq=518 Ack=1 Win=64896 Len=0 TSval=2428981928 TSecr=669441170 SLE=2857 SRE=4097"
"211","2.989772817","2001:6a8:3081:6f06:3a94:8b2c:c377:90c7","2a01:b740:a41:280::2:7","TCP","86","33942  >  443 [ACK] Seq=518 Ack=4097 Win=60800 Len=0 TSval=2428981928 TSecr=669441186"
"212","2.990414453","2a01:b740:a41:280::2:7","2001:6a8:3081:6f06:3a94:8b2c:c377:90c7","TLSv1.2","1156","[TCP Previous segment not captured] , Ignored Unknown Record"
"213","2.990415919","2a01:b740:a41:280::2:7","2001:6a8:3081:6f06:3a94:8b2c:c377:90c7","TCP","1514","[TCP Out-Of-Order] 443  >  33942 [ACK] Seq=4097 Ack=518 Win=64128 Len=1428 TSval=669441186 TSecr=2428981912"
"214","2.990425488","2001:6a8:3081:6f06:3a94:8b2c:c377:90c7","2a01:b740:a41:280::2:7","TCP","98","[TCP Window Update] 33942  >  443 [ACK] Seq=518 Ack=4097 Win=63104 Len=0 TSval=2428981929 TSecr=669441186 SLE=5525 SRE=6595"
"215","2.990441551","2001:6a8:3081:6f06:3a94:8b2c:c377:90c7","2a01:b740:a41:280::2:7","TCP","86","33942  >  443 [ACK] Seq=518 Ack=6595 Win=61056 Len=0 TSval=2428981929 TSecr=669441186"
"216","2.993825383","130.104.1.2","192.168.166.195","DNS","231","Standard query response 0xfa9d A experiments.apple.com CNAME ab.apple.com.akadns.net CNAME experiments.apple.com.edgekey.net CNAME e3925.dscg.akamaiedge.net A 23.33.108.150 OPT"
"217","2.993883631","130.104.1.2","192.168.166.195","DNS","271","Standard query response 0x9702 AAAA experiments.apple.com CNAME ab.apple.com.akadns.net CNAME experiments.apple.com.edgekey.net CNAME e3925.dscg.akamaiedge.net AAAA 2a02:26f0:8d00:b8c::f55 AAAA 2a02:26f0:8d00:b97::f55 OPT"
"218","2.994749808","2001:6a8:3081:6f06:3a94:8b2c:c377:90c7","2a01:b740:a41:280::2:7","TLSv1.2","179","Client Key Exchange, Change Cipher Spec, Encrypted Handshake Message"
"219","2.995180591","2001:6a8:3081:6f06:3a94:8b2c:c377:90c7","2a02:26f0:8d00:b8c::f55","TCP","94","48716  >  443 [SYN] Seq=0 Win=64800 Len=0 MSS=1440 SACK_PERM=1 TSval=2111507207 TSecr=0 WS=128"
"220","2.995247500","2001:6a8:3081:6f06:3a94:8b2c:c377:90c7","2a01:b740:a41:280::2:7","TLSv1.2","191","Application Data"
"221","2.995641617","2001:6a8:3081:6f06:3a94:8b2c:c377:90c7","2a01:b740:a41:280::2:7","TLSv1.2","3018","Application Data"
"222","3.002311501","2a01:b740:a41:280::2:9","2001:6a8:3081:6f06:3a94:8b2c:c377:90c7","TCP","86","443  >  35336 [ACK] Seq=7131 Ack=598 Win=64128 Len=0 TSval=3648561201 TSecr=1400873693"
"223","3.002314295","2a01:b740:a41:280::2:9","2001:6a8:3081:6f06:3a94:8b2c:c377:90c7","TLSv1.3","389","Application Data"
"224","3.002315273","2a01:b740:a41:280::2:9","2001:6a8:3081:6f06:3a94:8b2c:c377:90c7","TLSv1.3","389","Application Data"
"225","3.002316670","2a01:b740:a41:280::2:9","2001:6a8:3081:6f06:3a94:8b2c:c377:90c7","TCP","86","443  >  35336 [ACK] Seq=7737 Ack=2026 Win=64128 Len=0 TSval=3648561201 TSecr=1400873694"
"226","3.002318067","2a01:b740:a41:280::2:9","2001:6a8:3081:6f06:3a94:8b2c:c377:90c7","TCP","86","443  >  35336 [ACK] Seq=7737 Ack=4359 Win=63744 Len=0 TSval=3648561201 TSecr=1400873694"
