"No.","Time","Source","Destination","Protocol","Length","Info"
"1","0.000000000","2a01:b740:a41:e80::2:1","2001:6a8:3081:6f06:6929:a50d:93f0:6a7e","TLSv1.2","1128","Application Data"
"2","0.000044838","2001:6a8:3081:6f06:6929:a50d:93f0:6a7e","2a01:b740:a41:e80::2:1","TCP","86","41750  >  443 [ACK] Seq=1 Ack=1043 Win=6453 Len=0 TSval=4014161554 TSecr=2360695355"
"3","0.002307363","2001:6a8:3081:6f06:6929:a50d:93f0:6a7e","2a01:b740:a41:e80::2:1","TLSv1.2","128","Application Data"
"4","0.006323197","2001:6a8:3081:6f06:6929:a50d:93f0:6a7e","2a01:b740:a41:e80::2:1","TLSv1.2","3052","Application Data"
"5","0.006938014","2001:6a8:3081:6f06:6929:a50d:93f0:6a7e","2a01:b740:a41:e80::2:1","TLSv1.2","162","Application Data"
"6","0.008724358","2a01:b740:a41:e80::2:1","2001:6a8:3081:6f06:6929:a50d:93f0:6a7e","TCP","86","443  >  41750 [ACK] Seq=1043 Ack=43 Win=960 Len=0 TSval=2360695447 TSecr=4014161557"
"7","0.014419886","2a01:b740:a41:e80::2:1","2001:6a8:3081:6f06:6929:a50d:93f0:6a7e","TCP","86","443  >  41750 [ACK] Seq=1043 Ack=1471 Win=955 Len=0 TSval=2360695451 TSecr=4014161561"
"8","0.014420794","2a01:b740:a41:e80::2:1","2001:6a8:3081:6f06:6929:a50d:93f0:6a7e","TCP","86","443  >  41750 [ACK] Seq=1043 Ack=3009 Win=952 Len=0 TSval=2360695451 TSecr=4014161561"
"9","0.014421772","2a01:b740:a41:e80::2:1","2001:6a8:3081:6f06:6929:a50d:93f0:6a7e","TCP","86","443  >  41750 [ACK] Seq=1043 Ack=3085 Win=960 Len=0 TSval=2360695452 TSecr=4014161561"
"10","0.412914403","2a01:b740:a41:e80::2:1","2001:6a8:3081:6f06:6929:a50d:93f0:6a7e","TLSv1.2","961","Application Data"
"11","0.453218986","2001:6a8:3081:6f06:6929:a50d:93f0:6a7e","2a01:b740:a41:e80::2:1","TCP","86","41750  >  443 [ACK] Seq=3085 Ack=1918 Win=6453 Len=0 TSval=4014162008 TSecr=2360695752"
"12","5.817827370","2001:6a8:3081:6f06:6929:a50d:93f0:6a7e","2a01:b740:a41:e80::2:2","TLSv1.2","3032","Application Data"
"13","5.820274208","2001:6a8:3081:6f06:6929:a50d:93f0:6a7e","2a01:b740:a41:e80::2:2","TLSv1.2","4795","Application Data, Application Data"
"14","5.826916302","2a01:b740:a41:e80::2:2","2001:6a8:3081:6f06:6929:a50d:93f0:6a7e","TCP","86","443  >  43038 [ACK] Seq=1 Ack=2857 Win=2635 Len=0 TSval=1363848369 TSecr=2862043722"
"15","5.826917210","2a01:b740:a41:e80::2:2","2001:6a8:3081:6f06:6929:a50d:93f0:6a7e","TCP","86","443  >  43038 [ACK] Seq=1 Ack=2947 Win=2635 Len=0 TSval=1363848369 TSecr=2862043722"
"16","5.826918188","2a01:b740:a41:e80::2:2","2001:6a8:3081:6f06:6929:a50d:93f0:6a7e","TCP","86","443  >  43038 [ACK] Seq=1 Ack=4375 Win=2643 Len=0 TSval=1363848370 TSecr=2862043725"
"17","5.826919585","2a01:b740:a41:e80::2:2","2001:6a8:3081:6f06:6929:a50d:93f0:6a7e","TLSv1.2","125","Application Data"
"18","5.826920493","2a01:b740:a41:e80::2:2","2001:6a8:3081:6f06:6929:a50d:93f0:6a7e","TCP","86","443  >  43038 [ACK] Seq=40 Ack=5803 Win=2643 Len=0 TSval=1363848370 TSecr=2862043725"
"19","5.827296172","2a01:b740:a41:e80::2:2","2001:6a8:3081:6f06:6929:a50d:93f0:6a7e","TCP","86","443  >  43038 [ACK] Seq=40 Ack=7656 Win=2639 Len=0 TSval=1363848370 TSecr=2862043725"
"20","5.869238475","2001:6a8:3081:6f06:6929:a50d:93f0:6a7e","2a01:b740:a41:e80::2:2","TCP","86","43038  >  443 [ACK] Seq=7656 Ack=40 Win=2307 Len=0 TSval=2862043774 TSecr=1363848370"
"21","6.053484414","2a01:b740:a41:e80::2:2","2001:6a8:3081:6f06:6929:a50d:93f0:6a7e","TLSv1.2","719","Application Data"
"22","6.053557050","2001:6a8:3081:6f06:6929:a50d:93f0:6a7e","2a01:b740:a41:e80::2:2","TCP","86","43038  >  443 [ACK] Seq=7656 Ack=673 Win=2317 Len=0 TSval=2862043958 TSecr=1363848519"
"23","6.056234714","2001:6a8:3081:6f06:6929:a50d:93f0:6a7e","2a01:b740:a41:e80::2:2","TLSv1.2","121","Application Data"
"24","6.062656597","2a01:b740:a41:e80::2:2","2001:6a8:3081:6f06:6929:a50d:93f0:6a7e","TCP","86","443  >  43038 [ACK] Seq=673 Ack=7691 Win=2647 Len=0 TSval=1363848606 TSecr=2862043961"
"25","7.783321468","192.168.166.19","130.104.1.1","DNS","96","Standard query 0xe1a1 A p50-contactsws.icloud.com OPT"
"26","7.783607051","192.168.166.19","130.104.1.1","DNS","96","Standard query 0x8e87 AAAA p50-contactsws.icloud.com OPT"
"27","7.858408312","130.104.1.1","192.168.166.19","DNS","278","Standard query response 0x8e87 AAAA p50-contactsws.icloud.com CNAME contactsws.fe2.apple-dns.net AAAA 2a01:b740:a41:e80::2:5 AAAA 2a01:b740:a41:e80::2:2 AAAA 2a01:b740:a41:e80::2:1 AAAA 2a01:b740:a41:e80::2:4 AAAA 2a01:b740:a41:e80::2:3 OPT"
"28","7.858487722","130.104.1.1","192.168.166.19","DNS","202","Standard query response 0xe1a1 A p50-contactsws.icloud.com CNAME contactsws.fe2.apple-dns.net A 17.248.236.66 A 17.248.236.68 A 17.248.236.64 A 17.248.236.67 OPT"
"29","7.860014115","2001:6a8:3081:6f06:6929:a50d:93f0:6a7e","2a01:b740:a41:e80::2:5","TCP","94","35566  >  443 [SYN] Seq=0 Win=64800 Len=0 MSS=1440 SACK_PERM=1 TSval=69445516 TSecr=0 WS=128"
"30","7.867072117","2a01:b740:a41:e80::2:5","2001:6a8:3081:6f06:6929:a50d:93f0:6a7e","TCP","94","443  >  35566 [SYN, ACK] Seq=0 Ack=1 Win=64260 Len=0 MSS=1440 SACK_PERM=1 TSval=2420198365 TSecr=69445516 WS=128"
"31","7.867115699","2001:6a8:3081:6f06:6929:a50d:93f0:6a7e","2a01:b740:a41:e80::2:5","TCP","86","35566  >  443 [ACK] Seq=1 Ack=1 Win=64896 Len=0 TSval=69445523 TSecr=2420198365"
"32","7.867422723","2001:6a8:3081:6f06:6929:a50d:93f0:6a7e","2a01:b740:a41:e80::2:5","TLSv1.2","633","Client Hello"
"33","7.869045986","2a01:b740:a41:e80::2:5","2001:6a8:3081:6f06:6929:a50d:93f0:6a7e","TCP","86","443  >  35566 [ACK] Seq=1 Ack=548 Win=1198080 Len=0 TSval=2420198365 TSecr=69445524"
"34","7.875238579","2a01:b740:a41:e80::2:5","2001:6a8:3081:6f06:6929:a50d:93f0:6a7e","TLSv1.2","1514","Server Hello"
"35","7.875239557","2a01:b740:a41:e80::2:5","2001:6a8:3081:6f06:6929:a50d:93f0:6a7e","TCP","1326","[TCP Previous segment not captured] 443  >  35566 [PSH, ACK] Seq=2857 Ack=548 Win=64128 Len=1240 TSval=2420198373 TSecr=69445524 [TCP segment of a reassembled PDU]"
"36","7.875280554","2001:6a8:3081:6f06:6929:a50d:93f0:6a7e","2a01:b740:a41:e80::2:5","TCP","86","35566  >  443 [ACK] Seq=548 Ack=1429 Win=63488 Len=0 TSval=69445532 TSecr=2420198373"
"37","7.875321900","2001:6a8:3081:6f06:6929:a50d:93f0:6a7e","2a01:b740:a41:e80::2:5","TCP","98","[TCP Dup ACK 36#1] 35566  >  443 [ACK] Seq=548 Ack=1429 Win=63488 Len=0 TSval=69445532 TSecr=2420198373 SLE=2857 SRE=4097"
"38","7.875605039","2a01:b740:a41:e80::2:5","2001:6a8:3081:6f06:6929:a50d:93f0:6a7e","TCP","1514","[TCP Out-Of-Order] 443  >  35566 [ACK] Seq=1429 Ack=548 Win=64128 Len=1428 TSval=2420198373 TSecr=69445524 [TCP segment of a reassembled PDU]"
"39","7.875606016","2a01:b740:a41:e80::2:5","2001:6a8:3081:6f06:6929:a50d:93f0:6a7e","TLSv1.2","1154","[TCP Previous segment not captured] , Ignored Unknown Record"
"40","7.875607413","2a01:b740:a41:e80::2:5","2001:6a8:3081:6f06:6929:a50d:93f0:6a7e","TCP","1514","[TCP Out-Of-Order] 443  >  35566 [ACK] Seq=4097 Ack=548 Win=64128 Len=1428 TSval=2420198373 TSecr=69445524"
"41","7.875628575","2001:6a8:3081:6f06:6929:a50d:93f0:6a7e","2a01:b740:a41:e80::2:5","TCP","86","35566  >  443 [ACK] Seq=548 Ack=4097 Win=61056 Len=0 TSval=69445532 TSecr=2420198373"
"42","7.875647433","2001:6a8:3081:6f06:6929:a50d:93f0:6a7e","2a01:b740:a41:e80::2:5","TCP","98","[TCP Dup ACK 41#1] 35566  >  443 [ACK] Seq=548 Ack=4097 Win=61056 Len=0 TSval=69445532 TSecr=2420198373 SLE=5525 SRE=6593"
"43","7.875660284","2001:6a8:3081:6f06:6929:a50d:93f0:6a7e","2a01:b740:a41:e80::2:5","TCP","86","35566  >  443 [ACK] Seq=548 Ack=6593 Win=58624 Len=0 TSval=69445532 TSecr=2420198373"
"44","7.878558997","2001:6a8:3081:6f06:6929:a50d:93f0:6a7e","2a01:b740:a41:e80::2:5","TLSv1.2","179","Client Key Exchange, Change Cipher Spec, Encrypted Handshake Message"
"45","7.878830682","2001:6a8:3081:6f06:6929:a50d:93f0:6a7e","2a01:b740:a41:e80::2:5","TLSv1.2","191","Application Data"
"46","7.879138126","2001:6a8:3081:6f06:6929:a50d:93f0:6a7e","2a01:b740:a41:e80::2:5","TLSv1.2","3151","Application Data"
"47","7.885436040","2a01:b740:a41:e80::2:5","2001:6a8:3081:6f06:6929:a50d:93f0:6a7e","TCP","86","443  >  35566 [ACK] Seq=6593 Ack=641 Win=64128 Len=0 TSval=2420198383 TSecr=69445535"
"48","7.885437506","2a01:b740:a41:e80::2:5","2001:6a8:3081:6f06:6929:a50d:93f0:6a7e","TLSv1.2","376","New Session Ticket, Change Cipher Spec, Encrypted Handshake Message"
"49","7.885438414","2a01:b740:a41:e80::2:5","2001:6a8:3081:6f06:6929:a50d:93f0:6a7e","TCP","86","443  >  35566 [ACK] Seq=6883 Ack=746 Win=64128 Len=0 TSval=2420198384 TSecr=69445535"
"50","7.885439322","2a01:b740:a41:e80::2:5","2001:6a8:3081:6f06:6929:a50d:93f0:6a7e","TLSv1.2","155","Application Data"
"51","7.885440300","2a01:b740:a41:e80::2:5","2001:6a8:3081:6f06:6929:a50d:93f0:6a7e","TLSv1.2","124","Application Data"
"52","7.885586758","2001:6a8:3081:6f06:6929:a50d:93f0:6a7e","2a01:b740:a41:e80::2:5","TCP","86","35566  >  443 [ACK] Seq=3811 Ack=6990 Win=64128 Len=0 TSval=69445542 TSecr=2420198384"
"53","7.885727001","2a01:b740:a41:e80::2:5","2001:6a8:3081:6f06:6929:a50d:93f0:6a7e","TCP","86","443  >  35566 [ACK] Seq=6990 Ack=2174 Win=64128 Len=0 TSval=2420198384 TSecr=69445535"
"54","7.885764715","2001:6a8:3081:6f06:6929:a50d:93f0:6a7e","2a01:b740:a41:e80::2:5","TLSv1.2","124","Application Data"
"55","7.886349431","2a01:b740:a41:e80::2:5","2001:6a8:3081:6f06:6929:a50d:93f0:6a7e","TCP","86","443  >  35566 [ACK] Seq=6990 Ack=3811 Win=64128 Len=0 TSval=2420198384 TSecr=69445535"
"56","7.892630164","2a01:b740:a41:e80::2:5","2001:6a8:3081:6f06:6929:a50d:93f0:6a7e","TCP","86","443  >  35566 [ACK] Seq=6990 Ack=3849 Win=64128 Len=0 TSval=2420198391 TSecr=69445542"
"57","8.246574834","2a01:b740:a41:e80::2:5","2001:6a8:3081:6f06:6929:a50d:93f0:6a7e","TLSv1.2","1105","Application Data"
"58","8.246575742","2a01:b740:a41:e80::2:5","2001:6a8:3081:6f06:6929:a50d:93f0:6a7e","TLSv1.2","124","Application Data"
"59","8.246577209","2a01:b740:a41:e80::2:5","2001:6a8:3081:6f06:6929:a50d:93f0:6a7e","TCP","124","[TCP Retransmission] 443  >  35566 [PSH, ACK] Seq=8009 Ack=3849 Win=64128 Len=38 TSval=2420198562 TSecr=69445542"
"60","8.246617578","2001:6a8:3081:6f06:6929:a50d:93f0:6a7e","2a01:b740:a41:e80::2:5","TCP","98","35566  >  443 [ACK] Seq=3849 Ack=8047 Win=63104 Len=0 TSval=69445903 TSecr=2420198545 SLE=8009 SRE=8047"
"61","8.255013749","2001:6a8:3081:6f06:6929:a50d:93f0:6a7e","2a01:b740:a41:e80::2:5","TLSv1.2","3244","Application Data"
"62","8.261837711","2a01:b740:a41:e80::2:5","2001:6a8:3081:6f06:6929:a50d:93f0:6a7e","TCP","86","443  >  35566 [ACK] Seq=8047 Ack=7007 Win=63104 Len=0 TSval=2420198760 TSecr=69445911"
"63","8.560278618","2a01:b740:a41:e80::2:5","2001:6a8:3081:6f06:6929:a50d:93f0:6a7e","TLSv1.2","954","Application Data"
"64","8.601289651","2001:6a8:3081:6f06:6929:a50d:93f0:6a7e","2a01:b740:a41:e80::2:5","TCP","86","35566  >  443 [ACK] Seq=7007 Ack=8915 Win=64128 Len=0 TSval=69446258 TSecr=2420198955"
"65","10.721235666","192.168.166.19","17.138.224.1","TCP","66","47270  >  443 [ACK] Seq=1 Ack=1 Win=501 Len=0 TSval=648611371 TSecr=2712367025"
"66","10.811040901","17.138.224.1","192.168.166.19","TCP","66","[TCP ACKed unseen segment] 443  >  47270 [ACK] Seq=1 Ack=2 Win=158 Len=0 TSval=2712413361 TSecr=648520011"
"67","12.513475596","2001:6a8:3081:6f06:6929:a50d:93f0:6a7e","2a01:b740:a41:e80::2:4","TCP","86","46320  >  443 [ACK] Seq=1 Ack=1 Win=501 Len=0 TSval=842971237 TSecr=1421515256"
"68","12.522059293","2a01:b740:a41:e80::2:4","2001:6a8:3081:6f06:6929:a50d:93f0:6a7e","TCP","86","[TCP ACKed unseen segment] 443  >  46320 [ACK] Seq=1 Ack=2 Win=501 Len=0 TSval=1421560357 TSecr=842926235"
"69","12.769435441","2001:6a8:3081:6f06:6929:a50d:93f0:6a7e","2620:149:208:430e::1d","TCP","86","54802  >  443 [ACK] Seq=1 Ack=1 Win=501 Len=0 TSval=829187928 TSecr=3627433971"
"70","13.155949576","2620:149:208:430e::1d","2001:6a8:3081:6f06:6929:a50d:93f0:6a7e","TCP","86","[TCP ACKed unseen segment] 443  >  54802 [ACK] Seq=1 Ack=2 Win=501 Len=0 TSval=3627479489 TSecr=829142372"
"71","13.819046789","2001:6a8:3081:6f06:6929:a50d:93f0:6a7e","2a01:b740:a41:e80::2:2","TLSv1.2","3034","Application Data"
"72","13.821550548","2001:6a8:3081:6f06:6929:a50d:93f0:6a7e","2a01:b740:a41:e80::2:2","TLSv1.2","2819","Application Data"
"73","13.828506651","2a01:b740:a41:e80::2:2","2001:6a8:3081:6f06:6929:a50d:93f0:6a7e","TCP","86","443  >  43038 [ACK] Seq=673 Ack=9119 Win=2643 Len=0 TSval=1363856370 TSecr=2862051723"
"74","13.828507629","2a01:b740:a41:e80::2:2","2001:6a8:3081:6f06:6929:a50d:93f0:6a7e","TCP","86","443  >  43038 [ACK] Seq=673 Ack=10639 Win=2641 Len=0 TSval=1363856371 TSecr=2862051723"
"75","13.828509026","2a01:b740:a41:e80::2:2","2001:6a8:3081:6f06:6929:a50d:93f0:6a7e","TCP","86","443  >  43038 [ACK] Seq=673 Ack=12067 Win=2643 Len=0 TSval=1363856371 TSecr=2862051726"
"76","13.828509934","2a01:b740:a41:e80::2:2","2001:6a8:3081:6f06:6929:a50d:93f0:6a7e","TCP","86","443  >  43038 [ACK] Seq=673 Ack=13372 Win=2643 Len=0 TSval=1363856371 TSecr=2862051726"
"77","14.096010017","2a01:b740:a41:e80::2:2","2001:6a8:3081:6f06:6929:a50d:93f0:6a7e","TLSv1.2","708","Application Data"
"78","14.098933874","2001:6a8:3081:6f06:6929:a50d:93f0:6a7e","2a01:b740:a41:e80::2:2","TLSv1.2","121","Application Data"
"79","14.105515975","2a01:b740:a41:e80::2:2","2001:6a8:3081:6f06:6929:a50d:93f0:6a7e","TCP","86","443  >  43038 [ACK] Seq=1295 Ack=13407 Win=2647 Len=0 TSval=1363856648 TSecr=2862052003"
"80","16.846959266","2001:6a8:3081:6f06:6929:a50d:93f0:6a7e","2a01:b740:a41:e80::2:5","TLSv1.2","4854","Application Data"
"81","16.855882463","2a01:b740:a41:e80::2:5","2001:6a8:3081:6f06:6929:a50d:93f0:6a7e","TCP","86","443  >  40566 [ACK] Seq=1 Ack=1429 Win=501 Len=0 TSval=731066 TSecr=69454503"
"82","16.855883441","2a01:b740:a41:e80::2:5","2001:6a8:3081:6f06:6929:a50d:93f0:6a7e","TCP","86","443  >  40566 [ACK] Seq=1 Ack=2857 Win=501 Len=0 TSval=731066 TSecr=69454503"
"83","16.855884907","2a01:b740:a41:e80::2:5","2001:6a8:3081:6f06:6929:a50d:93f0:6a7e","TCP","86","443  >  40566 [ACK] Seq=1 Ack=4769 Win=500 Len=0 TSval=731066 TSecr=69454503"
"84","17.230656471","2a01:b740:a41:e80::2:5","2001:6a8:3081:6f06:6929:a50d:93f0:6a7e","TLSv1.2","1260","Application Data"
"85","17.230718002","2001:6a8:3081:6f06:6929:a50d:93f0:6a7e","2a01:b740:a41:e80::2:5","TCP","86","40566  >  443 [ACK] Seq=4769 Ack=1175 Win=493 Len=0 TSval=69454887 TSecr=731337"
"86","17.234560698","2001:6a8:3081:6f06:6929:a50d:93f0:6a7e","2a01:b740:a41:e80::2:5","TLSv1.2","3951","Application Data"
"87","17.242786804","2a01:b740:a41:e80::2:5","2001:6a8:3081:6f06:6929:a50d:93f0:6a7e","TCP","86","443  >  40566 [ACK] Seq=1175 Ack=7625 Win=496 Len=0 TSval=731452 TSecr=69454891"
"88","17.242787782","2a01:b740:a41:e80::2:5","2001:6a8:3081:6f06:6929:a50d:93f0:6a7e","TCP","86","443  >  40566 [ACK] Seq=1175 Ack=8634 Win=501 Len=0 TSval=731452 TSecr=69454891"
"89","17.542873254","2a01:b740:a41:e80::2:5","2001:6a8:3081:6f06:6929:a50d:93f0:6a7e","TLSv1.2","403","[TCP Previous segment not captured] , Ignored Unknown Record"
"90","17.542874161","2a01:b740:a41:e80::2:5","2001:6a8:3081:6f06:6929:a50d:93f0:6a7e","TCP","1514","[TCP Out-Of-Order] 443  >  40566 [ACK] Seq=1175 Ack=8634 Win=501 Len=1428 TSval=731729 TSecr=69454891"
"91","17.542908384","2001:6a8:3081:6f06:6929:a50d:93f0:6a7e","2a01:b740:a41:e80::2:5","TCP","98","[TCP Dup ACK 85#1] 40566  >  443 [ACK] Seq=8634 Ack=1175 Win=501 Len=0 TSval=69455199 TSecr=731452 SLE=2603 SRE=2920"
"92","17.542946448","2001:6a8:3081:6f06:6929:a50d:93f0:6a7e","2a01:b740:a41:e80::2:5","TCP","86","40566  >  443 [ACK] Seq=8634 Ack=2920 Win=488 Len=0 TSval=69455199 TSecr=731729"
"93","17.755357139","192.168.166.19","130.104.1.1","DNS","98","Standard query 0xe0f1 A p50-ckdatabasews.icloud.com OPT"
"94","17.755433266","192.168.166.19","130.104.1.1","DNS","98","Standard query 0xad9d AAAA p50-ckdatabasews.icloud.com OPT"
"95","17.758810327","130.104.1.1","192.168.166.19","DNS","282","Standard query response 0xad9d AAAA p50-ckdatabasews.icloud.com CNAME ckdatabasews.fe2.apple-dns.net AAAA 2a01:b740:a41:e80::2:1 AAAA 2a01:b740:a41:e80::2:4 AAAA 2a01:b740:a41:e80::2:3 AAAA 2a01:b740:a41:e80::2:6 AAAA 2a01:b740:a41:e80::2:5 OPT"
"96","17.766980280","130.104.1.1","192.168.166.19","DNS","190","Standard query response 0xe0f1 A p50-ckdatabasews.icloud.com CNAME ckdatabasews.fe2.apple-dns.net A 17.248.236.67 A 17.248.236.64 A 17.248.236.68 OPT"
"97","17.767948148","2001:6a8:3081:6f06:6929:a50d:93f0:6a7e","2a01:b740:a41:e80::2:1","TCP","94","33660  >  443 [SYN] Seq=0 Win=64800 Len=0 MSS=1440 SACK_PERM=1 TSval=4014179322 TSecr=0 WS=128"
"98","17.775092684","2a01:b740:a41:e80::2:1","2001:6a8:3081:6f06:6929:a50d:93f0:6a7e","TCP","94","443  >  33660 [SYN, ACK] Seq=0 Ack=1 Win=64260 Len=0 MSS=1440 SACK_PERM=1 TSval=4121381511 TSecr=4014179322 WS=128"
"99","17.775141224","2001:6a8:3081:6f06:6929:a50d:93f0:6a7e","2a01:b740:a41:e80::2:1","TCP","86","33660  >  443 [ACK] Seq=1 Ack=1 Win=64896 Len=0 TSval=4014179329 TSecr=4121381511"
"100","17.775476535","2001:6a8:3081:6f06:6929:a50d:93f0:6a7e","2a01:b740:a41:e80::2:1","TLSv1.2","635","Client Hello"
"101","17.776880285","2a01:b740:a41:e80::2:1","2001:6a8:3081:6f06:6929:a50d:93f0:6a7e","TCP","86","443  >  33660 [ACK] Seq=1 Ack=550 Win=1198080 Len=0 TSval=4121381511 TSecr=4014179330"
"102","17.782452822","2a01:b740:a41:e80::2:1","2001:6a8:3081:6f06:6929:a50d:93f0:6a7e","TLSv1.2","1514","Server Hello"
"103","17.782453800","2a01:b740:a41:e80::2:1","2001:6a8:3081:6f06:6929:a50d:93f0:6a7e","TCP","1326","[TCP Previous segment not captured] 443  >  33660 [PSH, ACK] Seq=2857 Ack=550 Win=64128 Len=1240 TSval=4121381519 TSecr=4014179330 [TCP segment of a reassembled PDU]"
"104","17.782488092","2001:6a8:3081:6f06:6929:a50d:93f0:6a7e","2a01:b740:a41:e80::2:1","TCP","86","33660  >  443 [ACK] Seq=550 Ack=1429 Win=63488 Len=0 TSval=4014179337 TSecr=4121381519"
"105","17.782512886","2001:6a8:3081:6f06:6929:a50d:93f0:6a7e","2a01:b740:a41:e80::2:1","TCP","98","[TCP Dup ACK 104#1] 33660  >  443 [ACK] Seq=550 Ack=1429 Win=63488 Len=0 TSval=4014179337 TSecr=4121381519 SLE=2857 SRE=4097"
"106","17.783354619","2a01:b740:a41:e80::2:1","2001:6a8:3081:6f06:6929:a50d:93f0:6a7e","TCP","1514","[TCP Out-Of-Order] 443  >  33660 [ACK] Seq=1429 Ack=550 Win=64128 Len=1428 TSval=4121381519 TSecr=4014179330 [TCP segment of a reassembled PDU]"
"107","17.783355597","2a01:b740:a41:e80::2:1","2001:6a8:3081:6f06:6929:a50d:93f0:6a7e","TLSv1.2","1316","[TCP Previous segment not captured] , Ignored Unknown Record"
"108","17.783356575","2a01:b740:a41:e80::2:1","2001:6a8:3081:6f06:6929:a50d:93f0:6a7e","TCP","1514","[TCP Out-Of-Order] 443  >  33660 [ACK] Seq=4097 Ack=550 Win=64128 Len=1428 TSval=4121381519 TSecr=4014179330"
"109","17.783368308","2001:6a8:3081:6f06:6929:a50d:93f0:6a7e","2a01:b740:a41:e80::2:1","TCP","86","33660  >  443 [ACK] Seq=550 Ack=4097 Win=61056 Len=0 TSval=4014179338 TSecr=4121381519"
"110","17.783380251","2001:6a8:3081:6f06:6929:a50d:93f0:6a7e","2a01:b740:a41:e80::2:1","TCP","98","[TCP Dup ACK 109#1] 33660  >  443 [ACK] Seq=550 Ack=4097 Win=61056 Len=0 TSval=4014179338 TSecr=4121381519 SLE=5525 SRE=6755"
"111","17.783392474","2001:6a8:3081:6f06:6929:a50d:93f0:6a7e","2a01:b740:a41:e80::2:1","TCP","86","33660  >  443 [ACK] Seq=550 Ack=6755 Win=58496 Len=0 TSval=4014179338 TSecr=4121381519"
"112","17.786514123","2001:6a8:3081:6f06:6929:a50d:93f0:6a7e","2a01:b740:a41:e80::2:1","TLSv1.2","179","Client Key Exchange, Change Cipher Spec, Encrypted Handshake Message"
"113","17.786808226","2001:6a8:3081:6f06:6929:a50d:93f0:6a7e","2a01:b740:a41:e80::2:1","TLSv1.2","4080","Application Data"
"114","17.786931148","2001:6a8:3081:6f06:6929:a50d:93f0:6a7e","2a01:b740:a41:e80::2:1","TLSv1.2","755","Application Data"
"115","17.793435375","2a01:b740:a41:e80::2:1","2001:6a8:3081:6f06:6929:a50d:93f0:6a7e","TCP","86","443  >  33660 [ACK] Seq=6755 Ack=643 Win=64128 Len=0 TSval=4121381530 TSecr=4014179341"
"116","17.793436771","2a01:b740:a41:e80::2:1","2001:6a8:3081:6f06:6929:a50d:93f0:6a7e","TLSv1.2","376","New Session Ticket, Change Cipher Spec, Encrypted Handshake Message"
"117","17.793437749","2a01:b740:a41:e80::2:1","2001:6a8:3081:6f06:6929:a50d:93f0:6a7e","TCP","86","443  >  33660 [ACK] Seq=7045 Ack=2071 Win=64128 Len=0 TSval=4121381530 TSecr=4014179341"
"118","17.793439705","2a01:b740:a41:e80::2:1","2001:6a8:3081:6f06:6929:a50d:93f0:6a7e","TCP","86","443  >  33660 [ACK] Seq=7045 Ack=4637 Win=63616 Len=0 TSval=4121381530 TSecr=4014179341"
"119","17.794180307","2a01:b740:a41:e80::2:1","2001:6a8:3081:6f06:6929:a50d:93f0:6a7e","TCP","86","443  >  33660 [ACK] Seq=7045 Ack=5306 Win=63104 Len=0 TSval=4121381530 TSecr=4014179341"
"120","17.837454354","2001:6a8:3081:6f06:6929:a50d:93f0:6a7e","2a01:b740:a41:e80::2:1","TCP","86","33660  >  443 [ACK] Seq=5306 Ack=7045 Win=64128 Len=0 TSval=4014179392 TSecr=4121381530"
"121","18.465753871","2001:6a8:3081:6f06:6929:a50d:93f0:6a7e","2a01:b740:a41:e80::2:1","TLSv1.2","3059","Application Data"
"122","18.468164879","2001:6a8:3081:6f06:6929:a50d:93f0:6a7e","2a01:b740:a41:e80::2:1","TLSv1.2","264","Application Data, Application Data"
"123","18.474615747","2a01:b740:a41:e80::2:1","2001:6a8:3081:6f06:6929:a50d:93f0:6a7e","TCP","86","443  >  41750 [ACK] Seq=1918 Ack=4513 Win=955 Len=0 TSval=2360713913 TSecr=4014180020"
"124","18.474616725","2a01:b740:a41:e80::2:1","2001:6a8:3081:6f06:6929:a50d:93f0:6a7e","TCP","86","443  >  41750 [ACK] Seq=1918 Ack=6058 Win=945 Len=0 TSval=2360713913 TSecr=4014180020"
"125","18.474617702","2a01:b740:a41:e80::2:1","2001:6a8:3081:6f06:6929:a50d:93f0:6a7e","TCP","86","443  >  41750 [ACK] Seq=1918 Ack=6236 Win=960 Len=0 TSval=2360713913 TSecr=4014180022"
"126","18.474618680","2a01:b740:a41:e80::2:1","2001:6a8:3081:6f06:6929:a50d:93f0:6a7e","TLSv1.2","132","Application Data"
"127","18.474679233","2001:6a8:3081:6f06:6929:a50d:93f0:6a7e","2a01:b740:a41:e80::2:1","TCP","86","41750  >  443 [ACK] Seq=6236 Ack=1964 Win=6453 Len=0 TSval=4014180029 TSecr=2360713913"
"128","18.534392013","2a01:b740:a41:e80::2:1","2001:6a8:3081:6f06:6929:a50d:93f0:6a7e","TCP","2942","443  >  33660 [ACK] Seq=7045 Ack=5306 Win=64128 Len=2856 TSval=4121382271 TSecr=4014179392 [TCP segment of a reassembled PDU]"
"129","18.534440483","2001:6a8:3081:6f06:6929:a50d:93f0:6a7e","2a01:b740:a41:e80::2:1","TCP","86","33660  >  443 [ACK] Seq=5306 Ack=9901 Win=61312 Len=0 TSval=4014180089 TSecr=4121382271"
"130","18.534929795","2a01:b740:a41:e80::2:1","2001:6a8:3081:6f06:6929:a50d:93f0:6a7e","TCP","1233","[TCP Previous segment not captured] 443  >  33660 [PSH, ACK] Seq=11329 Ack=5306 Win=64128 Len=1147 TSval=4121382271 TSecr=4014179392 [TCP segment of a reassembled PDU]"
"131","18.534930772","2a01:b740:a41:e80::2:1","2001:6a8:3081:6f06:6929:a50d:93f0:6a7e","TCP","1514","[TCP Out-Of-Order] 443  >  33660 [PSH, ACK] Seq=9901 Ack=5306 Win=64128 Len=1428 TSval=4121382271 TSecr=4014179392"
"132","18.534949280","2001:6a8:3081:6f06:6929:a50d:93f0:6a7e","2a01:b740:a41:e80::2:1","TCP","98","[TCP Window Update] 33660  >  443 [ACK] Seq=5306 Ack=9901 Win=63104 Len=0 TSval=4014180089 TSecr=4121382271 SLE=11329 SRE=12476"
"133","18.534974214","2001:6a8:3081:6f06:6929:a50d:93f0:6a7e","2a01:b740:a41:e80::2:1","TCP","86","33660  >  443 [ACK] Seq=5306 Ack=12476 Win=61056 Len=0 TSval=4014180089 TSecr=4121382271"
"134","18.569963208","2001:6a8:3081:6f06:6929:a50d:93f0:6a7e","2a01:b740:a41:e80::2:1","TLSv1.2","3051","Application Data"
"135","18.571183763","2001:6a8:3081:6f06:6929:a50d:93f0:6a7e","2a01:b740:a41:e80::2:1","TLSv1.2","215","Application Data"
"136","18.577579944","2a01:b740:a41:e80::2:1","2001:6a8:3081:6f06:6929:a50d:93f0:6a7e","TCP","86","443  >  41750 [ACK] Seq=1964 Ack=9201 Win=945 Len=0 TSval=2360714016 TSecr=4014180124"
"137","18.577580852","2a01:b740:a41:e80::2:1","2001:6a8:3081:6f06:6929:a50d:93f0:6a7e","TCP","86","443  >  41750 [ACK] Seq=1964 Ack=9330 Win=960 Len=0 TSval=2360714016 TSecr=4014180125"
"138","18.725123461","2001:6a8:3081:6f06:6929:a50d:93f0:6a7e","2a01:b740:a41:e80::2:1","TLSv1.2","3052","Application Data"
"139","18.728254958","2001:6a8:3081:6f06:6929:a50d:93f0:6a7e","2a01:b740:a41:e80::2:1","TLSv1.2","152","Application Data"
"140","18.734243193","2a01:b740:a41:e80::2:1","2001:6a8:3081:6f06:6929:a50d:93f0:6a7e","TCP","86","443  >  41750 [ACK] Seq=1964 Ack=10758 Win=955 Len=0 TSval=2360714172 TSecr=4014180279"
"141","18.734244590","2a01:b740:a41:e80::2:1","2001:6a8:3081:6f06:6929:a50d:93f0:6a7e","TCP","86","443  >  41750 [ACK] Seq=1964 Ack=12186 Win=947 Len=0 TSval=2360714172 TSecr=4014180279"
"142","18.734245498","2a01:b740:a41:e80::2:1","2001:6a8:3081:6f06:6929:a50d:93f0:6a7e","TCP","86","443  >  41750 [ACK] Seq=1964 Ack=12296 Win=960 Len=0 TSval=2360714173 TSecr=4014180279"
"143","18.735142337","2a01:b740:a41:e80::2:1","2001:6a8:3081:6f06:6929:a50d:93f0:6a7e","TCP","86","443  >  41750 [ACK] Seq=1964 Ack=12362 Win=960 Len=0 TSval=2360714173 TSecr=4014180283"
"144","19.109418583","2a01:b740:a41:e80::2:1","2001:6a8:3081:6f06:6929:a50d:93f0:6a7e","TLSv1.2","1324","Application Data"
"145","19.109489752","2001:6a8:3081:6f06:6929:a50d:93f0:6a7e","2a01:b740:a41:e80::2:1","TCP","86","41750  >  443 [ACK] Seq=12362 Ack=3202 Win=6472 Len=0 TSval=4014180664 TSecr=2360714501"
"146","19.110919343","2a01:b740:a41:e80::2:1","2001:6a8:3081:6f06:6929:a50d:93f0:6a7e","TLSv1.2","1255","Application Data"
"147","19.110936943","2001:6a8:3081:6f06:6929:a50d:93f0:6a7e","2a01:b740:a41:e80::2:1","TCP","86","41750  >  443 [ACK] Seq=12362 Ack=4371 Win=6492 Len=0 TSval=4014180665 TSecr=2360714549"
"148","19.114841868","2001:6a8:3081:6f06:6929:a50d:93f0:6a7e","2a01:b740:a41:e80::2:1","TLSv1.2","128","Application Data"
"149","19.121311034","2a01:b740:a41:e80::2:1","2001:6a8:3081:6f06:6929:a50d:93f0:6a7e","TCP","86","443  >  41750 [ACK] Seq=4371 Ack=12404 Win=960 Len=0 TSval=2360714560 TSecr=4014180669"
"150","19.121458819","2001:6a8:3081:6f06:6929:a50d:93f0:6a7e","2a01:b740:a41:e80::2:5","TLSv1.2","4121","Application Data"
"151","19.122070214","2001:6a8:3081:6f06:6929:a50d:93f0:6a7e","2a01:b740:a41:e80::2:5","TLSv1.2","169","Application Data"
"152","19.128139746","2a01:b740:a41:e80::2:5","2001:6a8:3081:6f06:6929:a50d:93f0:6a7e","TCP","86","443  >  40566 [ACK] Seq=2920 Ack=10062 Win=501 Len=0 TSval=733338 TSecr=69456778"
"153","19.128140724","2a01:b740:a41:e80::2:5","2001:6a8:3081:6f06:6929:a50d:93f0:6a7e","TCP","86","443  >  40566 [ACK] Seq=2920 Ack=11490 Win=496 Len=0 TSval=733338 TSecr=69456778"
"154","19.128141632","2a01:b740:a41:e80::2:5","2001:6a8:3081:6f06:6929:a50d:93f0:6a7e","TCP","86","443  >  40566 [ACK] Seq=2920 Ack=12669 Win=501 Len=0 TSval=733338 TSecr=69456778"
"155","19.128690588","2a01:b740:a41:e80::2:5","2001:6a8:3081:6f06:6929:a50d:93f0:6a7e","TCP","86","443  >  40566 [ACK] Seq=2920 Ack=12752 Win=501 Len=0 TSval=733339 TSecr=69456778"
"156","19.134632658","2001:6a8:3081:6f06:6929:a50d:93f0:6a7e","2a01:b740:a41:e80::2:1","TLSv1.2","4080","Application Data"
"157","19.135256625","2001:6a8:3081:6f06:6929:a50d:93f0:6a7e","2a01:b740:a41:e80::2:1","TLSv1.2","226","Application Data"
"158","19.141892783","2a01:b740:a41:e80::2:1","2001:6a8:3081:6f06:6929:a50d:93f0:6a7e","TCP","86","443  >  33660 [ACK] Seq=12476 Ack=6734 Win=64128 Len=0 TSval=4121382878 TSecr=4014180689"
"159","19.141894180","2a01:b740:a41:e80::2:1","2001:6a8:3081:6f06:6929:a50d:93f0:6a7e","TCP","86","443  >  33660 [ACK] Seq=12476 Ack=9300 Win=63616 Len=0 TSval=4121382878 TSecr=4014180689"
"160","19.141895157","2a01:b740:a41:e80::2:1","2001:6a8:3081:6f06:6929:a50d:93f0:6a7e","TCP","86","443  >  33660 [ACK] Seq=12476 Ack=9440 Win=64128 Len=0 TSval=4121382878 TSecr=4014180690"
"161","19.142567105","2001:6a8:3081:6f06:6929:a50d:93f0:6a7e","2a01:b740:a41:e80::2:1","TLSv1.2","3054","Application Data"
"162","19.143137503","2001:6a8:3081:6f06:6929:a50d:93f0:6a7e","2a01:b740:a41:e80::2:1","TLSv1.2","185","Application Data"
"163","19.149128882","2a01:b740:a41:e80::2:1","2001:6a8:3081:6f06:6929:a50d:93f0:6a7e","TCP","86","443  >  41750 [ACK] Seq=4371 Ack=13832 Win=955 Len=0 TSval=2360714588 TSecr=4014180697"
"164","19.149129859","2a01:b740:a41:e80::2:1","2001:6a8:3081:6f06:6929:a50d:93f0:6a7e","TCP","86","443  >  41750 [ACK] Seq=4371 Ack=15260 Win=955 Len=0 TSval=2360714588 TSecr=4014180697"
"165","19.149130837","2a01:b740:a41:e80::2:1","2001:6a8:3081:6f06:6929:a50d:93f0:6a7e","TCP","86","443  >  41750 [ACK] Seq=4371 Ack=15372 Win=960 Len=0 TSval=2360714588 TSecr=4014180697"
"166","19.149721559","2a01:b740:a41:e80::2:1","2001:6a8:3081:6f06:6929:a50d:93f0:6a7e","TCP","86","443  >  41750 [ACK] Seq=4371 Ack=15471 Win=960 Len=0 TSval=2360714588 TSecr=4014180697"
"167","19.422677754","2a01:b740:a41:e80::2:1","2001:6a8:3081:6f06:6929:a50d:93f0:6a7e","TCP","4370","443  >  33660 [PSH, ACK] Seq=12476 Ack=9440 Win=64128 Len=4284 TSval=4121383130 TSecr=4014180690 [TCP segment of a reassembled PDU]"
"168","19.422679220","2a01:b740:a41:e80::2:1","2001:6a8:3081:6f06:6929:a50d:93f0:6a7e","TLSv1.2","1228","Application Data"
"169","19.422680617","2a01:b740:a41:e80::2:1","2001:6a8:3081:6f06:6929:a50d:93f0:6a7e","TCP","1228","[TCP Retransmission] 443  >  33660 [PSH, ACK] Seq=16760 Ack=9440 Win=64128 Len=1142 TSval=4121383156 TSecr=4014180690"
"170","19.422745500","2001:6a8:3081:6f06:6929:a50d:93f0:6a7e","2a01:b740:a41:e80::2:1","TCP","86","33660  >  443 [ACK] Seq=9440 Ack=16760 Win=59904 Len=0 TSval=4014180977 TSecr=4121383130"
"171","19.422792783","2001:6a8:3081:6f06:6929:a50d:93f0:6a7e","2a01:b740:a41:e80::2:1","TCP","86","33660  >  443 [ACK] Seq=9440 Ack=17902 Win=58880 Len=0 TSval=4014180977 TSecr=4121383130"
"172","19.422809405","2001:6a8:3081:6f06:6929:a50d:93f0:6a7e","2a01:b740:a41:e80::2:1","TCP","98","[TCP Dup ACK 171#1] 33660  >  443 [ACK] Seq=9440 Ack=17902 Win=58880 Len=0 TSval=4014180977 TSecr=4121383156 SLE=16760 SRE=17902"
"173","19.469458207","2a01:b740:a41:e80::2:1","2001:6a8:3081:6f06:6929:a50d:93f0:6a7e","TLSv1.2","1137","Application Data"
"174","19.483632879","2a01:b740:a41:e80::2:5","2001:6a8:3081:6f06:6929:a50d:93f0:6a7e","TLSv1.2","698","[TCP Previous segment not captured] , Ignored Unknown Record"
"175","19.483633857","2a01:b740:a41:e80::2:5","2001:6a8:3081:6f06:6929:a50d:93f0:6a7e","TCP","1514","[TCP Out-Of-Order] 443  >  40566 [ACK] Seq=2920 Ack=12752 Win=501 Len=1428 TSval=733694 TSecr=69456778"
"176","19.483658651","2001:6a8:3081:6f06:6929:a50d:93f0:6a7e","2a01:b740:a41:e80::2:5","TCP","98","[TCP Dup ACK 92#1] 40566  >  443 [ACK] Seq=12752 Ack=2920 Win=501 Len=0 TSval=69457140 TSecr=733339 SLE=4348 SRE=4960"
"177","19.483681140","2001:6a8:3081:6f06:6929:a50d:93f0:6a7e","2a01:b740:a41:e80::2:5","TCP","86","40566  >  443 [ACK] Seq=12752 Ack=4960 Win=486 Len=0 TSval=69457140 TSecr=733694"
"178","19.513238746","2001:6a8:3081:6f06:6929:a50d:93f0:6a7e","2a01:b740:a41:e80::2:1","TCP","86","41750  >  443 [ACK] Seq=15471 Ack=5422 Win=6511 Len=0 TSval=4014181068 TSecr=2360714908"
"179","20.049262375","2a01:b740:a41:e80::2:1","2001:6a8:3081:6f06:6929:a50d:93f0:6a7e","TLSv1.2","969","Application Data"
"180","20.049305607","2001:6a8:3081:6f06:6929:a50d:93f0:6a7e","2a01:b740:a41:e80::2:1","TCP","86","41750  >  443 [ACK] Seq=15471 Ack=6305 Win=6511 Len=0 TSval=4014181604 TSecr=2360715426"
"181","21.185469728","2001:6a8:3081:6f06:6929:a50d:93f0:6a7e","2a01:b740:984:100::1:3","TCP","86","58872  >  443 [ACK] Seq=1 Ack=1 Win=501 Len=0 TSval=14776960 TSecr=218371403"
"182","21.199499409","2a01:b740:984:100::1:3","2001:6a8:3081:6f06:6929:a50d:93f0:6a7e","TCP","86","[TCP ACKed unseen segment] 443  >  58872 [ACK] Seq=1 Ack=2 Win=501 Len=0 TSval=218416419 TSecr=14731957"
"183","21.819024910","2001:6a8:3081:6f06:6929:a50d:93f0:6a7e","2a01:b740:a41:e80::2:2","TLSv1.2","3034","Application Data"
"184","21.819182543","2001:6a8:3081:6f06:6929:a50d:93f0:6a7e","2a01:b740:a41:e80::2:2","TCP","7226","43038  >  443 [PSH, ACK] Seq=16355 Ack=1295 Win=2326 Len=7140 TSval=2862059723 TSecr=1363856648 [TCP segment of a reassembled PDU]"
"185","21.819217185","2001:6a8:3081:6f06:6929:a50d:93f0:6a7e","2a01:b740:a41:e80::2:2","TLSv1.2","1773","Application Data"
"186","21.829393484","2a01:b740:a41:e80::2:2","2001:6a8:3081:6f06:6929:a50d:93f0:6a7e","TCP","86","443  >  43038 [ACK] Seq=1295 Ack=14835 Win=2643 Len=0 TSval=1363864371 TSecr=2862059723"
"187","21.829394880","2a01:b740:a41:e80::2:2","2001:6a8:3081:6f06:6929:a50d:93f0:6a7e","TCP","86","443  >  43038 [ACK] Seq=1295 Ack=16355 Win=2632 Len=0 TSval=1363864371 TSecr=2862059723"
"188","21.829396347","2a01:b740:a41:e80::2:2","2001:6a8:3081:6f06:6929:a50d:93f0:6a7e","TCP","86","443  >  43038 [ACK] Seq=1295 Ack=17783 Win=2643 Len=0 TSval=1363864372 TSecr=2862059723"
"189","21.829397325","2a01:b740:a41:e80::2:2","2001:6a8:3081:6f06:6929:a50d:93f0:6a7e","TCP","86","443  >  43038 [ACK] Seq=1295 Ack=19211 Win=2635 Len=0 TSval=1363864372 TSecr=2862059723"
"190","21.829398722","2a01:b740:a41:e80::2:2","2001:6a8:3081:6f06:6929:a50d:93f0:6a7e","TCP","86","443  >  43038 [ACK] Seq=1295 Ack=20639 Win=2643 Len=0 TSval=1363864372 TSecr=2862059723"
"191","21.829399630","2a01:b740:a41:e80::2:2","2001:6a8:3081:6f06:6929:a50d:93f0:6a7e","TCP","86","443  >  43038 [ACK] Seq=1295 Ack=22067 Win=2643 Len=0 TSval=1363864372 TSecr=2862059723"
"192","21.829400607","2a01:b740:a41:e80::2:2","2001:6a8:3081:6f06:6929:a50d:93f0:6a7e","TCP","86","443  >  43038 [ACK] Seq=1295 Ack=23495 Win=2643 Len=0 TSval=1363864372 TSecr=2862059723"
"193","21.829402004","2a01:b740:a41:e80::2:2","2001:6a8:3081:6f06:6929:a50d:93f0:6a7e","TCP","86","443  >  43038 [ACK] Seq=1295 Ack=25182 Win=2640 Len=0 TSval=1363864372 TSecr=2862059723"
"194","22.138384413","2a01:b740:a41:e80::2:2","2001:6a8:3081:6f06:6929:a50d:93f0:6a7e","TLSv1.2","717","Application Data"
"195","22.140658182","2001:6a8:3081:6f06:6929:a50d:93f0:6a7e","2a01:b740:a41:e80::2:2","TLSv1.2","121","Application Data"
"196","22.147392817","2a01:b740:a41:e80::2:2","2001:6a8:3081:6f06:6929:a50d:93f0:6a7e","TCP","86","443  >  43038 [ACK] Seq=1926 Ack=25217 Win=2647 Len=0 TSval=1363864690 TSecr=2862060045"
"197","23.009448703","IntelCor_85:a6:01","IETF-VRRP-VRID_ff","ARP","42","Who has 192.168.167.254? Tell 192.168.166.19"
"198","23.012570073","IETF-VRRP-VRID_ff","IntelCor_85:a6:01","ARP","60","192.168.167.254 is at 00:00:5e:00:01:ff"
"199","27.466030842","2a01:b740:a41:e80::2:4","2001:6a8:3081:6f06:6929:a50d:93f0:6a7e","TLSv1.2","117","[TCP ACKed unseen segment] , Encrypted Alert"
"200","27.466032239","2a01:b740:a41:e80::2:4","2001:6a8:3081:6f06:6929:a50d:93f0:6a7e","TCP","86","[TCP ACKed unseen segment] 443  >  46320 [FIN, ACK] Seq=32 Ack=2 Win=501 Len=0 TSval=1421575256 TSecr=842926235"
"201","27.466092373","2001:6a8:3081:6f06:6929:a50d:93f0:6a7e","2a01:b740:a41:e80::2:4","TCP","86","[TCP Previous segment not captured] 46320  >  443 [ACK] Seq=2 Ack=32 Win=501 Len=0 TSval=842986189 TSecr=1421575256"
"202","27.468802933","2a01:b740:a41:e80::2:4","2001:6a8:3081:6f06:6929:a50d:93f0:6a7e","TCP","86","[TCP ACKed unseen segment] [TCP Out-Of-Order] 443  >  46320 [FIN, ACK] Seq=32 Ack=2 Win=501 Len=0 TSval=1421575304 TSecr=842926235"
"203","27.468857270","2001:6a8:3081:6f06:6929:a50d:93f0:6a7e","2a01:b740:a41:e80::2:4","TCP","98","46320  >  443 [ACK] Seq=2 Ack=33 Win=501 Len=0 TSval=842986192 TSecr=1421575304 SLE=32 SRE=33"
"204","28.228462855","2001:6a8:3081:6f06:6929:a50d:93f0:6a7e","2a01:b740:a41:e80::2:4","TCP","86","46320  >  443 [RST, ACK] Seq=2 Ack=33 Win=501 Len=0 TSval=842986952 TSecr=1421575304"
"205","28.228762406","2001:6a8:3081:6f06:6929:a50d:93f0:6a7e","2a01:b740:a41:e80::2:5","TLSv1.2","5108","Application Data"
"206","28.236861261","2a01:b740:a41:e80::2:5","2001:6a8:3081:6f06:6929:a50d:93f0:6a7e","TCP","86","443  >  40566 [ACK] Seq=4960 Ack=14180 Win=501 Len=0 TSval=742447 TSecr=69465885"
"207","28.237684905","2a01:b740:a41:e80::2:5","2001:6a8:3081:6f06:6929:a50d:93f0:6a7e","TCP","86","443  >  40566 [ACK] Seq=4960 Ack=17036 Win=496 Len=0 TSval=742448 TSecr=69465885"
"208","28.237685883","2a01:b740:a41:e80::2:5","2001:6a8:3081:6f06:6929:a50d:93f0:6a7e","TCP","86","443  >  40566 [ACK] Seq=4960 Ack=17774 Win=492 Len=0 TSval=742448 TSecr=69465885"
"209","28.509667295","2a01:b740:a41:e80::2:5","2001:6a8:3081:6f06:6929:a50d:93f0:6a7e","TLSv1.2","1260","Application Data"
"210","28.514844668","2001:6a8:3081:6f06:6929:a50d:93f0:6a7e","2a01:b740:a41:e80::2:5","TLSv1.2","3998","Application Data"
"211","28.522033064","2a01:b740:a41:e80::2:5","2001:6a8:3081:6f06:6929:a50d:93f0:6a7e","TCP","86","443  >  40566 [ACK] Seq=6134 Ack=19202 Win=501 Len=0 TSval=742732 TSecr=69466171"
"212","28.522034042","2a01:b740:a41:e80::2:5","2001:6a8:3081:6f06:6929:a50d:93f0:6a7e","TCP","86","443  >  40566 [ACK] Seq=6134 Ack=20630 Win=501 Len=0 TSval=742732 TSecr=69466171"
"213","28.522035020","2a01:b740:a41:e80::2:5","2001:6a8:3081:6f06:6929:a50d:93f0:6a7e","TCP","86","443  >  40566 [ACK] Seq=6134 Ack=21686 Win=501 Len=0 TSval=742732 TSecr=69466171"
"214","28.822638229","2a01:b740:a41:e80::2:5","2001:6a8:3081:6f06:6929:a50d:93f0:6a7e","TLSv1.2","2417","Application Data"
"215","28.822680483","2001:6a8:3081:6f06:6929:a50d:93f0:6a7e","2a01:b740:a41:e80::2:5","TCP","86","40566  >  443 [ACK] Seq=21686 Ack=8465 Win=538 Len=0 TSval=69466479 TSecr=743022"
"216","29.818649492","2001:6a8:3081:6f06:6929:a50d:93f0:6a7e","2a01:b740:a41:e80::2:2","TLSv1.2","3033","Application Data"
"217","29.821796563","2001:6a8:3081:6f06:6929:a50d:93f0:6a7e","2a01:b740:a41:e80::2:2","TLSv1.2","2398","Application Data"
"218","29.828079322","2a01:b740:a41:e80::2:2","2001:6a8:3081:6f06:6929:a50d:93f0:6a7e","TCP","86","443  >  43038 [ACK] Seq=1926 Ack=26645 Win=2643 Len=0 TSval=1363872371 TSecr=2862067723"
"219","29.828080718","2a01:b740:a41:e80::2:2","2001:6a8:3081:6f06:6929:a50d:93f0:6a7e","TCP","86","443  >  43038 [ACK] Seq=1926 Ack=28073 Win=2635 Len=0 TSval=1363872371 TSecr=2862067723"
"220","29.828081696","2a01:b740:a41:e80::2:2","2001:6a8:3081:6f06:6929:a50d:93f0:6a7e","TCP","86","443  >  43038 [ACK] Seq=1926 Ack=28164 Win=2647 Len=0 TSval=1363872371 TSecr=2862067723"
"221","29.829489777","2a01:b740:a41:e80::2:2","2001:6a8:3081:6f06:6929:a50d:93f0:6a7e","TCP","86","443  >  43038 [ACK] Seq=1926 Ack=29592 Win=2643 Len=0 TSval=1363872372 TSecr=2862067726"
"222","29.829490685","2a01:b740:a41:e80::2:2","2001:6a8:3081:6f06:6929:a50d:93f0:6a7e","TCP","86","443  >  43038 [ACK] Seq=1926 Ack=30476 Win=2645 Len=0 TSval=1363872372 TSecr=2862067726"
"223","30.010630480","2001:6a8:3081:6f06:6929:a50d:93f0:6a7e","2a01:b740:a41:e80::2:1","TLSv1.2","3060","Application Data"
"224","30.013856961","2001:6a8:3081:6f06:6929:a50d:93f0:6a7e","2a01:b740:a41:e80::2:1","TLSv1.2","195","Application Data"
"225","30.013931343","2a01:b740:a41:e80::2:2","2001:6a8:3081:6f06:6929:a50d:93f0:6a7e","TLSv1.2","706","Application Data"
"226","30.013932321","2a01:b740:a41:e80::2:2","2001:6a8:3081:6f06:6929:a50d:93f0:6a7e","TLSv1.2","117","Application Data"
"227","30.013976251","2001:6a8:3081:6f06:6929:a50d:93f0:6a7e","2a01:b740:a41:e80::2:2","TCP","86","43038  >  443 [ACK] Seq=30476 Ack=2577 Win=2346 Len=0 TSval=2862067918 TSecr=1363872519"
"228","30.016162928","2001:6a8:3081:6f06:6929:a50d:93f0:6a7e","2a01:b740:a41:e80::2:2","TLSv1.2","121","Application Data"
"229","30.020638460","2a01:b740:a41:e80::2:1","2001:6a8:3081:6f06:6929:a50d:93f0:6a7e","TCP","86","443  >  41750 [ACK] Seq=6305 Ack=16899 Win=955 Len=0 TSval=2360725458 TSecr=4014191565"
"230","30.020639368","2a01:b740:a41:e80::2:1","2001:6a8:3081:6f06:6929:a50d:93f0:6a7e","TCP","86","443  >  41750 [ACK] Seq=6305 Ack=18445 Win=945 Len=0 TSval=2360725458 TSecr=4014191565"
"231","30.020640835","2a01:b740:a41:e80::2:1","2001:6a8:3081:6f06:6929:a50d:93f0:6a7e","TCP","86","443  >  41750 [ACK] Seq=6305 Ack=18554 Win=960 Len=0 TSval=2360725459 TSecr=4014191568"
"232","30.022767587","2a01:b740:a41:e80::2:2","2001:6a8:3081:6f06:6929:a50d:93f0:6a7e","TCP","86","443  >  43038 [ACK] Seq=2577 Ack=30511 Win=2647 Len=0 TSval=1363872566 TSecr=2862067920"
