"No.","Time","Source","Destination","Protocol","Length","Info"
"1","0.000000000","2a01:b740:a41:e80::2:1","2001:6a8:3081:6f06:6929:a50d:93f0:6a7e","TLSv1.2","1163","Application Data"
"2","0.000062509","2001:6a8:3081:6f06:6929:a50d:93f0:6a7e","2a01:b740:a41:e80::2:1","TCP","86","41750  >  443 [ACK] Seq=1 Ack=1078 Win=6890 Len=0 TSval=4014363656 TSecr=2360897489"
"3","0.002406679","2001:6a8:3081:6f06:6929:a50d:93f0:6a7e","2a01:b740:a41:e80::2:1","TLSv1.2","128","Application Data"
"4","0.009354890","2a01:b740:a41:e80::2:1","2001:6a8:3081:6f06:6929:a50d:93f0:6a7e","TCP","86","443  >  41750 [ACK] Seq=1078 Ack=43 Win=960 Len=0 TSval=2360897550 TSecr=4014363658"
"5","1.132015797","IntelCor_85:a6:01","IETF-VRRP-VRID_ff","ARP","42","Who has 192.168.167.254? Tell 192.168.166.19"
"6","1.134453975","Fortinet_93:32:4a","IntelCor_85:a6:01","ARP","60","Who has 192.168.166.19? Tell 192.168.167.253"
"7","1.134484495","IntelCor_85:a6:01","Fortinet_93:32:4a","ARP","42","192.168.166.19 is at c0:3c:59:85:a6:01"
"8","1.135329232","IETF-VRRP-VRID_ff","IntelCor_85:a6:01","ARP","60","192.168.167.254 is at 00:00:5e:00:01:ff"
"9","3.179784158","2001:6a8:3081:6f06:6929:a50d:93f0:6a7e","2a01:b740:a41:e80::2:6","TCP","86","39480  >  443 [ACK] Seq=1 Ack=1 Win=501 Len=0 TSval=2262737645 TSecr=4106774647"
"10","3.179845898","2001:6a8:3081:6f06:6929:a50d:93f0:6a7e","2a01:b740:a41:e80::2:5","TCP","86","36866  >  443 [ACK] Seq=1 Ack=1 Win=501 Len=0 TSval=69642938 TSecr=479868061"
"11","3.188430782","2a01:b740:a41:e80::2:6","2001:6a8:3081:6f06:6929:a50d:93f0:6a7e","TCP","86","[TCP ACKed unseen segment] 443  >  39480 [ACK] Seq=1 Ack=2 Win=501 Len=0 TSval=4106820623 TSecr=2262691746"
"12","3.188430782","2a01:b740:a41:e80::2:5","2001:6a8:3081:6f06:6929:a50d:93f0:6a7e","TCP","86","[TCP ACKed unseen segment] 443  >  36866 [ACK] Seq=1 Ack=2 Win=501 Len=0 TSval=479914404 TSecr=69596621"
"13","3.715888803","2001:6a8:3081:6f06:6929:a50d:93f0:6a7e","2a01:b740:a41:e80::2:2","TLSv1.2","3037","Application Data"
"14","3.718523445","2001:6a8:3081:6f06:6929:a50d:93f0:6a7e","2a01:b740:a41:e80::2:2","TLSv1.2","1369","Application Data, Application Data"
"15","3.725318982","2a01:b740:a41:e80::2:2","2001:6a8:3081:6f06:6929:a50d:93f0:6a7e","TCP","86","443  >  43038 [ACK] Seq=1 Ack=1429 Win=2643 Len=0 TSval=1364048369 TSecr=2862243722"
"16","3.725319959","2a01:b740:a41:e80::2:2","2001:6a8:3081:6f06:6929:a50d:93f0:6a7e","TCP","86","443  >  43038 [ACK] Seq=1 Ack=2952 Win=2641 Len=0 TSval=1364048369 TSecr=2862243722"
"17","3.725321426","2a01:b740:a41:e80::2:2","2001:6a8:3081:6f06:6929:a50d:93f0:6a7e","TCP","86","443  >  43038 [ACK] Seq=1 Ack=4235 Win=2643 Len=0 TSval=1364048370 TSecr=2862243724"
"18","3.725322334","2a01:b740:a41:e80::2:2","2001:6a8:3081:6f06:6929:a50d:93f0:6a7e","TLSv1.2","125","Application Data"
"19","3.768051475","2001:6a8:3081:6f06:6929:a50d:93f0:6a7e","2a01:b740:a41:e80::2:2","TCP","86","43038  >  443 [ACK] Seq=4235 Ack=40 Win=2513 Len=0 TSval=2862243774 TSecr=1364048370"
"20","4.073543470","2a01:b740:a41:e80::2:2","2001:6a8:3081:6f06:6929:a50d:93f0:6a7e","TLSv1.2","676","Application Data"
"21","4.073578321","2001:6a8:3081:6f06:6929:a50d:93f0:6a7e","2a01:b740:a41:e80::2:2","TCP","86","43038  >  443 [ACK] Seq=4235 Ack=630 Win=2523 Len=0 TSval=2862244079 TSecr=1364048672"
"22","4.075016922","2001:6a8:3081:6f06:6929:a50d:93f0:6a7e","2a01:b740:a41:e80::2:2","TLSv1.2","121","Application Data"
"23","4.081483783","2a01:b740:a41:e80::2:2","2001:6a8:3081:6f06:6929:a50d:93f0:6a7e","TCP","86","443  >  43038 [ACK] Seq=630 Ack=4270 Win=2647 Len=0 TSval=1364048727 TSecr=2862244081"
"24","5.383081536","2001:6a8:3081:6f06:6929:a50d:93f0:6a7e","2a01:b740:a41:e80::2:1","TLSv1.2","3053","Application Data"
"25","5.385516012","2001:6a8:3081:6f06:6929:a50d:93f0:6a7e","2a01:b740:a41:e80::2:1","TLSv1.2","696","Application Data"
"26","5.392221732","2a01:b740:a41:e80::2:1","2001:6a8:3081:6f06:6929:a50d:93f0:6a7e","TCP","86","443  >  41750 [ACK] Seq=1078 Ack=1471 Win=955 Len=0 TSval=2360902932 TSecr=4014369039"
"27","5.392222640","2a01:b740:a41:e80::2:1","2001:6a8:3081:6f06:6929:a50d:93f0:6a7e","TCP","86","443  >  41750 [ACK] Seq=1078 Ack=3010 Win=945 Len=0 TSval=2360902932 TSecr=4014369039"
"28","5.392223548","2a01:b740:a41:e80::2:1","2001:6a8:3081:6f06:6929:a50d:93f0:6a7e","TCP","86","443  >  41750 [ACK] Seq=1078 Ack=3620 Win=958 Len=0 TSval=2360902932 TSecr=4014369041"
"29","6.093806385","192.168.166.19","130.104.1.1","DNS","100","Standard query 0xda9d AAAA connectivity-check.ubuntu.com OPT"
"30","6.097805666","130.104.1.1","192.168.166.19","DNS","436","Standard query response 0xda9d AAAA connectivity-check.ubuntu.com AAAA 2001:67c:1562::23 AAAA 2620:2d:4002:1::198 AAAA 2620:2d:4000:1::22 AAAA 2620:2d:4000:1::96 AAAA 2620:2d:4000:1::98 AAAA 2620:2d:4000:1::97 AAAA 2620:2d:4000:1::23 AAAA 2620:2d:4000:1::2b AAAA 2620:2d:4000:1::2a AAAA 2620:2d:4002:1::196 AAAA 2620:2d:4002:1::197 AAAA 2001:67c:1562::24 OPT"
"31","6.099444713","2001:6a8:3081:6f06:6929:a50d:93f0:6a7e","2001:67c:1562::23","TCP","94","34136  >  80 [SYN] Seq=0 Win=64800 Len=0 MSS=1440 SACK_PERM=1 TSval=3389328687 TSecr=0 WS=128"
"32","6.154555198","2a01:b740:a41:e80::2:1","2001:6a8:3081:6f06:6929:a50d:93f0:6a7e","TLSv1.2","328","[TCP Previous segment not captured] , Ignored Unknown Record"
"33","6.154556594","2a01:b740:a41:e80::2:1","2001:6a8:3081:6f06:6929:a50d:93f0:6a7e","TCP","1514","[TCP Out-Of-Order] 443  >  41750 [ACK] Seq=1078 Ack=3620 Win=960 Len=1428 TSval=2360903694 TSecr=4014369041"
"34","6.154616449","2001:6a8:3081:6f06:6929:a50d:93f0:6a7e","2a01:b740:a41:e80::2:1","TCP","98","[TCP Dup ACK 2#1] 41750  >  443 [ACK] Seq=3620 Ack=1078 Win=6890 Len=0 TSval=4014369810 TSecr=2360902932 SLE=2506 SRE=2748"
"35","6.154680424","2001:6a8:3081:6f06:6929:a50d:93f0:6a7e","2a01:b740:a41:e80::2:1","TCP","86","41750  >  443 [ACK] Seq=3620 Ack=2748 Win=6912 Len=0 TSval=4014369810 TSecr=2360903694"
"36","6.157858435","2001:6a8:3081:6f06:6929:a50d:93f0:6a7e","2a01:b740:a41:e80::2:1","TLSv1.2","128","Application Data"
"37","6.164378446","2a01:b740:a41:e80::2:1","2001:6a8:3081:6f06:6929:a50d:93f0:6a7e","TCP","86","443  >  41750 [ACK] Seq=2748 Ack=3662 Win=960 Len=0 TSval=2360903705 TSecr=4014369814"
"38","6.171629421","2001:6a8:3081:6f06:6929:a50d:93f0:6a7e","2a01:b740:a41:e80::2:5","TCP","86","40566  >  443 [RST, ACK] Seq=1 Ack=1 Win=1166 Len=0 TSval=69645929 TSecr=912665"
"39","6.171899569","2001:6a8:3081:6f06:6929:a50d:93f0:6a7e","2a01:b740:a41:e80::2:6","TLSv1.2","3956","[TCP Previous segment not captured] , Application Data"
"40","6.178835628","2a01:b740:a41:e80::2:6","2001:6a8:3081:6f06:6929:a50d:93f0:6a7e","TCP","86","[TCP ACKed unseen segment] 443  >  39480 [ACK] Seq=1 Ack=1430 Win=501 Len=0 TSval=4106823614 TSecr=2262740637"
"41","6.178836606","2a01:b740:a41:e80::2:6","2001:6a8:3081:6f06:6929:a50d:93f0:6a7e","TCP","86","443  >  39480 [ACK] Seq=1 Ack=3872 Win=498 Len=0 TSval=4106823614 TSecr=2262740637"
"42","6.179381162","2001:67c:1562::23","2001:6a8:3081:6f06:6929:a50d:93f0:6a7e","TCP","94","80  >  34136 [SYN, ACK] Seq=0 Ack=1 Win=64260 Len=0 MSS=1440 SACK_PERM=1 TSval=2264657663 TSecr=3389328687 WS=128"
"43","6.179415385","2001:6a8:3081:6f06:6929:a50d:93f0:6a7e","2001:67c:1562::23","TCP","86","34136  >  80 [ACK] Seq=1 Ack=1 Win=64896 Len=0 TSval=3389328767 TSecr=2264657663"
"44","6.179574903","2001:6a8:3081:6f06:6929:a50d:93f0:6a7e","2001:67c:1562::23","HTTP","173","GET / HTTP/1.1 "
"45","6.185109656","2001:6a8:3081:6f06:6929:a50d:93f0:6a7e","2a01:b740:a41:e80::2:2","TLSv1.2","3033","Application Data"
"46","6.185740956","2001:6a8:3081:6f06:6929:a50d:93f0:6a7e","2a01:b740:a41:e80::2:2","TLSv1.2","4298","Application Data"
"47","6.193419433","2a01:b740:a41:e80::2:2","2001:6a8:3081:6f06:6929:a50d:93f0:6a7e","TCP","86","443  >  43038 [ACK] Seq=630 Ack=5698 Win=2643 Len=0 TSval=1364050837 TSecr=2862246191"
"48","6.193420900","2a01:b740:a41:e80::2:2","2001:6a8:3081:6f06:6929:a50d:93f0:6a7e","TCP","86","443  >  43038 [ACK] Seq=630 Ack=7217 Win=2641 Len=0 TSval=1364050837 TSecr=2862246191"
"49","6.193421808","2a01:b740:a41:e80::2:2","2001:6a8:3081:6f06:6929:a50d:93f0:6a7e","TCP","86","443  >  43038 [ACK] Seq=630 Ack=8645 Win=2643 Len=0 TSval=1364050838 TSecr=2862246192"
"50","6.193422785","2a01:b740:a41:e80::2:2","2001:6a8:3081:6f06:6929:a50d:93f0:6a7e","TCP","86","443  >  43038 [ACK] Seq=630 Ack=10073 Win=2643 Len=0 TSval=1364050838 TSecr=2862246192"
"51","6.193423763","2a01:b740:a41:e80::2:2","2001:6a8:3081:6f06:6929:a50d:93f0:6a7e","TCP","86","443  >  43038 [ACK] Seq=630 Ack=11429 Win=2643 Len=0 TSval=1364050838 TSecr=2862246192"
"52","6.256626258","192.168.166.19","130.104.1.1","DNS","91","Standard query 0xea69 A gatewayws.icloud.com OPT"
"53","6.256822374","192.168.166.19","130.104.1.1","DNS","91","Standard query 0x6d8f AAAA gatewayws.icloud.com OPT"
"54","6.257396962","2001:6a8:3081:6f06:6929:a50d:93f0:6a7e","2a01:b740:a41:e80::2:6","TCP","94","54844  >  443 [SYN] Seq=0 Win=64800 Len=0 MSS=1440 SACK_PERM=1 TSval=2262740722 TSecr=0 WS=128"
"55","6.260590269","2001:67c:1562::23","2001:6a8:3081:6f06:6929:a50d:93f0:6a7e","HTTP","275","HTTP/1.1 204 No Content "
"56","6.260591666","2001:67c:1562::23","2001:6a8:3081:6f06:6929:a50d:93f0:6a7e","TCP","86","80  >  34136 [FIN, ACK] Seq=190 Ack=88 Win=64256 Len=0 TSval=2264657744 TSecr=3389328767"
"57","6.260656549","2001:6a8:3081:6f06:6929:a50d:93f0:6a7e","2001:67c:1562::23","TCP","86","34136  >  80 [ACK] Seq=88 Ack=190 Win=64768 Len=0 TSval=3389328848 TSecr=2264657744"
"58","6.260751114","2001:6a8:3081:6f06:6929:a50d:93f0:6a7e","2001:67c:1562::23","TCP","86","34136  >  80 [FIN, ACK] Seq=88 Ack=191 Win=64768 Len=0 TSval=3389328849 TSecr=2264657744"
"59","6.264333649","2a01:b740:a41:e80::2:6","2001:6a8:3081:6f06:6929:a50d:93f0:6a7e","TCP","94","443  >  54844 [SYN, ACK] Seq=0 Ack=1 Win=64260 Len=0 MSS=1440 SACK_PERM=1 TSval=160543335 TSecr=2262740722 WS=128"
"60","6.264398951","2001:6a8:3081:6f06:6929:a50d:93f0:6a7e","2a01:b740:a41:e80::2:6","TCP","86","54844  >  443 [ACK] Seq=1 Ack=1 Win=64896 Len=0 TSval=2262740729 TSecr=160543335"
"61","6.264768624","2001:6a8:3081:6f06:6929:a50d:93f0:6a7e","2a01:b740:a41:e80::2:6","TLSv1.2","628","Client Hello"
"62","6.266583812","130.104.1.1","192.168.166.19","DNS","180","Standard query response 0xea69 A gatewayws.icloud.com CNAME gatewayws.fe2.apple-dns.net A 17.248.236.64 A 17.248.236.67 A 17.248.236.69 OPT"
"63","6.266583812","2a01:b740:a41:e80::2:6","2001:6a8:3081:6f06:6929:a50d:93f0:6a7e","TCP","86","443  >  54844 [ACK] Seq=1 Ack=543 Win=1198080 Len=0 TSval=160543335 TSecr=2262740730"
"64","6.271888157","2a01:b740:a41:e80::2:6","2001:6a8:3081:6f06:6929:a50d:93f0:6a7e","TLSv1.2","1514","Server Hello"
"65","6.271889065","2a01:b740:a41:e80::2:6","2001:6a8:3081:6f06:6929:a50d:93f0:6a7e","TCP","1326","[TCP Previous segment not captured] 443  >  54844 [PSH, ACK] Seq=2857 Ack=543 Win=64128 Len=1240 TSval=160543343 TSecr=2262740730 [TCP segment of a reassembled PDU]"
"66","6.271890043","2a01:b740:a41:e80::2:6","2001:6a8:3081:6f06:6929:a50d:93f0:6a7e","TCP","1514","[TCP Out-Of-Order] 443  >  54844 [ACK] Seq=1429 Ack=543 Win=64128 Len=1428 TSval=160543343 TSecr=2262740730 [TCP segment of a reassembled PDU]"
"67","6.271944519","2001:6a8:3081:6f06:6929:a50d:93f0:6a7e","2a01:b740:a41:e80::2:6","TCP","86","54844  >  443 [ACK] Seq=543 Ack=1429 Win=63488 Len=0 TSval=2262740737 TSecr=160543343"
"68","6.271983980","2001:6a8:3081:6f06:6929:a50d:93f0:6a7e","2a01:b740:a41:e80::2:6","TCP","98","[TCP Dup ACK 67#1] 54844  >  443 [ACK] Seq=543 Ack=1429 Win=63488 Len=0 TSval=2262740737 TSecr=160543343 SLE=2857 SRE=4097"
"69","6.271994666","2001:6a8:3081:6f06:6929:a50d:93f0:6a7e","2a01:b740:a41:e80::2:6","TCP","86","54844  >  443 [ACK] Seq=543 Ack=4097 Win=60928 Len=0 TSval=2262740737 TSecr=160543343"
"70","6.272005491","130.104.1.1","192.168.166.19","DNS","244","Standard query response 0x6d8f AAAA gatewayws.icloud.com CNAME gatewayws.fe2.apple-dns.net AAAA 2a01:b740:a41:e80::2:2 AAAA 2a01:b740:a41:e80::2:1 AAAA 2a01:b740:a41:e80::2:4 AAAA 2a01:b740:a41:e80::2:3 OPT"
"71","6.272371462","2a01:b740:a41:e80::2:6","2001:6a8:3081:6f06:6929:a50d:93f0:6a7e","TLSv1.2","507","[TCP Previous segment not captured] , Ignored Unknown Record"
"72","6.272372370","2a01:b740:a41:e80::2:6","2001:6a8:3081:6f06:6929:a50d:93f0:6a7e","TCP","2942","[TCP Out-Of-Order] 443  >  54844 [ACK] Seq=4097 Ack=543 Win=64128 Len=2856 TSval=160543343 TSecr=2262740730"
"73","6.272379145","2001:6a8:3081:6f06:6929:a50d:93f0:6a7e","2a01:b740:a41:e80::2:6","TCP","98","[TCP Window Update] 54844  >  443 [ACK] Seq=543 Ack=4097 Win=63104 Len=0 TSval=2262740737 TSecr=160543343 SLE=6953 SRE=7374"
"74","6.272386827","2001:6a8:3081:6f06:6929:a50d:93f0:6a7e","2a01:b740:a41:e80::2:6","TCP","86","54844  >  443 [ACK] Seq=543 Ack=7374 Win=59904 Len=0 TSval=2262740737 TSecr=160543343"
"75","6.273184700","2001:6a8:3081:6f06:6929:a50d:93f0:6a7e","2a01:b740:a41:e80::2:6","TLSv1.2","179","Client Key Exchange, Change Cipher Spec, Encrypted Handshake Message"
"76","6.273478036","2001:6a8:3081:6f06:6929:a50d:93f0:6a7e","2a01:b740:a41:e80::2:2","TCP","94","35086  >  443 [SYN] Seq=0 Win=64800 Len=0 MSS=1440 SACK_PERM=1 TSval=2862246279 TSecr=0 WS=128"
"77","6.273708025","2001:6a8:3081:6f06:6929:a50d:93f0:6a7e","2a01:b740:a41:e80::2:6","TLSv1.2","3968","Application Data"
"78","6.279619434","2a01:b740:a41:e80::2:6","2001:6a8:3081:6f06:6929:a50d:93f0:6a7e","TCP","86","443  >  54844 [ACK] Seq=7374 Ack=636 Win=64128 Len=0 TSval=160543351 TSecr=2262740738"
"79","6.280964517","2a01:b740:a41:e80::2:2","2001:6a8:3081:6f06:6929:a50d:93f0:6a7e","TCP","94","443  >  35086 [SYN, ACK] Seq=0 Ack=1 Win=64260 Len=0 MSS=1440 SACK_PERM=1 TSval=2682918846 TSecr=2862246279 WS=128"
"80","6.280964517","2a01:b740:a41:e80::2:6","2001:6a8:3081:6f06:6929:a50d:93f0:6a7e","TLSv1.2","376","New Session Ticket, Change Cipher Spec, Encrypted Handshake Message"
"81","6.280965425","2a01:b740:a41:e80::2:6","2001:6a8:3081:6f06:6929:a50d:93f0:6a7e","TCP","86","443  >  54844 [ACK] Seq=7664 Ack=3492 Win=63488 Len=0 TSval=160543352 TSecr=2262740738"
"82","6.280966403","2a01:b740:a41:e80::2:6","2001:6a8:3081:6f06:6929:a50d:93f0:6a7e","TCP","86","443  >  54844 [ACK] Seq=7664 Ack=4518 Win=62720 Len=0 TSval=160543352 TSecr=2262740738"
"83","6.280995108","2001:6a8:3081:6f06:6929:a50d:93f0:6a7e","2a01:b740:a41:e80::2:2","TCP","86","35086  >  443 [ACK] Seq=1 Ack=1 Win=64896 Len=0 TSval=2862246287 TSecr=2682918846"
"84","6.281313307","2001:6a8:3081:6f06:6929:a50d:93f0:6a7e","2a01:b740:a41:e80::2:2","TLSv1.2","612","Client Hello"
"85","6.282770207","2a01:b740:a41:e80::2:2","2001:6a8:3081:6f06:6929:a50d:93f0:6a7e","TCP","86","443  >  35086 [ACK] Seq=1 Ack=527 Win=1198080 Len=0 TSval=2682918846 TSecr=2862246287"
"86","6.288810545","2a01:b740:a41:e80::2:2","2001:6a8:3081:6f06:6929:a50d:93f0:6a7e","TCP","1326","[TCP Previous segment not captured] 443  >  35086 [PSH, ACK] Seq=2857 Ack=527 Win=64128 Len=1240 TSval=2682918854 TSecr=2862246287"
"87","6.288812430","2a01:b740:a41:e80::2:2","2001:6a8:3081:6f06:6929:a50d:93f0:6a7e","TLSv1.2","728","Ignored Unknown Record"
"88","6.288813408","2a01:b740:a41:e80::2:2","2001:6a8:3081:6f06:6929:a50d:93f0:6a7e","TCP","2942","[TCP Out-Of-Order] 443  >  35086 [ACK] Seq=1 Ack=527 Win=64128 Len=2856 TSval=2682918854 TSecr=2862246287"
"89","6.288880596","2001:6a8:3081:6f06:6929:a50d:93f0:6a7e","2a01:b740:a41:e80::2:2","TCP","98","[TCP Dup ACK 83#1] 35086  >  443 [ACK] Seq=527 Ack=1 Win=64896 Len=0 TSval=2862246295 TSecr=2682918846 SLE=2857 SRE=4097"
"90","6.288925574","2001:6a8:3081:6f06:6929:a50d:93f0:6a7e","2a01:b740:a41:e80::2:2","TCP","98","[TCP Dup ACK 83#2] 35086  >  443 [ACK] Seq=527 Ack=1 Win=64896 Len=0 TSval=2862246295 TSecr=2682918846 SLE=2857 SRE=4739"
"91","6.288938774","2001:6a8:3081:6f06:6929:a50d:93f0:6a7e","2a01:b740:a41:e80::2:2","TCP","86","35086  >  443 [ACK] Seq=527 Ack=4739 Win=60160 Len=0 TSval=2862246295 TSecr=2682918854"
"92","6.292107217","2001:6a8:3081:6f06:6929:a50d:93f0:6a7e","2a01:b740:a41:e80::2:2","TLSv1.2","179","Client Key Exchange, Change Cipher Spec, Encrypted Handshake Message"
"93","6.292340628","2001:6a8:3081:6f06:6929:a50d:93f0:6a7e","2a01:b740:a41:e80::2:2","TLSv1.2","191","Application Data"
"94","6.292736701","2001:6a8:3081:6f06:6929:a50d:93f0:6a7e","2a01:b740:a41:e80::2:2","TLSv1.2","3146","Application Data"
"95","6.293277486","2001:6a8:3081:6f06:6929:a50d:93f0:6a7e","2a01:b740:a41:e80::2:2","TLSv1.2","3166","Application Data"
"96","6.296956962","2001:6a8:3081:6f06:6929:a50d:93f0:6a7e","2a01:b740:a41:e80::2:2","TLSv1.2","4220","Application Data"
"97","6.297607259","2001:6a8:3081:6f06:6929:a50d:93f0:6a7e","2a01:b740:a41:e80::2:2","TLSv1.2","166","Application Data"
"98","6.298959116","2a01:b740:a41:e80::2:2","2001:6a8:3081:6f06:6929:a50d:93f0:6a7e","TCP","86","443  >  35086 [ACK] Seq=4739 Ack=620 Win=64128 Len=0 TSval=2682918865 TSecr=2862246298"
"99","6.298960024","2a01:b740:a41:e80::2:2","2001:6a8:3081:6f06:6929:a50d:93f0:6a7e","TCP","86","443  >  35086 [ACK] Seq=4739 Ack=725 Win=64128 Len=0 TSval=2682918865 TSecr=2862246298"
"100","6.298961002","2a01:b740:a41:e80::2:2","2001:6a8:3081:6f06:6929:a50d:93f0:6a7e","TLSv1.2","360","New Session Ticket, Change Cipher Spec, Encrypted Handshake Message"
"101","6.298961910","2a01:b740:a41:e80::2:2","2001:6a8:3081:6f06:6929:a50d:93f0:6a7e","TLSv1.2","164","Application Data"
"102","6.299039365","2001:6a8:3081:6f06:6929:a50d:93f0:6a7e","2a01:b740:a41:e80::2:2","TCP","86","35086  >  443 [ACK] Seq=6865 Ack=5091 Win=64128 Len=0 TSval=2862246305 TSecr=2682918865"
"103","6.299184705","2001:6a8:3081:6f06:6929:a50d:93f0:6a7e","2a01:b740:a41:e80::2:2","TLSv1.2","124","Application Data"
"104","6.299260274","2a01:b740:a41:e80::2:2","2001:6a8:3081:6f06:6929:a50d:93f0:6a7e","TCP","86","443  >  35086 [ACK] Seq=5091 Ack=2153 Win=64128 Len=0 TSval=2682918865 TSecr=2862246299"
"105","6.299261182","2a01:b740:a41:e80::2:2","2001:6a8:3081:6f06:6929:a50d:93f0:6a7e","TCP","86","443  >  35086 [ACK] Seq=5091 Ack=3785 Win=64128 Len=0 TSval=2682918865 TSecr=2862246299"
"106","6.300541173","2a01:b740:a41:e80::2:2","2001:6a8:3081:6f06:6929:a50d:93f0:6a7e","TCP","86","443  >  35086 [ACK] Seq=5091 Ack=6641 Win=63488 Len=0 TSval=2682918866 TSecr=2862246299"
"107","6.300542639","2a01:b740:a41:e80::2:2","2001:6a8:3081:6f06:6929:a50d:93f0:6a7e","TCP","86","443  >  35086 [ACK] Seq=5091 Ack=6865 Win=63360 Len=0 TSval=2682918866 TSecr=2862246299"
"108","6.300994865","192.168.166.19","130.104.1.1","DNS","98","Standard query 0x0636 A p50-ckdatabasews.icloud.com OPT"
"109","6.301112967","192.168.166.19","130.104.1.1","DNS","98","Standard query 0xbf92 AAAA p50-ckdatabasews.icloud.com OPT"
"110","6.302941845","192.168.166.19","130.104.1.1","DNS","91","Standard query 0xb78a A p50-docws.icloud.com OPT"
"111","6.303117357","192.168.166.19","130.104.1.1","DNS","91","Standard query 0x13b4 AAAA p50-docws.icloud.com OPT"
"112","6.303132233","2a01:b740:a41:e80::2:2","2001:6a8:3081:6f06:6929:a50d:93f0:6a7e","TCP","86","443  >  48446 [ACK] Seq=1 Ack=1429 Win=501 Len=0 TSval=2541633337 TSecr=2862246303"
"113","6.303490452","2a01:b740:a41:e80::2:2","2001:6a8:3081:6f06:6929:a50d:93f0:6a7e","TCP","86","443  >  48446 [ACK] Seq=1 Ack=2857 Win=496 Len=0 TSval=2541633337 TSecr=2862246303"
"114","6.303491849","2a01:b740:a41:e80::2:2","2001:6a8:3081:6f06:6929:a50d:93f0:6a7e","TCP","86","443  >  48446 [ACK] Seq=1 Ack=4135 Win=501 Len=0 TSval=2541633337 TSecr=2862246303"
"115","6.304426192","2a01:b740:a41:e80::2:2","2001:6a8:3081:6f06:6929:a50d:93f0:6a7e","TCP","86","443  >  48446 [ACK] Seq=1 Ack=4215 Win=501 Len=0 TSval=2541633338 TSecr=2862246303"
"116","6.304998895","130.104.1.1","192.168.166.19","DNS","208","Standard query response 0xb78a A p50-docws.icloud.com CNAME docws.fe2.apple-dns.net A 17.248.209.64 A 17.248.209.72 A 17.248.209.73 A 17.248.209.74 A 17.248.209.70 OPT"
"117","6.305647516","2a01:b740:a41:e80::2:2","2001:6a8:3081:6f06:6929:a50d:93f0:6a7e","TCP","86","443  >  35086 [ACK] Seq=5091 Ack=6903 Win=64128 Len=0 TSval=2682918872 TSecr=2862246305"
"118","6.311622551","130.104.1.1","192.168.166.19","DNS","222","Standard query response 0x0636 A p50-ckdatabasews.icloud.com CNAME ckdatabasews.fe2.apple-dns.net A 17.248.236.68 A 17.248.236.67 A 17.248.236.65 A 17.248.236.69 A 17.248.236.64 OPT"
"119","6.311622551","130.104.1.1","192.168.166.19","DNS","282","Standard query response 0xbf92 AAAA p50-ckdatabasews.icloud.com CNAME ckdatabasews.fe2.apple-dns.net AAAA 2a01:b740:a41:e80::2:5 AAAA 2a01:b740:a41:e80::2:3 AAAA 2a01:b740:a41:e80::2:6 AAAA 2a01:b740:a41:e80::2:2 AAAA 2a01:b740:a41:e80::2:4 OPT"
"120","6.313111159","2001:6a8:3081:6f06:6929:a50d:93f0:6a7e","2a01:b740:a41:e80::2:5","TCP","94","39740  >  443 [SYN] Seq=0 Win=64800 Len=0 MSS=1440 SACK_PERM=1 TSval=69646071 TSecr=0 WS=128"
"121","6.318304875","130.104.1.1","192.168.166.19","DNS","240","Standard query response 0x13b4 AAAA p50-docws.icloud.com CNAME docws.fe2.apple-dns.net AAAA 2a01:b740:a41:e80::2:6 AAAA 2a01:b740:a41:e80::2:1 AAAA 2a01:b740:a41:e80::2:3 AAAA 2a01:b740:a41:e80::2:5 OPT"
"122","6.319020823","2001:6a8:3081:6f06:6929:a50d:93f0:6a7e","2a01:b740:a41:e80::2:6","TCP","94","54850  >  443 [SYN] Seq=0 Win=64800 Len=0 MSS=1440 SACK_PERM=1 TSval=2262740784 TSecr=0 WS=128"
"123","6.319146398","2001:6a8:3081:6f06:6929:a50d:93f0:6a7e","2a01:b740:a41:e80::2:6","TCP","94","54852  >  443 [SYN] Seq=0 Win=64800 Len=0 MSS=1440 SACK_PERM=1 TSval=2262740784 TSecr=0 WS=128"
"124","6.319236075","2001:6a8:3081:6f06:6929:a50d:93f0:6a7e","2a01:b740:a41:e80::2:6","TCP","94","54864  >  443 [SYN] Seq=0 Win=64800 Len=0 MSS=1440 SACK_PERM=1 TSval=2262740784 TSecr=0 WS=128"
"125","6.319327289","2001:6a8:3081:6f06:6929:a50d:93f0:6a7e","2a01:b740:a41:e80::2:6","TCP","94","54866  >  443 [SYN] Seq=0 Win=64800 Len=0 MSS=1440 SACK_PERM=1 TSval=2262740784 TSecr=0 WS=128"
"126","6.319427232","2001:6a8:3081:6f06:6929:a50d:93f0:6a7e","2a01:b740:a41:e80::2:6","TCP","94","54876  >  443 [SYN] Seq=0 Win=64800 Len=0 MSS=1440 SACK_PERM=1 TSval=2262740784 TSecr=0 WS=128"
"127","6.319483525","2a01:b740:a41:e80::2:5","2001:6a8:3081:6f06:6929:a50d:93f0:6a7e","TCP","94","443  >  39740 [SYN, ACK] Seq=0 Ack=1 Win=64260 Len=0 MSS=1440 SACK_PERM=1 TSval=390539284 TSecr=69646071 WS=128"
"128","6.319524452","2001:6a8:3081:6f06:6929:a50d:93f0:6a7e","2a01:b740:a41:e80::2:5","TCP","86","39740  >  443 [ACK] Seq=1 Ack=1 Win=64896 Len=0 TSval=69646077 TSecr=390539284"
"129","6.319879528","2001:6a8:3081:6f06:6929:a50d:93f0:6a7e","2a01:b740:a41:e80::2:5","TLSv1.2","635","Client Hello"
"130","6.321577382","2a01:b740:a41:e80::2:5","2001:6a8:3081:6f06:6929:a50d:93f0:6a7e","TCP","86","443  >  39740 [ACK] Seq=1 Ack=550 Win=1198080 Len=0 TSval=390539284 TSecr=69646078"
"131","6.326471336","2a01:b740:a41:e80::2:6","2001:6a8:3081:6f06:6929:a50d:93f0:6a7e","TCP","94","443  >  54866 [SYN, ACK] Seq=0 Ack=1 Win=64260 Len=0 MSS=1440 SACK_PERM=1 TSval=1078858267 TSecr=2262740784 WS=128"
"132","6.326476923","2a01:b740:a41:e80::2:6","2001:6a8:3081:6f06:6929:a50d:93f0:6a7e","TCP","94","443  >  54850 [SYN, ACK] Seq=0 Ack=1 Win=64260 Len=0 MSS=1440 SACK_PERM=1 TSval=160543397 TSecr=2262740784 WS=128"
"133","6.326476923","2a01:b740:a41:e80::2:6","2001:6a8:3081:6f06:6929:a50d:93f0:6a7e","TCP","94","443  >  54864 [SYN, ACK] Seq=0 Ack=1 Win=64260 Len=0 MSS=1440 SACK_PERM=1 TSval=3848216562 TSecr=2262740784 WS=128"
"134","6.326514079","2001:6a8:3081:6f06:6929:a50d:93f0:6a7e","2a01:b740:a41:e80::2:6","TCP","86","54866  >  443 [ACK] Seq=1 Ack=1 Win=64896 Len=0 TSval=2262740791 TSecr=1078858267"
"135","6.326522740","2a01:b740:a41:e80::2:6","2001:6a8:3081:6f06:6929:a50d:93f0:6a7e","TCP","94","443  >  54876 [SYN, ACK] Seq=0 Ack=1 Win=64260 Len=0 MSS=1440 SACK_PERM=1 TSval=3848216562 TSecr=2262740784 WS=128"
"136","6.326529933","2001:6a8:3081:6f06:6929:a50d:93f0:6a7e","2a01:b740:a41:e80::2:6","TCP","86","54850  >  443 [ACK] Seq=1 Ack=1 Win=64896 Len=0 TSval=2262740791 TSecr=160543397"
"137","6.326542226","2001:6a8:3081:6f06:6929:a50d:93f0:6a7e","2a01:b740:a41:e80::2:6","TCP","86","54864  >  443 [ACK] Seq=1 Ack=1 Win=64896 Len=0 TSval=2262740791 TSecr=3848216562"
"138","6.326548441","2001:6a8:3081:6f06:6929:a50d:93f0:6a7e","2a01:b740:a41:e80::2:6","TCP","86","54876  >  443 [ACK] Seq=1 Ack=1 Win=64896 Len=0 TSval=2262740791 TSecr=3848216562"
"139","6.326552772","2a01:b740:a41:e80::2:6","2001:6a8:3081:6f06:6929:a50d:93f0:6a7e","TCP","94","443  >  54852 [SYN, ACK] Seq=0 Ack=1 Win=64260 Len=0 MSS=1440 SACK_PERM=1 TSval=1577631478 TSecr=2262740784 WS=128"
"140","6.326560943","2001:6a8:3081:6f06:6929:a50d:93f0:6a7e","2a01:b740:a41:e80::2:6","TCP","86","54852  >  443 [ACK] Seq=1 Ack=1 Win=64896 Len=0 TSval=2262740791 TSecr=1577631478"
"141","6.326788767","2001:6a8:3081:6f06:6929:a50d:93f0:6a7e","2a01:b740:a41:e80::2:6","TLSv1.2","628","Client Hello"
"142","6.326963232","2001:6a8:3081:6f06:6929:a50d:93f0:6a7e","2a01:b740:a41:e80::2:6","TLSv1.2","628","Client Hello"
"143","6.327113112","2001:6a8:3081:6f06:6929:a50d:93f0:6a7e","2a01:b740:a41:e80::2:6","TLSv1.2","628","Client Hello"
"144","6.327251679","2001:6a8:3081:6f06:6929:a50d:93f0:6a7e","2a01:b740:a41:e80::2:6","TLSv1.2","628","Client Hello"
"145","6.327421324","2001:6a8:3081:6f06:6929:a50d:93f0:6a7e","2a01:b740:a41:e80::2:6","TLSv1.2","628","Client Hello"
"146","6.327746228","2a01:b740:a41:e80::2:5","2001:6a8:3081:6f06:6929:a50d:93f0:6a7e","TLSv1.2","1514","Server Hello"
"147","6.327747625","2a01:b740:a41:e80::2:5","2001:6a8:3081:6f06:6929:a50d:93f0:6a7e","TCP","1326","[TCP Previous segment not captured] 443  >  39740 [PSH, ACK] Seq=2857 Ack=550 Win=64128 Len=1240 TSval=390539291 TSecr=69646078 [TCP segment of a reassembled PDU]"
"148","6.327748533","2a01:b740:a41:e80::2:5","2001:6a8:3081:6f06:6929:a50d:93f0:6a7e","TCP","1514","[TCP Out-Of-Order] 443  >  39740 [ACK] Seq=1429 Ack=550 Win=64128 Len=1428 TSval=390539291 TSecr=69646078 [TCP segment of a reassembled PDU]"
"149","6.327749930","2a01:b740:a41:e80::2:5","2001:6a8:3081:6f06:6929:a50d:93f0:6a7e","TLSv1.2","1316","[TCP Previous segment not captured] , Ignored Unknown Record"
"150","6.327752235","2a01:b740:a41:e80::2:5","2001:6a8:3081:6f06:6929:a50d:93f0:6a7e","TCP","1514","[TCP Out-Of-Order] 443  >  39740 [ACK] Seq=4097 Ack=550 Win=64128 Len=1428 TSval=390539291 TSecr=69646078"
"151","6.327766622","2001:6a8:3081:6f06:6929:a50d:93f0:6a7e","2a01:b740:a41:e80::2:5","TCP","86","39740  >  443 [ACK] Seq=550 Ack=1429 Win=63488 Len=0 TSval=69646086 TSecr=390539291"
"152","6.327778146","2001:6a8:3081:6f06:6929:a50d:93f0:6a7e","2a01:b740:a41:e80::2:5","TCP","98","[TCP Dup ACK 151#1] 39740  >  443 [ACK] Seq=550 Ack=1429 Win=63488 Len=0 TSval=69646086 TSecr=390539291 SLE=2857 SRE=4097"
"153","6.327786108","2001:6a8:3081:6f06:6929:a50d:93f0:6a7e","2a01:b740:a41:e80::2:5","TCP","86","39740  >  443 [ACK] Seq=550 Ack=4097 Win=60928 Len=0 TSval=69646086 TSecr=390539291"
"154","6.327792673","2001:6a8:3081:6f06:6929:a50d:93f0:6a7e","2a01:b740:a41:e80::2:5","TCP","98","[TCP Dup ACK 153#1] 39740  >  443 [ACK] Seq=550 Ack=4097 Win=60928 Len=0 TSval=69646086 TSecr=390539291 SLE=5525 SRE=6755"
"155","6.327804686","2001:6a8:3081:6f06:6929:a50d:93f0:6a7e","2a01:b740:a41:e80::2:6","TCP","86","54844  >  443 [ACK] Seq=4518 Ack=7664 Win=64128 Len=0 TSval=2262740793 TSecr=160543351"
"156","6.327810413","2001:6a8:3081:6f06:6929:a50d:93f0:6a7e","2a01:b740:a41:e80::2:5","TCP","86","39740  >  443 [ACK] Seq=550 Ack=6755 Win=58496 Len=0 TSval=69646086 TSecr=390539291"
"157","6.328477821","2001:6a8:3081:6f06:6929:a50d:93f0:6a7e","2a01:b740:a41:e80::2:5","TLSv1.2","179","Client Key Exchange, Change Cipher Spec, Encrypted Handshake Message"
"158","6.328745315","2001:6a8:3081:6f06:6929:a50d:93f0:6a7e","2a01:b740:a41:e80::2:5","TLSv1.2","4023","Application Data"
"159","6.328842535","2001:6a8:3081:6f06:6929:a50d:93f0:6a7e","2a01:b740:a41:e80::2:5","TLSv1.2","516","Application Data"
"160","6.329287078","2a01:b740:a41:e80::2:6","2001:6a8:3081:6f06:6929:a50d:93f0:6a7e","TCP","86","443  >  54866 [ACK] Seq=1 Ack=543 Win=1198080 Len=0 TSval=1078858267 TSecr=2262740792"
"161","6.329298532","2a01:b740:a41:e80::2:6","2001:6a8:3081:6f06:6929:a50d:93f0:6a7e","TCP","86","443  >  54850 [ACK] Seq=1 Ack=543 Win=1198080 Len=0 TSval=160543397 TSecr=2262740792"
"162","6.329737977","2a01:b740:a41:e80::2:6","2001:6a8:3081:6f06:6929:a50d:93f0:6a7e","TCP","86","443  >  54864 [ACK] Seq=1 Ack=543 Win=1198080 Len=0 TSval=3848216562 TSecr=2262740792"
"163","6.329761862","2a01:b740:a41:e80::2:6","2001:6a8:3081:6f06:6929:a50d:93f0:6a7e","TCP","86","443  >  54852 [ACK] Seq=1 Ack=543 Win=1198080 Len=0 TSval=1577631478 TSecr=2262740792"
"164","6.329764656","2a01:b740:a41:e80::2:6","2001:6a8:3081:6f06:6929:a50d:93f0:6a7e","TCP","86","443  >  54876 [ACK] Seq=1 Ack=543 Win=1198080 Len=0 TSval=3848216562 TSecr=2262740792"
"165","6.335417581","2a01:b740:a41:e80::2:5","2001:6a8:3081:6f06:6929:a50d:93f0:6a7e","TCP","86","443  >  39740 [ACK] Seq=6755 Ack=643 Win=64128 Len=0 TSval=390539299 TSecr=69646086"
"166","6.335423308","2a01:b740:a41:e80::2:6","2001:6a8:3081:6f06:6929:a50d:93f0:6a7e","TLSv1.2","1514","Server Hello"
"167","6.335423308","2a01:b740:a41:e80::2:6","2001:6a8:3081:6f06:6929:a50d:93f0:6a7e","TLSv1.2","1514","Server Hello"
"168","6.335424705","2a01:b740:a41:e80::2:6","2001:6a8:3081:6f06:6929:a50d:93f0:6a7e","TCP","1326","[TCP Previous segment not captured] 443  >  54876 [PSH, ACK] Seq=2857 Ack=543 Win=64128 Len=1240 TSval=3848216570 TSecr=2262740792 [TCP segment of a reassembled PDU]"
"169","6.335424705","2a01:b740:a41:e80::2:6","2001:6a8:3081:6f06:6929:a50d:93f0:6a7e","TCP","1326","[TCP Previous segment not captured] 443  >  54866 [PSH, ACK] Seq=2857 Ack=543 Win=64128 Len=1240 TSval=1078858275 TSecr=2262740792 [TCP segment of a reassembled PDU]"
"170","6.335425683","2a01:b740:a41:e80::2:6","2001:6a8:3081:6f06:6929:a50d:93f0:6a7e","TCP","1514","[TCP Out-Of-Order] 443  >  54876 [ACK] Seq=1429 Ack=543 Win=64128 Len=1428 TSval=3848216570 TSecr=2262740792 [TCP segment of a reassembled PDU]"
"171","6.335425683","2a01:b740:a41:e80::2:6","2001:6a8:3081:6f06:6929:a50d:93f0:6a7e","TLSv1.2","4182","Server Hello"
"172","6.335426661","2a01:b740:a41:e80::2:6","2001:6a8:3081:6f06:6929:a50d:93f0:6a7e","TCP","1514","[TCP Out-Of-Order] 443  >  54866 [ACK] Seq=1429 Ack=543 Win=64128 Len=1428 TSval=1078858275 TSecr=2262740792 [TCP segment of a reassembled PDU]"
"173","6.335451245","2001:6a8:3081:6f06:6929:a50d:93f0:6a7e","2a01:b740:a41:e80::2:6","TCP","86","54866  >  443 [ACK] Seq=543 Ack=1429 Win=63488 Len=0 TSval=2262740800 TSecr=1078858275"
"174","6.335469544","2001:6a8:3081:6f06:6929:a50d:93f0:6a7e","2a01:b740:a41:e80::2:6","TCP","86","54876  >  443 [ACK] Seq=543 Ack=1429 Win=63488 Len=0 TSval=2262740800 TSecr=3848216570"
"175","6.335482953","2001:6a8:3081:6f06:6929:a50d:93f0:6a7e","2a01:b740:a41:e80::2:6","TCP","98","[TCP Dup ACK 173#1] 54866  >  443 [ACK] Seq=543 Ack=1429 Win=63488 Len=0 TSval=2262740800 TSecr=1078858275 SLE=2857 SRE=4097"
"176","6.335488261","2001:6a8:3081:6f06:6929:a50d:93f0:6a7e","2a01:b740:a41:e80::2:6","TCP","98","[TCP Dup ACK 174#1] 54876  >  443 [ACK] Seq=543 Ack=1429 Win=63488 Len=0 TSval=2262740800 TSecr=3848216570 SLE=2857 SRE=4097"
"177","6.335494477","2001:6a8:3081:6f06:6929:a50d:93f0:6a7e","2a01:b740:a41:e80::2:6","TCP","86","54864  >  443 [ACK] Seq=543 Ack=4097 Win=60800 Len=0 TSval=2262740800 TSecr=3848216570"
"178","6.335500064","2001:6a8:3081:6f06:6929:a50d:93f0:6a7e","2a01:b740:a41:e80::2:6","TCP","86","54876  >  443 [ACK] Seq=543 Ack=4097 Win=60928 Len=0 TSval=2262740800 TSecr=3848216570"
"179","6.335506699","2001:6a8:3081:6f06:6929:a50d:93f0:6a7e","2a01:b740:a41:e80::2:6","TCP","86","54866  >  443 [ACK] Seq=543 Ack=4097 Win=61056 Len=0 TSval=2262740800 TSecr=1078858275"
"180","6.336663908","2a01:b740:a41:e80::2:6","2001:6a8:3081:6f06:6929:a50d:93f0:6a7e","TLSv1.2","782","[TCP Previous segment not captured] , Ignored Unknown Record"
"181","6.336667819","2a01:b740:a41:e80::2:5","2001:6a8:3081:6f06:6929:a50d:93f0:6a7e","TLSv1.2","376","New Session Ticket, Change Cipher Spec, Encrypted Handshake Message"
"182","6.336665375","2a01:b740:a41:e80::2:6","2001:6a8:3081:6f06:6929:a50d:93f0:6a7e","TCP","1514","[TCP Out-Of-Order] 443  >  54876 [ACK] Seq=4097 Ack=543 Win=64128 Len=1428 TSval=3848216570 TSecr=2262740792"
"183","6.336669705","2a01:b740:a41:e80::2:6","2001:6a8:3081:6f06:6929:a50d:93f0:6a7e","TLSv1.2","4182","Server Hello"
"184","6.336670683","2a01:b740:a41:e80::2:6","2001:6a8:3081:6f06:6929:a50d:93f0:6a7e","TLSv1.2","782","[TCP Previous segment not captured] , Ignored Unknown Record"
"185","6.336671591","2a01:b740:a41:e80::2:6","2001:6a8:3081:6f06:6929:a50d:93f0:6a7e","TLSv1.2","782","[TCP Previous segment not captured] , Ignored Unknown Record"
"186","6.336672988","2a01:b740:a41:e80::2:6","2001:6a8:3081:6f06:6929:a50d:93f0:6a7e","TCP","1514","[TCP Out-Of-Order] 443  >  54866 [ACK] Seq=4097 Ack=543 Win=64128 Len=1428 TSval=1078858275 TSecr=2262740792"
"187","6.336674454","2a01:b740:a41:e80::2:6","2001:6a8:3081:6f06:6929:a50d:93f0:6a7e","TCP","1514","[TCP Out-Of-Order] 443  >  54864 [ACK] Seq=4097 Ack=543 Win=64128 Len=1428 TSval=3848216570 TSecr=2262740792"
"188","6.336708747","2001:6a8:3081:6f06:6929:a50d:93f0:6a7e","2a01:b740:a41:e80::2:6","TCP","98","[TCP Window Update] 54866  >  443 [ACK] Seq=543 Ack=4097 Win=63104 Len=0 TSval=2262740801 TSecr=1078858275 SLE=5525 SRE=6221"
"189","6.336741153","2001:6a8:3081:6f06:6929:a50d:93f0:6a7e","2a01:b740:a41:e80::2:6","TCP","98","[TCP Window Update] 54876  >  443 [ACK] Seq=543 Ack=4097 Win=63104 Len=0 TSval=2262740801 TSecr=3848216570 SLE=5525 SRE=6221"
"190","6.336754842","2001:6a8:3081:6f06:6929:a50d:93f0:6a7e","2a01:b740:a41:e80::2:6","TCP","86","54850  >  443 [ACK] Seq=543 Ack=4097 Win=60800 Len=0 TSval=2262740801 TSecr=160543406"
"191","6.336767693","2001:6a8:3081:6f06:6929:a50d:93f0:6a7e","2a01:b740:a41:e80::2:6","TCP","98","[TCP Window Update] 54864  >  443 [ACK] Seq=543 Ack=4097 Win=63104 Len=0 TSval=2262740802 TSecr=3848216570 SLE=5525 SRE=6221"
"192","6.336774258","2001:6a8:3081:6f06:6929:a50d:93f0:6a7e","2a01:b740:a41:e80::2:6","TCP","86","54876  >  443 [ACK] Seq=543 Ack=6221 Win=61056 Len=0 TSval=2262740802 TSecr=3848216570"
"193","6.336780823","2001:6a8:3081:6f06:6929:a50d:93f0:6a7e","2a01:b740:a41:e80::2:6","TCP","86","54866  >  443 [ACK] Seq=543 Ack=6221 Win=61056 Len=0 TSval=2262740802 TSecr=1078858275"
"194","6.336787947","2001:6a8:3081:6f06:6929:a50d:93f0:6a7e","2a01:b740:a41:e80::2:6","TCP","86","54864  >  443 [ACK] Seq=543 Ack=6221 Win=61056 Len=0 TSval=2262740802 TSecr=3848216570"
"195","6.336785084","2a01:b740:a41:e80::2:6","2001:6a8:3081:6f06:6929:a50d:93f0:6a7e","TLSv1.2","1514","Server Hello"
"196","6.336785992","2a01:b740:a41:e80::2:6","2001:6a8:3081:6f06:6929:a50d:93f0:6a7e","TCP","1326","[TCP Previous segment not captured] 443  >  54852 [PSH, ACK] Seq=2857 Ack=543 Win=64128 Len=1240 TSval=1577631486 TSecr=2262740792 [TCP segment of a reassembled PDU]"
"197","6.336786969","2a01:b740:a41:e80::2:6","2001:6a8:3081:6f06:6929:a50d:93f0:6a7e","TCP","1514","[TCP Out-Of-Order] 443  >  54852 [ACK] Seq=1429 Ack=543 Win=64128 Len=1428 TSval=1577631486 TSecr=2262740792 [TCP segment of a reassembled PDU]"
"198","6.336787947","2a01:b740:a41:e80::2:6","2001:6a8:3081:6f06:6929:a50d:93f0:6a7e","TLSv1.2","783","[TCP Previous segment not captured] , Ignored Unknown Record"
"199","6.336788855","2a01:b740:a41:e80::2:6","2001:6a8:3081:6f06:6929:a50d:93f0:6a7e","TCP","1514","[TCP Out-Of-Order] 443  >  54852 [ACK] Seq=4097 Ack=543 Win=64128 Len=1428 TSval=1577631486 TSecr=2262740792"
"200","6.336805198","2001:6a8:3081:6f06:6929:a50d:93f0:6a7e","2a01:b740:a41:e80::2:6","TCP","86","54852  >  443 [ACK] Seq=543 Ack=1429 Win=63488 Len=0 TSval=2262740802 TSecr=1577631486"
"201","6.336816512","2001:6a8:3081:6f06:6929:a50d:93f0:6a7e","2a01:b740:a41:e80::2:6","TCP","98","[TCP Dup ACK 200#1] 54852  >  443 [ACK] Seq=543 Ack=1429 Win=63488 Len=0 TSval=2262740802 TSecr=1577631486 SLE=2857 SRE=4097"
"202","6.336825662","2001:6a8:3081:6f06:6929:a50d:93f0:6a7e","2a01:b740:a41:e80::2:6","TCP","86","54852  >  443 [ACK] Seq=543 Ack=4097 Win=60928 Len=0 TSval=2262740802 TSecr=1577631486"
"203","6.336832367","2001:6a8:3081:6f06:6929:a50d:93f0:6a7e","2a01:b740:a41:e80::2:6","TCP","98","[TCP Dup ACK 202#1] 54852  >  443 [ACK] Seq=543 Ack=4097 Win=60928 Len=0 TSval=2262740802 TSecr=1577631486 SLE=5525 SRE=6222"
"204","6.336839979","2001:6a8:3081:6f06:6929:a50d:93f0:6a7e","2a01:b740:a41:e80::2:6","TCP","86","54852  >  443 [ACK] Seq=543 Ack=6222 Win=58880 Len=0 TSval=2262740802 TSecr=1577631486"
"205","6.337499076","2001:6a8:3081:6f06:6929:a50d:93f0:6a7e","2a01:b740:a41:e80::2:6","TLSv1.2","179","Client Key Exchange, Change Cipher Spec, Encrypted Handshake Message"
"206","6.337950883","2a01:b740:a41:e80::2:5","2001:6a8:3081:6f06:6929:a50d:93f0:6a7e","TCP","86","443  >  39740 [ACK] Seq=7045 Ack=2071 Win=64128 Len=0 TSval=390539300 TSecr=69646087"
"207","6.337951372","2a01:b740:a41:e80::2:5","2001:6a8:3081:6f06:6929:a50d:93f0:6a7e","TCP","86","443  >  39740 [ACK] Seq=7045 Ack=4580 Win=63744 Len=0 TSval=390539300 TSecr=69646087"
"208","6.337952350","2a01:b740:a41:e80::2:5","2001:6a8:3081:6f06:6929:a50d:93f0:6a7e","TCP","86","443  >  39740 [ACK] Seq=7045 Ack=5010 Win=63360 Len=0 TSval=390539300 TSecr=69646087"
"209","6.337953257","2a01:b740:a41:e80::2:6","2001:6a8:3081:6f06:6929:a50d:93f0:6a7e","TLSv1.2","783","[TCP Previous segment not captured] , Ignored Unknown Record"
"210","6.337954165","2a01:b740:a41:e80::2:6","2001:6a8:3081:6f06:6929:a50d:93f0:6a7e","TCP","1514","[TCP Out-Of-Order] 443  >  54850 [ACK] Seq=4097 Ack=543 Win=64128 Len=1428 TSval=160543407 TSecr=2262740792"
"211","6.337979518","2001:6a8:3081:6f06:6929:a50d:93f0:6a7e","2a01:b740:a41:e80::2:6","TCP","98","[TCP Window Update] 54850  >  443 [ACK] Seq=543 Ack=4097 Win=63104 Len=0 TSval=2262740803 TSecr=160543406 SLE=5525 SRE=6222"
"212","6.337989436","2001:6a8:3081:6f06:6929:a50d:93f0:6a7e","2a01:b740:a41:e80::2:6","TCP","86","54850  >  443 [ACK] Seq=543 Ack=6222 Win=61056 Len=0 TSval=2262740803 TSecr=160543407"
"213","6.338296251","2001:6a8:3081:6f06:6929:a50d:93f0:6a7e","2a01:b740:a41:e80::2:6","TLSv1.2","179","Client Key Exchange, Change Cipher Spec, Encrypted Handshake Message"
"214","6.338698679","2001:6a8:3081:6f06:6929:a50d:93f0:6a7e","2a01:b740:a41:e80::2:6","TLSv1.2","179","Client Key Exchange, Change Cipher Spec, Encrypted Handshake Message"
"215","6.338920147","2001:6a8:3081:6f06:6929:a50d:93f0:6a7e","2a01:b740:a41:e80::2:6","TLSv1.2","4015","Application Data"
"216","6.338995786","2001:6a8:3081:6f06:6929:a50d:93f0:6a7e","2a01:b740:a41:e80::2:6","TLSv1.2","4013","Application Data"
"217","6.339069888","2001:6a8:3081:6f06:6929:a50d:93f0:6a7e","2a01:b740:a41:e80::2:6","TLSv1.2","3997","Application Data"
"218","6.340869292","2001:67c:1562::23","2001:6a8:3081:6f06:6929:a50d:93f0:6a7e","TCP","86","80  >  34136 [ACK] Seq=191 Ack=89 Win=64256 Len=0 TSval=2264657824 TSecr=3389328849"
"219","6.344114561","2001:6a8:3081:6f06:6929:a50d:93f0:6a7e","2a01:b740:a41:e80::2:6","TLSv1.2","179","Client Key Exchange, Change Cipher Spec, Encrypted Handshake Message"
"220","6.344250613","2a01:b740:a41:e80::2:6","2001:6a8:3081:6f06:6929:a50d:93f0:6a7e","TCP","86","443  >  54876 [ACK] Seq=6221 Ack=636 Win=64128 Len=0 TSval=3848216580 TSecr=2262740802"
"221","6.344443376","2a01:b740:a41:e80::2:6","2001:6a8:3081:6f06:6929:a50d:93f0:6a7e","TLSv1.2","376","New Session Ticket, Change Cipher Spec, Encrypted Handshake Message"
"222","6.344443376","2a01:b740:a41:e80::2:2","2001:6a8:3081:6f06:6929:a50d:93f0:6a7e","TLSv1.2","716","Application Data"
"223","6.344449103","2001:6a8:3081:6f06:6929:a50d:93f0:6a7e","2a01:b740:a41:e80::2:6","TLSv1.2","179","Client Key Exchange, Change Cipher Spec, Encrypted Handshake Message"
"224","6.345617137","2a01:b740:a41:e80::2:6","2001:6a8:3081:6f06:6929:a50d:93f0:6a7e","TCP","86","443  >  54864 [ACK] Seq=6221 Ack=636 Win=64128 Len=0 TSval=3848216581 TSecr=2262740803"
