"No.","Time","Source","Destination","Protocol","Length","Info"
"1","0.000000000","2001:6a8:3081:6f06:6929:a50d:93f0:6a7e","2a01:b740:a41:e80::2:2","TLSv1.2","3033","Application Data"
"2","0.002412964","2001:6a8:3081:6f06:6929:a50d:93f0:6a7e","2a01:b740:a41:e80::2:2","TLSv1.2","4756","Application Data"
"3","0.008450508","2a01:b740:a41:e80::2:2","2001:6a8:3081:6f06:6929:a50d:93f0:6a7e","TCP","86","443  >  43038 [ACK] Seq=1 Ack=1429 Win=2643 Len=0 TSval=1363752369 TSecr=2861947722"
"4","0.008451486","2a01:b740:a41:e80::2:2","2001:6a8:3081:6f06:6929:a50d:93f0:6a7e","TCP","86","443  >  43038 [ACK] Seq=1 Ack=2857 Win=2643 Len=0 TSval=1363752369 TSecr=2861947722"
"5","0.008452393","2a01:b740:a41:e80::2:2","2001:6a8:3081:6f06:6929:a50d:93f0:6a7e","TCP","86","443  >  43038 [ACK] Seq=1 Ack=2948 Win=2647 Len=0 TSval=1363752369 TSecr=2861947722"
"6","0.008807818","2a01:b740:a41:e80::2:2","2001:6a8:3081:6f06:6929:a50d:93f0:6a7e","TCP","86","443  >  43038 [ACK] Seq=1 Ack=4376 Win=2643 Len=0 TSval=1363752369 TSecr=2861947725"
"7","0.008809215","2a01:b740:a41:e80::2:2","2001:6a8:3081:6f06:6929:a50d:93f0:6a7e","TCP","86","443  >  43038 [ACK] Seq=1 Ack=5804 Win=2643 Len=0 TSval=1363752369 TSecr=2861947725"
"8","0.008810123","2a01:b740:a41:e80::2:2","2001:6a8:3081:6f06:6929:a50d:93f0:6a7e","TCP","86","443  >  43038 [ACK] Seq=1 Ack=7618 Win=2639 Len=0 TSval=1363752370 TSecr=2861947725"
"9","0.249561288","2a01:b740:a41:e80::2:2","2001:6a8:3081:6f06:6929:a50d:93f0:6a7e","TLSv1.2","708","Application Data"
"10","0.249562685","2a01:b740:a41:e80::2:2","2001:6a8:3081:6f06:6929:a50d:93f0:6a7e","TLSv1.2","117","Application Data"
"11","0.249604590","2001:6a8:3081:6f06:6929:a50d:93f0:6a7e","2a01:b740:a41:e80::2:2","TCP","86","43038  >  443 [ACK] Seq=7618 Ack=654 Win=2218 Len=0 TSval=2861947972 TSecr=1363752533"
"12","0.251948620","2001:6a8:3081:6f06:6929:a50d:93f0:6a7e","2a01:b740:a41:e80::2:2","TLSv1.2","121","Application Data"
"13","0.258923301","2a01:b740:a41:e80::2:2","2001:6a8:3081:6f06:6929:a50d:93f0:6a7e","TCP","86","443  >  43038 [ACK] Seq=654 Ack=7653 Win=2647 Len=0 TSval=1363752619 TSecr=2861947974"
"14","5.433560746","2001:6a8:3081:6f06:6929:a50d:93f0:6a7e","2a01:b740:a41:e80::2:5","TLSv1.2","4212","Application Data"
"15","5.436045368","2001:6a8:3081:6f06:6929:a50d:93f0:6a7e","2a01:b740:a41:e80::2:5","TLSv1.2","196","Application Data"
"16","5.442183344","2a01:b740:a41:e80::2:5","2001:6a8:3081:6f06:6929:a50d:93f0:6a7e","TCP","86","443  >  40566 [ACK] Seq=1 Ack=1429 Win=501 Len=0 TSval=629470 TSecr=69352908"
"17","5.442184811","2a01:b740:a41:e80::2:5","2001:6a8:3081:6f06:6929:a50d:93f0:6a7e","TCP","86","443  >  40566 [ACK] Seq=1 Ack=2857 Win=501 Len=0 TSval=629470 TSecr=69352908"
"18","5.442185788","2a01:b740:a41:e80::2:5","2001:6a8:3081:6f06:6929:a50d:93f0:6a7e","TCP","86","443  >  40566 [ACK] Seq=1 Ack=4127 Win=501 Len=0 TSval=629470 TSecr=69352908"
"19","5.442828612","2a01:b740:a41:e80::2:5","2001:6a8:3081:6f06:6929:a50d:93f0:6a7e","TCP","86","443  >  40566 [ACK] Seq=1 Ack=4237 Win=501 Len=0 TSval=629470 TSecr=69352910"
"20","5.783595952","2a01:b740:a41:e80::2:5","2001:6a8:3081:6f06:6929:a50d:93f0:6a7e","TLSv1.2","1868","Application Data"
"21","5.783597419","2a01:b740:a41:e80::2:5","2001:6a8:3081:6f06:6929:a50d:93f0:6a7e","TCP","440","[TCP Retransmission] 443  >  40566 [PSH, ACK] Seq=1429 Ack=4237 Win=501 Len=354 TSval=629799 TSecr=69352910"
"22","5.783673477","2001:6a8:3081:6f06:6929:a50d:93f0:6a7e","2a01:b740:a41:e80::2:5","TCP","98","40566  >  443 [ACK] Seq=4237 Ack=1783 Win=488 Len=0 TSval=69353258 TSecr=629751 SLE=1429 SRE=1783"
"23","5.798511087","192.168.166.19","130.104.1.1","DNS","93","Standard query 0x922b A cws.icloud-content.com OPT"
"24","5.798662434","192.168.166.19","130.104.1.1","DNS","93","Standard query 0xa0e8 AAAA cws.icloud-content.com OPT"
"25","5.855257546","130.104.1.1","192.168.166.19","DNS","329","Standard query response 0xa0e8 AAAA cws.icloud-content.com CNAME contentws.v.aaplimg.com CNAME ddeead2e-210c-4b2d-b7db-27fce9278350.apple.com CNAME ddeead2e-210c-4b2d-b7db-27fce9278350.apple.com.v.aaplimg.com SOA a.gslb.aaplimg.com OPT"
"26","5.856077418","192.168.166.19","130.104.1.1","DNS","131","Standard query 0x41c0 AAAA ddeead2e-210c-4b2d-b7db-27fce9278350.apple.com.v.aaplimg.com OPT"
"27","5.857961331","130.104.1.1","192.168.166.19","DNS","218","Standard query response 0x41c0 AAAA ddeead2e-210c-4b2d-b7db-27fce9278350.apple.com.v.aaplimg.com SOA a.gslb.aaplimg.com OPT"
"28","5.858884709","130.104.1.1","192.168.166.19","DNS","280","Standard query response 0x922b A cws.icloud-content.com CNAME contentws.v.aaplimg.com CNAME ddeead2e-210c-4b2d-b7db-27fce9278350.apple.com CNAME ddeead2e-210c-4b2d-b7db-27fce9278350.apple.com.v.aaplimg.com A 17.138.224.1 OPT"
"29","5.859654506","192.168.166.19","17.138.224.1","TCP","74","47270  >  443 [SYN] Seq=0 Win=64240 Len=0 MSS=1460 SACK_PERM=1 TSval=648516327 TSecr=0 WS=128"
"30","5.948594890","17.138.224.1","192.168.166.19","TCP","74","443  >  47270 [SYN, ACK] Seq=0 Ack=1 Win=65535 Len=0 MSS=1424 SACK_PERM=1 TSval=2712318315 TSecr=648516327 WS=512"
"31","5.948682611","192.168.166.19","17.138.224.1","TCP","66","47270  >  443 [ACK] Seq=1 Ack=1 Win=64256 Len=0 TSval=648516416 TSecr=2712318315"
"32","5.949220742","192.168.166.19","17.138.224.1","TLSv1.3","583","Client Hello"
"33","5.951030413","17.138.224.1","192.168.166.19","TCP","66","443  >  47270 [ACK] Seq=1 Ack=518 Win=1184768 Len=0 TSval=2712318315 TSecr=648516416"
"34","8.001184570","2001:6a8:3081:6f06:6929:a50d:93f0:6a7e","2a01:b740:a41:e80::2:2","TLSv1.2","3031","Application Data"
"35","8.004347286","2001:6a8:3081:6f06:6929:a50d:93f0:6a7e","2a01:b740:a41:e80::2:2","TLSv1.2","1800","Application Data"
"36","8.010336080","2a01:b740:a41:e80::2:2","2001:6a8:3081:6f06:6929:a50d:93f0:6a7e","TCP","86","443  >  43038 [ACK] Seq=654 Ack=9081 Win=2643 Len=0 TSval=1363760371 TSecr=2861955723"
"37","8.010337477","2a01:b740:a41:e80::2:2","2001:6a8:3081:6f06:6929:a50d:93f0:6a7e","TCP","86","443  >  43038 [ACK] Seq=654 Ack=10509 Win=2643 Len=0 TSval=1363760371 TSecr=2861955723"
"38","8.010338455","2a01:b740:a41:e80::2:2","2001:6a8:3081:6f06:6929:a50d:93f0:6a7e","TCP","86","443  >  43038 [ACK] Seq=654 Ack=10598 Win=2647 Len=0 TSval=1363760371 TSecr=2861955723"
"39","8.011505861","2a01:b740:a41:e80::2:2","2001:6a8:3081:6f06:6929:a50d:93f0:6a7e","TCP","86","443  >  43038 [ACK] Seq=654 Ack=12312 Win=2640 Len=0 TSval=1363760372 TSecr=2861955726"
"40","8.186232713","2a01:b740:a41:e80::2:2","2001:6a8:3081:6f06:6929:a50d:93f0:6a7e","TLSv1.2","719","Application Data"
"41","8.189293040","2001:6a8:3081:6f06:6929:a50d:93f0:6a7e","2a01:b740:a41:e80::2:2","TLSv1.2","121","Application Data"
"42","8.195841337","2a01:b740:a41:e80::2:2","2001:6a8:3081:6f06:6929:a50d:93f0:6a7e","TCP","86","443  >  43038 [ACK] Seq=1287 Ack=12347 Win=2647 Len=0 TSval=1363760556 TSecr=2861955911"
"43","9.126121902","17.138.224.1","192.168.166.19","TLSv1.3","2962","Server Hello, Change Cipher Spec, Application Data"
"44","9.126123299","17.138.224.1","192.168.166.19","TCP","1266","443  >  47270 [PSH, ACK] Seq=2897 Ack=518 Win=67072 Len=1200 TSval=2712321406 TSecr=648516416 [TCP segment of a reassembled PDU]"
"45","9.126124696","17.138.224.1","192.168.166.19","TCP","1514","443  >  47270 [ACK] Seq=4097 Ack=518 Win=67072 Len=1448 TSval=2712321407 TSecr=648516416 [TCP segment of a reassembled PDU]"
"46","9.126199148","192.168.166.19","17.138.224.1","TCP","66","47270  >  443 [ACK] Seq=518 Ack=2897 Win=61440 Len=0 TSval=648519593 TSecr=2712321406"
"47","9.126248316","192.168.166.19","17.138.224.1","TCP","66","47270  >  443 [ACK] Seq=518 Ack=4097 Win=60288 Len=0 TSval=648519593 TSecr=2712321406"
"48","9.126263053","192.168.166.19","17.138.224.1","TCP","66","47270  >  443 [ACK] Seq=518 Ack=5545 Win=58880 Len=0 TSval=648519593 TSecr=2712321407"
"49","9.126334501","17.138.224.1","192.168.166.19","TLSv1.3","1514","Application Data [TCP segment of a reassembled PDU]"
"50","9.126335968","17.138.224.1","192.168.166.19","TLSv1.3","312","Application Data, Application Data"
"51","9.126346095","192.168.166.19","17.138.224.1","TCP","66","47270  >  443 [ACK] Seq=518 Ack=6993 Win=57472 Len=0 TSval=648519593 TSecr=2712321407"
"52","9.126358806","192.168.166.19","17.138.224.1","TCP","66","47270  >  443 [ACK] Seq=518 Ack=7239 Win=57344 Len=0 TSval=648519593 TSecr=2712321407"
"53","9.130566285","192.168.166.19","17.138.224.1","TLSv1.3","146","Change Cipher Spec, Application Data"
"54","9.130901735","192.168.166.19","17.138.224.1","TLSv1.3","164","Application Data"
"55","9.131137242","192.168.166.19","17.138.224.1","TLSv1.3","755","Application Data"
"56","9.218736384","17.138.224.1","192.168.166.19","TCP","66","443  >  47270 [ACK] Seq=7239 Ack=598 Win=67072 Len=0 TSval=2712321586 TSecr=648519598"
"57","9.218797007","17.138.224.1","192.168.166.19","TCP","66","443  >  47270 [ACK] Seq=7239 Ack=696 Win=67072 Len=0 TSval=2712321586 TSecr=648519598"
"58","9.218798403","17.138.224.1","192.168.166.19","TLSv1.3","337","Application Data"
"59","9.219259429","17.138.224.1","192.168.166.19","TLSv1.3","337","Application Data"
"60","9.219260407","17.138.224.1","192.168.166.19","TLSv1.3","137","Application Data"
"61","9.219261804","17.138.224.1","192.168.166.19","TCP","66","443  >  47270 [ACK] Seq=7852 Ack=1385 Win=68096 Len=0 TSval=2712321586 TSecr=648519598"
"62","9.219316141","192.168.166.19","17.138.224.1","TCP","66","47270  >  443 [ACK] Seq=1385 Ack=7852 Win=64128 Len=0 TSval=648519686 TSecr=2712321586"
"63","9.219550390","192.168.166.19","17.138.224.1","TLSv1.3","97","Application Data"
"64","9.226612862","17.138.224.1","192.168.166.19","TLSv1.3","695","Application Data"
"65","9.230549285","192.168.166.19","17.138.224.1","TLSv1.3","620","Application Data"
"66","9.230761605","192.168.166.19","17.138.224.1","TLSv1.3","5819","Application Data"
"67","9.307453344","17.138.224.1","192.168.166.19","TCP","66","443  >  47270 [ACK] Seq=8481 Ack=1416 Win=68096 Len=0 TSval=2712321675 TSecr=648519687"
"68","9.319083400","17.138.224.1","192.168.166.19","TCP","66","443  >  47270 [ACK] Seq=8481 Ack=1970 Win=69632 Len=0 TSval=2712321686 TSecr=648519698"
"69","9.319160435","17.138.224.1","192.168.166.19","TCP","66","443  >  47270 [ACK] Seq=8481 Ack=7723 Win=80896 Len=0 TSval=2712321686 TSecr=648519698"
"70","9.320057274","17.138.224.1","192.168.166.19","TLSv1.3","101","Application Data"
"71","9.367433408","192.168.166.19","17.138.224.1","TCP","66","47270  >  443 [ACK] Seq=7723 Ack=8516 Win=64128 Len=0 TSval=648519835 TSecr=2712321687"
"72","9.543978801","17.138.224.1","192.168.166.19","TLSv1.3","851","Application Data"
"73","9.544047874","192.168.166.19","17.138.224.1","TCP","66","47270  >  443 [ACK] Seq=7723 Ack=9301 Win=63360 Len=0 TSval=648520011 TSecr=2712321901"
"74","9.553001942","2001:6a8:3081:6f06:6929:a50d:93f0:6a7e","2a01:b740:a41:e80::2:5","TLSv1.2","3917","Application Data"
"75","9.553694283","2001:6a8:3081:6f06:6929:a50d:93f0:6a7e","2a01:b740:a41:e80::2:5","TLSv1.2","784","Application Data"
"76","9.559722538","2a01:b740:a41:e80::2:5","2001:6a8:3081:6f06:6929:a50d:93f0:6a7e","TCP","86","443  >  40566 [ACK] Seq=1783 Ack=5665 Win=501 Len=0 TSval=633587 TSecr=69357027"
"77","9.559723935","2a01:b740:a41:e80::2:5","2001:6a8:3081:6f06:6929:a50d:93f0:6a7e","TCP","86","443  >  40566 [ACK] Seq=1783 Ack=7093 Win=501 Len=0 TSval=633587 TSecr=69357027"
"78","9.559724913","2a01:b740:a41:e80::2:5","2001:6a8:3081:6f06:6929:a50d:93f0:6a7e","TCP","86","443  >  40566 [ACK] Seq=1783 Ack=8068 Win=501 Len=0 TSval=633587 TSecr=69357027"
"79","9.560936389","2a01:b740:a41:e80::2:5","2001:6a8:3081:6f06:6929:a50d:93f0:6a7e","TCP","86","443  >  40566 [ACK] Seq=1783 Ack=8766 Win=501 Len=0 TSval=633588 TSecr=69357028"
"80","9.961647894","2a01:b740:a41:e80::2:5","2001:6a8:3081:6f06:6929:a50d:93f0:6a7e","TLSv1.2","2131","Application Data"
"81","9.961687913","2001:6a8:3081:6f06:6929:a50d:93f0:6a7e","2a01:b740:a41:e80::2:5","TCP","86","40566  >  443 [ACK] Seq=8766 Ack=3828 Win=486 Len=0 TSval=69357436 TSecr=633933"
"82","9.964432417","2a01:b740:a41:e80::2:5","2001:6a8:3081:6f06:6929:a50d:93f0:6a7e","TCP","703","[TCP Spurious Retransmission] 443  >  40566 [PSH, ACK] Seq=3211 Ack=8766 Win=501 Len=617 TSval=633992 TSecr=69357028"
"83","9.964450855","2001:6a8:3081:6f06:6929:a50d:93f0:6a7e","2a01:b740:a41:e80::2:5","TCP","98","[TCP Window Update] 40566  >  443 [ACK] Seq=8766 Ack=3828 Win=501 Len=0 TSval=69357439 TSecr=633992 SLE=3211 SRE=3828"
"84","9.979113581","2001:6a8:3081:6f06:6929:a50d:93f0:6a7e","2a01:b740:a41:e80::2:5","TLSv1.2","3972","Application Data"
"85","9.986397382","2a01:b740:a41:e80::2:5","2001:6a8:3081:6f06:6929:a50d:93f0:6a7e","TCP","86","443  >  40566 [ACK] Seq=3828 Ack=10194 Win=501 Len=0 TSval=634014 TSecr=69357453"
"86","9.986399268","2a01:b740:a41:e80::2:5","2001:6a8:3081:6f06:6929:a50d:93f0:6a7e","TCP","86","443  >  40566 [ACK] Seq=3828 Ack=11622 Win=496 Len=0 TSval=634014 TSecr=69357453"
"87","9.986400176","2a01:b740:a41:e80::2:5","2001:6a8:3081:6f06:6929:a50d:93f0:6a7e","TCP","86","443  >  40566 [ACK] Seq=3828 Ack=12652 Win=490 Len=0 TSval=634014 TSecr=69357453"
"88","10.029655085","192.168.166.19","130.104.1.1","DNS","91","Standard query 0x3988 A p50-docws.icloud.com OPT"
"89","10.029947792","192.168.166.19","130.104.1.1","DNS","91","Standard query 0x9ea2 AAAA p50-docws.icloud.com OPT"
"90","10.031685456","130.104.1.1","192.168.166.19","DNS","192","Standard query response 0x3988 A p50-docws.icloud.com CNAME docws.fe2.apple-dns.net A 17.248.236.66 A 17.248.236.65 A 17.248.236.69 A 17.248.236.68 OPT"
"91","10.031724637","130.104.1.1","192.168.166.19","DNS","240","Standard query response 0x9ea2 AAAA p50-docws.icloud.com CNAME docws.fe2.apple-dns.net AAAA 2a01:b740:a41:e80::2:3 AAAA 2a01:b740:a41:e80::2:6 AAAA 2a01:b740:a41:e80::2:1 AAAA 2a01:b740:a41:e80::2:2 OPT"
"92","10.032872208","2001:6a8:3081:6f06:6929:a50d:93f0:6a7e","2a01:b740:a41:e80::2:3","TCP","94","53456  >  443 [SYN] Seq=0 Win=64800 Len=0 MSS=1440 SACK_PERM=1 TSval=2372571418 TSecr=0 WS=128"
"93","10.032981022","192.168.166.19","130.104.1.1","DNS","91","Standard query 0x62d6 A p50-setup.icloud.com OPT"
"94","10.033122870","192.168.166.19","130.104.1.1","DNS","91","Standard query 0xccff AAAA p50-setup.icloud.com OPT"
"95","10.039529039","2a01:b740:a41:e80::2:3","2001:6a8:3081:6f06:6929:a50d:93f0:6a7e","TCP","94","443  >  53456 [SYN, ACK] Seq=0 Ack=1 Win=64260 Len=0 MSS=1440 SACK_PERM=1 TSval=1856784051 TSecr=2372571418 WS=128"
"96","10.039574855","2001:6a8:3081:6f06:6929:a50d:93f0:6a7e","2a01:b740:a41:e80::2:3","TCP","86","53456  >  443 [ACK] Seq=1 Ack=1 Win=64896 Len=0 TSval=2372571425 TSecr=1856784051"
"97","10.039855270","2001:6a8:3081:6f06:6929:a50d:93f0:6a7e","2a01:b740:a41:e80::2:3","TLSv1.2","628","Client Hello"
"98","10.041550051","2a01:b740:a41:e80::2:3","2001:6a8:3081:6f06:6929:a50d:93f0:6a7e","TCP","86","443  >  53456 [ACK] Seq=1 Ack=543 Win=1198080 Len=0 TSval=1856784051 TSecr=2372571425"
"99","10.047373949","2a01:b740:a41:e80::2:3","2001:6a8:3081:6f06:6929:a50d:93f0:6a7e","TLSv1.2","1514","Server Hello"
"100","10.047374927","2a01:b740:a41:e80::2:3","2001:6a8:3081:6f06:6929:a50d:93f0:6a7e","TCP","1326","[TCP Previous segment not captured] 443  >  53456 [PSH, ACK] Seq=2857 Ack=543 Win=64128 Len=1240 TSval=1856784058 TSecr=2372571425 [TCP segment of a reassembled PDU]"
"101","10.047375904","2a01:b740:a41:e80::2:3","2001:6a8:3081:6f06:6929:a50d:93f0:6a7e","TCP","1514","[TCP Out-Of-Order] 443  >  53456 [ACK] Seq=1429 Ack=543 Win=64128 Len=1428 TSval=1856784058 TSecr=2372571425 [TCP segment of a reassembled PDU]"
"102","10.047428705","2001:6a8:3081:6f06:6929:a50d:93f0:6a7e","2a01:b740:a41:e80::2:3","TCP","86","53456  >  443 [ACK] Seq=543 Ack=1429 Win=63488 Len=0 TSval=2372571432 TSecr=1856784058"
"103","10.047489188","2001:6a8:3081:6f06:6929:a50d:93f0:6a7e","2a01:b740:a41:e80::2:3","TCP","98","[TCP Dup ACK 102#1] 53456  >  443 [ACK] Seq=543 Ack=1429 Win=63488 Len=0 TSval=2372571433 TSecr=1856784058 SLE=2857 SRE=4097"
"104","10.047520896","2001:6a8:3081:6f06:6929:a50d:93f0:6a7e","2a01:b740:a41:e80::2:3","TCP","86","53456  >  443 [ACK] Seq=543 Ack=4097 Win=60928 Len=0 TSval=2372571433 TSecr=1856784058"
"105","10.047883165","2a01:b740:a41:e80::2:3","2001:6a8:3081:6f06:6929:a50d:93f0:6a7e","TLSv1.2","783","[TCP Previous segment not captured] , Ignored Unknown Record"
"106","10.047884143","2a01:b740:a41:e80::2:3","2001:6a8:3081:6f06:6929:a50d:93f0:6a7e","TCP","1514","[TCP Out-Of-Order] 443  >  53456 [ACK] Seq=4097 Ack=543 Win=64128 Len=1428 TSval=1856784058 TSecr=2372571425"
"107","10.047902232","2001:6a8:3081:6f06:6929:a50d:93f0:6a7e","2a01:b740:a41:e80::2:3","TCP","98","[TCP Window Update] 53456  >  443 [ACK] Seq=543 Ack=4097 Win=63104 Len=0 TSval=2372571433 TSecr=1856784058 SLE=5525 SRE=6222"
"108","10.047925629","2001:6a8:3081:6f06:6929:a50d:93f0:6a7e","2a01:b740:a41:e80::2:3","TCP","86","53456  >  443 [ACK] Seq=543 Ack=6222 Win=61056 Len=0 TSval=2372571433 TSecr=1856784058"
"109","10.048814017","2001:6a8:3081:6f06:6929:a50d:93f0:6a7e","2a01:b740:a41:e80::2:3","TLSv1.2","179","Client Key Exchange, Change Cipher Spec, Encrypted Handshake Message"
"110","10.048924926","130.104.1.1","192.168.166.19","DNS","268","Standard query response 0xccff AAAA p50-setup.icloud.com CNAME setup.fe2.apple-dns.net AAAA 2a01:b740:a41:e80::2:4 AAAA 2a01:b740:a41:e80::2:5 AAAA 2a01:b740:a41:e80::2:2 AAAA 2a01:b740:a41:e80::2:1 AAAA 2a01:b740:a41:e80::2:6 OPT"
"111","10.049047428","2001:6a8:3081:6f06:6929:a50d:93f0:6a7e","2a01:b740:a41:e80::2:3","TLSv1.2","4121","Application Data"
"112","10.049144927","2001:6a8:3081:6f06:6929:a50d:93f0:6a7e","2a01:b740:a41:e80::2:3","TLSv1.2","169","Application Data"
"113","10.050003353","130.104.1.1","192.168.166.19","DNS","176","Standard query response 0x62d6 A p50-setup.icloud.com CNAME setup.fe2.apple-dns.net A 17.248.236.69 A 17.248.236.66 A 17.248.236.68 OPT"
"114","10.050573960","2001:6a8:3081:6f06:6929:a50d:93f0:6a7e","2a01:b740:a41:e80::2:4","TCP","94","46320  >  443 [SYN] Seq=0 Win=64800 Len=0 MSS=1440 SACK_PERM=1 TSval=842878592 TSecr=0 WS=128"
"115","10.056034192","2a01:b740:a41:e80::2:3","2001:6a8:3081:6f06:6929:a50d:93f0:6a7e","TCP","86","443  >  53456 [ACK] Seq=6222 Ack=636 Win=64128 Len=0 TSval=1856784066 TSecr=2372571434"
"116","10.056035170","2a01:b740:a41:e80::2:3","2001:6a8:3081:6f06:6929:a50d:93f0:6a7e","TLSv1.2","376","New Session Ticket, Change Cipher Spec, Encrypted Handshake Message"
"117","10.056036147","2a01:b740:a41:e80::2:3","2001:6a8:3081:6f06:6929:a50d:93f0:6a7e","TCP","86","443  >  53456 [ACK] Seq=6512 Ack=2064 Win=64128 Len=0 TSval=1856784067 TSecr=2372571434"
"118","10.056037055","2a01:b740:a41:e80::2:3","2001:6a8:3081:6f06:6929:a50d:93f0:6a7e","TCP","86","443  >  53456 [ACK] Seq=6512 Ack=3492 Win=64128 Len=0 TSval=1856784067 TSecr=2372571434"
"119","10.056038033","2a01:b740:a41:e80::2:3","2001:6a8:3081:6f06:6929:a50d:93f0:6a7e","TCP","86","443  >  53456 [ACK] Seq=6512 Ack=4671 Win=63616 Len=0 TSval=1856784067 TSecr=2372571434"
"120","10.056038522","2a01:b740:a41:e80::2:3","2001:6a8:3081:6f06:6929:a50d:93f0:6a7e","TCP","86","443  >  53456 [ACK] Seq=6512 Ack=4754 Win=63616 Len=0 TSval=1856784067 TSecr=2372571434"
"121","10.058105839","2a01:b740:a41:e80::2:4","2001:6a8:3081:6f06:6929:a50d:93f0:6a7e","TCP","94","443  >  46320 [SYN, ACK] Seq=0 Ack=1 Win=64260 Len=0 MSS=1440 SACK_PERM=1 TSval=1421467711 TSecr=842878592 WS=128"
"122","10.058140620","2001:6a8:3081:6f06:6929:a50d:93f0:6a7e","2a01:b740:a41:e80::2:4","TCP","86","46320  >  443 [ACK] Seq=1 Ack=1 Win=64896 Len=0 TSval=842878599 TSecr=1421467711"
"123","10.058388489","2001:6a8:3081:6f06:6929:a50d:93f0:6a7e","2a01:b740:a41:e80::2:4","TLSv1.2","628","Client Hello"
"124","10.059860894","2a01:b740:a41:e80::2:4","2001:6a8:3081:6f06:6929:a50d:93f0:6a7e","TCP","86","443  >  46320 [ACK] Seq=1 Ack=543 Win=1198080 Len=0 TSval=1421467711 TSecr=842878599"
"125","10.065422466","2a01:b740:a41:e80::2:4","2001:6a8:3081:6f06:6929:a50d:93f0:6a7e","TLSv1.2","1326","[TCP Previous segment not captured] , Ignored Unknown Record"
"126","10.065423863","2a01:b740:a41:e80::2:4","2001:6a8:3081:6f06:6929:a50d:93f0:6a7e","TCP","1514","[TCP Out-Of-Order] 443  >  46320 [ACK] Seq=1 Ack=543 Win=64128 Len=1428 TSval=1421467718 TSecr=842878599"
"127","10.065488746","2001:6a8:3081:6f06:6929:a50d:93f0:6a7e","2a01:b740:a41:e80::2:4","TCP","98","[TCP Dup ACK 122#1] 46320  >  443 [ACK] Seq=543 Ack=1 Win=64896 Len=0 TSval=842878607 TSecr=1421467711 SLE=2857 SRE=4097"
"128","10.065551324","2001:6a8:3081:6f06:6929:a50d:93f0:6a7e","2a01:b740:a41:e80::2:4","TCP","98","46320  >  443 [ACK] Seq=543 Ack=1429 Win=63488 Len=0 TSval=842878607 TSecr=1421467718 SLE=2857 SRE=4097"
"129","10.065574092","2a01:b740:a41:e80::2:4","2001:6a8:3081:6f06:6929:a50d:93f0:6a7e","TCP","1514","[TCP Out-Of-Order] 443  >  46320 [ACK] Seq=1429 Ack=543 Win=64128 Len=1428 TSval=1421467718 TSecr=842878599"
"130","10.065586105","2001:6a8:3081:6f06:6929:a50d:93f0:6a7e","2a01:b740:a41:e80::2:4","TCP","86","46320  >  443 [ACK] Seq=543 Ack=4097 Win=60928 Len=0 TSval=842878607 TSecr=1421467718"
"131","10.066091550","2a01:b740:a41:e80::2:4","2001:6a8:3081:6f06:6929:a50d:93f0:6a7e","TLSv1.2","506","[TCP Previous segment not captured] , Ignored Unknown Record"
"132","10.066092458","2a01:b740:a41:e80::2:4","2001:6a8:3081:6f06:6929:a50d:93f0:6a7e","TCP","2942","[TCP Out-Of-Order] 443  >  46320 [ACK] Seq=4097 Ack=543 Win=64128 Len=2856 TSval=1421467719 TSecr=842878599"
"133","10.066100630","2001:6a8:3081:6f06:6929:a50d:93f0:6a7e","2a01:b740:a41:e80::2:4","TCP","98","[TCP Window Update] 46320  >  443 [ACK] Seq=543 Ack=4097 Win=63104 Len=0 TSval=842878607 TSecr=1421467718 SLE=6953 SRE=7373"
"134","10.066112014","2001:6a8:3081:6f06:6929:a50d:93f0:6a7e","2a01:b740:a41:e80::2:4","TCP","86","46320  >  443 [ACK] Seq=543 Ack=7373 Win=59904 Len=0 TSval=842878607 TSecr=1421467719"
"135","10.066793041","2001:6a8:3081:6f06:6929:a50d:93f0:6a7e","2a01:b740:a41:e80::2:4","TLSv1.2","179","Client Key Exchange, Change Cipher Spec, Encrypted Handshake Message"
"136","10.066998655","2001:6a8:3081:6f06:6929:a50d:93f0:6a7e","2a01:b740:a41:e80::2:4","TLSv1.2","3956","Application Data"
"137","10.073989191","2a01:b740:a41:e80::2:4","2001:6a8:3081:6f06:6929:a50d:93f0:6a7e","TCP","86","443  >  46320 [ACK] Seq=7373 Ack=636 Win=64128 Len=0 TSval=1421467726 TSecr=842878608"
"138","10.073990168","2a01:b740:a41:e80::2:4","2001:6a8:3081:6f06:6929:a50d:93f0:6a7e","TLSv1.2","376","New Session Ticket, Change Cipher Spec, Encrypted Handshake Message"
"139","10.073991146","2a01:b740:a41:e80::2:4","2001:6a8:3081:6f06:6929:a50d:93f0:6a7e","TCP","86","443  >  46320 [ACK] Seq=7663 Ack=2064 Win=64128 Len=0 TSval=1421467727 TSecr=842878608"
"140","10.073992543","2a01:b740:a41:e80::2:4","2001:6a8:3081:6f06:6929:a50d:93f0:6a7e","TCP","86","443  >  46320 [ACK] Seq=7663 Ack=4506 Win=62720 Len=0 TSval=1421467727 TSecr=842878608"
"141","10.099647600","2001:6a8:3081:6f06:6929:a50d:93f0:6a7e","2a01:b740:a41:e80::2:3","TCP","86","53456  >  443 [ACK] Seq=4754 Ack=6512 Win=64128 Len=0 TSval=2372571485 TSecr=1856784067"
"142","10.115497217","2001:6a8:3081:6f06:6929:a50d:93f0:6a7e","2a01:b740:a41:e80::2:4","TCP","86","46320  >  443 [ACK] Seq=4506 Ack=7663 Win=64128 Len=0 TSval=842878657 TSecr=1421467727"
"143","10.379643917","2a01:b740:a41:e80::2:3","2001:6a8:3081:6f06:6929:a50d:93f0:6a7e","TLSv1.2","692","[TCP Previous segment not captured] , Ignored Unknown Record"
"144","10.379708730","2001:6a8:3081:6f06:6929:a50d:93f0:6a7e","2a01:b740:a41:e80::2:3","TCP","98","[TCP Dup ACK 141#1] 53456  >  443 [ACK] Seq=4754 Ack=6512 Win=64128 Len=0 TSval=2372571765 TSecr=1856784067 SLE=7940 SRE=8546"
"145","10.380918320","2a01:b740:a41:e80::2:3","2001:6a8:3081:6f06:6929:a50d:93f0:6a7e","TCP","1514","[TCP Out-Of-Order] 443  >  53456 [ACK] Seq=6512 Ack=4754 Win=64128 Len=1428 TSval=1856784358 TSecr=2372571485"
"146","10.380919298","2a01:b740:a41:e80::2:3","2001:6a8:3081:6f06:6929:a50d:93f0:6a7e","TCP","692","[TCP Retransmission] 443  >  53456 [PSH, ACK] Seq=7940 Ack=4754 Win=64128 Len=606 TSval=1856784385 TSecr=2372571485"
"147","10.380981317","2001:6a8:3081:6f06:6929:a50d:93f0:6a7e","2a01:b740:a41:e80::2:3","TCP","86","53456  >  443 [ACK] Seq=4754 Ack=8546 Win=62208 Len=0 TSval=2372571766 TSecr=1856784358"
"148","10.381020918","2001:6a8:3081:6f06:6929:a50d:93f0:6a7e","2a01:b740:a41:e80::2:3","TCP","98","[TCP Dup ACK 147#1] 53456  >  443 [ACK] Seq=4754 Ack=8546 Win=62208 Len=0 TSval=2372571766 TSecr=1856784385 SLE=7940 SRE=8546"
"149","10.386689138","2a01:b740:a41:e80::2:3","2001:6a8:3081:6f06:6929:a50d:93f0:6a7e","TCP","1514","[TCP Spurious Retransmission] 443  >  53456 [ACK] Seq=6512 Ack=4754 Win=64128 Len=1428 TSval=1856784398 TSecr=2372571765"
"150","10.386703595","2001:6a8:3081:6f06:6929:a50d:93f0:6a7e","2a01:b740:a41:e80::2:3","TCP","98","[TCP Window Update] 53456  >  443 [ACK] Seq=4754 Ack=8546 Win=64128 Len=0 TSval=2372571772 TSecr=1856784385 SLE=6512 SRE=7940"
"151","10.483377631","2a01:b740:a41:e80::2:5","2001:6a8:3081:6f06:6929:a50d:93f0:6a7e","TCP","1514","443  >  40566 [ACK] Seq=3828 Ack=12652 Win=501 Len=1428 TSval=634511 TSecr=69357453 [TCP segment of a reassembled PDU]"
"152","10.483379028","2a01:b740:a41:e80::2:5","2001:6a8:3081:6f06:6929:a50d:93f0:6a7e","TCP","651","[TCP Previous segment not captured] 443  >  40566 [PSH, ACK] Seq=6684 Ack=12652 Win=501 Len=565 TSval=634511 TSecr=69357453 [TCP segment of a reassembled PDU]"
"153","10.483476178","2001:6a8:3081:6f06:6929:a50d:93f0:6a7e","2a01:b740:a41:e80::2:5","TCP","98","40566  >  443 [ACK] Seq=12652 Ack=5256 Win=490 Len=0 TSval=69357958 TSecr=634511 SLE=6684 SRE=7249"
"154","10.483599658","2a01:b740:a41:e80::2:5","2001:6a8:3081:6f06:6929:a50d:93f0:6a7e","TCP","1514","[TCP Out-Of-Order] 443  >  40566 [ACK] Seq=5256 Ack=12652 Win=501 Len=1428 TSval=634511 TSecr=69357453"
"155","10.483612439","2001:6a8:3081:6f06:6929:a50d:93f0:6a7e","2a01:b740:a41:e80::2:5","TCP","86","40566  >  443 [ACK] Seq=12652 Ack=7249 Win=475 Len=0 TSval=69357958 TSecr=634511"
"156","10.493611480","2001:6a8:3081:6f06:6929:a50d:93f0:6a7e","2a01:b740:a41:e80::2:5","TLSv1.2","4121","Application Data"
"157","10.494676218","2001:6a8:3081:6f06:6929:a50d:93f0:6a7e","2a01:b740:a41:e80::2:5","TLSv1.2","169","Application Data"
"158","10.501334027","2a01:b740:a41:e80::2:5","2001:6a8:3081:6f06:6929:a50d:93f0:6a7e","TCP","86","443  >  40566 [ACK] Seq=7249 Ack=14080 Win=501 Len=0 TSval=634528 TSecr=69357968"
"159","10.501335493","2a01:b740:a41:e80::2:5","2001:6a8:3081:6f06:6929:a50d:93f0:6a7e","TCP","86","443  >  40566 [ACK] Seq=7249 Ack=16687 Win=482 Len=0 TSval=634528 TSecr=69357968"
"160","10.501336401","2a01:b740:a41:e80::2:5","2001:6a8:3081:6f06:6929:a50d:93f0:6a7e","TCP","86","443  >  40566 [ACK] Seq=7249 Ack=16770 Win=501 Len=0 TSval=634529 TSecr=69357969"
"161","10.523121664","2a01:b740:a41:e80::2:4","2001:6a8:3081:6f06:6929:a50d:93f0:6a7e","TLSv1.2","1466","Application Data"
"162","10.523150718","2001:6a8:3081:6f06:6929:a50d:93f0:6a7e","2a01:b740:a41:e80::2:4","TCP","86","46320  >  443 [ACK] Seq=4506 Ack=9043 Win=63104 Len=0 TSval=842879064 TSecr=1421468176"
"163","10.901733409","2a01:b740:a41:e80::2:5","2001:6a8:3081:6f06:6929:a50d:93f0:6a7e","TLSv1.2","2123","Application Data"
"164","10.902016757","2001:6a8:3081:6f06:6929:a50d:93f0:6a7e","2a01:b740:a41:e80::2:5","TCP","86","40566  >  443 [ACK] Seq=16770 Ack=9286 Win=501 Len=0 TSval=69358376 TSecr=634918"
"165","15.425118598","2001:6a8:3081:6f06:6929:a50d:93f0:6a7e","2a01:b740:a41:e80::2:1","TLSv1.2","3054","Application Data"
"166","15.427585969","2001:6a8:3081:6f06:6929:a50d:93f0:6a7e","2a01:b740:a41:e80::2:1","TLSv1.2","198","Application Data, Application Data"
"167","15.434569660","2a01:b740:a41:e80::2:1","2001:6a8:3081:6f06:6929:a50d:93f0:6a7e","TCP","86","443  >  41750 [ACK] Seq=1 Ack=1429 Win=955 Len=0 TSval=2360620689 TSecr=4014086797"
"168","15.434571057","2a01:b740:a41:e80::2:1","2001:6a8:3081:6f06:6929:a50d:93f0:6a7e","TCP","86","443  >  41750 [ACK] Seq=1 Ack=2969 Win=945 Len=0 TSval=2360620689 TSecr=4014086797"
"169","15.434572035","2a01:b740:a41:e80::2:1","2001:6a8:3081:6f06:6929:a50d:93f0:6a7e","TCP","86","443  >  41750 [ACK] Seq=1 Ack=3081 Win=960 Len=0 TSval=2360620690 TSecr=4014086800"
"170","15.434573501","2a01:b740:a41:e80::2:1","2001:6a8:3081:6f06:6929:a50d:93f0:6a7e","TLSv1.2","132","Application Data"
"171","15.475681125","2001:6a8:3081:6f06:6929:a50d:93f0:6a7e","2a01:b740:a41:e80::2:1","TCP","86","41750  >  443 [ACK] Seq=3081 Ack=47 Win=6293 Len=0 TSval=4014086848 TSecr=2360620690"
"172","16.001238821","2001:6a8:3081:6f06:6929:a50d:93f0:6a7e","2a01:b740:a41:e80::2:2","TLSv1.2","3033","Application Data"
"173","16.001393311","2001:6a8:3081:6f06:6929:a50d:93f0:6a7e","2a01:b740:a41:e80::2:2","TLSv1.2","6054","Application Data"
"174","16.010200920","2a01:b740:a41:e80::2:2","2001:6a8:3081:6f06:6929:a50d:93f0:6a7e","TCP","86","443  >  43038 [ACK] Seq=1287 Ack=13775 Win=2643 Len=0 TSval=1363768370 TSecr=2861963723"
"175","16.010201898","2a01:b740:a41:e80::2:2","2001:6a8:3081:6f06:6929:a50d:93f0:6a7e","TCP","86","443  >  43038 [ACK] Seq=1287 Ack=15294 Win=2641 Len=0 TSval=1363768370 TSecr=2861963723"
"176","16.010203365","2a01:b740:a41:e80::2:2","2001:6a8:3081:6f06:6929:a50d:93f0:6a7e","TCP","86","443  >  43038 [ACK] Seq=1287 Ack=16722 Win=2633 Len=0 TSval=1363768370 TSecr=2861963723"
"177","16.010204343","2a01:b740:a41:e80::2:2","2001:6a8:3081:6f06:6929:a50d:93f0:6a7e","TCP","86","443  >  43038 [ACK] Seq=1287 Ack=18150 Win=2643 Len=0 TSval=1363768370 TSecr=2861963723"
"178","16.010205739","2a01:b740:a41:e80::2:2","2001:6a8:3081:6f06:6929:a50d:93f0:6a7e","TCP","86","443  >  43038 [ACK] Seq=1287 Ack=19578 Win=2635 Len=0 TSval=1363768370 TSecr=2861963723"
"179","16.010206717","2a01:b740:a41:e80::2:2","2001:6a8:3081:6f06:6929:a50d:93f0:6a7e","TCP","86","443  >  43038 [ACK] Seq=1287 Ack=21262 Win=2640 Len=0 TSval=1363768371 TSecr=2861963723"
"180","16.333051465","2a01:b740:a41:e80::2:2","2001:6a8:3081:6f06:6929:a50d:93f0:6a7e","TLSv1.2","678","Application Data"
"181","16.333052443","Fortinet_93:32:4a","IntelCor_85:a6:01","ARP","60","Who has 192.168.166.19? Tell 192.168.167.253"
"182","16.333052443","2a01:b740:a41:e80::2:2","2001:6a8:3081:6f06:6929:a50d:93f0:6a7e","TLSv1.2","117","Application Data"
"183","16.333071370","IntelCor_85:a6:01","Fortinet_93:32:4a","ARP","42","192.168.166.19 is at c0:3c:59:85:a6:01"
"184","16.333221111","2001:6a8:3081:6f06:6929:a50d:93f0:6a7e","2a01:b740:a41:e80::2:2","TCP","86","43038  >  443 [ACK] Seq=21262 Ack=1910 Win=2238 Len=0 TSval=2861964055 TSecr=1363768594"
"185","16.335294434","2001:6a8:3081:6f06:6929:a50d:93f0:6a7e","2a01:b740:a41:e80::2:2","TLSv1.2","121","Application Data"
"186","16.341959646","2a01:b740:a41:e80::2:2","2001:6a8:3081:6f06:6929:a50d:93f0:6a7e","TCP","86","443  >  43038 [ACK] Seq=1910 Ack=21297 Win=2647 Len=0 TSval=1363768702 TSecr=2861964057"
"187","16.367347628","2001:6a8:3081:6f06:6929:a50d:93f0:6a7e","2a01:b740:a41:e80::2:1","TLSv1.2","3060","Application Data"
"188","16.368242720","2001:6a8:3081:6f06:6929:a50d:93f0:6a7e","2a01:b740:a41:e80::2:1","TLSv1.2","218","Application Data"
"189","16.374416316","2a01:b740:a41:e80::2:1","2001:6a8:3081:6f06:6929:a50d:93f0:6a7e","TCP","86","443  >  41750 [ACK] Seq=47 Ack=6055 Win=960 Len=0 TSval=2360621630 TSecr=4014087739"
"190","16.416349191","2a01:b740:a41:e80::2:1","2001:6a8:3081:6f06:6929:a50d:93f0:6a7e","TCP","86","443  >  41750 [ACK] Seq=47 Ack=6187 Win=960 Len=0 TSval=2360621672 TSecr=4014087740"
"191","17.030308930","2001:6a8:3081:6f06:6929:a50d:93f0:6a7e","2a01:b740:a41:e80::2:5","TLSv1.2","4854","Application Data"
"192","17.039121498","2a01:b740:a41:e80::2:5","2001:6a8:3081:6f06:6929:a50d:93f0:6a7e","TCP","86","443  >  40566 [ACK] Seq=9286 Ack=18198 Win=501 Len=0 TSval=641066 TSecr=69364504"
"193","17.039122895","2a01:b740:a41:e80::2:5","2001:6a8:3081:6f06:6929:a50d:93f0:6a7e","TCP","86","443  >  40566 [ACK] Seq=9286 Ack=19626 Win=501 Len=0 TSval=641066 TSecr=69364504"
"194","17.039123803","2a01:b740:a41:e80::2:5","2001:6a8:3081:6f06:6929:a50d:93f0:6a7e","TCP","86","443  >  40566 [ACK] Seq=9286 Ack=21538 Win=500 Len=0 TSval=641067 TSecr=69364504"
"195","17.124837496","2a01:b740:a41:e80::2:1","2001:6a8:3081:6f06:6929:a50d:93f0:6a7e","TLSv1.2","1277","Application Data"
"196","17.124838962","2a01:b740:a41:e80::2:1","2001:6a8:3081:6f06:6929:a50d:93f0:6a7e","TLSv1.2","968","Application Data"
"197","17.124839870","2a01:b740:a41:e80::2:1","2001:6a8:3081:6f06:6929:a50d:93f0:6a7e","TLSv1.2","124","Application Data"
"198","17.124910061","2001:6a8:3081:6f06:6929:a50d:93f0:6a7e","2a01:b740:a41:e80::2:1","TCP","86","41750  >  443 [ACK] Seq=6187 Ack=1238 Win=6315 Len=0 TSval=4014088497 TSecr=2360622380"
"199","17.124962512","2001:6a8:3081:6f06:6929:a50d:93f0:6a7e","2a01:b740:a41:e80::2:1","TCP","86","41750  >  443 [ACK] Seq=6187 Ack=2120 Win=6315 Len=0 TSval=4014088497 TSecr=2360622380"
"200","17.124976341","2001:6a8:3081:6f06:6929:a50d:93f0:6a7e","2a01:b740:a41:e80::2:1","TCP","86","41750  >  443 [ACK] Seq=6187 Ack=2158 Win=6315 Len=0 TSval=4014088497 TSecr=2360622380"
"201","17.130522757","2001:6a8:3081:6f06:6929:a50d:93f0:6a7e","2a01:b740:a41:e80::2:1","TLSv1.2","128","Application Data"
"202","17.137150744","2a01:b740:a41:e80::2:1","2001:6a8:3081:6f06:6929:a50d:93f0:6a7e","TCP","86","443  >  41750 [ACK] Seq=2158 Ack=6229 Win=960 Len=0 TSval=2360622393 TSecr=4014088503"
"203","17.156336076","2001:6a8:3081:6f06:6929:a50d:93f0:6a7e","2a01:b740:a41:e80::2:1","TLSv1.2","3052","Application Data"
"204","17.157484973","2001:6a8:3081:6f06:6929:a50d:93f0:6a7e","2a01:b740:a41:e80::2:1","TLSv1.2","185","Application Data"
"205","17.164214859","2a01:b740:a41:e80::2:1","2001:6a8:3081:6f06:6929:a50d:93f0:6a7e","TCP","86","443  >  41750 [ACK] Seq=2158 Ack=7657 Win=955 Len=0 TSval=2360622419 TSecr=4014088528"
"206","17.164216325","2a01:b740:a41:e80::2:1","2001:6a8:3081:6f06:6929:a50d:93f0:6a7e","TCP","86","443  >  41750 [ACK] Seq=2158 Ack=9195 Win=952 Len=0 TSval=2360622419 TSecr=4014088528"
"207","17.164217233","2a01:b740:a41:e80::2:1","2001:6a8:3081:6f06:6929:a50d:93f0:6a7e","TCP","86","443  >  41750 [ACK] Seq=2158 Ack=9294 Win=960 Len=0 TSval=2360622420 TSecr=4014088530"
"208","17.377483417","2a01:b740:a41:e80::2:5","2001:6a8:3081:6f06:6929:a50d:93f0:6a7e","TLSv1.2","1260","Application Data"
"209","17.382815628","2001:6a8:3081:6f06:6929:a50d:93f0:6a7e","2a01:b740:a41:e80::2:5","TLSv1.2","3951","Application Data"
"210","17.390380891","2a01:b740:a41:e80::2:5","2001:6a8:3081:6f06:6929:a50d:93f0:6a7e","TCP","86","443  >  40566 [ACK] Seq=10460 Ack=22966 Win=501 Len=0 TSval=641418 TSecr=69364857"
"211","17.390382288","2a01:b740:a41:e80::2:5","2001:6a8:3081:6f06:6929:a50d:93f0:6a7e","TCP","86","443  >  40566 [ACK] Seq=10460 Ack=24394 Win=496 Len=0 TSval=641418 TSecr=69364857"
"212","17.390383685","2a01:b740:a41:e80::2:5","2001:6a8:3081:6f06:6929:a50d:93f0:6a7e","TCP","86","443  >  40566 [ACK] Seq=10460 Ack=25403 Win=501 Len=0 TSval=641418 TSecr=69364857"
"213","17.476896228","2a01:b740:a41:e80::2:1","2001:6a8:3081:6f06:6929:a50d:93f0:6a7e","TLSv1.2","1130","Application Data"
"214","17.476897695","2a01:b740:a41:e80::2:1","2001:6a8:3081:6f06:6929:a50d:93f0:6a7e","TLSv1.2","124","Application Data"
"215","17.477197805","2001:6a8:3081:6f06:6929:a50d:93f0:6a7e","2a01:b740:a41:e80::2:1","TCP","86","41750  >  443 [ACK] Seq=9294 Ack=3240 Win=6338 Len=0 TSval=4014088849 TSecr=2360622731"
"216","17.691277855","2a01:b740:a41:e80::2:5","2001:6a8:3081:6f06:6929:a50d:93f0:6a7e","TLSv1.2","403","[TCP Previous segment not captured] , Ignored Unknown Record"
"217","17.691279252","2a01:b740:a41:e80::2:5","2001:6a8:3081:6f06:6929:a50d:93f0:6a7e","TCP","1514","[TCP Out-Of-Order] 443  >  40566 [ACK] Seq=10460 Ack=25403 Win=501 Len=1428 TSval=641690 TSecr=69364857"
"218","17.691335544","2001:6a8:3081:6f06:6929:a50d:93f0:6a7e","2a01:b740:a41:e80::2:5","TCP","98","[TCP Dup ACK 209#1] 40566  >  443 [ACK] Seq=25403 Ack=10460 Win=501 Len=0 TSval=69365165 TSecr=641418 SLE=11888 SRE=12205"
"219","17.691417818","2001:6a8:3081:6f06:6929:a50d:93f0:6a7e","2a01:b740:a41:e80::2:5","TCP","86","40566  >  443 [ACK] Seq=25403 Ack=12205 Win=488 Len=0 TSval=69365165 TSecr=641690"
