"No.","Time","Source","Destination","Protocol","Length","Info"
"1","0.000000000","42:12:ae:b4:8f:f3","IPv4mcast_fb","TDLS","63","TDLS Discovery Request, Dialog Token=18[Malformed Packet]"
"2","0.000000908","42:12:ae:b4:8f:f3","IPv4mcast_fb","TDLS","63","TDLS Discovery Request, Dialog Token=18[Malformed Packet]"
"3","0.929472121","Cisco_74:bd:55","Broadcast","ARP","60","Gratuitous ARP for 0.0.0.0 (Request)"
"4","0.929473029","Cisco_74:bd:55","Broadcast","ARP","60","Gratuitous ARP for 0.0.0.0 (Request)"
"5","1.023756407","Cisco_74:bd:55","Broadcast","ARP","60","Gratuitous ARP for 0.0.0.0 (Reply)"
"6","1.023759759","Cisco_74:bd:55","Broadcast","ARP","60","Gratuitous ARP for 0.0.0.0 (Reply)"
"7","1.023763111","Cisco_74:bd:55","Broadcast","ARP","60","Gratuitous ARP for 0.0.0.0 (Reply)"
"8","1.023766324","Cisco_74:bd:55","Broadcast","ARP","60","Gratuitous ARP for 0.0.0.0 (Reply)"
"9","1.023769676","42:12:ae:b4:8f:f3","IPv4mcast_fb","TDLS","63","TDLS Discovery Request, Dialog Token=18[Malformed Packet]"
"10","1.023772540","42:12:ae:b4:8f:f3","IPv4mcast_fb","TDLS","63","TDLS Discovery Request, Dialog Token=18[Malformed Packet]"
"11","1.737920593","Cisco_74:bd:55","Broadcast","ARP","60","Gratuitous ARP for 0.0.0.0 (Request)"
"12","1.748480183","Cisco_74:bd:55","Broadcast","ARP","60","Gratuitous ARP for 0.0.0.0 (Request)"
"13","1.748482068","Cisco_74:bd:55","Broadcast","ARP","60","Gratuitous ARP for 0.0.0.0 (Reply)"
"14","1.748483046","Cisco_74:bd:55","Broadcast","ARP","60","Gratuitous ARP for 0.0.0.0 (Reply)"
"15","1.748484513","Cisco_74:bd:55","Broadcast","ARP","60","Gratuitous ARP for 0.0.0.0 (Reply)"
"16","1.748485490","Cisco_74:bd:55","Broadcast","ARP","60","Gratuitous ARP for 0.0.0.0 (Reply)"
"17","2.047462984","42:12:ae:b4:8f:f3","IPv4mcast_fb","TDLS","63","TDLS Discovery Request, Dialog Token=18[Malformed Packet]"
"18","2.047463892","42:12:ae:b4:8f:f3","IPv4mcast_fb","TDLS","63","TDLS Discovery Request, Dialog Token=18[Malformed Packet]"
"19","3.080643625","42:12:ae:b4:8f:f3","IPv4mcast_fb","TDLS","63","TDLS Discovery Request, Dialog Token=18[Malformed Packet]"
"20","3.080644603","42:12:ae:b4:8f:f3","IPv4mcast_fb","TDLS","63","TDLS Discovery Request, Dialog Token=18[Malformed Packet]"
"21","3.250853502","192.168.166.195","130.104.1.1","DNS","95","Standard query 0x56f5 A detectportal.firefox.com OPT"
"22","3.250954279","192.168.166.195","130.104.1.1","DNS","95","Standard query 0xf5ca AAAA detectportal.firefox.com OPT"
"23","3.254791356","130.104.1.1","192.168.166.195","DNS","209","Standard query response 0x56f5 A detectportal.firefox.com CNAME detectportal.prod.mozaws.net CNAME prod.detectportal.prod.cloudops.mozgcp.net A 34.107.221.82 OPT"
"24","3.254837310","130.104.1.1","192.168.166.195","DNS","221","Standard query response 0xf5ca AAAA detectportal.firefox.com CNAME detectportal.prod.mozaws.net CNAME prod.detectportal.prod.cloudops.mozgcp.net AAAA 2600:1901:0:38d7:: OPT"
"25","3.255826924","2001:6a8:3081:6f19:e0f8:f791:d194:4c92","2600:1901:0:38d7::","TCP","94","49376  >  80 [SYN] Seq=0 Win=64800 Len=0 MSS=1440 SACK_PERM=1 TSval=918446161 TSecr=0 WS=128"
"26","3.300867432","192.168.166.195","130.104.1.1","DNS","99","Standard query 0x8c77 A contile.services.mozilla.com OPT"
"27","3.300968908","192.168.166.195","130.104.1.1","DNS","99","Standard query 0xfd82 AAAA contile.services.mozilla.com OPT"
"28","3.304155996","130.104.1.1","192.168.166.195","DNS","115","Standard query response 0x8c77 A contile.services.mozilla.com A 34.117.237.239 OPT"
"29","3.304191195","130.104.1.1","192.168.166.195","DNS","183","Standard query response 0xfd82 AAAA contile.services.mozilla.com SOA ns-679.awsdns-20.net OPT"
"30","3.304676993","192.168.166.195","34.117.237.239","TCP","74","41684  >  443 [SYN] Seq=0 Win=64240 Len=0 MSS=1460 SACK_PERM=1 TSval=683477480 TSecr=0 WS=128"
"31","3.315202312","34.117.237.239","192.168.166.195","TCP","74","443  >  41684 [SYN, ACK] Seq=0 Ack=1 Win=65535 Len=0 MSS=1412 SACK_PERM=1 TSval=4160710074 TSecr=683477480 WS=256"
"32","3.315247148","192.168.166.195","34.117.237.239","TCP","66","41684  >  443 [ACK] Seq=1 Ack=1 Win=64256 Len=0 TSval=683477490 TSecr=4160710074"
"33","3.316856651","192.168.166.195","34.117.237.239","TLSv1.2","742","Client Hello"
"34","3.320065599","34.117.237.239","192.168.166.195","TCP","66","443  >  41684 [ACK] Seq=1 Ack=677 Win=1174784 Len=0 TSval=4160710074 TSecr=683477492"
"35","3.329082612","34.117.237.239","192.168.166.195","TLSv1.2","714","[TCP Previous segment not captured] , Ignored Unknown Record"
"36","3.329111246","192.168.166.195","34.117.237.239","TCP","78","[TCP Dup ACK 32#1] 41684  >  443 [ACK] Seq=677 Ack=1 Win=64256 Len=0 TSval=683477504 TSecr=4160710074 SLE=1401 SRE=2049"
"37","3.329083590","34.117.237.239","192.168.166.195","TLSv1.2","714","[TCP Previous segment not captured] , Ignored Unknown Record"
"38","3.329133524","192.168.166.195","34.117.237.239","TCP","86","[TCP Dup ACK 32#2] 41684  >  443 [ACK] Seq=677 Ack=1 Win=64256 Len=0 TSval=683477504 TSecr=4160710074 SLE=3449 SRE=4097 SLE=1401 SRE=2049"
"39","3.329084497","34.117.237.239","192.168.166.195","TLSv1.2","485","Ignored Unknown Record"
"40","3.329142743","192.168.166.195","34.117.237.239","TCP","86","[TCP Dup ACK 32#3] 41684  >  443 [ACK] Seq=677 Ack=1 Win=64256 Len=0 TSval=683477504 TSecr=4160710074 SLE=3449 SRE=4516 SLE=1401 SRE=2049"
"41","3.329085475","34.117.237.239","192.168.166.195","TCP","1466","[TCP Out-Of-Order] 443  >  41684 [ACK] Seq=1 Ack=677 Win=67072 Len=1400 TSval=4160710088 TSecr=683477492"
"42","3.329154127","192.168.166.195","34.117.237.239","TCP","78","41684  >  443 [ACK] Seq=677 Ack=2049 Win=62208 Len=0 TSval=683477504 TSecr=4160710088 SLE=3449 SRE=4516"
"43","3.329086453","34.117.237.239","192.168.166.195","TCP","1466","[TCP Out-Of-Order] 443  >  41684 [ACK] Seq=2049 Ack=677 Win=67072 Len=1400 TSval=4160710088 TSecr=683477492"
"44","3.329163136","192.168.166.195","34.117.237.239","TCP","66","41684  >  443 [ACK] Seq=677 Ack=4516 Win=59776 Len=0 TSval=683477504 TSecr=4160710088"
"45","3.338724402","34.117.237.239","192.168.166.195","TCP","1466","[TCP Spurious Retransmission] 443  >  41684 [ACK] Seq=1 Ack=677 Win=67072 Len=1400 TSval=4160710099 TSecr=683477504"
"46","3.338755899","192.168.166.195","34.117.237.239","TCP","78","[TCP Window Update] 41684  >  443 [ACK] Seq=677 Ack=4516 Win=64128 Len=0 TSval=683477514 TSecr=4160710088 SLE=1 SRE=1401"
"47","3.338725379","34.117.237.239","192.168.166.195","TCP","1466","[TCP Spurious Retransmission] 443  >  41684 [ACK] Seq=2049 Ack=677 Win=67072 Len=1400 TSval=4160710099 TSecr=683477504"
"48","3.338779923","192.168.166.195","34.117.237.239","TCP","78","[TCP Dup ACK 44#1] 41684  >  443 [ACK] Seq=677 Ack=4516 Win=64128 Len=0 TSval=683477514 TSecr=4160710088 SLE=2049 SRE=3449"
"49","3.374233255","192.168.166.195","130.104.1.1","DNS","85","Standard query 0x310d A r3.o.lencr.org OPT"
"50","3.374332845","192.168.166.195","130.104.1.1","DNS","85","Standard query 0x3ac5 AAAA r3.o.lencr.org OPT"
"51","3.378618706","130.104.1.1","192.168.166.195","DNS","211","Standard query response 0x3ac5 AAAA r3.o.lencr.org CNAME o.lencr.edgesuite.net CNAME a1887.dscq.akamai.net AAAA 2a02:26f0:9100:15::6010:7a9c AAAA 2a02:26f0:9100:15::6010:7a8b OPT"
"52","3.378639518","130.104.1.1","192.168.166.195","DNS","187","Standard query response 0x310d A r3.o.lencr.org CNAME o.lencr.edgesuite.net CNAME a1887.dscq.akamai.net A 96.17.206.28 A 96.17.206.24 OPT"
"53","3.379794929","2001:6a8:3081:6f19:e0f8:f791:d194:4c92","2a02:26f0:9100:15::6010:7a9c","TCP","94","56692  >  80 [SYN] Seq=0 Win=64800 Len=0 MSS=1440 SACK_PERM=1 TSval=3027961593 TSecr=0 WS=128"
"54","3.380035383","192.168.166.195","130.104.1.1","DNS","106","Standard query 0xa2de A content-signature-2.cdn.mozilla.net OPT"
"55","3.380190774","192.168.166.195","130.104.1.1","DNS","106","Standard query 0x05a8 AAAA content-signature-2.cdn.mozilla.net OPT"
"56","3.385251076","130.104.1.1","192.168.166.195","DNS","266","Standard query response 0xa2de A content-signature-2.cdn.mozilla.net CNAME content-signature-chains.prod.autograph.services.mozaws.net CNAME prod.content-signature-chains.prod.webservices.mozgcp.net A 34.160.144.191 OPT"
"57","3.385315607","130.104.1.1","192.168.166.195","DNS","278","Standard query response 0x05a8 AAAA content-signature-2.cdn.mozilla.net CNAME content-signature-chains.prod.autograph.services.mozaws.net CNAME prod.content-signature-chains.prod.webservices.mozgcp.net AAAA 2600:1901:0:92a9:: OPT"
"58","3.508914654","192.168.166.195","34.107.221.82","TCP","74","47636  >  80 [SYN] Seq=0 Win=64240 Len=0 MSS=1460 SACK_PERM=1 TSval=2718176461 TSecr=0 WS=128"
"59","3.518841735","34.107.221.82","192.168.166.195","TCP","74","80  >  47636 [SYN, ACK] Seq=0 Ack=1 Win=65535 Len=0 MSS=1412 SACK_PERM=1 TSval=4273158031 TSecr=2718176461 WS=256"
"60","3.518886432","192.168.166.195","34.107.221.82","TCP","66","47636  >  80 [ACK] Seq=1 Ack=1 Win=64256 Len=0 TSval=2718176471 TSecr=4273158031"
"61","3.519387454","192.168.166.195","34.107.221.82","HTTP","367","GET /canonical.html HTTP/1.1 "
"62","3.528455938","34.107.221.82","192.168.166.195","TCP","66","80  >  47636 [ACK] Seq=1 Ack=302 Win=66816 Len=0 TSval=4273158041 TSecr=2718176471"
"63","3.528457335","34.107.221.82","192.168.166.195","TCP","66","[TCP Dup ACK 62#1] 80  >  47636 [ACK] Seq=1 Ack=302 Win=66816 Len=0 TSval=4273158041 TSecr=2718176471"
"64","3.528458313","34.107.221.82","192.168.166.195","HTTP","364","HTTP/1.1 200 OK  (text/html)"
"65","3.528491766","192.168.166.195","34.107.221.82","TCP","66","47636  >  80 [ACK] Seq=302 Ack=299 Win=64000 Len=0 TSval=2718176481 TSecr=4273158042"
"66","3.579633032","192.168.166.195","130.104.1.1","DNS","82","Standard query 0x943f A example.org OPT"
"67","3.579762722","192.168.166.195","130.104.1.1","DNS","82","Standard query 0x483b AAAA example.org OPT"
"68","3.580124137","192.168.166.195","130.104.1.1","DNS","84","Standard query 0xa3a4 A ipv4only.arpa OPT"
"69","3.580203335","192.168.166.195","130.104.1.1","DNS","84","Standard query 0xae58 AAAA ipv4only.arpa OPT"
"70","3.580760927","192.168.166.195","34.107.221.82","TCP","74","47644  >  80 [SYN] Seq=0 Win=64240 Len=0 MSS=1460 SACK_PERM=1 TSval=2718176533 TSecr=0 WS=128"
"71","3.581390243","2001:6a8:3081:6f19:e0f8:f791:d194:4c92","2600:1901:0:38d7::","TCP","94","49390  >  80 [SYN] Seq=0 Win=64800 Len=0 MSS=1440 SACK_PERM=1 TSval=918446486 TSecr=0 WS=128"
"72","3.584511963","130.104.1.1","192.168.166.195","DNS","116","Standard query response 0xa3a4 A ipv4only.arpa A 192.0.0.170 A 192.0.0.171 OPT"
"73","3.584524534","130.104.1.1","192.168.166.195","DNS","98","Standard query response 0x943f A example.org A 93.184.216.34 OPT"
"74","3.584540527","130.104.1.1","192.168.166.195","DNS","141","Standard query response 0xae58 AAAA ipv4only.arpa SOA sns.dns.icann.org OPT"
"75","3.584525930","130.104.1.1","192.168.166.195","DNS","110","Standard query response 0x483b AAAA example.org AAAA 2606:2800:220:1:248:1893:25c8:1946 OPT"
"76","3.591201252","34.107.221.82","192.168.166.195","TCP","74","80  >  47644 [SYN, ACK] Seq=0 Ack=1 Win=65535 Len=0 MSS=1412 SACK_PERM=1 TSval=3318306579 TSecr=2718176533 WS=256"
"77","3.591246717","192.168.166.195","34.107.221.82","TCP","66","47644  >  80 [ACK] Seq=1 Ack=1 Win=64256 Len=0 TSval=2718176543 TSecr=3318306579"
"78","3.591378293","192.168.166.195","34.107.221.82","HTTP","369","GET /success.txt?ipv4 HTTP/1.1 "
"79","3.601254741","34.107.221.82","192.168.166.195","TCP","66","80  >  47644 [ACK] Seq=1 Ack=304 Win=66816 Len=0 TSval=3318306589 TSecr=2718176543"
"80","3.601255719","34.107.221.82","192.168.166.195","HTTP","282","HTTP/1.1 200 OK  (text/plain)"
"81","3.601290568","192.168.166.195","34.107.221.82","TCP","66","47644  >  80 [ACK] Seq=304 Ack=217 Win=64128 Len=0 TSval=2718176553 TSecr=3318306590"
"82","3.647576020","192.168.166.195","96.17.206.28","TCP","74","40924  >  80 [SYN] Seq=0 Win=64240 Len=0 MSS=1460 SACK_PERM=1 TSval=2965338709 TSecr=0 WS=128"
"83","3.657852714","96.17.206.28","192.168.166.195","TCP","74","80  >  40924 [SYN, ACK] Seq=0 Ack=1 Win=65160 Len=0 MSS=1460 SACK_PERM=1 TSval=1325612605 TSecr=2965338709 WS=128"
"84","3.657902439","192.168.166.195","96.17.206.28","TCP","66","40924  >  80 [ACK] Seq=1 Ack=1 Win=64256 Len=0 TSval=2965338719 TSecr=1325612605"
"85","3.658139960","192.168.166.195","96.17.206.28","OCSP","489","Request"
"86","3.668552699","96.17.206.28","192.168.166.195","TCP","66","80  >  40924 [ACK] Seq=1 Ack=424 Win=64768 Len=0 TSval=1325612615 TSecr=2965338719"
"87","3.668554585","96.17.206.28","192.168.166.195","OCSP","954","Response"
"88","3.668598025","192.168.166.195","96.17.206.28","TCP","66","40924  >  80 [ACK] Seq=424 Ack=889 Win=63488 Len=0 TSval=2965338730 TSecr=1325612616"
"89","3.677684108","192.168.166.195","34.117.237.239","TLSv1.2","130","Change Cipher Spec, Application Data"
"90","3.678199867","192.168.166.195","34.117.237.239","TLSv1.2","236","Application Data"
"91","3.678256645","192.168.166.195","34.117.237.239","TLSv1.2","253","Application Data"
"92","3.687713014","34.117.237.239","192.168.166.195","TLSv1.2","684","Application Data, Application Data"
"93","3.687757012","192.168.166.195","34.117.237.239","TCP","66","41684  >  443 [ACK] Seq=1098 Ack=5134 Win=63616 Len=0 TSval=683477863 TSecr=4160710447"
"94","3.687713991","34.117.237.239","192.168.166.195","TCP","66","443  >  41684 [ACK] Seq=5134 Ack=1098 Win=69632 Len=0 TSval=4160710448 TSecr=683477853"
"95","3.687714969","34.117.237.239","192.168.166.195","TLSv1.2","97","Application Data"
"96","3.687795074","192.168.166.195","34.117.237.239","TCP","66","41684  >  443 [ACK] Seq=1098 Ack=5165 Win=63616 Len=0 TSval=683477863 TSecr=4160710448"
"97","3.688420340","192.168.166.195","34.117.237.239","TLSv1.2","97","Application Data"
"98","3.702795936","34.117.237.239","192.168.166.195","TCP","66","443  >  41684 [ACK] Seq=5165 Ack=1129 Win=69632 Len=0 TSval=4160710463 TSecr=683477863"
"99","3.823212878","34.117.237.239","192.168.166.195","TLSv1.2","264","Application Data"
"100","3.823652582","192.168.166.195","34.117.237.239","TLSv1.2","105","Application Data"
"101","3.832566452","2001:6a8:3081:6f19:e0f8:f791:d194:4c92","2600:1901:0:38d7::","TCP","94","49402  >  80 [SYN] Seq=0 Win=64800 Len=0 MSS=1440 SACK_PERM=1 TSval=918446738 TSecr=0 WS=128"
"102","3.832789796","34.117.237.239","192.168.166.195","TCP","66","443  >  41684 [ACK] Seq=5363 Ack=1168 Win=69632 Len=0 TSval=4160710593 TSecr=683477999"
"103","3.862117325","192.168.166.195","130.104.1.1","DNS","96","Standard query 0x8d95 A push.services.mozilla.com OPT"
"104","3.862220686","192.168.166.195","130.104.1.1","DNS","96","Standard query 0x0972 AAAA push.services.mozilla.com OPT"
"105","3.865496473","130.104.1.1","192.168.166.195","DNS","219","Standard query response 0x0972 AAAA push.services.mozilla.com CNAME autopush.prod.mozaws.net SOA ns-1260.awsdns-29.org OPT"
"106","3.865539005","130.104.1.1","192.168.166.195","DNS","150","Standard query response 0x8d95 A push.services.mozilla.com CNAME autopush.prod.mozaws.net A 34.107.243.93 OPT"
"107","3.865812214","192.168.166.195","130.104.1.1","DNS","95","Standard query 0x831f AAAA autopush.prod.mozaws.net OPT"
"108","3.869027939","130.104.1.1","192.168.166.195","DNS","180","Standard query response 0x831f AAAA autopush.prod.mozaws.net SOA ns-1260.awsdns-29.org OPT"
"109","3.888725262","192.168.166.195","130.104.1.1","DNS","95","Standard query 0xc656 AAAA autopush.prod.mozaws.net OPT"
"110","3.888875904","Cisco_74:bd:55","Broadcast","ARP","60","Gratuitous ARP for 0.0.0.0 (Request)"
"111","3.888876882","Cisco_74:bd:55","Broadcast","ARP","60","Gratuitous ARP for 0.0.0.0 (Request)"
"112","3.888877860","Cisco_74:bd:55","Broadcast","ARP","60","Gratuitous ARP for 0.0.0.0 (Reply)"
"113","3.888878768","Cisco_74:bd:55","Broadcast","ARP","60","Gratuitous ARP for 0.0.0.0 (Reply)"
"114","3.888931426","Cisco_74:bd:55","Broadcast","ARP","60","Gratuitous ARP for 0.0.0.0 (Reply)"
"115","3.889387822","Cisco_74:bd:55","Broadcast","ARP","60","Gratuitous ARP for 0.0.0.0 (Reply)"
"116","3.892445573","130.104.1.1","192.168.166.195","DNS","180","Standard query response 0xc656 AAAA autopush.prod.mozaws.net SOA ns-1260.awsdns-29.org OPT"
"117","3.893200041","192.168.166.195","34.107.243.93","TCP","74","60756  >  443 [SYN] Seq=0 Win=64240 Len=0 MSS=1460 SACK_PERM=1 TSval=1642825719 TSecr=0 WS=128"
"118","3.903326521","34.107.243.93","192.168.166.195","TCP","74","443  >  60756 [SYN, ACK] Seq=0 Ack=1 Win=65535 Len=0 MSS=1412 SACK_PERM=1 TSval=2165719368 TSecr=1642825719 WS=256"
"119","3.903371287","192.168.166.195","34.107.243.93","TCP","66","60756  >  443 [ACK] Seq=1 Ack=1 Win=64256 Len=0 TSval=1642825729 TSecr=2165719368"
"120","3.904917657","192.168.166.195","34.107.243.93","TLSv1.3","739","Client Hello"
"121","3.905597328","192.168.166.195","130.104.1.1","DNS","101","Standard query 0xf203 A incoming.telemetry.mozilla.org OPT"
"122","3.905757119","192.168.166.195","130.104.1.1","DNS","101","Standard query 0xa0b3 AAAA incoming.telemetry.mozilla.org OPT"
"123","3.907806537","130.104.1.1","192.168.166.195","DNS","245","Standard query response 0xa0b3 AAAA incoming.telemetry.mozilla.org CNAME telemetry-incoming.r53-2.services.mozilla.com SOA ns-1507.awsdns-60.org OPT"
"124","3.907835590","130.104.1.1","192.168.166.195","DNS","176","Standard query response 0xf203 A incoming.telemetry.mozilla.org CNAME telemetry-incoming.r53-2.services.mozilla.com A 34.120.208.123 OPT"
"125","3.907836568","34.107.243.93","192.168.166.195","TCP","66","443  >  60756 [ACK] Seq=1 Ack=674 Win=1174784 Len=0 TSval=2165719368 TSecr=1642825731"
"126","3.908087429","192.168.166.195","130.104.1.1","DNS","116","Standard query 0x288f AAAA telemetry-incoming.r53-2.services.mozilla.com OPT"
"127","3.911478589","130.104.1.1","192.168.166.195","DNS","201","Standard query response 0x288f AAAA telemetry-incoming.r53-2.services.mozilla.com SOA ns-1507.awsdns-60.org OPT"
"128","3.912088980","192.168.166.195","34.120.208.123","TCP","74","34506  >  443 [SYN] Seq=0 Win=64240 Len=0 MSS=1460 SACK_PERM=1 TSval=43793608 TSecr=0 WS=128"
"129","3.917121351","34.107.243.93","192.168.166.195","TLSv1.3","2114","Server Hello, Change Cipher Spec"
"130","3.917179247","192.168.166.195","34.107.243.93","TCP","66","60756  >  443 [ACK] Seq=674 Ack=2049 Win=62208 Len=0 TSval=1642825743 TSecr=2165719383"
"131","3.918356519","34.107.243.93","192.168.166.195","TLSv1.3","1095","Application Data"
"132","3.918380474","192.168.166.195","34.107.243.93","TCP","66","60756  >  443 [ACK] Seq=674 Ack=3078 Win=63104 Len=0 TSval=1642825744 TSecr=2165719383"
"133","3.920650443","192.168.166.195","96.17.206.28","OCSP","489","Request"
"134","3.921474471","34.120.208.123","192.168.166.195","TCP","74","443  >  34506 [SYN, ACK] Seq=0 Ack=1 Win=65535 Len=0 MSS=1412 SACK_PERM=1 TSval=3599439997 TSecr=43793608 WS=256"
"135","3.921497727","192.168.166.195","34.120.208.123","TCP","66","34506  >  443 [ACK] Seq=1 Ack=1 Win=64256 Len=0 TSval=43793618 TSecr=3599439997"
"136","3.922238437","192.168.166.195","34.120.208.123","TLSv1.2","744","Client Hello"
"137","3.924940009","34.120.208.123","192.168.166.195","TCP","66","443  >  34506 [ACK] Seq=1 Ack=679 Win=1174784 Len=0 TSval=3599439997 TSecr=43793618"
"138","3.930882240","96.17.206.28","192.168.166.195","TCP","66","80  >  40924 [ACK] Seq=889 Ack=847 Win=64384 Len=0 TSval=1325612878 TSecr=2965338982"
"139","3.930883148","96.17.206.28","192.168.166.195","OCSP","954","Response"
"140","3.930914435","192.168.166.195","96.17.206.28","TCP","66","40924  >  80 [ACK] Seq=847 Ack=1777 Win=63360 Len=0 TSval=2965338992 TSecr=1325612879"
"141","3.935908954","34.120.208.123","192.168.166.195","TLSv1.2","714","[TCP Previous segment not captured] , Ignored Unknown Record"
"142","3.935935144","192.168.166.195","34.120.208.123","TCP","78","[TCP Dup ACK 135#1] 34506  >  443 [ACK] Seq=679 Ack=1 Win=64256 Len=0 TSval=43793632 TSecr=3599439997 SLE=1401 SRE=2049"
"143","3.935909862","34.120.208.123","192.168.166.195","TCP","1466","[TCP Out-Of-Order] 443  >  34506 [ACK] Seq=1 Ack=679 Win=67072 Len=1400 TSval=3599440010 TSecr=43793618"
"144","3.935959168","192.168.166.195","34.120.208.123","TCP","66","34506  >  443 [ACK] Seq=679 Ack=2049 Win=62208 Len=0 TSval=43793632 TSecr=3599440010"
"145","3.935911259","34.120.208.123","192.168.166.195","TLSv1.2","130","[TCP Previous segment not captured] , Ignored Unknown Record"
"146","3.935966920","192.168.166.195","34.120.208.123","TCP","78","[TCP Dup ACK 144#1] 34506  >  443 [ACK] Seq=679 Ack=2049 Win=62208 Len=0 TSval=43793632 TSecr=3599440010 SLE=3449 SRE=3513"
"147","3.935912167","34.120.208.123","192.168.166.195","TCP","1466","[TCP Out-Of-Order] 443  >  34506 [ACK] Seq=2049 Ack=679 Win=67072 Len=1400 TSval=3599440010 TSecr=43793618"
"148","3.935977955","192.168.166.195","34.120.208.123","TCP","66","34506  >  443 [ACK] Seq=679 Ack=3513 Win=60800 Len=0 TSval=43793632 TSecr=3599440010"
"149","3.936979582","192.168.166.195","34.107.243.93","TLSv1.3","130","Change Cipher Spec, Application Data"
"150","3.937266131","192.168.166.195","34.107.243.93","TLSv1.3","236","Application Data"
"151","3.938185628","192.168.166.195","130.104.1.1","DNS","108","Standard query 0x0b5a A firefox.settings.services.mozilla.com OPT"
"152","3.938364555","192.168.166.195","130.104.1.1","DNS","108","Standard query 0xb5d9 AAAA firefox.settings.services.mozilla.com OPT"
"153","3.941232413","192.168.166.195","130.104.1.1","DNS","88","Standard query 0x27a2 A ocsp.digicert.com OPT"
"154","3.941330118","192.168.166.195","130.104.1.1","DNS","88","Standard query 0xcc3d AAAA ocsp.digicert.com OPT"
"155","3.942390340","130.104.1.1","192.168.166.195","DNS","186","Standard query response 0x0b5a A firefox.settings.services.mozilla.com CNAME prod.remote-settings.prod.webservices.mozgcp.net A 34.149.100.209 OPT"
"156","3.942420859","130.104.1.1","192.168.166.195","DNS","266","Standard query response 0xb5d9 AAAA firefox.settings.services.mozilla.com CNAME prod.remote-settings.prod.webservices.mozgcp.net SOA ns-cloud-a1.googledomains.com OPT"
"157","3.943065192","130.104.1.1","192.168.166.195","DNS","265","Standard query response 0xcc3d AAAA ocsp.digicert.com CNAME ocsp.edge.digicert.com CNAME fp2e7a.wpc.2be4.phicdn.net CNAME fp2e7a.wpc.phicdn.net SOA ns1.phicdn.net OPT"
"158","3.943136148","192.168.166.195","130.104.1.1","DNS","119","Standard query 0xa74a AAAA prod.remote-settings.prod.webservices.mozgcp.net OPT"
"159","3.943510204","192.168.166.195","130.104.1.1","DNS","92","Standard query 0x50cb AAAA fp2e7a.wpc.phicdn.net OPT"
"160","3.945398155","130.104.1.1","192.168.166.195","DNS","215","Standard query response 0xa74a AAAA prod.remote-settings.prod.webservices.mozgcp.net SOA ns-cloud-a1.googledomains.com OPT"
"161","3.945414009","130.104.1.1","192.168.166.195","DNS","215","Standard query response 0x27a2 A ocsp.digicert.com CNAME ocsp.edge.digicert.com CNAME fp2e7a.wpc.2be4.phicdn.net CNAME fp2e7a.wpc.phicdn.net A 192.229.221.95 OPT"
"162","3.945422389","130.104.1.1","192.168.166.195","DNS","158","Standard query response 0x50cb AAAA fp2e7a.wpc.phicdn.net SOA ns1.phicdn.net OPT"
"163","3.945804966","34.107.243.93","192.168.166.195","TLSv1.3","684","Application Data, Application Data"
"164","3.945806363","34.107.243.93","192.168.166.195","TLSv1.3","97","Application Data"
"165","3.946209053","192.168.166.195","34.107.243.93","TLSv1.3","97","Application Data"
"166","3.946462358","192.168.166.195","192.229.221.95","TCP","74","44772  >  80 [SYN] Seq=0 Win=64240 Len=0 MSS=1460 SACK_PERM=1 TSval=2461992327 TSecr=0 WS=128"
"167","3.947132322","192.168.166.195","130.104.1.1","DNS","95","Standard query 0xef0e AAAA autopush.prod.mozaws.net OPT"
"168","3.950925264","130.104.1.1","192.168.166.195","DNS","180","Standard query response 0xef0e AAAA autopush.prod.mozaws.net SOA ns-1260.awsdns-29.org OPT"
"169","3.952105469","192.168.166.195","34.107.243.93","TCP","74","60770  >  443 [SYN] Seq=0 Win=64240 Len=0 MSS=1460 SACK_PERM=1 TSval=1642825778 TSecr=0 WS=128"
"170","3.954350785","192.229.221.95","192.168.166.195","TCP","74","80  >  44772 [SYN, ACK] Seq=0 Ack=1 Win=65535 Len=0 MSS=1460 SACK_PERM=1 TSval=4257635327 TSecr=2461992327 WS=512"
"171","3.954400092","192.168.166.195","192.229.221.95","TCP","66","44772  >  80 [ACK] Seq=1 Ack=1 Win=64256 Len=0 TSval=2461992334 TSecr=4257635327"
"172","3.954558486","192.168.166.195","192.229.221.95","OCSP","490","Request"
"173","3.960836990","34.107.243.93","192.168.166.195","TCP","66","443  >  60756 [ACK] Seq=3727 Ack=939 Win=67072 Len=0 TSval=2165719427 TSecr=1642825772"
"174","3.960836990","34.107.243.93","192.168.166.195","TCP","74","443  >  60770 [SYN, ACK] Seq=0 Ack=1 Win=65535 Len=0 MSS=1412 SACK_PERM=1 TSval=2314606811 TSecr=1642825778 WS=256"
"175","3.960877078","192.168.166.195","34.107.243.93","TCP","66","60770  >  443 [ACK] Seq=1 Ack=1 Win=64256 Len=0 TSval=1642825787 TSecr=2314606811"
"176","3.961645304","192.229.221.95","192.168.166.195","TCP","66","80  >  44772 [ACK] Seq=1 Ack=425 Win=67072 Len=0 TSval=4257635335 TSecr=2461992335"
"177","3.961985000","192.168.166.195","34.107.243.93","TLSv1.3","1312","Client Hello"
"178","3.963215977","192.229.221.95","192.168.166.195","OCSP","803","Response"
"179","3.963228898","192.168.166.195","192.229.221.95","TCP","66","44772  >  80 [ACK] Seq=425 Ack=738 Win=63616 Len=0 TSval=2461992343 TSecr=4257635336"
"180","3.964018145","34.107.243.93","192.168.166.195","TCP","66","443  >  60770 [ACK] Seq=1 Ack=1247 Win=1174784 Len=0 TSval=2314606811 TSecr=1642825788"
"181","3.972975594","34.107.243.93","192.168.166.195","TLSv1.3","284","Server Hello, Change Cipher Spec, Application Data"
"182","3.973018056","192.168.166.195","34.107.243.93","TCP","66","60770  >  443 [ACK] Seq=1247 Ack=219 Win=64128 Len=0 TSval=1642825799 TSecr=2314606822"
"183","3.974087846","192.168.166.195","34.107.243.93","TLSv1.3","130","Change Cipher Spec, Application Data"
"184","3.974308327","192.168.166.195","34.107.243.93","TLSv1.3","690","Application Data"
"185","3.974983738","192.168.166.195","34.120.208.123","TLSv1.2","130","Change Cipher Spec, Application Data"
"186","3.975347039","192.168.166.195","34.120.208.123","TLSv1.2","236","Application Data"
"187","3.975389571","192.168.166.195","34.120.208.123","TLSv1.2","466","Application Data"
"188","3.975891781","192.168.166.195","34.120.208.123","TLSv1.2","937","Application Data"
"189","3.983639693","34.107.243.93","192.168.166.195","TCP","66","443  >  60770 [ACK] Seq=219 Ack=1935 Win=70656 Len=0 TSval=2314606833 TSecr=1642825800"
"190","3.983639693","34.120.208.123","192.168.166.195","TLSv1.2","684","Application Data, Application Data"
"191","3.983679361","192.168.166.195","34.120.208.123","TCP","66","34506  >  443 [ACK] Seq=2184 Ack=4131 Win=63616 Len=0 TSval=43793680 TSecr=3599440060"
"192","3.983641160","34.120.208.123","192.168.166.195","TLSv1.2","97","Application Data"
"193","3.983706319","192.168.166.195","34.120.208.123","TCP","66","34506  >  443 [ACK] Seq=2184 Ack=4162 Win=63616 Len=0 TSval=43793680 TSecr=3599440060"
"194","3.984191699","192.168.166.195","34.120.208.123","TLSv1.2","97","Application Data"
"195","3.990838882","34.120.208.123","192.168.166.195","TCP","66","443  >  34506 [ACK] Seq=4162 Ack=2184 Win=71424 Len=0 TSval=3599440066 TSecr=43793672"
"196","3.993247411","34.120.208.123","192.168.166.195","TCP","66","443  >  34506 [ACK] Seq=4162 Ack=2215 Win=71424 Len=0 TSval=3599440069 TSecr=43793680"
"197","4.114955410","192.168.166.195","130.104.1.1","DNS","85","Standard query 0x50b8 A darkreader.org OPT"
"198","4.115114154","192.168.166.195","130.104.1.1","DNS","85","Standard query 0xa445 AAAA darkreader.org OPT"
"199","4.118869873","34.107.243.93","192.168.166.195","TLSv1.3","898","Application Data, Application Data"
"200","4.118870850","130.104.1.1","192.168.166.195","DNS","156","Standard query response 0xa445 AAAA darkreader.org SOA ns15.domaincontrol.com OPT"
"201","4.124132153","192.168.166.195","34.107.243.93","TLSv1.3","205","Application Data"
"202","4.126505972","130.104.1.1","192.168.166.195","DNS","149","Standard query response 0x50b8 A darkreader.org A 185.199.110.153 A 185.199.108.153 A 185.199.109.153 A 185.199.111.153 OPT"
"203","4.127080257","192.168.166.195","185.199.110.153","TCP","74","38010  >  443 [SYN] Seq=0 Win=64240 Len=0 MSS=1460 SACK_PERM=1 TSval=1856388678 TSecr=0 WS=128"
"204","4.135037335","185.199.110.153","192.168.166.195","TCP","74","443  >  38010 [SYN, ACK] Seq=0 Ack=1 Win=65535 Len=0 MSS=1396 SACK_PERM=1 TSval=1736664037 TSecr=1856388678 WS=512"
"205","4.135071696","192.168.166.195","185.199.110.153","TCP","66","38010  >  443 [ACK] Seq=1 Ack=1 Win=64256 Len=0 TSval=1856388686 TSecr=1736664037"
"206","4.135939582","192.168.166.195","185.199.110.153","TLSv1.3","728","Client Hello"
"207","4.138399792","185.199.110.153","192.168.166.195","TCP","66","443  >  38010 [ACK] Seq=1 Ack=663 Win=1161216 Len=0 TSval=1736664037 TSecr=1856388687"
"208","4.138400700","34.107.243.93","192.168.166.195","TCP","66","443  >  60770 [ACK] Seq=1051 Ack=2074 Win=73216 Len=0 TSval=2314606989 TSecr=1642825950"
"209","4.205538721","42:12:ae:b4:8f:f3","IPv4mcast_fb","TDLS","63","TDLS Discovery Request, Dialog Token=18[Malformed Packet]"
"210","4.205540118","42:12:ae:b4:8f:f3","IPv4mcast_fb","TDLS","63","TDLS Discovery Request, Dialog Token=18[Malformed Packet]"
"211","4.211433322","34.120.208.123","192.168.166.195","TLSv1.2","515","Application Data"
"212","4.212100142","34.120.208.123","192.168.166.195","TLSv1.2","307","Application Data"
"213","4.212163556","192.168.166.195","34.120.208.123","TCP","66","34506  >  443 [ACK] Seq=2215 Ack=4852 Win=64128 Len=0 TSval=43793908 TSecr=3599440287"
"214","4.212461627","34.120.208.123","192.168.166.195","TLSv1.2","105","Application Data"
"215","4.212545574","192.168.166.195","34.120.208.123","TLSv1.2","105","Application Data"
"216","4.213939136","192.168.166.195","34.120.208.123","TLSv1.2","190","Application Data"
"217","4.213980690","192.168.166.195","34.120.208.123","TLSv1.2","1076","Application Data"
"218","4.222126822","34.120.208.123","192.168.166.195","TCP","66","443  >  34506 [ACK] Seq=4891 Ack=2254 Win=71424 Len=0 TSval=3599440297 TSecr=43793909"
"219","4.222127800","34.120.208.123","192.168.166.195","TCP","66","443  >  34506 [ACK] Seq=4891 Ack=2378 Win=71424 Len=0 TSval=3599440299 TSecr=43793910"
"220","4.222128778","34.120.208.123","192.168.166.195","TCP","66","443  >  34506 [ACK] Seq=4891 Ack=3388 Win=73472 Len=0 TSval=3599440299 TSecr=43793910"
"221","4.268253505","34.107.243.93","192.168.166.195","TLSv1.3","203","Application Data"
"222","4.272452001","2001:6a8:3081:6f19:e0f8:f791:d194:4c92","2600:1901:0:38d7::","TCP","94","[TCP Retransmission] [TCP Port numbers reused] 49376  >  80 [SYN] Seq=0 Win=64800 Len=0 MSS=1440 SACK_PERM=1 TSval=918447178 TSecr=0 WS=128"
"223","4.312635825","192.168.166.195","34.107.243.93","TCP","66","60770  >  443 [ACK] Seq=2074 Ack=1188 Win=64128 Len=0 TSval=1642826139 TSecr=2314607118"
"224","4.324357352","192.168.166.195","130.104.1.1","DNS","85","Standard query 0x9eb2 A www.icloud.com OPT"
"225","4.324486623","192.168.166.195","130.104.1.1","DNS","85","Standard query 0x61cc AAAA www.icloud.com OPT"
"226","4.328519183","130.104.1.1","192.168.166.195","DNS","226","Standard query response 0x9eb2 A www.icloud.com CNAME www-cdn.icloud.com.akadns.net CNAME www.icloud.com-v1.edgekey.net CNAME e4478.dscb.akamaiedge.net A 23.223.79.36 OPT"
"227","4.400472028","2001:6a8:3081:6f19:e0f8:f791:d194:4c92","2a02:26f0:9100:15::6010:7a9c","TCP","94","[TCP Retransmission] [TCP Port numbers reused] 56692  >  80 [SYN] Seq=0 Win=64800 Len=0 MSS=1440 SACK_PERM=1 TSval=3027962614 TSecr=0 WS=128"
"228","4.417501789","34.120.208.123","192.168.166.195","TLSv1.2","134","Application Data"
"229","4.418110434","34.120.208.123","192.168.166.195","TLSv1.2","150","Application Data"
"230","4.418172381","192.168.166.195","34.120.208.123","TCP","66","34506  >  443 [ACK] Seq=3388 Ack=5043 Win=64128 Len=0 TSval=43794114 TSecr=3599440493"
"231","4.419617904","34.120.208.123","192.168.166.195","TLSv1.2","105","Application Data"
"232","4.419661902","192.168.166.195","34.120.208.123","TLSv1.2","193","Application Data"
"233","4.419695774","192.168.166.195","34.120.208.123","TLSv1.2","1524","Application Data"
"234","4.420269220","192.168.166.195","34.120.208.123","TLSv1.2","919","Application Data, Application Data"
"235","4.429266896","34.120.208.123","192.168.166.195","TCP","66","443  >  34506 [ACK] Seq=5082 Ack=3515 Win=73472 Len=0 TSval=3599440505 TSecr=43794116"
"236","4.429268363","34.120.208.123","192.168.166.195","TCP","66","443  >  34506 [ACK] Seq=5082 Ack=4915 Win=76288 Len=0 TSval=3599440505 TSecr=43794116"
"237","4.429269271","34.120.208.123","192.168.166.195","TCP","66","443  >  34506 [ACK] Seq=5082 Ack=4973 Win=76288 Len=0 TSval=3599440505 TSecr=43794116"
"238","4.429270667","34.120.208.123","192.168.166.195","TCP","66","443  >  34506 [ACK] Seq=5082 Ack=5826 Win=79104 Len=0 TSval=3599440505 TSecr=43794116"
"239","4.592677712","2001:6a8:3081:6f19:e0f8:f791:d194:4c92","2600:1901:0:38d7::","TCP","94","[TCP Retransmission] [TCP Port numbers reused] 49390  >  80 [SYN] Seq=0 Win=64800 Len=0 MSS=1440 SACK_PERM=1 TSval=918447498 TSecr=0 WS=128"
"240","4.643193062","34.120.208.123","192.168.166.195","TLSv1.2","134","Application Data"
"241","4.643388541","34.120.208.123","192.168.166.195","TLSv1.2","371","Application Data"
"242","4.643636608","192.168.166.195","34.120.208.123","TCP","66","34506  >  443 [ACK] Seq=5826 Ack=5455 Win=64128 Len=0 TSval=43794340 TSecr=3599440719"
"243","4.643747651","34.120.208.123","192.168.166.195","TLSv1.2","105","Application Data"
"244","4.643831528","192.168.166.195","34.120.208.123","TLSv1.2","105","Application Data"
"245","4.646395239","192.168.166.195","34.120.208.123","TLSv1.2","190","Application Data"
"246","4.646443497","192.168.166.195","34.120.208.123","TLSv1.2","509","Application Data"
"247","4.653187127","34.120.208.123","192.168.166.195","TCP","66","443  >  34506 [ACK] Seq=5494 Ack=5865 Win=79104 Len=0 TSval=3599440728 TSecr=43794340"
"248","4.655371404","34.120.208.123","192.168.166.195","TCP","66","443  >  34506 [ACK] Seq=5494 Ack=5989 Win=79104 Len=0 TSval=3599440731 TSecr=43794342"
"249","4.655372801","34.120.208.123","192.168.166.195","TCP","66","443  >  34506 [ACK] Seq=5494 Ack=6432 Win=81920 Len=0 TSval=3599440731 TSecr=43794343"
"250","4.810055182","34.120.208.123","192.168.166.195","TLSv1.2","134","Application Data"
"251","4.810056579","34.120.208.123","192.168.166.195","TLSv1.2","316","Application Data"
"252","4.810403888","192.168.166.195","34.120.208.123","TCP","66","34506  >  443 [ACK] Seq=6432 Ack=5812 Win=64128 Len=0 TSval=43794506 TSecr=3599440885"
"253","4.810406681","34.120.208.123","192.168.166.195","TLSv1.2","105","Application Data"
"254","4.810561514","192.168.166.195","34.120.208.123","TLSv1.2","105","Application Data"
"255","4.813158540","192.168.166.195","34.120.208.123","TLSv1.2","214","Application Data"
"256","4.813193110","192.168.166.195","34.120.208.123","TLSv1.2","574","Application Data"
"257","4.819427133","34.120.208.123","192.168.166.195","TCP","66","443  >  34506 [ACK] Seq=5851 Ack=6471 Win=81920 Len=0 TSval=3599440895 TSecr=43794507"
"258","4.822962793","34.120.208.123","192.168.166.195","TCP","66","443  >  34506 [ACK] Seq=5851 Ack=6619 Win=84736 Len=0 TSval=3599440898 TSecr=43794509"
"259","4.822964260","34.120.208.123","192.168.166.195","TCP","66","443  >  34506 [ACK] Seq=5851 Ack=7127 Win=87552 Len=0 TSval=3599440898 TSecr=43794509"
"260","4.848503339","2001:6a8:3081:6f19:e0f8:f791:d194:4c92","2600:1901:0:38d7::","TCP","94","[TCP Retransmission] [TCP Port numbers reused] 49402  >  80 [SYN] Seq=0 Win=64800 Len=0 MSS=1440 SACK_PERM=1 TSval=918447754 TSecr=0 WS=128"
"261","4.932680280","130.104.1.1","192.168.166.195","DNS","266","Standard query response 0x61cc AAAA www.icloud.com CNAME www-cdn.icloud.com.akadns.net CNAME www.icloud.com-v1.edgekey.net CNAME e4478.dscb.akamaiedge.net AAAA 2a02:26f0:de:6aa::117e AAAA 2a02:26f0:de:6ae::117e OPT"
"262","4.998592623","34.120.208.123","192.168.166.195","TLSv1.2","134","Application Data"
"263","5.000446704","34.120.208.123","192.168.166.195","TLSv1.2","242","Application Data"
"264","5.000448101","34.120.208.123","192.168.166.195","TLSv1.2","105","Application Data"
"265","5.000805047","192.168.166.195","34.120.208.123","TCP","66","34506  >  443 [ACK] Seq=7127 Ack=6134 Win=64128 Len=0 TSval=43794697 TSecr=3599441074"
"266","5.000944376","192.168.166.195","34.120.208.123","TLSv1.2","105","Application Data"
"267","5.010703303","34.120.208.123","192.168.166.195","TCP","66","443  >  34506 [ACK] Seq=6134 Ack=7166 Win=87552 Len=0 TSval=3599441086 TSecr=43794697"
"268","5.010832505","192.168.166.195","34.120.208.123","TLSv1.2","190","Application Data"
"269","5.010899131","192.168.166.195","34.120.208.123","TLSv1.2","870","Application Data"
"270","5.019913158","34.120.208.123","192.168.166.195","TCP","66","443  >  34506 [ACK] Seq=6134 Ack=7290 Win=87552 Len=0 TSval=3599441096 TSecr=43794707"
"271","5.019914555","34.120.208.123","192.168.166.195","TCP","66","443  >  34506 [ACK] Seq=6134 Ack=8094 Win=90368 Len=0 TSval=3599441096 TSecr=43794707"
"272","5.183953375","192.168.166.195","130.104.1.1","DNS","84","Standard query 0xb735 A www.apple.com OPT"
"273","5.184109744","192.168.166.195","130.104.1.1","DNS","84","Standard query 0x9597 AAAA www.apple.com OPT"
"274","5.189315041","192.168.166.195","130.104.1.1","DNS","87","Standard query 0x3f20 A setup.icloud.com OPT"
"275","5.189436910","192.168.166.195","130.104.1.1","DNS","87","Standard query 0x17eb AAAA setup.icloud.com OPT"
"276","5.234642951","34.120.208.123","192.168.166.195","TLSv1.2","134","Application Data"
"277","5.234648538","34.120.208.123","192.168.166.195","TLSv1.2","195","Application Data"
"278","5.234650004","34.120.208.123","192.168.166.195","TLSv1.2","105","Application Data"
"279","5.234651401","34.120.208.123","192.168.166.195","TCP","105","[TCP Retransmission] 443  >  34506 [PSH, ACK] Seq=6331 Ack=8094 Win=90368 Len=39 TSval=3599441298 TSecr=43794707"
"280","5.234709716","192.168.166.195","34.120.208.123","TCP","78","34506  >  443 [ACK] Seq=8094 Ack=6370 Win=64128 Len=0 TSval=43794931 TSecr=3599441274 SLE=6331 SRE=6370"
"281","5.235131613","192.168.166.195","34.120.208.123","TLSv1.2","105","Application Data"
"282","5.235557839","130.104.1.1","192.168.166.195","DNS","240","Standard query response 0xb735 A www.apple.com CNAME www.apple.com.edgekey.net CNAME www.apple.com.edgekey.net.globalredir.akadns.net CNAME e6858.dscx.akamaiedge.net A 23.77.164.214 OPT"
"283","5.235600580","130.104.1.1","192.168.166.195","DNS","280","Standard query response 0x9597 AAAA www.apple.com CNAME www.apple.com.edgekey.net CNAME www.apple.com.edgekey.net.globalredir.akadns.net CNAME e6858.dscx.akamaiedge.net AAAA 2a02:26f0:9100:59c::1aca AAAA 2a02:26f0:9100:59a::1aca OPT"
"284","5.235601977","130.104.1.1","192.168.166.195","DNS","264","Standard query response 0x17eb AAAA setup.icloud.com CNAME setup.fe2.apple-dns.net AAAA 2a01:b740:a41:e80::2:6 AAAA 2a01:b740:a41:e80::2:1 AAAA 2a01:b740:a41:e80::2:3 AAAA 2a01:b740:a41:e80::2:4 AAAA 2a01:b740:a41:e80::2:5 OPT"
"285","5.237075437","130.104.1.1","192.168.166.195","DNS","172","Standard query response 0x3f20 A setup.icloud.com CNAME setup.fe2.apple-dns.net A 17.248.236.67 A 17.248.236.69 A 17.248.236.68 OPT"
"286","5.245043627","2001:6a8:3081:6f19:e0f8:f791:d194:4c92","2a02:26f0:9100:59c::1aca","TCP","94","56254  >  443 [SYN] Seq=0 Win=64800 Len=0 MSS=1440 SACK_PERM=1 TSval=1901482920 TSecr=0 WS=128"
"287","5.245830431","34.120.208.123","192.168.166.195","TCP","66","443  >  34506 [ACK] Seq=6370 Ack=8133 Win=90368 Len=0 TSval=3599441320 TSecr=43794931"
"288","5.247651129","2001:6a8:3081:6f19:e0f8:f791:d194:4c92","2a01:b740:a41:e80::2:3","TCP","94","35758  >  443 [SYN] Seq=0 Win=64800 Len=0 MSS=1440 SACK_PERM=1 TSval=1287294778 TSecr=0 WS=128"
